	accession	genbank_accession_rev	strain	date	region	country	division	location	host	date_submitted	sra_accession	abbr_authors	reverse	authors	institution
0	OK649668	OK649668.1	OK649668	1956-XX-XX	North America	USA			Homo sapiens	2021-11-07		Wang et al		Wang,L., Ng,T.F.F., Castro,C.J., Marine,R.L., Magana,L.C., Esona,M., Peret,T.C.T., Thornburg,N.J.	
1	MG642073	MG642073.1	MG642073	1979-XX-XX	North America	USA	Rochester	Ny	Homo sapiens	2017-12-13		Shabman et al		Shabman,R., Fedorova,N., Puri,V., Shrivastava,S., Amedeo,P., Isom,R., Hu,L., Pickett,B., Novotny,M., Durbin,A., Rocchi,I., Williams,T., Hall,C.B., Tesini,B.L., Schnabel,K.C., Walsh,E.E., Caserta,M.	
2	MG642028	MG642028.1	MG642028	1980-XX-XX	North America	USA	Rochester	Ny	Homo sapiens	2017-12-13		Shabman et al		Shabman,R., Fedorova,N., Puri,V., Shrivastava,S., Amedeo,P., Isom,R., Hu,L., Pickett,B., Novotny,M., Durbin,A., Rocchi,I., Williams,T., Hall,C.B., Tesini,B.L., Schnabel,K.C., Walsh,E.E., Caserta,M.	
3	MG642032	MG642032.1	MG642032	1980-XX-XX	North America	USA	Rochester	Ny	Homo sapiens	2017-12-13		Shabman et al		Shabman,R., Fedorova,N., Puri,V., Shrivastava,S., Amedeo,P., Isom,R., Hu,L., Pickett,B., Novotny,M., Durbin,A., Rocchi,I., Williams,T., Hall,C.B., Tesini,B.L., Schnabel,K.C., Walsh,E.E., Caserta,M.	
4	MG642040	MG642040.1	MG642040	1980-XX-XX	North America	USA	Rochester	Ny	Homo sapiens	2017-12-13		Shabman et al		Shabman,R., Fedorova,N., Puri,V., Shrivastava,S., Amedeo,P., Isom,R., Hu,L., Pickett,B., Novotny,M., Durbin,A., Rocchi,I., Williams,T., Hall,C.B., Tesini,B.L., Schnabel,K.C., Walsh,E.E., Caserta,M.	
5	MG642058	MG642058.1	MG642058	1980-XX-XX	North America	USA	Rochester	Ny	Homo sapiens	2017-12-13		Shabman et al		Shabman,R., Fedorova,N., Puri,V., Shrivastava,S., Amedeo,P., Isom,R., Hu,L., Pickett,B., Novotny,M., Durbin,A., Rocchi,I., Williams,T., Hall,C.B., Tesini,B.L., Schnabel,K.C., Walsh,E.E., Caserta,M.	
6	MG642060	MG642060.1	MG642060	1980-XX-XX	North America	USA	Rochester	Ny	Homo sapiens	2017-12-13		Shabman et al		Shabman,R., Fedorova,N., Puri,V., Shrivastava,S., Amedeo,P., Isom,R., Hu,L., Pickett,B., Novotny,M., Durbin,A., Rocchi,I., Williams,T., Hall,C.B., Tesini,B.L., Schnabel,K.C., Walsh,E.E., Caserta,M.	
7	MG642074	MG642074.1	MG642074	1980-XX-XX	North America	USA	Rochester	Ny	Homo sapiens	2017-12-13		Shabman et al		Shabman,R., Fedorova,N., Puri,V., Shrivastava,S., Amedeo,P., Isom,R., Hu,L., Pickett,B., Novotny,M., Durbin,A., Rocchi,I., Williams,T., Hall,C.B., Tesini,B.L., Schnabel,K.C., Walsh,E.E., Caserta,M.	
8	MG642024	MG642024.1	MG642024	1981-XX-XX	North America	USA	Rochester	Ny	Homo sapiens	2017-12-13		Shabman et al		Shabman,R., Fedorova,N., Puri,V., Shrivastava,S., Amedeo,P., Isom,R., Hu,L., Pickett,B., Novotny,M., Durbin,A., Rocchi,I., Williams,T., Hall,C.B., Tesini,B.L., Schnabel,K.C., Walsh,E.E., Caserta,M.	
9	MG642026	MG642026.1	MG642026	1982-XX-XX	North America	USA	Rochester	Ny	Homo sapiens	2017-12-13		Shabman et al		Shabman,R., Fedorova,N., Puri,V., Shrivastava,S., Amedeo,P., Isom,R., Hu,L., Pickett,B., Novotny,M., Durbin,A., Rocchi,I., Williams,T., Hall,C.B., Tesini,B.L., Schnabel,K.C., Walsh,E.E., Caserta,M.	
10	MG642031	MG642031.1	MG642031	1982-XX-XX	North America	USA	Rochester	Ny	Homo sapiens	2017-12-13		Shabman et al		Shabman,R., Fedorova,N., Puri,V., Shrivastava,S., Amedeo,P., Isom,R., Hu,L., Pickett,B., Novotny,M., Durbin,A., Rocchi,I., Williams,T., Hall,C.B., Tesini,B.L., Schnabel,K.C., Walsh,E.E., Caserta,M.	
11	MG642056	MG642056.1	MG642056	1982-XX-XX	North America	USA	Rochester	Ny	Homo sapiens	2017-12-13		Shabman et al		Shabman,R., Fedorova,N., Puri,V., Shrivastava,S., Amedeo,P., Isom,R., Hu,L., Pickett,B., Novotny,M., Durbin,A., Rocchi,I., Williams,T., Hall,C.B., Tesini,B.L., Schnabel,K.C., Walsh,E.E., Caserta,M.	
12	MG642063	MG642063.1	MG642063	1982-XX-XX	North America	USA	Rochester	Ny	Homo sapiens	2017-12-13		Shabman et al		Shabman,R., Fedorova,N., Puri,V., Shrivastava,S., Amedeo,P., Isom,R., Hu,L., Pickett,B., Novotny,M., Durbin,A., Rocchi,I., Williams,T., Hall,C.B., Tesini,B.L., Schnabel,K.C., Walsh,E.E., Caserta,M.	
13	MG642079	MG642079.1	MG642079	1982-XX-XX	North America	USA	Rochester	Ny	Homo sapiens	2017-12-13		Shabman et al		Shabman,R., Fedorova,N., Puri,V., Shrivastava,S., Amedeo,P., Isom,R., Hu,L., Pickett,B., Novotny,M., Durbin,A., Rocchi,I., Williams,T., Hall,C.B., Tesini,B.L., Schnabel,K.C., Walsh,E.E., Caserta,M.	
14	MG642081	MG642081.1	MG642081	1982-XX-XX	North America	USA	Rochester	Ny	Homo sapiens	2017-12-13		Shabman et al		Shabman,R., Fedorova,N., Puri,V., Shrivastava,S., Amedeo,P., Isom,R., Hu,L., Pickett,B., Novotny,M., Durbin,A., Rocchi,I., Williams,T., Hall,C.B., Tesini,B.L., Schnabel,K.C., Walsh,E.E., Caserta,M.	
15	MG642035	MG642035.1	MG642035	1984-XX-XX	North America	USA	Rochester	Ny	Homo sapiens	2017-12-13		Shabman et al		Shabman,R., Fedorova,N., Puri,V., Shrivastava,S., Amedeo,P., Isom,R., Hu,L., Pickett,B., Novotny,M., Durbin,A., Rocchi,I., Williams,T., Hall,C.B., Tesini,B.L., Schnabel,K.C., Walsh,E.E., Caserta,M.	
16	MG642071	MG642071.1	MG642071	1984-XX-XX	North America	USA	Rochester	Ny	Homo sapiens	2017-12-13		Shabman et al		Shabman,R., Fedorova,N., Puri,V., Shrivastava,S., Amedeo,P., Isom,R., Hu,L., Pickett,B., Novotny,M., Durbin,A., Rocchi,I., Williams,T., Hall,C.B., Tesini,B.L., Schnabel,K.C., Walsh,E.E., Caserta,M.	
17	MG642034	MG642034.1	MG642034	1985-XX-XX	North America	USA	Rochester	Ny	Homo sapiens	2017-12-13		Shabman et al		Shabman,R., Fedorova,N., Puri,V., Shrivastava,S., Amedeo,P., Isom,R., Hu,L., Pickett,B., Novotny,M., Durbin,A., Rocchi,I., Williams,T., Hall,C.B., Tesini,B.L., Schnabel,K.C., Walsh,E.E., Caserta,M.	
18	MG642038	MG642038.1	MG642038	1985-XX-XX	North America	USA	Rochester	Ny	Homo sapiens	2017-12-13		Shabman et al		Shabman,R., Fedorova,N., Puri,V., Shrivastava,S., Amedeo,P., Isom,R., Hu,L., Pickett,B., Novotny,M., Durbin,A., Rocchi,I., Williams,T., Hall,C.B., Tesini,B.L., Schnabel,K.C., Walsh,E.E., Caserta,M.	
19	MG642041	MG642041.1	MG642041	1985-XX-XX	North America	USA	Rochester	Ny	Homo sapiens	2017-12-13		Shabman et al		Shabman,R., Fedorova,N., Puri,V., Shrivastava,S., Amedeo,P., Isom,R., Hu,L., Pickett,B., Novotny,M., Durbin,A., Rocchi,I., Williams,T., Hall,C.B., Tesini,B.L., Schnabel,K.C., Walsh,E.E., Caserta,M.	
20	MG642069	MG642069.1	MG642069	1985-XX-XX	North America	USA	Rochester	Ny	Homo sapiens	2017-12-13		Shabman et al		Shabman,R., Fedorova,N., Puri,V., Shrivastava,S., Amedeo,P., Isom,R., Hu,L., Pickett,B., Novotny,M., Durbin,A., Rocchi,I., Williams,T., Hall,C.B., Tesini,B.L., Schnabel,K.C., Walsh,E.E., Caserta,M.	
21	MG642070	MG642070.1	MG642070	1986-XX-XX	North America	USA	Rochester	Ny	Homo sapiens	2017-12-13		Shabman et al		Shabman,R., Fedorova,N., Puri,V., Shrivastava,S., Amedeo,P., Isom,R., Hu,L., Pickett,B., Novotny,M., Durbin,A., Rocchi,I., Williams,T., Hall,C.B., Tesini,B.L., Schnabel,K.C., Walsh,E.E., Caserta,M.	
22	MG642075	MG642075.1	MG642075	1986-XX-XX	North America	USA	Rochester	Ny	Homo sapiens	2017-12-13		Shabman et al		Shabman,R., Fedorova,N., Puri,V., Shrivastava,S., Amedeo,P., Isom,R., Hu,L., Pickett,B., Novotny,M., Durbin,A., Rocchi,I., Williams,T., Hall,C.B., Tesini,B.L., Schnabel,K.C., Walsh,E.E., Caserta,M.	
23	MG642067	MG642067.1	MG642067	1987-XX-XX	North America	USA	Rochester	Ny	Homo sapiens	2017-12-13		Shabman et al		Shabman,R., Fedorova,N., Puri,V., Shrivastava,S., Amedeo,P., Isom,R., Hu,L., Pickett,B., Novotny,M., Durbin,A., Rocchi,I., Williams,T., Hall,C.B., Tesini,B.L., Schnabel,K.C., Walsh,E.E., Caserta,M.	
24	MG642077	MG642077.1	MG642077	1987-XX-XX	North America	USA	Rochester	Ny	Homo sapiens	2017-12-13		Shabman et al		Shabman,R., Fedorova,N., Puri,V., Shrivastava,S., Amedeo,P., Isom,R., Hu,L., Pickett,B., Novotny,M., Durbin,A., Rocchi,I., Williams,T., Hall,C.B., Tesini,B.L., Schnabel,K.C., Walsh,E.E., Caserta,M.	
25	MG642083	MG642083.1	MG642083	1987-XX-XX	North America	USA	Rochester	Ny	Homo sapiens	2017-12-13		Shabman et al		Shabman,R., Fedorova,N., Puri,V., Shrivastava,S., Amedeo,P., Isom,R., Hu,L., Pickett,B., Novotny,M., Durbin,A., Rocchi,I., Williams,T., Hall,C.B., Tesini,B.L., Schnabel,K.C., Walsh,E.E., Caserta,M.	
26	MG642030	MG642030.1	MG642030	1988-XX-XX	North America	USA	Rochester	Ny	Homo sapiens	2017-12-13		Shabman et al		Shabman,R., Fedorova,N., Puri,V., Shrivastava,S., Amedeo,P., Isom,R., Hu,L., Pickett,B., Novotny,M., Durbin,A., Rocchi,I., Williams,T., Hall,C.B., Tesini,B.L., Schnabel,K.C., Walsh,E.E., Caserta,M.	
27	MG642048	MG642048.1	MG642048	1990-XX-XX	North America	USA	Rochester	Ny	Homo sapiens	2017-12-13		Shabman et al		Shabman,R., Fedorova,N., Puri,V., Shrivastava,S., Amedeo,P., Isom,R., Hu,L., Pickett,B., Novotny,M., Durbin,A., Rocchi,I., Williams,T., Hall,C.B., Tesini,B.L., Schnabel,K.C., Walsh,E.E., Caserta,M.	
28	MG642055	MG642055.1	MG642055	1990-XX-XX	North America	USA	Rochester	Ny	Homo sapiens	2017-12-13		Shabman et al		Shabman,R., Fedorova,N., Puri,V., Shrivastava,S., Amedeo,P., Isom,R., Hu,L., Pickett,B., Novotny,M., Durbin,A., Rocchi,I., Williams,T., Hall,C.B., Tesini,B.L., Schnabel,K.C., Walsh,E.E., Caserta,M.	
29	MF361904	MF361904.1	MON/9/92	1992-XX-XX	South America	Uruguay			Homo sapiens	2017-11-20		Rossey et al		Rossey,I., Gilman,M.S., Kabeche,S.C., Sedeyn,K., Wrapp,D., Kanekiyo,M., Chen,M., Mas,V., Spitaels,J., Melero,J.A., Graham,B.S., Schepens,B., McLellan,J.S., Saelens,X., Van Cauwenberghe,S.	
30	OK649676	OK649676.1	OK649676	1993-XX-XX	North America	USA			Homo sapiens	2021-11-07		Wang et al		Wang,L., Ng,T.F.F., Castro,C.J., Marine,R.L., Magana,L.C., Esona,M., Peret,T.C.T., Thornburg,N.J.	
31	AF086899	AF086899.1	177771	1993-11-XX	North America	USA	Birmingham			1998-09-24		Coggins et al		Coggins,W.B., Lefkowitz,E.J., Sullender,W.M.	
32	AF086868	AF086868.1	179381	1993-12-XX	North America	USA	Birmingham			1998-09-24		Coggins et al		Coggins,W.B., Lefkowitz,E.J., Sullender,W.M.	
33	AF086869	AF086869.1	179522	1993-12-XX	North America	USA	Birmingham			1998-09-24		Coggins et al		Coggins,W.B., Lefkowitz,E.J., Sullender,W.M.	
34	MG642033	MG642033.1	MG642033	1994-XX-XX	North America	USA	Rochester	Ny	Homo sapiens	2017-12-13		Shabman et al		Shabman,R., Fedorova,N., Puri,V., Shrivastava,S., Amedeo,P., Isom,R., Hu,L., Pickett,B., Novotny,M., Durbin,A., Rocchi,I., Williams,T., Hall,C.B., Tesini,B.L., Schnabel,K.C., Walsh,E.E., Caserta,M.	
35	MG642050	MG642050.1	MG642050	1994-XX-XX	North America	USA	Rochester	Ny	Homo sapiens	2017-12-13		Shabman et al		Shabman,R., Fedorova,N., Puri,V., Shrivastava,S., Amedeo,P., Isom,R., Hu,L., Pickett,B., Novotny,M., Durbin,A., Rocchi,I., Williams,T., Hall,C.B., Tesini,B.L., Schnabel,K.C., Walsh,E.E., Caserta,M.	
36	MG642052	MG642052.1	MG642052	1994-XX-XX	North America	USA	Rochester	Ny	Homo sapiens	2017-12-13		Shabman et al		Shabman,R., Fedorova,N., Puri,V., Shrivastava,S., Amedeo,P., Isom,R., Hu,L., Pickett,B., Novotny,M., Durbin,A., Rocchi,I., Williams,T., Hall,C.B., Tesini,B.L., Schnabel,K.C., Walsh,E.E., Caserta,M.	
37	MG642061	MG642061.1	MG642061	1994-XX-XX	North America	USA	Rochester	Ny	Homo sapiens	2017-12-13		Shabman et al		Shabman,R., Fedorova,N., Puri,V., Shrivastava,S., Amedeo,P., Isom,R., Hu,L., Pickett,B., Novotny,M., Durbin,A., Rocchi,I., Williams,T., Hall,C.B., Tesini,B.L., Schnabel,K.C., Walsh,E.E., Caserta,M.	
38	MG642080	MG642080.1	MG642080	1994-XX-XX	North America	USA	Rochester	Ny	Homo sapiens	2017-12-13		Shabman et al		Shabman,R., Fedorova,N., Puri,V., Shrivastava,S., Amedeo,P., Isom,R., Hu,L., Pickett,B., Novotny,M., Durbin,A., Rocchi,I., Williams,T., Hall,C.B., Tesini,B.L., Schnabel,K.C., Walsh,E.E., Caserta,M.	
39	OK649589	OK649589.1	OK649589	1994-XX-XX	North America	USA			Homo sapiens	2021-11-07		Wang et al		Wang,L., Ng,T.F.F., Castro,C.J., Marine,R.L., Magana,L.C., Esona,M., Peret,T.C.T., Thornburg,N.J.	
40	OK649590	OK649590.1	OK649590	1994-XX-XX	North America	USA			Homo sapiens	2021-11-07		Wang et al		Wang,L., Ng,T.F.F., Castro,C.J., Marine,R.L., Magana,L.C., Esona,M., Peret,T.C.T., Thornburg,N.J.	
41	OK649591	OK649591.1	OK649591	1994-XX-XX	North America	USA			Homo sapiens	2021-11-07		Wang et al		Wang,L., Ng,T.F.F., Castro,C.J., Marine,R.L., Magana,L.C., Esona,M., Peret,T.C.T., Thornburg,N.J.	
42	OK649592	OK649592.1	OK649592	1994-XX-XX	North America	USA			Homo sapiens	2021-11-07		Wang et al		Wang,L., Ng,T.F.F., Castro,C.J., Marine,R.L., Magana,L.C., Esona,M., Peret,T.C.T., Thornburg,N.J.	
43	OK649669	OK649669.1	OK649669	1994-XX-XX	North America	USA			Homo sapiens	2021-11-07		Wang et al		Wang,L., Ng,T.F.F., Castro,C.J., Marine,R.L., Magana,L.C., Esona,M., Peret,T.C.T., Thornburg,N.J.	
44	OK649675	OK649675.1	OK649675	1994-XX-XX	North America	USA			Homo sapiens	2021-11-07		Wang et al		Wang,L., Ng,T.F.F., Castro,C.J., Marine,R.L., Magana,L.C., Esona,M., Peret,T.C.T., Thornburg,N.J.	
45	AF086870	AF086870.1	180081	1994-01-XX	North America	USA	Birmingham			1998-09-24		Coggins et al		Coggins,W.B., Lefkowitz,E.J., Sullender,W.M.	
46	AF086871	AF086871.1	180893	1994-01-XX	North America	USA	Birmingham			1998-09-24		Coggins et al		Coggins,W.B., Lefkowitz,E.J., Sullender,W.M.	
47	AF086872	AF086872.1	181691	1994-01-XX	North America	USA	Birmingham			1998-09-24		Coggins et al		Coggins,W.B., Lefkowitz,E.J., Sullender,W.M.	
48	AF086873	AF086873.1	182473	1994-02-XX	North America	USA	Birmingham			1998-09-24		Coggins et al		Coggins,W.B., Lefkowitz,E.J., Sullender,W.M.	
49	AF086874	AF086874.1	182701	1994-02-XX	North America	USA	Birmingham			1998-09-24		Coggins et al		Coggins,W.B., Lefkowitz,E.J., Sullender,W.M.	
50	AF086882	AF086882.1	194581	1994-11-XX	North America	USA	Birmingham			1998-09-24		Coggins et al		Coggins,W.B., Lefkowitz,E.J., Sullender,W.M.	
51	AF086880	AF086880.1	193651	1994-12-XX	North America	USA	Birmingham			1998-09-24		Coggins et al		Coggins,W.B., Lefkowitz,E.J., Sullender,W.M.	
52	AF086881	AF086881.1	194522	1994-12-XX	North America	USA	Birmingham			1998-09-24		Coggins et al		Coggins,W.B., Lefkowitz,E.J., Sullender,W.M.	
53	OK649593	OK649593.1	OK649593	1995-XX-XX	North America	USA			Homo sapiens	2021-11-07		Wang et al		Wang,L., Ng,T.F.F., Castro,C.J., Marine,R.L., Magana,L.C., Esona,M., Peret,T.C.T., Thornburg,N.J.	
54	OK649594	OK649594.1	OK649594	1995-XX-XX	North America	USA			Homo sapiens	2021-11-07		Wang et al		Wang,L., Ng,T.F.F., Castro,C.J., Marine,R.L., Magana,L.C., Esona,M., Peret,T.C.T., Thornburg,N.J.	
55	OK649657	OK649657.1	OK649657	1995-XX-XX	North America	Canada			Homo sapiens	2021-11-07		Wang et al		Wang,L., Ng,T.F.F., Castro,C.J., Marine,R.L., Magana,L.C., Esona,M., Peret,T.C.T., Thornburg,N.J.	
56	OK649658	OK649658.1	OK649658	1995-XX-XX	North America	Canada			Homo sapiens	2021-11-07		Wang et al		Wang,L., Ng,T.F.F., Castro,C.J., Marine,R.L., Magana,L.C., Esona,M., Peret,T.C.T., Thornburg,N.J.	
57	OK649659	OK649659.1	OK649659	1995-XX-XX	North America	Canada			Homo sapiens	2021-11-07		Wang et al		Wang,L., Ng,T.F.F., Castro,C.J., Marine,R.L., Magana,L.C., Esona,M., Peret,T.C.T., Thornburg,N.J.	
58	OK649670	OK649670.1	OK649670	1995-XX-XX	North America	USA			Homo sapiens	2021-11-07		Wang et al		Wang,L., Ng,T.F.F., Castro,C.J., Marine,R.L., Magana,L.C., Esona,M., Peret,T.C.T., Thornburg,N.J.	
59	OK649671	OK649671.1	OK649671	1995-XX-XX	North America	USA			Homo sapiens	2021-11-07		Wang et al		Wang,L., Ng,T.F.F., Castro,C.J., Marine,R.L., Magana,L.C., Esona,M., Peret,T.C.T., Thornburg,N.J.	
60	OK649672	OK649672.1	OK649672	1995-XX-XX	North America	USA			Homo sapiens	2021-11-07		Wang et al		Wang,L., Ng,T.F.F., Castro,C.J., Marine,R.L., Magana,L.C., Esona,M., Peret,T.C.T., Thornburg,N.J.	
61	OK649673	OK649673.1	OK649673	1995-XX-XX	North America	USA			Homo sapiens	2021-11-07		Wang et al		Wang,L., Ng,T.F.F., Castro,C.J., Marine,R.L., Magana,L.C., Esona,M., Peret,T.C.T., Thornburg,N.J.	
62	OK649674	OK649674.1	OK649674	1995-XX-XX	North America	USA			Homo sapiens	2021-11-07		Wang et al		Wang,L., Ng,T.F.F., Castro,C.J., Marine,R.L., Magana,L.C., Esona,M., Peret,T.C.T., Thornburg,N.J.	
63	AF086883	AF086883.1	195462	1995-01-XX	North America	USA	Birmingham			1998-09-24		Coggins et al		Coggins,W.B., Lefkowitz,E.J., Sullender,W.M.	
64	AF086884	AF086884.1	195563	1995-02-XX	North America	USA	Birmingham			1998-09-24		Coggins et al		Coggins,W.B., Lefkowitz,E.J., Sullender,W.M.	
65	AF086885	AF086885.1	195901	1995-02-XX	North America	USA	Birmingham			1998-09-24		Coggins et al		Coggins,W.B., Lefkowitz,E.J., Sullender,W.M.	
66	AF086886	AF086886.1	196775	1995-03-XX	North America	USA	Birmingham			1998-09-24		Coggins et al		Coggins,W.B., Lefkowitz,E.J., Sullender,W.M.	
67	AF086888	AF086888.1	203721	1995-10-XX	North America	USA	Birmingham			1998-09-24		Coggins et al		Coggins,W.B., Lefkowitz,E.J., Sullender,W.M.	
68	AF086891	AF086891.1	205342	1995-12-XX	North America	USA	Birmingham			1998-09-24		Coggins et al		Coggins,W.B., Lefkowitz,E.J., Sullender,W.M.	
69	AF086895	AF086895.1	206344	1996-01-XX	North America	USA	Birmingham			1998-09-24		Coggins et al		Coggins,W.B., Lefkowitz,E.J., Sullender,W.M.	
70	AF086896	AF086896.1	206846	1996-01-XX	North America	USA	Birmingham			1998-09-24		Coggins et al		Coggins,W.B., Lefkowitz,E.J., Sullender,W.M.	
71	AF086897	AF086897.1	207347	1996-01-XX	North America	USA	Birmingham			1998-09-24		Coggins et al		Coggins,W.B., Lefkowitz,E.J., Sullender,W.M.	
72	AF086898	AF086898.1	207385	1996-02-XX	North America	USA	Birmingham			1998-09-24		Coggins et al		Coggins,W.B., Lefkowitz,E.J., Sullender,W.M.	
73	MF173101	MF173101.1	Caldas/2000/2425	2000-XX-XX	South America	Colombia			Homo sapiens	2017-10-25		Avila et al		Avila,V., Calvo,E.P., Barbosa,J., Velandia-Romero,M.L., Castellanos,J.E.	
74	MF173102	MF173102.1	Caldas/2000/2569	2000-XX-XX	South America	Colombia			Homo sapiens	2017-10-25		Avila et al		Avila,V., Calvo,E.P., Barbosa,J., Velandia-Romero,M.L., Castellanos,J.E.	
75	MF496471	MF496471.1	R89-52	2000-XX-XX	Asia	Taiwan			Homo sapiens	2017-08-30		Chi et al		Chi,H., Hsiao,K.-L., Weng,L.-C., Chiu,N.-C., Huang,L.-M., Chiu,Y.-Y., Liu,C.-P., Liu,H.-F.	
76	MF496472	MF496472.1	R89-49	2000-XX-XX	Asia	Taiwan			Homo sapiens	2017-08-30		Chi et al		Chi,H., Hsiao,K.-L., Weng,L.-C., Chiu,N.-C., Huang,L.-M., Chiu,Y.-Y., Liu,C.-P., Liu,H.-F.	
77	KT765780	KT765780.1	KEN/Kilifi/500_18/01/2000	2000-01-18	Africa	Kenya			Homo sapiens	2016-02-27		Otieno et al		Otieno,J.R., Agoti,C.N., Gitahi,C.W., Bett,A., Ngama,M., Medley,G.F., Cane,P.A., Nokes,D.J., Nokes,J.D.	
78	KT765661	KT765661.1	KEN/Kilifi/501_18/02/2000	2000-02-18	Africa	Kenya			Homo sapiens	2016-02-27		Otieno et al		Otieno,J.R., Agoti,C.N., Gitahi,C.W., Bett,A., Ngama,M., Medley,G.F., Cane,P.A., Nokes,D.J., Nokes,J.D.	
79	KT765662	KT765662.1	KEN/Kilifi/502_29/02/2000	2000-02-29	Africa	Kenya			Homo sapiens	2016-02-27		Otieno et al		Otieno,J.R., Agoti,C.N., Gitahi,C.W., Bett,A., Ngama,M., Medley,G.F., Cane,P.A., Nokes,D.J., Nokes,J.D.	
80	KT765663	KT765663.1	KEN/Kilifi/503_13/03/2000	2000-03-13	Africa	Kenya			Homo sapiens	2016-02-27		Otieno et al		Otieno,J.R., Agoti,C.N., Gitahi,C.W., Bett,A., Ngama,M., Medley,G.F., Cane,P.A., Nokes,D.J., Nokes,J.D.	
81	KT765664	KT765664.1	KEN/Kilifi/504_21/07/2000	2000-07-21	Africa	Kenya			Homo sapiens	2016-02-27		Otieno et al		Otieno,J.R., Agoti,C.N., Gitahi,C.W., Bett,A., Ngama,M., Medley,G.F., Cane,P.A., Nokes,D.J., Nokes,J.D.	
82	JN968312	JN968312.1	V00-2221902	2000-08-22	Asia	Hong Kong			Homo sapiens	2012-01-10		Mak et al		Mak,G.C., Lau,C.S., Chiu,D.M.Y., Lim,W.	
83	JN968333	JN968333.1	V00-2225288	2000-10-03	Asia	Hong Kong			Homo sapiens	2012-01-10		Mak et al		Mak,G.C., Lau,C.S., Chiu,D.M.Y., Lim,W.	
84	KJ627647	KJ627647.1	RSV-A/US/BID-V8313/2001	2001-XX-XX	North America	USA	Tennessee		Homo sapiens	2014-04-16		Newman et al		Newman,R.M., Zody,M.C., DeVincenzo,J.P., Grad,Y., Lipsitch,M., Murphy,R., Fitzgerald,M., Young,S., Gargeya,S., Poon,T.W., Charlebois,P., Weiner,B., Yang,X., Piper,M.E., McCowan,C., Ireland,A., Levin,J., Malboeuf,C., Qu,J., Chapman,S.B., Murphy,C., Wortman,J., Nusbaum,C., Birren,B.	
85	KJ627648	KJ627648.1	RSV-A/US/BID-V8314/2001	2001-XX-XX	North America	USA	Tennessee		Homo sapiens	2014-04-16		Newman et al		Newman,R.M., Zody,M.C., DeVincenzo,J.P., Grad,Y., Lipsitch,M., Murphy,R., Fitzgerald,M., Young,S., Gargeya,S., Poon,T.W., Charlebois,P., Weiner,B., Yang,X., Piper,M.E., McCowan,C., Ireland,A., Levin,J., Malboeuf,C., Qu,J., Chapman,S.B., Murphy,C., Wortman,J., Nusbaum,C., Birren,B.	
86	KJ627649	KJ627649.1	RSV-A/US/BID-V8316/2001	2001-XX-XX	North America	USA	Tennessee		Homo sapiens	2014-04-16		Newman et al		Newman,R.M., Zody,M.C., DeVincenzo,J.P., Grad,Y., Lipsitch,M., Murphy,R., Fitzgerald,M., Young,S., Gargeya,S., Poon,T.W., Charlebois,P., Weiner,B., Yang,X., Piper,M.E., McCowan,C., Ireland,A., Levin,J., Malboeuf,C., Qu,J., Chapman,S.B., Murphy,C., Wortman,J., Nusbaum,C., Birren,B.	
87	KJ627650	KJ627650.1	RSV-A/US/BID-V8317/2001	2001-XX-XX	North America	USA	Tennessee		Homo sapiens	2014-04-16		Newman et al		Newman,R.M., Zody,M.C., DeVincenzo,J.P., Grad,Y., Lipsitch,M., Murphy,R., Fitzgerald,M., Young,S., Gargeya,S., Poon,T.W., Charlebois,P., Weiner,B., Yang,X., Piper,M.E., McCowan,C., Ireland,A., Levin,J., Malboeuf,C., Qu,J., Chapman,S.B., Murphy,C., Wortman,J., Nusbaum,C., Birren,B.	
88	KJ627672	KJ627672.1	RSV-A/US/BID-V8411/2001	2001-XX-XX	North America	USA	Tennessee		Homo sapiens	2014-04-16		Newman et al		Newman,R.M., Zody,M.C., DeVincenzo,J.P., Grad,Y., Lipsitch,M., Murphy,R., Fitzgerald,M., Young,S., Gargeya,S., Poon,T.W., Charlebois,P., Weiner,B., Yang,X., Piper,M.E., McCowan,C., Ireland,A., Levin,J., Malboeuf,C., Qu,J., Chapman,S.B., Murphy,C., Wortman,J., Nusbaum,C., Birren,B.	
89	KJ627673	KJ627673.1	RSV-A/US/BID-V8413/2001	2001-XX-XX	North America	USA	Tennessee		Homo sapiens	2014-04-16		Newman et al		Newman,R.M., Zody,M.C., DeVincenzo,J.P., Grad,Y., Lipsitch,M., Murphy,R., Fitzgerald,M., Young,S., Gargeya,S., Poon,T.W., Charlebois,P., Weiner,B., Yang,X., Piper,M.E., McCowan,C., Ireland,A., Levin,J., Malboeuf,C., Qu,J., Chapman,S.B., Murphy,C., Wortman,J., Nusbaum,C., Birren,B.	
90	KJ627674	KJ627674.1	RSV-A/US/BID-V8414/2001	2001-XX-XX	North America	USA	Tennessee		Homo sapiens	2014-04-16		Newman et al		Newman,R.M., Zody,M.C., DeVincenzo,J.P., Grad,Y., Lipsitch,M., Murphy,R., Fitzgerald,M., Young,S., Gargeya,S., Poon,T.W., Charlebois,P., Weiner,B., Yang,X., Piper,M.E., McCowan,C., Ireland,A., Levin,J., Malboeuf,C., Qu,J., Chapman,S.B., Murphy,C., Wortman,J., Nusbaum,C., Birren,B.	
91	KJ627675	KJ627675.1	RSV-A/US/BID-V8415/2001	2001-XX-XX	North America	USA	Tennessee		Homo sapiens	2014-04-16		Newman et al		Newman,R.M., Zody,M.C., DeVincenzo,J.P., Grad,Y., Lipsitch,M., Murphy,R., Fitzgerald,M., Young,S., Gargeya,S., Poon,T.W., Charlebois,P., Weiner,B., Yang,X., Piper,M.E., McCowan,C., Ireland,A., Levin,J., Malboeuf,C., Qu,J., Chapman,S.B., Murphy,C., Wortman,J., Nusbaum,C., Birren,B.	
92	KJ627676	KJ627676.1	RSV-A/US/BID-V8419/2001	2001-XX-XX	North America	USA	Tennessee		Homo sapiens	2014-04-16		Newman et al		Newman,R.M., Zody,M.C., DeVincenzo,J.P., Grad,Y., Lipsitch,M., Murphy,R., Fitzgerald,M., Young,S., Gargeya,S., Poon,T.W., Charlebois,P., Weiner,B., Yang,X., Piper,M.E., McCowan,C., Ireland,A., Levin,J., Malboeuf,C., Qu,J., Chapman,S.B., Murphy,C., Wortman,J., Nusbaum,C., Birren,B.	
93	KJ627677	KJ627677.1	RSV-A/US/BID-V8420/2001	2001-XX-XX	North America	USA	Tennessee		Homo sapiens	2014-04-16		Newman et al		Newman,R.M., Zody,M.C., DeVincenzo,J.P., Grad,Y., Lipsitch,M., Murphy,R., Fitzgerald,M., Young,S., Gargeya,S., Poon,T.W., Charlebois,P., Weiner,B., Yang,X., Piper,M.E., McCowan,C., Ireland,A., Levin,J., Malboeuf,C., Qu,J., Chapman,S.B., Murphy,C., Wortman,J., Nusbaum,C., Birren,B.	
94	KJ627678	KJ627678.1	RSV-A/US/BID-V8422/2001	2001-XX-XX	North America	USA	Tennessee		Homo sapiens	2014-04-16		Newman et al		Newman,R.M., Zody,M.C., DeVincenzo,J.P., Grad,Y., Lipsitch,M., Murphy,R., Fitzgerald,M., Young,S., Gargeya,S., Poon,T.W., Charlebois,P., Weiner,B., Yang,X., Piper,M.E., McCowan,C., Ireland,A., Levin,J., Malboeuf,C., Qu,J., Chapman,S.B., Murphy,C., Wortman,J., Nusbaum,C., Birren,B.	
95	KJ627679	KJ627679.1	RSV-A/US/BID-V8423/2001	2001-XX-XX	North America	USA	Tennessee		Homo sapiens	2014-04-16		Newman et al		Newman,R.M., Zody,M.C., DeVincenzo,J.P., Grad,Y., Lipsitch,M., Murphy,R., Fitzgerald,M., Young,S., Gargeya,S., Poon,T.W., Charlebois,P., Weiner,B., Yang,X., Piper,M.E., McCowan,C., Ireland,A., Levin,J., Malboeuf,C., Qu,J., Chapman,S.B., Murphy,C., Wortman,J., Nusbaum,C., Birren,B.	
96	KJ627680	KJ627680.1	RSV-A/US/BID-V8424/2001	2001-XX-XX	North America	USA	Tennessee		Homo sapiens	2014-04-16		Newman et al		Newman,R.M., Zody,M.C., DeVincenzo,J.P., Grad,Y., Lipsitch,M., Murphy,R., Fitzgerald,M., Young,S., Gargeya,S., Poon,T.W., Charlebois,P., Weiner,B., Yang,X., Piper,M.E., McCowan,C., Ireland,A., Levin,J., Malboeuf,C., Qu,J., Chapman,S.B., Murphy,C., Wortman,J., Nusbaum,C., Birren,B.	
97	KJ627681	KJ627681.1	RSV-A/US/BID-V8425/2001	2001-XX-XX	North America	USA	Tennessee		Homo sapiens	2014-04-16		Newman et al		Newman,R.M., Zody,M.C., DeVincenzo,J.P., Grad,Y., Lipsitch,M., Murphy,R., Fitzgerald,M., Young,S., Gargeya,S., Poon,T.W., Charlebois,P., Weiner,B., Yang,X., Piper,M.E., McCowan,C., Ireland,A., Levin,J., Malboeuf,C., Qu,J., Chapman,S.B., Murphy,C., Wortman,J., Nusbaum,C., Birren,B.	
98	KJ627682	KJ627682.1	RSV-A/US/BID-V8432/2001	2001-XX-XX	North America	USA	Tennessee		Homo sapiens	2014-04-16		Newman et al		Newman,R.M., Zody,M.C., DeVincenzo,J.P., Grad,Y., Lipsitch,M., Murphy,R., Fitzgerald,M., Young,S., Gargeya,S., Poon,T.W., Charlebois,P., Weiner,B., Yang,X., Piper,M.E., McCowan,C., Ireland,A., Levin,J., Malboeuf,C., Qu,J., Chapman,S.B., Murphy,C., Wortman,J., Nusbaum,C., Birren,B.	
99	KJ627683	KJ627683.1	RSV-A/US/BID-V8433/2001	2001-XX-XX	North America	USA	Tennessee		Homo sapiens	2014-04-16		Newman et al		Newman,R.M., Zody,M.C., DeVincenzo,J.P., Grad,Y., Lipsitch,M., Murphy,R., Fitzgerald,M., Young,S., Gargeya,S., Poon,T.W., Charlebois,P., Weiner,B., Yang,X., Piper,M.E., McCowan,C., Ireland,A., Levin,J., Malboeuf,C., Qu,J., Chapman,S.B., Murphy,C., Wortman,J., Nusbaum,C., Birren,B.	
100	KJ627684	KJ627684.1	RSV-A/US/BID-V8434/2001	2001-XX-XX	North America	USA	Tennessee		Homo sapiens	2014-04-16		Newman et al		Newman,R.M., Zody,M.C., DeVincenzo,J.P., Grad,Y., Lipsitch,M., Murphy,R., Fitzgerald,M., Young,S., Gargeya,S., Poon,T.W., Charlebois,P., Weiner,B., Yang,X., Piper,M.E., McCowan,C., Ireland,A., Levin,J., Malboeuf,C., Qu,J., Chapman,S.B., Murphy,C., Wortman,J., Nusbaum,C., Birren,B.	
101	KJ627685	KJ627685.1	RSV-A/US/BID-V8435/2001	2001-XX-XX	North America	USA	Tennessee		Homo sapiens	2014-04-16		Newman et al		Newman,R.M., Zody,M.C., DeVincenzo,J.P., Grad,Y., Lipsitch,M., Murphy,R., Fitzgerald,M., Young,S., Gargeya,S., Poon,T.W., Charlebois,P., Weiner,B., Yang,X., Piper,M.E., McCowan,C., Ireland,A., Levin,J., Malboeuf,C., Qu,J., Chapman,S.B., Murphy,C., Wortman,J., Nusbaum,C., Birren,B.	
102	KJ627686	KJ627686.1	RSV-A/US/BID-V8436/2001	2001-XX-XX	North America	USA	Tennessee		Homo sapiens	2014-04-16		Newman et al		Newman,R.M., Zody,M.C., DeVincenzo,J.P., Grad,Y., Lipsitch,M., Murphy,R., Fitzgerald,M., Young,S., Gargeya,S., Poon,T.W., Charlebois,P., Weiner,B., Yang,X., Piper,M.E., McCowan,C., Ireland,A., Levin,J., Malboeuf,C., Qu,J., Chapman,S.B., Murphy,C., Wortman,J., Nusbaum,C., Birren,B.	
103	KJ627687	KJ627687.1	RSV-A/US/BID-V8437/2001	2001-XX-XX	North America	USA	Tennessee		Homo sapiens	2014-04-16		Newman et al		Newman,R.M., Zody,M.C., DeVincenzo,J.P., Grad,Y., Lipsitch,M., Murphy,R., Fitzgerald,M., Young,S., Gargeya,S., Poon,T.W., Charlebois,P., Weiner,B., Yang,X., Piper,M.E., McCowan,C., Ireland,A., Levin,J., Malboeuf,C., Qu,J., Chapman,S.B., Murphy,C., Wortman,J., Nusbaum,C., Birren,B.	
104	KJ627688	KJ627688.1	RSV-A/US/BID-V8453/2001	2001-XX-XX	North America	USA	Tennessee		Homo sapiens	2014-04-16		Newman et al		Newman,R.M., Zody,M.C., DeVincenzo,J.P., Grad,Y., Lipsitch,M., Murphy,R., Fitzgerald,M., Young,S., Gargeya,S., Poon,T.W., Charlebois,P., Weiner,B., Yang,X., Piper,M.E., McCowan,C., Ireland,A., Levin,J., Malboeuf,C., Qu,J., Chapman,S.B., Murphy,C., Wortman,J., Nusbaum,C., Birren,B.	
105	KJ627689	KJ627689.1	RSV-A/US/BID-V8454/2001	2001-XX-XX	North America	USA	Tennessee		Homo sapiens	2014-04-16		Newman et al		Newman,R.M., Zody,M.C., DeVincenzo,J.P., Grad,Y., Lipsitch,M., Murphy,R., Fitzgerald,M., Young,S., Gargeya,S., Poon,T.W., Charlebois,P., Weiner,B., Yang,X., Piper,M.E., McCowan,C., Ireland,A., Levin,J., Malboeuf,C., Qu,J., Chapman,S.B., Murphy,C., Wortman,J., Nusbaum,C., Birren,B.	
106	KJ627690	KJ627690.1	RSV-A/US/BID-V8456/2001	2001-XX-XX	North America	USA	Tennessee		Homo sapiens	2014-04-16		Newman et al		Newman,R.M., Zody,M.C., DeVincenzo,J.P., Grad,Y., Lipsitch,M., Murphy,R., Fitzgerald,M., Young,S., Gargeya,S., Poon,T.W., Charlebois,P., Weiner,B., Yang,X., Piper,M.E., McCowan,C., Ireland,A., Levin,J., Malboeuf,C., Qu,J., Chapman,S.B., Murphy,C., Wortman,J., Nusbaum,C., Birren,B.	
107	KJ627691	KJ627691.1	RSV-A/US/BID-V8459/2001	2001-XX-XX	North America	USA	Tennessee		Homo sapiens	2014-04-16		Newman et al		Newman,R.M., Zody,M.C., DeVincenzo,J.P., Grad,Y., Lipsitch,M., Murphy,R., Fitzgerald,M., Young,S., Gargeya,S., Poon,T.W., Charlebois,P., Weiner,B., Yang,X., Piper,M.E., McCowan,C., Ireland,A., Levin,J., Malboeuf,C., Qu,J., Chapman,S.B., Murphy,C., Wortman,J., Nusbaum,C., Birren,B.	
108	KJ627692	KJ627692.1	RSV-A/US/BID-V8460/2001	2001-XX-XX	North America	USA	Tennessee		Homo sapiens	2014-04-16		Newman et al		Newman,R.M., Zody,M.C., DeVincenzo,J.P., Grad,Y., Lipsitch,M., Murphy,R., Fitzgerald,M., Young,S., Gargeya,S., Poon,T.W., Charlebois,P., Weiner,B., Yang,X., Piper,M.E., McCowan,C., Ireland,A., Levin,J., Malboeuf,C., Qu,J., Chapman,S.B., Murphy,C., Wortman,J., Nusbaum,C., Birren,B.	
109	KJ627693	KJ627693.1	RSV-A/US/BID-V8466/2001	2001-XX-XX	North America	USA	Tennessee		Homo sapiens	2014-04-16		Newman et al		Newman,R.M., Zody,M.C., DeVincenzo,J.P., Grad,Y., Lipsitch,M., Murphy,R., Fitzgerald,M., Young,S., Gargeya,S., Poon,T.W., Charlebois,P., Weiner,B., Yang,X., Piper,M.E., McCowan,C., Ireland,A., Levin,J., Malboeuf,C., Qu,J., Chapman,S.B., Murphy,C., Wortman,J., Nusbaum,C., Birren,B.	
110	KJ627694	KJ627694.1	RSV-A/US/BID-V8467/2001	2001-XX-XX	North America	USA	Tennessee		Homo sapiens	2014-04-16		Newman et al		Newman,R.M., Zody,M.C., DeVincenzo,J.P., Grad,Y., Lipsitch,M., Murphy,R., Fitzgerald,M., Young,S., Gargeya,S., Poon,T.W., Charlebois,P., Weiner,B., Yang,X., Piper,M.E., McCowan,C., Ireland,A., Levin,J., Malboeuf,C., Qu,J., Chapman,S.B., Murphy,C., Wortman,J., Nusbaum,C., Birren,B.	
111	KJ627695	KJ627695.1	RSV-A/US/BID-V8469/2001	2001-XX-XX	North America	USA	Tennessee		Homo sapiens	2014-04-16		Newman et al		Newman,R.M., Zody,M.C., DeVincenzo,J.P., Grad,Y., Lipsitch,M., Murphy,R., Fitzgerald,M., Young,S., Gargeya,S., Poon,T.W., Charlebois,P., Weiner,B., Yang,X., Piper,M.E., McCowan,C., Ireland,A., Levin,J., Malboeuf,C., Qu,J., Chapman,S.B., Murphy,C., Wortman,J., Nusbaum,C., Birren,B.	
112	KJ627696	KJ627696.1	RSV-A/US/BID-V8471/2001	2001-XX-XX	North America	USA	Tennessee		Homo sapiens	2014-04-16		Newman et al		Newman,R.M., Zody,M.C., DeVincenzo,J.P., Grad,Y., Lipsitch,M., Murphy,R., Fitzgerald,M., Young,S., Gargeya,S., Poon,T.W., Charlebois,P., Weiner,B., Yang,X., Piper,M.E., McCowan,C., Ireland,A., Levin,J., Malboeuf,C., Qu,J., Chapman,S.B., Murphy,C., Wortman,J., Nusbaum,C., Birren,B.	
113	KJ627697	KJ627697.1	RSV-A/US/BID-V8472/2001	2001-XX-XX	North America	USA	Tennessee		Homo sapiens	2014-04-16		Newman et al		Newman,R.M., Zody,M.C., DeVincenzo,J.P., Grad,Y., Lipsitch,M., Murphy,R., Fitzgerald,M., Young,S., Gargeya,S., Poon,T.W., Charlebois,P., Weiner,B., Yang,X., Piper,M.E., McCowan,C., Ireland,A., Levin,J., Malboeuf,C., Qu,J., Chapman,S.B., Murphy,C., Wortman,J., Nusbaum,C., Birren,B.	
114	KJ627698	KJ627698.1	RSV-A/US/BID-V8473/2001	2001-XX-XX	North America	USA	Tennessee		Homo sapiens	2014-04-16		Newman et al		Newman,R.M., Zody,M.C., DeVincenzo,J.P., Grad,Y., Lipsitch,M., Murphy,R., Fitzgerald,M., Young,S., Gargeya,S., Poon,T.W., Charlebois,P., Weiner,B., Yang,X., Piper,M.E., McCowan,C., Ireland,A., Levin,J., Malboeuf,C., Qu,J., Chapman,S.B., Murphy,C., Wortman,J., Nusbaum,C., Birren,B.	
115	KJ627699	KJ627699.1	RSV-A/US/BID-V8474/2001	2001-XX-XX	North America	USA	Tennessee		Homo sapiens	2014-04-16		Newman et al		Newman,R.M., Zody,M.C., DeVincenzo,J.P., Grad,Y., Lipsitch,M., Murphy,R., Fitzgerald,M., Young,S., Gargeya,S., Poon,T.W., Charlebois,P., Weiner,B., Yang,X., Piper,M.E., McCowan,C., Ireland,A., Levin,J., Malboeuf,C., Qu,J., Chapman,S.B., Murphy,C., Wortman,J., Nusbaum,C., Birren,B.	
116	KJ627700	KJ627700.1	RSV-A/US/BID-V8476/2001	2001-XX-XX	North America	USA	Tennessee		Homo sapiens	2014-04-16		Newman et al		Newman,R.M., Zody,M.C., DeVincenzo,J.P., Grad,Y., Lipsitch,M., Murphy,R., Fitzgerald,M., Young,S., Gargeya,S., Poon,T.W., Charlebois,P., Weiner,B., Yang,X., Piper,M.E., McCowan,C., Ireland,A., Levin,J., Malboeuf,C., Qu,J., Chapman,S.B., Murphy,C., Wortman,J., Nusbaum,C., Birren,B.	
117	KJ627701	KJ627701.1	RSV-A/US/BID-V8477/2001	2001-XX-XX	North America	USA	Tennessee		Homo sapiens	2014-04-16		Newman et al		Newman,R.M., Zody,M.C., DeVincenzo,J.P., Grad,Y., Lipsitch,M., Murphy,R., Fitzgerald,M., Young,S., Gargeya,S., Poon,T.W., Charlebois,P., Weiner,B., Yang,X., Piper,M.E., McCowan,C., Ireland,A., Levin,J., Malboeuf,C., Qu,J., Chapman,S.B., Murphy,C., Wortman,J., Nusbaum,C., Birren,B.	
118	KJ627702	KJ627702.1	RSV-A/US/BID-V8481/2001	2001-XX-XX	North America	USA	Tennessee		Homo sapiens	2014-04-16		Newman et al		Newman,R.M., Zody,M.C., DeVincenzo,J.P., Grad,Y., Lipsitch,M., Murphy,R., Fitzgerald,M., Young,S., Gargeya,S., Poon,T.W., Charlebois,P., Weiner,B., Yang,X., Piper,M.E., McCowan,C., Ireland,A., Levin,J., Malboeuf,C., Qu,J., Chapman,S.B., Murphy,C., Wortman,J., Nusbaum,C., Birren,B.	
119	KJ627703	KJ627703.1	RSV-A/US/BID-V8482/2001	2001-XX-XX	North America	USA	Tennessee		Homo sapiens	2014-04-16		Newman et al		Newman,R.M., Zody,M.C., DeVincenzo,J.P., Grad,Y., Lipsitch,M., Murphy,R., Fitzgerald,M., Young,S., Gargeya,S., Poon,T.W., Charlebois,P., Weiner,B., Yang,X., Piper,M.E., McCowan,C., Ireland,A., Levin,J., Malboeuf,C., Qu,J., Chapman,S.B., Murphy,C., Wortman,J., Nusbaum,C., Birren,B.	
120	KJ627704	KJ627704.1	RSV-A/US/BID-V8483/2001	2001-XX-XX	North America	USA	Tennessee		Homo sapiens	2014-04-16		Newman et al		Newman,R.M., Zody,M.C., DeVincenzo,J.P., Grad,Y., Lipsitch,M., Murphy,R., Fitzgerald,M., Young,S., Gargeya,S., Poon,T.W., Charlebois,P., Weiner,B., Yang,X., Piper,M.E., McCowan,C., Ireland,A., Levin,J., Malboeuf,C., Qu,J., Chapman,S.B., Murphy,C., Wortman,J., Nusbaum,C., Birren,B.	
121	KJ627705	KJ627705.1	RSV-A/US/BID-V8484/2001	2001-XX-XX	North America	USA	Tennessee		Homo sapiens	2014-04-16		Newman et al		Newman,R.M., Zody,M.C., DeVincenzo,J.P., Grad,Y., Lipsitch,M., Murphy,R., Fitzgerald,M., Young,S., Gargeya,S., Poon,T.W., Charlebois,P., Weiner,B., Yang,X., Piper,M.E., McCowan,C., Ireland,A., Levin,J., Malboeuf,C., Qu,J., Chapman,S.B., Murphy,C., Wortman,J., Nusbaum,C., Birren,B.	
122	KJ627706	KJ627706.1	RSV-A/US/BID-V8485/2001	2001-XX-XX	North America	USA	Tennessee		Homo sapiens	2014-04-16		Newman et al		Newman,R.M., Zody,M.C., DeVincenzo,J.P., Grad,Y., Lipsitch,M., Murphy,R., Fitzgerald,M., Young,S., Gargeya,S., Poon,T.W., Charlebois,P., Weiner,B., Yang,X., Piper,M.E., McCowan,C., Ireland,A., Levin,J., Malboeuf,C., Qu,J., Chapman,S.B., Murphy,C., Wortman,J., Nusbaum,C., Birren,B.	
123	KJ627707	KJ627707.1	RSV-A/US/BID-V8486/2001	2001-XX-XX	North America	USA	Tennessee		Homo sapiens	2014-04-16		Newman et al		Newman,R.M., Zody,M.C., DeVincenzo,J.P., Grad,Y., Lipsitch,M., Murphy,R., Fitzgerald,M., Young,S., Gargeya,S., Poon,T.W., Charlebois,P., Weiner,B., Yang,X., Piper,M.E., McCowan,C., Ireland,A., Levin,J., Malboeuf,C., Qu,J., Chapman,S.B., Murphy,C., Wortman,J., Nusbaum,C., Birren,B.	
124	KJ627708	KJ627708.1	RSV-A/US/BID-V8490/2001	2001-XX-XX	North America	USA	Tennessee		Homo sapiens	2014-04-16		Newman et al		Newman,R.M., Zody,M.C., DeVincenzo,J.P., Grad,Y., Lipsitch,M., Murphy,R., Fitzgerald,M., Young,S., Gargeya,S., Poon,T.W., Charlebois,P., Weiner,B., Yang,X., Piper,M.E., McCowan,C., Ireland,A., Levin,J., Malboeuf,C., Qu,J., Chapman,S.B., Murphy,C., Wortman,J., Nusbaum,C., Birren,B.	
125	KJ627709	KJ627709.1	RSV-A/US/BID-V8491/2001	2001-XX-XX	North America	USA	Tennessee		Homo sapiens	2014-04-16		Newman et al		Newman,R.M., Zody,M.C., DeVincenzo,J.P., Grad,Y., Lipsitch,M., Murphy,R., Fitzgerald,M., Young,S., Gargeya,S., Poon,T.W., Charlebois,P., Weiner,B., Yang,X., Piper,M.E., McCowan,C., Ireland,A., Levin,J., Malboeuf,C., Qu,J., Chapman,S.B., Murphy,C., Wortman,J., Nusbaum,C., Birren,B.	
126	KJ627710	KJ627710.1	RSV-A/US/BID-V8493/2001	2001-XX-XX	North America	USA	Tennessee		Homo sapiens	2014-04-16		Newman et al		Newman,R.M., Zody,M.C., DeVincenzo,J.P., Grad,Y., Lipsitch,M., Murphy,R., Fitzgerald,M., Young,S., Gargeya,S., Poon,T.W., Charlebois,P., Weiner,B., Yang,X., Piper,M.E., McCowan,C., Ireland,A., Levin,J., Malboeuf,C., Qu,J., Chapman,S.B., Murphy,C., Wortman,J., Nusbaum,C., Birren,B.	
127	KJ627711	KJ627711.1	RSV-A/US/BID-V8494/2001	2001-XX-XX	North America	USA	Tennessee		Homo sapiens	2014-04-16		Newman et al		Newman,R.M., Zody,M.C., DeVincenzo,J.P., Grad,Y., Lipsitch,M., Murphy,R., Fitzgerald,M., Young,S., Gargeya,S., Poon,T.W., Charlebois,P., Weiner,B., Yang,X., Piper,M.E., McCowan,C., Ireland,A., Levin,J., Malboeuf,C., Qu,J., Chapman,S.B., Murphy,C., Wortman,J., Nusbaum,C., Birren,B.	
128	KJ627712	KJ627712.1	RSV-A/US/BID-V8499/2001	2001-XX-XX	North America	USA	Tennessee		Homo sapiens	2014-04-16		Newman et al		Newman,R.M., Zody,M.C., DeVincenzo,J.P., Grad,Y., Lipsitch,M., Murphy,R., Fitzgerald,M., Young,S., Gargeya,S., Poon,T.W., Charlebois,P., Weiner,B., Yang,X., Piper,M.E., McCowan,C., Ireland,A., Levin,J., Malboeuf,C., Qu,J., Chapman,S.B., Murphy,C., Wortman,J., Nusbaum,C., Birren,B.	
129	KJ627713	KJ627713.1	RSV-A/US/BID-V8500/2001	2001-XX-XX	North America	USA	Tennessee		Homo sapiens	2014-04-16		Newman et al		Newman,R.M., Zody,M.C., DeVincenzo,J.P., Grad,Y., Lipsitch,M., Murphy,R., Fitzgerald,M., Young,S., Gargeya,S., Poon,T.W., Charlebois,P., Weiner,B., Yang,X., Piper,M.E., McCowan,C., Ireland,A., Levin,J., Malboeuf,C., Qu,J., Chapman,S.B., Murphy,C., Wortman,J., Nusbaum,C., Birren,B.	
130	KJ627717	KJ627717.1	RSV-A/US/BID-V8509/2003	2001-XX-XX	North America	USA	Tennessee		Homo sapiens	2014-04-16		Newman et al		Newman,R.M., Zody,M.C., DeVincenzo,J.P., Grad,Y., Lipsitch,M., Murphy,R., Fitzgerald,M., Young,S., Gargeya,S., Poon,T.W., Charlebois,P., Weiner,B., Yang,X., Piper,M.E., McCowan,C., Ireland,A., Levin,J., Malboeuf,C., Qu,J., Chapman,S.B., Murphy,C., Wortman,J., Nusbaum,C., Birren,B.	
131	MF372397	MF372397.1	Caldas/2001/2978	2001-XX-XX	South America	Colombia			Homo sapiens	2017-10-25		Avila et al		Avila,V., Calvo,E.P., Barbosa,J., Velandia-Romero,M.L., Castellanos,J.E.	
132	MF372401	MF372401.1	Bogota/2001/2960	2001-XX-XX	South America	Colombia			Homo sapiens	2017-10-25		Avila et al		Avila,V., Calvo,E.P., Barbosa,J., Velandia-Romero,M.L., Castellanos,J.E.	
133	MF496468	MF496468.1	R90-165	2001-XX-XX	Asia	Taiwan			Homo sapiens	2017-08-30		Chi et al		Chi,H., Hsiao,K.-L., Weng,L.-C., Chiu,N.-C., Huang,L.-M., Chiu,Y.-Y., Liu,C.-P., Liu,H.-F.	
134	MF496469	MF496469.1	R90-164	2001-XX-XX	Asia	Taiwan			Homo sapiens	2017-08-30		Chi et al		Chi,H., Hsiao,K.-L., Weng,L.-C., Chiu,N.-C., Huang,L.-M., Chiu,Y.-Y., Liu,C.-P., Liu,H.-F.	
135	MF496470	MF496470.1	R90-161	2001-XX-XX	Asia	Taiwan			Homo sapiens	2017-08-30		Chi et al		Chi,H., Hsiao,K.-L., Weng,L.-C., Chiu,N.-C., Huang,L.-M., Chiu,Y.-Y., Liu,C.-P., Liu,H.-F.	
136	KT765782	KT765782.1	KEN/Kilifi/505_09/01/2001	2001-01-09	Africa	Kenya			Homo sapiens	2016-02-27		Otieno et al		Otieno,J.R., Agoti,C.N., Gitahi,C.W., Bett,A., Ngama,M., Medley,G.F., Cane,P.A., Nokes,D.J., Nokes,J.D.	
137	KT765783	KT765783.1	KEN/Kilifi/506_09/01/2001	2001-01-09	Africa	Kenya			Homo sapiens	2016-02-27		Otieno et al		Otieno,J.R., Agoti,C.N., Gitahi,C.W., Bett,A., Ngama,M., Medley,G.F., Cane,P.A., Nokes,D.J., Nokes,J.D.	
138	KT765784	KT765784.1	KEN/Kilifi/508_11/01/2001	2001-01-11	Africa	Kenya			Homo sapiens	2016-02-27		Otieno et al		Otieno,J.R., Agoti,C.N., Gitahi,C.W., Bett,A., Ngama,M., Medley,G.F., Cane,P.A., Nokes,D.J., Nokes,J.D.	
139	KT765808	KT765808.1	KEN/Kilifi/507_11/01/2001	2001-01-11	Africa	Kenya			Homo sapiens	2016-02-27		Otieno et al		Otieno,J.R., Agoti,C.N., Gitahi,C.W., Bett,A., Ngama,M., Medley,G.F., Cane,P.A., Nokes,D.J., Nokes,J.D.	
140	KT765785	KT765785.1	KEN/Kilifi/509_17/01/2001	2001-01-17	Africa	Kenya			Homo sapiens	2016-02-27		Otieno et al		Otieno,J.R., Agoti,C.N., Gitahi,C.W., Bett,A., Ngama,M., Medley,G.F., Cane,P.A., Nokes,D.J., Nokes,J.D.	
141	KT765802	KT765802.1	KEN/Kilifi/510_17/01/2001	2001-01-17	Africa	Kenya			Homo sapiens	2016-02-27		Otieno et al		Otieno,J.R., Agoti,C.N., Gitahi,C.W., Bett,A., Ngama,M., Medley,G.F., Cane,P.A., Nokes,D.J., Nokes,J.D.	
142	MK182708	MK182708.1	MK182708	2001-01-31	Asia	Saudi Arabia			Homo sapiens	2019-06-29		Al Aboud et al		Al Aboud,D., Al Aboud,N.M., Al-Malky,M.I.R., Abdel-Moneim,A.S., Al Aboud,D.M.	
143	KT765803	KT765803.1	KEN/Kilifi/511_02/02/2001	2001-02-02	Africa	Kenya			Homo sapiens	2016-02-27		Otieno et al		Otieno,J.R., Agoti,C.N., Gitahi,C.W., Bett,A., Ngama,M., Medley,G.F., Cane,P.A., Nokes,D.J., Nokes,J.D.	
144	JN968334	JN968334.1	V01-2203685	2001-02-12	Asia	Hong Kong			Homo sapiens	2012-01-10		Mak et al		Mak,G.C., Lau,C.S., Chiu,D.M.Y., Lim,W.	
145	KT765786	KT765786.1	KEN/Kilifi/513_15/02/2001	2001-02-15	Africa	Kenya			Homo sapiens	2016-02-27		Otieno et al		Otieno,J.R., Agoti,C.N., Gitahi,C.W., Bett,A., Ngama,M., Medley,G.F., Cane,P.A., Nokes,D.J., Nokes,J.D.	
146	KT765832	KT765832.1	KEN/Kilifi/512_15/02/2001	2001-02-15	Africa	Kenya			Homo sapiens	2016-02-27		Otieno et al		Otieno,J.R., Agoti,C.N., Gitahi,C.W., Bett,A., Ngama,M., Medley,G.F., Cane,P.A., Nokes,D.J., Nokes,J.D.	
147	KT765787	KT765787.1	KEN/Kilifi/514_12/03/2001	2001-03-12	Africa	Kenya			Homo sapiens	2016-02-27		Otieno et al		Otieno,J.R., Agoti,C.N., Gitahi,C.W., Bett,A., Ngama,M., Medley,G.F., Cane,P.A., Nokes,D.J., Nokes,J.D.	
148	KT765788	KT765788.1	KEN/Kilifi/515_22/03/2001	2001-03-22	Africa	Kenya			Homo sapiens	2016-02-27		Otieno et al		Otieno,J.R., Agoti,C.N., Gitahi,C.W., Bett,A., Ngama,M., Medley,G.F., Cane,P.A., Nokes,D.J., Nokes,J.D.	
149	JN968335	JN968335.1	V01-2209978	2001-04-18	Asia	Hong Kong			Homo sapiens	2012-01-10		Mak et al		Mak,G.C., Lau,C.S., Chiu,D.M.Y., Lim,W.	
150	MW455133	MW455133.1	ZS2018RSV05	2001-05-16	Asia	China	Zhongshan City		Homo sapiens	2021-07-22		Lin et al		Lin,J., Wu,Y., Shi,W., Yang,S., Xie,Y.	
151	KT765789	KT765789.1	KEN/Kilifi/516_29/05/2001	2001-05-29	Africa	Kenya			Homo sapiens	2016-02-27		Otieno et al		Otieno,J.R., Agoti,C.N., Gitahi,C.W., Bett,A., Ngama,M., Medley,G.F., Cane,P.A., Nokes,D.J., Nokes,J.D.	
152	KT765672	KT765672.1	KEN/Kilifi/518_10/07/2001	2001-07-10	Africa	Kenya			Homo sapiens	2016-02-27		Otieno et al		Otieno,J.R., Agoti,C.N., Gitahi,C.W., Bett,A., Ngama,M., Medley,G.F., Cane,P.A., Nokes,D.J., Nokes,J.D.	
153	JN968336	JN968336.1	V01-2222398	2001-08-18	Asia	Hong Kong			Homo sapiens	2012-01-10		Mak et al		Mak,G.C., Lau,C.S., Chiu,D.M.Y., Lim,W.	
154	KT765810	KT765810.1	KEN/Kilifi/519_22/12/2001	2001-12-22	Africa	Kenya			Homo sapiens	2016-02-27		Otieno et al		Otieno,J.R., Agoti,C.N., Gitahi,C.W., Bett,A., Ngama,M., Medley,G.F., Cane,P.A., Nokes,D.J., Nokes,J.D.	
155	KF973319	KF973319.1	RSV-A/US/BID-V7335/2002	2002-XX-XX	North America	USA	Tennessee		Homo sapiens	2014-07-22		Grad et al		Grad,Y.H., Newman,R., Zody,M., Yang,X., Murphy,R., Qu,J., Malboeuf,C.M., Levin,J.Z., Lipsitch,M., DeVincenzo,J., Newman,R.M., Zody,M.C., DeVincenzo,J.P., Grad,Y., Fitzgerald,M., Young,S., Gargeya,S., Poon,T.W., Charlebois,P., Weiner,B., Piper,M.E., McCowan,C., Ireland,A., Levin,J., Malboeuf,C., Chapman,S.B., Murphy,C., Wortman,J., Nusbaum,C., Birren,B.	
156	KF973320	KF973320.1	RSV-A/US/BID-V7336/2002	2002-XX-XX	North America	USA	Tennessee		Homo sapiens	2014-07-22		Grad et al		Grad,Y.H., Newman,R., Zody,M., Yang,X., Murphy,R., Qu,J., Malboeuf,C.M., Levin,J.Z., Lipsitch,M., DeVincenzo,J., Newman,R.M., Zody,M.C., DeVincenzo,J.P., Grad,Y., Fitzgerald,M., Young,S., Gargeya,S., Poon,T.W., Charlebois,P., Weiner,B., Piper,M.E., McCowan,C., Ireland,A., Levin,J., Malboeuf,C., Chapman,S.B., Murphy,C., Wortman,J., Nusbaum,C., Birren,B.	
157	KF973321	KF973321.1	RSV-A/US/BID-V7337/2002	2002-XX-XX	North America	USA	Tennessee		Homo sapiens	2014-07-22		Grad et al		Grad,Y.H., Newman,R., Zody,M., Yang,X., Murphy,R., Qu,J., Malboeuf,C.M., Levin,J.Z., Lipsitch,M., DeVincenzo,J., Newman,R.M., Zody,M.C., DeVincenzo,J.P., Grad,Y., Fitzgerald,M., Young,S., Gargeya,S., Poon,T.W., Charlebois,P., Weiner,B., Piper,M.E., McCowan,C., Ireland,A., Levin,J., Malboeuf,C., Chapman,S.B., Murphy,C., Wortman,J., Nusbaum,C., Birren,B.	
158	KF973322	KF973322.1	RSV-A/US/BID-V7338/2002	2002-XX-XX	North America	USA	Tennessee		Homo sapiens	2014-07-22		Grad et al		Grad,Y.H., Newman,R., Zody,M., Yang,X., Murphy,R., Qu,J., Malboeuf,C.M., Levin,J.Z., Lipsitch,M., DeVincenzo,J., Newman,R.M., Zody,M.C., DeVincenzo,J.P., Grad,Y., Fitzgerald,M., Young,S., Gargeya,S., Poon,T.W., Charlebois,P., Weiner,B., Piper,M.E., McCowan,C., Ireland,A., Levin,J., Malboeuf,C., Chapman,S.B., Murphy,C., Wortman,J., Nusbaum,C., Birren,B.	
159	KF973323	KF973323.1	RSV-A/US/BID-V7339/2002	2002-XX-XX	North America	USA	Tennessee		Homo sapiens	2014-07-22		Grad et al		Grad,Y.H., Newman,R., Zody,M., Yang,X., Murphy,R., Qu,J., Malboeuf,C.M., Levin,J.Z., Lipsitch,M., DeVincenzo,J., Newman,R.M., Zody,M.C., DeVincenzo,J.P., Grad,Y., Fitzgerald,M., Young,S., Gargeya,S., Poon,T.W., Charlebois,P., Weiner,B., Piper,M.E., McCowan,C., Ireland,A., Levin,J., Malboeuf,C., Chapman,S.B., Murphy,C., Wortman,J., Nusbaum,C., Birren,B.	
160	KF973324	KF973324.1	RSV-A/US/BID-V7340/2002	2002-XX-XX	North America	USA	Tennessee		Homo sapiens	2014-07-22		Grad et al		Grad,Y.H., Newman,R., Zody,M., Yang,X., Murphy,R., Qu,J., Malboeuf,C.M., Levin,J.Z., Lipsitch,M., DeVincenzo,J., Newman,R.M., Zody,M.C., DeVincenzo,J.P., Grad,Y., Fitzgerald,M., Young,S., Gargeya,S., Poon,T.W., Charlebois,P., Weiner,B., Piper,M.E., McCowan,C., Ireland,A., Levin,J., Malboeuf,C., Chapman,S.B., Murphy,C., Wortman,J., Nusbaum,C., Birren,B.	
161	KF973325	KF973325.1	RSV-A/US/BID-V7342/2002	2002-XX-XX	North America	USA	Tennessee		Homo sapiens	2014-07-22		Grad et al		Grad,Y.H., Newman,R., Zody,M., Yang,X., Murphy,R., Qu,J., Malboeuf,C.M., Levin,J.Z., Lipsitch,M., DeVincenzo,J., Newman,R.M., Zody,M.C., DeVincenzo,J.P., Grad,Y., Fitzgerald,M., Young,S., Gargeya,S., Poon,T.W., Charlebois,P., Weiner,B., Piper,M.E., McCowan,C., Ireland,A., Levin,J., Malboeuf,C., Chapman,S.B., Murphy,C., Wortman,J., Nusbaum,C., Birren,B.	
162	KF973326	KF973326.1	RSV-A/US/BID-V7343/2002	2002-XX-XX	North America	USA	Tennessee		Homo sapiens	2014-07-22		Grad et al		Grad,Y.H., Newman,R., Zody,M., Yang,X., Murphy,R., Qu,J., Malboeuf,C.M., Levin,J.Z., Lipsitch,M., DeVincenzo,J., Newman,R.M., Zody,M.C., DeVincenzo,J.P., Grad,Y., Fitzgerald,M., Young,S., Gargeya,S., Poon,T.W., Charlebois,P., Weiner,B., Piper,M.E., McCowan,C., Ireland,A., Levin,J., Malboeuf,C., Chapman,S.B., Murphy,C., Wortman,J., Nusbaum,C., Birren,B.	
163	KF973327	KF973327.1	RSV-A/US/BID-V7344/2002	2002-XX-XX	North America	USA	Tennessee		Homo sapiens	2014-07-22		Grad et al		Grad,Y.H., Newman,R., Zody,M., Yang,X., Murphy,R., Qu,J., Malboeuf,C.M., Levin,J.Z., Lipsitch,M., DeVincenzo,J., Newman,R.M., Zody,M.C., DeVincenzo,J.P., Grad,Y., Fitzgerald,M., Young,S., Gargeya,S., Poon,T.W., Charlebois,P., Weiner,B., Piper,M.E., McCowan,C., Ireland,A., Levin,J., Malboeuf,C., Chapman,S.B., Murphy,C., Wortman,J., Nusbaum,C., Birren,B.	
164	KF973328	KF973328.1	RSV-A/US/BID-V7345/2002	2002-XX-XX	North America	USA	Tennessee		Homo sapiens	2014-07-22		Grad et al		Grad,Y.H., Newman,R., Zody,M., Yang,X., Murphy,R., Qu,J., Malboeuf,C.M., Levin,J.Z., Lipsitch,M., DeVincenzo,J., Newman,R.M., Zody,M.C., DeVincenzo,J.P., Grad,Y., Fitzgerald,M., Young,S., Gargeya,S., Poon,T.W., Charlebois,P., Weiner,B., Piper,M.E., McCowan,C., Ireland,A., Levin,J., Malboeuf,C., Chapman,S.B., Murphy,C., Wortman,J., Nusbaum,C., Birren,B.	
165	KF973329	KF973329.1	RSV-A/US/BID-V7346/2002	2002-XX-XX	North America	USA	Tennessee		Homo sapiens	2014-07-22		Grad et al		Grad,Y.H., Newman,R., Zody,M., Yang,X., Murphy,R., Qu,J., Malboeuf,C.M., Levin,J.Z., Lipsitch,M., DeVincenzo,J., Newman,R.M., Zody,M.C., DeVincenzo,J.P., Grad,Y., Fitzgerald,M., Young,S., Gargeya,S., Poon,T.W., Charlebois,P., Weiner,B., Piper,M.E., McCowan,C., Ireland,A., Levin,J., Malboeuf,C., Chapman,S.B., Murphy,C., Wortman,J., Nusbaum,C., Birren,B.	
166	KF973330	KF973330.1	RSV-A/US/BID-V7347/2002	2002-XX-XX	North America	USA	Tennessee		Homo sapiens	2014-07-22		Grad et al		Grad,Y.H., Newman,R., Zody,M., Yang,X., Murphy,R., Qu,J., Malboeuf,C.M., Levin,J.Z., Lipsitch,M., DeVincenzo,J., Newman,R.M., Zody,M.C., DeVincenzo,J.P., Grad,Y., Fitzgerald,M., Young,S., Gargeya,S., Poon,T.W., Charlebois,P., Weiner,B., Piper,M.E., McCowan,C., Ireland,A., Levin,J., Malboeuf,C., Chapman,S.B., Murphy,C., Wortman,J., Nusbaum,C., Birren,B.	
167	KF973331	KF973331.1	RSV-A/US/BID-V7348/2002	2002-XX-XX	North America	USA	Tennessee		Homo sapiens	2014-07-22		Grad et al		Grad,Y.H., Newman,R., Zody,M., Yang,X., Murphy,R., Qu,J., Malboeuf,C.M., Levin,J.Z., Lipsitch,M., DeVincenzo,J., Newman,R.M., Zody,M.C., DeVincenzo,J.P., Grad,Y., Fitzgerald,M., Young,S., Gargeya,S., Poon,T.W., Charlebois,P., Weiner,B., Piper,M.E., McCowan,C., Ireland,A., Levin,J., Malboeuf,C., Chapman,S.B., Murphy,C., Wortman,J., Nusbaum,C., Birren,B.	
168	KF973332	KF973332.1	RSV-A/US/BID-V7349/2002	2002-XX-XX	North America	USA	Tennessee		Homo sapiens	2014-07-22		Grad et al		Grad,Y.H., Newman,R., Zody,M., Yang,X., Murphy,R., Qu,J., Malboeuf,C.M., Levin,J.Z., Lipsitch,M., DeVincenzo,J., Newman,R.M., Zody,M.C., DeVincenzo,J.P., Grad,Y., Fitzgerald,M., Young,S., Gargeya,S., Poon,T.W., Charlebois,P., Weiner,B., Piper,M.E., McCowan,C., Ireland,A., Levin,J., Malboeuf,C., Chapman,S.B., Murphy,C., Wortman,J., Nusbaum,C., Birren,B.	
169	KF973333	KF973333.1	RSV-A/US/BID-V7350/2002	2002-XX-XX	North America	USA	Tennessee		Homo sapiens	2014-07-22		Grad et al		Grad,Y.H., Newman,R., Zody,M., Yang,X., Murphy,R., Qu,J., Malboeuf,C.M., Levin,J.Z., Lipsitch,M., DeVincenzo,J., Newman,R.M., Zody,M.C., DeVincenzo,J.P., Grad,Y., Fitzgerald,M., Young,S., Gargeya,S., Poon,T.W., Charlebois,P., Weiner,B., Piper,M.E., McCowan,C., Ireland,A., Levin,J., Malboeuf,C., Chapman,S.B., Murphy,C., Wortman,J., Nusbaum,C., Birren,B.	
170	KF973334	KF973334.1	RSV-A/US/BID-V7351/2002	2002-XX-XX	North America	USA	Tennessee		Homo sapiens	2014-07-22		Grad et al		Grad,Y.H., Newman,R., Zody,M., Yang,X., Murphy,R., Qu,J., Malboeuf,C.M., Levin,J.Z., Lipsitch,M., DeVincenzo,J., Newman,R.M., Zody,M.C., DeVincenzo,J.P., Grad,Y., Fitzgerald,M., Young,S., Gargeya,S., Poon,T.W., Charlebois,P., Weiner,B., Piper,M.E., McCowan,C., Ireland,A., Levin,J., Malboeuf,C., Chapman,S.B., Murphy,C., Wortman,J., Nusbaum,C., Birren,B.	
171	KF973335	KF973335.1	RSV-A/US/BID-V7354/2002	2002-XX-XX	North America	USA	Tennessee		Homo sapiens	2014-07-22		Grad et al		Grad,Y.H., Newman,R., Zody,M., Yang,X., Murphy,R., Qu,J., Malboeuf,C.M., Levin,J.Z., Lipsitch,M., DeVincenzo,J., Newman,R.M., Zody,M.C., DeVincenzo,J.P., Grad,Y., Fitzgerald,M., Young,S., Gargeya,S., Poon,T.W., Charlebois,P., Weiner,B., Piper,M.E., McCowan,C., Ireland,A., Levin,J., Malboeuf,C., Chapman,S.B., Murphy,C., Wortman,J., Nusbaum,C., Birren,B.	
172	KF973336	KF973336.1	RSV-A/US/BID-V7355/2002	2002-XX-XX	North America	USA	Tennessee		Homo sapiens	2014-07-22		Grad et al		Grad,Y.H., Newman,R., Zody,M., Yang,X., Murphy,R., Qu,J., Malboeuf,C.M., Levin,J.Z., Lipsitch,M., DeVincenzo,J., Newman,R.M., Zody,M.C., DeVincenzo,J.P., Grad,Y., Fitzgerald,M., Young,S., Gargeya,S., Poon,T.W., Charlebois,P., Weiner,B., Piper,M.E., McCowan,C., Ireland,A., Levin,J., Malboeuf,C., Chapman,S.B., Murphy,C., Wortman,J., Nusbaum,C., Birren,B.	
173	KF973337	KF973337.1	RSV-A/US/BID-V7356/2002	2002-XX-XX	North America	USA	Tennessee		Homo sapiens	2014-07-22		Grad et al		Grad,Y.H., Newman,R., Zody,M., Yang,X., Murphy,R., Qu,J., Malboeuf,C.M., Levin,J.Z., Lipsitch,M., DeVincenzo,J., Newman,R.M., Zody,M.C., DeVincenzo,J.P., Grad,Y., Fitzgerald,M., Young,S., Gargeya,S., Poon,T.W., Charlebois,P., Weiner,B., Piper,M.E., McCowan,C., Ireland,A., Levin,J., Malboeuf,C., Chapman,S.B., Murphy,C., Wortman,J., Nusbaum,C., Birren,B.	
174	KF973338	KF973338.1	RSV-A/US/BID-V7357/2002	2002-XX-XX	North America	USA	Tennessee		Homo sapiens	2014-07-22		Grad et al		Grad,Y.H., Newman,R., Zody,M., Yang,X., Murphy,R., Qu,J., Malboeuf,C.M., Levin,J.Z., Lipsitch,M., DeVincenzo,J., Newman,R.M., Zody,M.C., DeVincenzo,J.P., Grad,Y., Fitzgerald,M., Young,S., Gargeya,S., Poon,T.W., Charlebois,P., Weiner,B., Piper,M.E., McCowan,C., Ireland,A., Levin,J., Malboeuf,C., Chapman,S.B., Murphy,C., Wortman,J., Nusbaum,C., Birren,B.	
175	KF973339	KF973339.1	RSV-A/US/BID-V7358/2002	2002-XX-XX	North America	USA	Tennessee		Homo sapiens	2014-07-22		Grad et al		Grad,Y.H., Newman,R., Zody,M., Yang,X., Murphy,R., Qu,J., Malboeuf,C.M., Levin,J.Z., Lipsitch,M., DeVincenzo,J., Newman,R.M., Zody,M.C., DeVincenzo,J.P., Grad,Y., Fitzgerald,M., Young,S., Gargeya,S., Poon,T.W., Charlebois,P., Weiner,B., Piper,M.E., McCowan,C., Ireland,A., Levin,J., Malboeuf,C., Chapman,S.B., Murphy,C., Wortman,J., Nusbaum,C., Birren,B.	
176	KF973340	KF973340.1	RSV-A/US/BID-V7359/2002	2002-XX-XX	North America	USA	Tennessee		Homo sapiens	2014-07-22		Grad et al		Grad,Y.H., Newman,R., Zody,M., Yang,X., Murphy,R., Qu,J., Malboeuf,C.M., Levin,J.Z., Lipsitch,M., DeVincenzo,J., Newman,R.M., Zody,M.C., DeVincenzo,J.P., Grad,Y., Fitzgerald,M., Young,S., Gargeya,S., Poon,T.W., Charlebois,P., Weiner,B., Piper,M.E., McCowan,C., Ireland,A., Levin,J., Malboeuf,C., Chapman,S.B., Murphy,C., Wortman,J., Nusbaum,C., Birren,B.	
177	KJ627651	KJ627651.1	RSV-A/US/BID-V8319/2002	2002-XX-XX	North America	USA	Tennessee		Homo sapiens	2014-04-16		Newman et al		Newman,R.M., Zody,M.C., DeVincenzo,J.P., Grad,Y., Lipsitch,M., Murphy,R., Fitzgerald,M., Young,S., Gargeya,S., Poon,T.W., Charlebois,P., Weiner,B., Yang,X., Piper,M.E., McCowan,C., Ireland,A., Levin,J., Malboeuf,C., Qu,J., Chapman,S.B., Murphy,C., Wortman,J., Nusbaum,C., Birren,B.	
178	KJ627652	KJ627652.1	RSV-A/US/BID-V8320/2002	2002-XX-XX	North America	USA	Tennessee		Homo sapiens	2014-04-16		Newman et al		Newman,R.M., Zody,M.C., DeVincenzo,J.P., Grad,Y., Lipsitch,M., Murphy,R., Fitzgerald,M., Young,S., Gargeya,S., Poon,T.W., Charlebois,P., Weiner,B., Yang,X., Piper,M.E., McCowan,C., Ireland,A., Levin,J., Malboeuf,C., Qu,J., Chapman,S.B., Murphy,C., Wortman,J., Nusbaum,C., Birren,B.	
179	KJ627653	KJ627653.1	RSV-A/US/BID-V8322/2002	2002-XX-XX	North America	USA	Tennessee		Homo sapiens	2014-04-16		Newman et al		Newman,R.M., Zody,M.C., DeVincenzo,J.P., Grad,Y., Lipsitch,M., Murphy,R., Fitzgerald,M., Young,S., Gargeya,S., Poon,T.W., Charlebois,P., Weiner,B., Yang,X., Piper,M.E., McCowan,C., Ireland,A., Levin,J., Malboeuf,C., Qu,J., Chapman,S.B., Murphy,C., Wortman,J., Nusbaum,C., Birren,B.	
180	KJ627654	KJ627654.1	RSV-A/US/BID-V8323/2002	2002-XX-XX	North America	USA	Tennessee		Homo sapiens	2014-04-16		Newman et al		Newman,R.M., Zody,M.C., DeVincenzo,J.P., Grad,Y., Lipsitch,M., Murphy,R., Fitzgerald,M., Young,S., Gargeya,S., Poon,T.W., Charlebois,P., Weiner,B., Yang,X., Piper,M.E., McCowan,C., Ireland,A., Levin,J., Malboeuf,C., Qu,J., Chapman,S.B., Murphy,C., Wortman,J., Nusbaum,C., Birren,B.	
181	KJ627655	KJ627655.1	RSV-A/US/BID-V8338/2002	2002-XX-XX	North America	USA	Tennessee		Homo sapiens	2014-04-16		Newman et al		Newman,R.M., Zody,M.C., DeVincenzo,J.P., Grad,Y., Lipsitch,M., Murphy,R., Fitzgerald,M., Young,S., Gargeya,S., Poon,T.W., Charlebois,P., Weiner,B., Yang,X., Piper,M.E., McCowan,C., Ireland,A., Levin,J., Malboeuf,C., Qu,J., Chapman,S.B., Murphy,C., Wortman,J., Nusbaum,C., Birren,B.	
182	MF372393	MF372393.1	Bogota/2002/3362	2002-XX-XX	South America	Colombia			Homo sapiens	2017-10-25		Avila et al		Avila,V., Calvo,E.P., Barbosa,J., Velandia-Romero,M.L., Castellanos,J.E.	
183	MF372394	MF372394.1	Bogota/2002/I7302	2002-XX-XX	South America	Colombia			Homo sapiens	2017-10-25		Avila et al		Avila,V., Calvo,E.P., Barbosa,J., Velandia-Romero,M.L., Castellanos,J.E.	
184	MF496457	MF496457.1	R91-353	2002-XX-XX	Asia	Taiwan			Homo sapiens	2017-08-30		Chi et al		Chi,H., Hsiao,K.-L., Weng,L.-C., Chiu,N.-C., Huang,L.-M., Chiu,Y.-Y., Liu,C.-P., Liu,H.-F.	
185	MF496458	MF496458.1	R91-350	2002-XX-XX	Asia	Taiwan			Homo sapiens	2017-08-30		Chi et al		Chi,H., Hsiao,K.-L., Weng,L.-C., Chiu,N.-C., Huang,L.-M., Chiu,Y.-Y., Liu,C.-P., Liu,H.-F.	
186	MF496459	MF496459.1	R91-345	2002-XX-XX	Asia	Taiwan			Homo sapiens	2017-08-30		Chi et al		Chi,H., Hsiao,K.-L., Weng,L.-C., Chiu,N.-C., Huang,L.-M., Chiu,Y.-Y., Liu,C.-P., Liu,H.-F.	
187	MF496460	MF496460.1	R91-341	2002-XX-XX	Asia	Taiwan			Homo sapiens	2017-08-30		Chi et al		Chi,H., Hsiao,K.-L., Weng,L.-C., Chiu,N.-C., Huang,L.-M., Chiu,Y.-Y., Liu,C.-P., Liu,H.-F.	
188	MF496461	MF496461.1	R91-340	2002-XX-XX	Asia	Taiwan			Homo sapiens	2017-08-30		Chi et al		Chi,H., Hsiao,K.-L., Weng,L.-C., Chiu,N.-C., Huang,L.-M., Chiu,Y.-Y., Liu,C.-P., Liu,H.-F.	
189	MF496462	MF496462.1	R91-339	2002-XX-XX	Asia	Taiwan			Homo sapiens	2017-08-30		Chi et al		Chi,H., Hsiao,K.-L., Weng,L.-C., Chiu,N.-C., Huang,L.-M., Chiu,Y.-Y., Liu,C.-P., Liu,H.-F.	
190	MF496463	MF496463.1	R91-338	2002-XX-XX	Asia	Taiwan			Homo sapiens	2017-08-30		Chi et al		Chi,H., Hsiao,K.-L., Weng,L.-C., Chiu,N.-C., Huang,L.-M., Chiu,Y.-Y., Liu,C.-P., Liu,H.-F.	
191	MF496464	MF496464.1	R91-335	2002-XX-XX	Asia	Taiwan			Homo sapiens	2017-08-30		Chi et al		Chi,H., Hsiao,K.-L., Weng,L.-C., Chiu,N.-C., Huang,L.-M., Chiu,Y.-Y., Liu,C.-P., Liu,H.-F.	
192	MF496465	MF496465.1	R91-331	2002-XX-XX	Asia	Taiwan			Homo sapiens	2017-08-30		Chi et al		Chi,H., Hsiao,K.-L., Weng,L.-C., Chiu,N.-C., Huang,L.-M., Chiu,Y.-Y., Liu,C.-P., Liu,H.-F.	
193	MF496466	MF496466.1	R91-330	2002-XX-XX	Asia	Taiwan			Homo sapiens	2017-08-30		Chi et al		Chi,H., Hsiao,K.-L., Weng,L.-C., Chiu,N.-C., Huang,L.-M., Chiu,Y.-Y., Liu,C.-P., Liu,H.-F.	
194	MF496467	MF496467.1	R91-327	2002-XX-XX	Asia	Taiwan			Homo sapiens	2017-08-30		Chi et al		Chi,H., Hsiao,K.-L., Weng,L.-C., Chiu,N.-C., Huang,L.-M., Chiu,Y.-Y., Liu,C.-P., Liu,H.-F.	
195	KT765790	KT765790.1	KEN/Kilifi/520_09/01/2002	2002-01-09	Africa	Kenya			Homo sapiens	2016-02-27		Otieno et al		Otieno,J.R., Agoti,C.N., Gitahi,C.W., Bett,A., Ngama,M., Medley,G.F., Cane,P.A., Nokes,D.J., Nokes,J.D.	
196	KT765804	KT765804.1	KEN/Kilifi/521_15/01/2002	2002-01-15	Africa	Kenya			Homo sapiens	2016-02-27		Otieno et al		Otieno,J.R., Agoti,C.N., Gitahi,C.W., Bett,A., Ngama,M., Medley,G.F., Cane,P.A., Nokes,D.J., Nokes,J.D.	
197	KT765805	KT765805.1	KEN/Kilifi/522_04/02/2002	2002-02-04	Africa	Kenya			Homo sapiens	2016-02-27		Otieno et al		Otieno,J.R., Agoti,C.N., Gitahi,C.W., Bett,A., Ngama,M., Medley,G.F., Cane,P.A., Nokes,D.J., Nokes,J.D.	
198	JN968337	JN968337.1	V02-2203034	2002-02-05	Asia	Hong Kong			Homo sapiens	2012-01-10		Mak et al		Mak,G.C., Lau,C.S., Chiu,D.M.Y., Lim,W.	
199	KT765791	KT765791.1	KEN/Kilifi/523_08/02/2002	2002-02-08	Africa	Kenya			Homo sapiens	2016-02-27		Otieno et al		Otieno,J.R., Agoti,C.N., Gitahi,C.W., Bett,A., Ngama,M., Medley,G.F., Cane,P.A., Nokes,D.J., Nokes,J.D.	
200	KT765811	KT765811.1	KEN/Kilifi/524_28/02/2002	2002-02-28	Africa	Kenya			Homo sapiens	2016-02-27		Otieno et al		Otieno,J.R., Agoti,C.N., Gitahi,C.W., Bett,A., Ngama,M., Medley,G.F., Cane,P.A., Nokes,D.J., Nokes,J.D.	
201	KT765674	KT765674.1	KEN/Kilifi/525_05/03/2002	2002-03-05	Africa	Kenya			Homo sapiens	2016-02-27		Otieno et al		Otieno,J.R., Agoti,C.N., Gitahi,C.W., Bett,A., Ngama,M., Medley,G.F., Cane,P.A., Nokes,D.J., Nokes,J.D.	
202	KT765792	KT765792.1	KEN/Kilifi/526_06/03/2002	2002-03-06	Africa	Kenya			Homo sapiens	2016-02-27		Otieno et al		Otieno,J.R., Agoti,C.N., Gitahi,C.W., Bett,A., Ngama,M., Medley,G.F., Cane,P.A., Nokes,D.J., Nokes,J.D.	
203	KT765793	KT765793.1	KEN/Kilifi/527_06/03/2002	2002-03-06	Africa	Kenya			Homo sapiens	2016-02-27		Otieno et al		Otieno,J.R., Agoti,C.N., Gitahi,C.W., Bett,A., Ngama,M., Medley,G.F., Cane,P.A., Nokes,D.J., Nokes,J.D.	
204	KT765781	KT765781.1	KEN/Kilifi/529_11/03/2002	2002-03-11	Africa	Kenya			Homo sapiens	2016-02-27		Otieno et al		Otieno,J.R., Agoti,C.N., Gitahi,C.W., Bett,A., Ngama,M., Medley,G.F., Cane,P.A., Nokes,D.J., Nokes,J.D.	
205	KT765813	KT765813.1	KEN/Kilifi/528_13/03/2002	2002-03-13	Africa	Kenya			Homo sapiens	2016-02-27		Otieno et al		Otieno,J.R., Agoti,C.N., Gitahi,C.W., Bett,A., Ngama,M., Medley,G.F., Cane,P.A., Nokes,D.J., Nokes,J.D.	
206	KT765675	KT765675.1	KEN/Kilifi/530_14/03/2002	2002-03-14	Africa	Kenya			Homo sapiens	2016-02-27		Otieno et al		Otieno,J.R., Agoti,C.N., Gitahi,C.W., Bett,A., Ngama,M., Medley,G.F., Cane,P.A., Nokes,D.J., Nokes,J.D.	
207	KT765668	KT765668.1	KEN/Kilifi/534_18/03/2002	2002-03-18	Africa	Kenya			Homo sapiens	2016-02-27		Otieno et al		Otieno,J.R., Agoti,C.N., Gitahi,C.W., Bett,A., Ngama,M., Medley,G.F., Cane,P.A., Nokes,D.J., Nokes,J.D.	
208	KT765676	KT765676.1	KEN/Kilifi/531_18/03/2002	2002-03-18	Africa	Kenya			Homo sapiens	2016-02-27		Otieno et al		Otieno,J.R., Agoti,C.N., Gitahi,C.W., Bett,A., Ngama,M., Medley,G.F., Cane,P.A., Nokes,D.J., Nokes,J.D.	
209	KT765794	KT765794.1	KEN/Kilifi/532_18/03/2002	2002-03-18	Africa	Kenya			Homo sapiens	2016-02-27		Otieno et al		Otieno,J.R., Agoti,C.N., Gitahi,C.W., Bett,A., Ngama,M., Medley,G.F., Cane,P.A., Nokes,D.J., Nokes,J.D.	
210	KT765795	KT765795.1	KEN/Kilifi/533_19/03/2002	2002-03-19	Africa	Kenya			Homo sapiens	2016-02-27		Otieno et al		Otieno,J.R., Agoti,C.N., Gitahi,C.W., Bett,A., Ngama,M., Medley,G.F., Cane,P.A., Nokes,D.J., Nokes,J.D.	
211	KT765669	KT765669.1	KEN/Kilifi/537_20/03/2002	2002-03-20	Africa	Kenya			Homo sapiens	2016-02-27		Otieno et al		Otieno,J.R., Agoti,C.N., Gitahi,C.W., Bett,A., Ngama,M., Medley,G.F., Cane,P.A., Nokes,D.J., Nokes,J.D.	
212	KT765796	KT765796.1	KEN/Kilifi/535_20/03/2002	2002-03-20	Africa	Kenya			Homo sapiens	2016-02-27		Otieno et al		Otieno,J.R., Agoti,C.N., Gitahi,C.W., Bett,A., Ngama,M., Medley,G.F., Cane,P.A., Nokes,D.J., Nokes,J.D.	
213	KT765797	KT765797.1	KEN/Kilifi/536_20/03/2002	2002-03-20	Africa	Kenya			Homo sapiens	2016-02-27		Otieno et al		Otieno,J.R., Agoti,C.N., Gitahi,C.W., Bett,A., Ngama,M., Medley,G.F., Cane,P.A., Nokes,D.J., Nokes,J.D.	
214	KT765812	KT765812.1	KEN/Kilifi/538_26/03/2002	2002-03-26	Africa	Kenya			Homo sapiens	2016-02-27		Otieno et al		Otieno,J.R., Agoti,C.N., Gitahi,C.W., Bett,A., Ngama,M., Medley,G.F., Cane,P.A., Nokes,D.J., Nokes,J.D.	
215	KT765677	KT765677.1	KEN/Kilifi/539_28/03/2002	2002-03-28	Africa	Kenya			Homo sapiens	2016-02-27		Otieno et al		Otieno,J.R., Agoti,C.N., Gitahi,C.W., Bett,A., Ngama,M., Medley,G.F., Cane,P.A., Nokes,D.J., Nokes,J.D.	
216	KT765678	KT765678.1	KEN/Kilifi/541_28/03/2002	2002-03-28	Africa	Kenya			Homo sapiens	2016-02-27		Otieno et al		Otieno,J.R., Agoti,C.N., Gitahi,C.W., Bett,A., Ngama,M., Medley,G.F., Cane,P.A., Nokes,D.J., Nokes,J.D.	
217	KT765798	KT765798.1	KEN/Kilifi/540_28/03/2002	2002-03-28	Africa	Kenya			Homo sapiens	2016-02-27		Otieno et al		Otieno,J.R., Agoti,C.N., Gitahi,C.W., Bett,A., Ngama,M., Medley,G.F., Cane,P.A., Nokes,D.J., Nokes,J.D.	
218	KT765799	KT765799.1	KEN/Kilifi/542_29/03/2002	2002-03-29	Africa	Kenya			Homo sapiens	2016-02-27		Otieno et al		Otieno,J.R., Agoti,C.N., Gitahi,C.W., Bett,A., Ngama,M., Medley,G.F., Cane,P.A., Nokes,D.J., Nokes,J.D.	
219	KT765670	KT765670.1	KEN/Kilifi/543_01/04/2002	2002-04-01	Africa	Kenya			Homo sapiens	2016-02-27		Otieno et al		Otieno,J.R., Agoti,C.N., Gitahi,C.W., Bett,A., Ngama,M., Medley,G.F., Cane,P.A., Nokes,D.J., Nokes,J.D.	
220	KT765665	KT765665.1	KEN/Kilifi/544_02/04/2002	2002-04-02	Africa	Kenya			Homo sapiens	2016-02-27		Otieno et al		Otieno,J.R., Agoti,C.N., Gitahi,C.W., Bett,A., Ngama,M., Medley,G.F., Cane,P.A., Nokes,D.J., Nokes,J.D.	
221	KT765831	KT765831.1	KEN/Kilifi/545_03/04/2002	2002-04-03	Africa	Kenya			Homo sapiens	2016-02-27		Otieno et al		Otieno,J.R., Agoti,C.N., Gitahi,C.W., Bett,A., Ngama,M., Medley,G.F., Cane,P.A., Nokes,D.J., Nokes,J.D.	
222	JN968338	JN968338.1	V02-2208039	2002-04-05	Asia	Hong Kong			Homo sapiens	2012-01-10		Mak et al		Mak,G.C., Lau,C.S., Chiu,D.M.Y., Lim,W.	
223	KT765800	KT765800.1	KEN/Kilifi/546_18/04/2002	2002-04-18	Africa	Kenya			Homo sapiens	2016-02-27		Otieno et al		Otieno,J.R., Agoti,C.N., Gitahi,C.W., Bett,A., Ngama,M., Medley,G.F., Cane,P.A., Nokes,D.J., Nokes,J.D.	
224	KT765814	KT765814.1	KEN/Kilifi/547_22/04/2002	2002-04-22	Africa	Kenya			Homo sapiens	2016-02-27		Otieno et al		Otieno,J.R., Agoti,C.N., Gitahi,C.W., Bett,A., Ngama,M., Medley,G.F., Cane,P.A., Nokes,D.J., Nokes,J.D.	
225	KT765666	KT765666.1	KEN/Kilifi/548_26/04/2002	2002-04-26	Africa	Kenya			Homo sapiens	2016-02-27		Otieno et al		Otieno,J.R., Agoti,C.N., Gitahi,C.W., Bett,A., Ngama,M., Medley,G.F., Cane,P.A., Nokes,D.J., Nokes,J.D.	
226	KT765667	KT765667.1	KEN/Kilifi/549_29/04/2002	2002-04-29	Africa	Kenya			Homo sapiens	2016-02-27		Otieno et al		Otieno,J.R., Agoti,C.N., Gitahi,C.W., Bett,A., Ngama,M., Medley,G.F., Cane,P.A., Nokes,D.J., Nokes,J.D.	
227	KT765801	KT765801.1	KEN/Kilifi/550_29/04/2002	2002-04-29	Africa	Kenya			Homo sapiens	2016-02-27		Otieno et al		Otieno,J.R., Agoti,C.N., Gitahi,C.W., Bett,A., Ngama,M., Medley,G.F., Cane,P.A., Nokes,D.J., Nokes,J.D.	
228	KT765806	KT765806.1	KEN/Kilifi/551_30/04/2002	2002-04-30	Africa	Kenya			Homo sapiens	2016-02-27		Otieno et al		Otieno,J.R., Agoti,C.N., Gitahi,C.W., Bett,A., Ngama,M., Medley,G.F., Cane,P.A., Nokes,D.J., Nokes,J.D.	
229	KT765673	KT765673.1	KEN/Kilifi/552_06/05/2002	2002-05-06	Africa	Kenya			Homo sapiens	2016-02-27		Otieno et al		Otieno,J.R., Agoti,C.N., Gitahi,C.W., Bett,A., Ngama,M., Medley,G.F., Cane,P.A., Nokes,D.J., Nokes,J.D.	
230	KT765683	KT765683.1	KEN/Kilifi/553_07/05/2002	2002-05-07	Africa	Kenya			Homo sapiens	2016-02-27		Otieno et al		Otieno,J.R., Agoti,C.N., Gitahi,C.W., Bett,A., Ngama,M., Medley,G.F., Cane,P.A., Nokes,D.J., Nokes,J.D.	
231	KT765679	KT765679.1	KEN/Kilifi/554_08/05/2002	2002-05-08	Africa	Kenya			Homo sapiens	2016-02-27		Otieno et al		Otieno,J.R., Agoti,C.N., Gitahi,C.W., Bett,A., Ngama,M., Medley,G.F., Cane,P.A., Nokes,D.J., Nokes,J.D.	
232	KT765671	KT765671.1	KEN/Kilifi/555_09/05/2002	2002-05-09	Africa	Kenya			Homo sapiens	2016-02-27		Otieno et al		Otieno,J.R., Agoti,C.N., Gitahi,C.W., Bett,A., Ngama,M., Medley,G.F., Cane,P.A., Nokes,D.J., Nokes,J.D.	
233	KT765680	KT765680.1	KEN/Kilifi/556_10/05/2002	2002-05-10	Africa	Kenya			Homo sapiens	2016-02-27		Otieno et al		Otieno,J.R., Agoti,C.N., Gitahi,C.W., Bett,A., Ngama,M., Medley,G.F., Cane,P.A., Nokes,D.J., Nokes,J.D.	
234	KT765681	KT765681.1	KEN/Kilifi/557_10/06/2002	2002-06-10	Africa	Kenya			Homo sapiens	2016-02-27		Otieno et al		Otieno,J.R., Agoti,C.N., Gitahi,C.W., Bett,A., Ngama,M., Medley,G.F., Cane,P.A., Nokes,D.J., Nokes,J.D.	
235	KT765682	KT765682.1	KEN/Kilifi/558_12/06/2002	2002-06-12	Africa	Kenya			Homo sapiens	2016-02-27		Otieno et al		Otieno,J.R., Agoti,C.N., Gitahi,C.W., Bett,A., Ngama,M., Medley,G.F., Cane,P.A., Nokes,D.J., Nokes,J.D.	
236	JN968339	JN968339.1	V02-2215330	2002-06-18	Asia	Hong Kong			Homo sapiens	2012-01-10		Mak et al		Mak,G.C., Lau,C.S., Chiu,D.M.Y., Lim,W.	
237	JN968314	JN968314.1	V02-2219452	2002-08-02	Asia	Hong Kong			Homo sapiens	2012-01-10		Mak et al		Mak,G.C., Lau,C.S., Chiu,D.M.Y., Lim,W.	
238	JN968340	JN968340.1	V02-2224573	2002-10-07	Asia	Hong Kong			Homo sapiens	2012-01-10		Mak et al		Mak,G.C., Lau,C.S., Chiu,D.M.Y., Lim,W.	
239	KJ627656	KJ627656.1	RSV-A/US/BID-V8352/2003	2003-XX-XX	North America	USA	Tennessee		Homo sapiens	2014-04-16		Newman et al		Newman,R.M., Zody,M.C., DeVincenzo,J.P., Grad,Y., Lipsitch,M., Murphy,R., Fitzgerald,M., Young,S., Gargeya,S., Poon,T.W., Charlebois,P., Weiner,B., Yang,X., Piper,M.E., McCowan,C., Ireland,A., Levin,J., Malboeuf,C., Qu,J., Chapman,S.B., Murphy,C., Wortman,J., Nusbaum,C., Birren,B.	
240	KJ627657	KJ627657.1	RSV-A/US/BID-V8354/2003	2003-XX-XX	North America	USA	Tennessee		Homo sapiens	2014-04-16		Newman et al		Newman,R.M., Zody,M.C., DeVincenzo,J.P., Grad,Y., Lipsitch,M., Murphy,R., Fitzgerald,M., Young,S., Gargeya,S., Poon,T.W., Charlebois,P., Weiner,B., Yang,X., Piper,M.E., McCowan,C., Ireland,A., Levin,J., Malboeuf,C., Qu,J., Chapman,S.B., Murphy,C., Wortman,J., Nusbaum,C., Birren,B.	
241	KJ627658	KJ627658.1	RSV-A/US/BID-V8355/2003	2003-XX-XX	North America	USA	Tennessee		Homo sapiens	2014-04-16		Newman et al		Newman,R.M., Zody,M.C., DeVincenzo,J.P., Grad,Y., Lipsitch,M., Murphy,R., Fitzgerald,M., Young,S., Gargeya,S., Poon,T.W., Charlebois,P., Weiner,B., Yang,X., Piper,M.E., McCowan,C., Ireland,A., Levin,J., Malboeuf,C., Qu,J., Chapman,S.B., Murphy,C., Wortman,J., Nusbaum,C., Birren,B.	
242	KJ627659	KJ627659.1	RSV-A/US/BID-V8356/2003	2003-XX-XX	North America	USA	Tennessee		Homo sapiens	2014-04-16		Newman et al		Newman,R.M., Zody,M.C., DeVincenzo,J.P., Grad,Y., Lipsitch,M., Murphy,R., Fitzgerald,M., Young,S., Gargeya,S., Poon,T.W., Charlebois,P., Weiner,B., Yang,X., Piper,M.E., McCowan,C., Ireland,A., Levin,J., Malboeuf,C., Qu,J., Chapman,S.B., Murphy,C., Wortman,J., Nusbaum,C., Birren,B.	
243	KJ627660	KJ627660.1	RSV-A/US/BID-V8359/2003	2003-XX-XX	North America	USA	Tennessee		Homo sapiens	2014-04-16		Newman et al		Newman,R.M., Zody,M.C., DeVincenzo,J.P., Grad,Y., Lipsitch,M., Murphy,R., Fitzgerald,M., Young,S., Gargeya,S., Poon,T.W., Charlebois,P., Weiner,B., Yang,X., Piper,M.E., McCowan,C., Ireland,A., Levin,J., Malboeuf,C., Qu,J., Chapman,S.B., Murphy,C., Wortman,J., Nusbaum,C., Birren,B.	
244	KJ627661	KJ627661.1	RSV-A/US/BID-V8365/2003	2003-XX-XX	North America	USA	Tennessee		Homo sapiens	2014-04-16		Newman et al		Newman,R.M., Zody,M.C., DeVincenzo,J.P., Grad,Y., Lipsitch,M., Murphy,R., Fitzgerald,M., Young,S., Gargeya,S., Poon,T.W., Charlebois,P., Weiner,B., Yang,X., Piper,M.E., McCowan,C., Ireland,A., Levin,J., Malboeuf,C., Qu,J., Chapman,S.B., Murphy,C., Wortman,J., Nusbaum,C., Birren,B.	
245	KJ627662	KJ627662.1	RSV-A/US/BID-V8372/2003	2003-XX-XX	North America	USA	Tennessee		Homo sapiens	2014-04-16		Newman et al		Newman,R.M., Zody,M.C., DeVincenzo,J.P., Grad,Y., Lipsitch,M., Murphy,R., Fitzgerald,M., Young,S., Gargeya,S., Poon,T.W., Charlebois,P., Weiner,B., Yang,X., Piper,M.E., McCowan,C., Ireland,A., Levin,J., Malboeuf,C., Qu,J., Chapman,S.B., Murphy,C., Wortman,J., Nusbaum,C., Birren,B.	
246	KJ627663	KJ627663.1	RSV-A/US/BID-V8375/2003	2003-XX-XX	North America	USA	Tennessee		Homo sapiens	2014-04-16		Newman et al		Newman,R.M., Zody,M.C., DeVincenzo,J.P., Grad,Y., Lipsitch,M., Murphy,R., Fitzgerald,M., Young,S., Gargeya,S., Poon,T.W., Charlebois,P., Weiner,B., Yang,X., Piper,M.E., McCowan,C., Ireland,A., Levin,J., Malboeuf,C., Qu,J., Chapman,S.B., Murphy,C., Wortman,J., Nusbaum,C., Birren,B.	
247	KJ627664	KJ627664.1	RSV-A/US/BID-V8376/2003	2003-XX-XX	North America	USA	Tennessee		Homo sapiens	2014-04-16		Newman et al		Newman,R.M., Zody,M.C., DeVincenzo,J.P., Grad,Y., Lipsitch,M., Murphy,R., Fitzgerald,M., Young,S., Gargeya,S., Poon,T.W., Charlebois,P., Weiner,B., Yang,X., Piper,M.E., McCowan,C., Ireland,A., Levin,J., Malboeuf,C., Qu,J., Chapman,S.B., Murphy,C., Wortman,J., Nusbaum,C., Birren,B.	
248	KJ627665	KJ627665.1	RSV-A/US/BID-V8377/2003	2003-XX-XX	North America	USA	Tennessee		Homo sapiens	2014-04-16		Newman et al		Newman,R.M., Zody,M.C., DeVincenzo,J.P., Grad,Y., Lipsitch,M., Murphy,R., Fitzgerald,M., Young,S., Gargeya,S., Poon,T.W., Charlebois,P., Weiner,B., Yang,X., Piper,M.E., McCowan,C., Ireland,A., Levin,J., Malboeuf,C., Qu,J., Chapman,S.B., Murphy,C., Wortman,J., Nusbaum,C., Birren,B.	
249	KJ627666	KJ627666.1	RSV-A/US/BID-V8382/2003	2003-XX-XX	North America	USA	Tennessee		Homo sapiens	2014-04-16		Newman et al		Newman,R.M., Zody,M.C., DeVincenzo,J.P., Grad,Y., Lipsitch,M., Murphy,R., Fitzgerald,M., Young,S., Gargeya,S., Poon,T.W., Charlebois,P., Weiner,B., Yang,X., Piper,M.E., McCowan,C., Ireland,A., Levin,J., Malboeuf,C., Qu,J., Chapman,S.B., Murphy,C., Wortman,J., Nusbaum,C., Birren,B.	
250	KJ627667	KJ627667.1	RSV-A/US/BID-V8383/2003	2003-XX-XX	North America	USA	Tennessee		Homo sapiens	2014-04-16		Newman et al		Newman,R.M., Zody,M.C., DeVincenzo,J.P., Grad,Y., Lipsitch,M., Murphy,R., Fitzgerald,M., Young,S., Gargeya,S., Poon,T.W., Charlebois,P., Weiner,B., Yang,X., Piper,M.E., McCowan,C., Ireland,A., Levin,J., Malboeuf,C., Qu,J., Chapman,S.B., Murphy,C., Wortman,J., Nusbaum,C., Birren,B.	
251	KJ627668	KJ627668.1	RSV-A/US/BID-V8384/2003	2003-XX-XX	North America	USA	Tennessee		Homo sapiens	2014-04-16		Newman et al		Newman,R.M., Zody,M.C., DeVincenzo,J.P., Grad,Y., Lipsitch,M., Murphy,R., Fitzgerald,M., Young,S., Gargeya,S., Poon,T.W., Charlebois,P., Weiner,B., Yang,X., Piper,M.E., McCowan,C., Ireland,A., Levin,J., Malboeuf,C., Qu,J., Chapman,S.B., Murphy,C., Wortman,J., Nusbaum,C., Birren,B.	
252	KJ627669	KJ627669.1	RSV-A/US/BID-V8387/2003	2003-XX-XX	North America	USA	Tennessee		Homo sapiens	2014-04-16		Newman et al		Newman,R.M., Zody,M.C., DeVincenzo,J.P., Grad,Y., Lipsitch,M., Murphy,R., Fitzgerald,M., Young,S., Gargeya,S., Poon,T.W., Charlebois,P., Weiner,B., Yang,X., Piper,M.E., McCowan,C., Ireland,A., Levin,J., Malboeuf,C., Qu,J., Chapman,S.B., Murphy,C., Wortman,J., Nusbaum,C., Birren,B.	
253	KJ627670	KJ627670.1	RSV-A/US/BID-V8397/2003	2003-XX-XX	North America	USA	Tennessee		Homo sapiens	2014-04-16		Newman et al		Newman,R.M., Zody,M.C., DeVincenzo,J.P., Grad,Y., Lipsitch,M., Murphy,R., Fitzgerald,M., Young,S., Gargeya,S., Poon,T.W., Charlebois,P., Weiner,B., Yang,X., Piper,M.E., McCowan,C., Ireland,A., Levin,J., Malboeuf,C., Qu,J., Chapman,S.B., Murphy,C., Wortman,J., Nusbaum,C., Birren,B.	
254	KJ627671	KJ627671.1	RSV-A/US/BID-V8405/2003	2003-XX-XX	North America	USA	Tennessee		Homo sapiens	2014-04-16		Newman et al		Newman,R.M., Zody,M.C., DeVincenzo,J.P., Grad,Y., Lipsitch,M., Murphy,R., Fitzgerald,M., Young,S., Gargeya,S., Poon,T.W., Charlebois,P., Weiner,B., Yang,X., Piper,M.E., McCowan,C., Ireland,A., Levin,J., Malboeuf,C., Qu,J., Chapman,S.B., Murphy,C., Wortman,J., Nusbaum,C., Birren,B.	
255	KJ627714	KJ627714.1	RSV-A/US/BID-V8505/2003	2003-XX-XX	North America	USA	Tennessee		Homo sapiens	2014-04-16		Newman et al		Newman,R.M., Zody,M.C., DeVincenzo,J.P., Grad,Y., Lipsitch,M., Murphy,R., Fitzgerald,M., Young,S., Gargeya,S., Poon,T.W., Charlebois,P., Weiner,B., Yang,X., Piper,M.E., McCowan,C., Ireland,A., Levin,J., Malboeuf,C., Qu,J., Chapman,S.B., Murphy,C., Wortman,J., Nusbaum,C., Birren,B.	
256	KJ627715	KJ627715.1	RSV-A/US/BID-V8507/2003	2003-XX-XX	North America	USA	Tennessee		Homo sapiens	2014-04-16		Newman et al		Newman,R.M., Zody,M.C., DeVincenzo,J.P., Grad,Y., Lipsitch,M., Murphy,R., Fitzgerald,M., Young,S., Gargeya,S., Poon,T.W., Charlebois,P., Weiner,B., Yang,X., Piper,M.E., McCowan,C., Ireland,A., Levin,J., Malboeuf,C., Qu,J., Chapman,S.B., Murphy,C., Wortman,J., Nusbaum,C., Birren,B.	
257	KJ627716	KJ627716.1	RSV-A/US/BID-V8508/2003	2003-XX-XX	North America	USA	Tennessee		Homo sapiens	2014-04-16		Newman et al		Newman,R.M., Zody,M.C., DeVincenzo,J.P., Grad,Y., Lipsitch,M., Murphy,R., Fitzgerald,M., Young,S., Gargeya,S., Poon,T.W., Charlebois,P., Weiner,B., Yang,X., Piper,M.E., McCowan,C., Ireland,A., Levin,J., Malboeuf,C., Qu,J., Chapman,S.B., Murphy,C., Wortman,J., Nusbaum,C., Birren,B.	
258	KJ627718	KJ627718.1	RSV-A/US/BID-V8510/2003	2003-XX-XX	North America	USA	Tennessee		Homo sapiens	2014-04-16		Newman et al		Newman,R.M., Zody,M.C., DeVincenzo,J.P., Grad,Y., Lipsitch,M., Murphy,R., Fitzgerald,M., Young,S., Gargeya,S., Poon,T.W., Charlebois,P., Weiner,B., Yang,X., Piper,M.E., McCowan,C., Ireland,A., Levin,J., Malboeuf,C., Qu,J., Chapman,S.B., Murphy,C., Wortman,J., Nusbaum,C., Birren,B.	
259	KJ627727	KJ627727.1	RSV-A/US/BID-V8535/2003	2003-XX-XX	North America	USA	Tennessee		Homo sapiens	2014-04-16		Newman et al		Newman,R.M., Zody,M.C., DeVincenzo,J.P., Grad,Y., Lipsitch,M., Murphy,R., Fitzgerald,M., Young,S., Gargeya,S., Poon,T.W., Charlebois,P., Weiner,B., Yang,X., Piper,M.E., McCowan,C., Ireland,A., Levin,J., Malboeuf,C., Qu,J., Chapman,S.B., Murphy,C., Wortman,J., Nusbaum,C., Birren,B.	
260	KJ627728	KJ627728.1	RSV-A/US/BID-V8536/2003	2003-XX-XX	North America	USA	Tennessee		Homo sapiens	2014-04-16		Newman et al		Newman,R.M., Zody,M.C., DeVincenzo,J.P., Grad,Y., Lipsitch,M., Murphy,R., Fitzgerald,M., Young,S., Gargeya,S., Poon,T.W., Charlebois,P., Weiner,B., Yang,X., Piper,M.E., McCowan,C., Ireland,A., Levin,J., Malboeuf,C., Qu,J., Chapman,S.B., Murphy,C., Wortman,J., Nusbaum,C., Birren,B.	
261	KJ627729	KJ627729.1	RSV-A/US/BID-V8537/2003	2003-XX-XX	North America	USA	Tennessee		Homo sapiens	2014-04-16		Newman et al		Newman,R.M., Zody,M.C., DeVincenzo,J.P., Grad,Y., Lipsitch,M., Murphy,R., Fitzgerald,M., Young,S., Gargeya,S., Poon,T.W., Charlebois,P., Weiner,B., Yang,X., Piper,M.E., McCowan,C., Ireland,A., Levin,J., Malboeuf,C., Qu,J., Chapman,S.B., Murphy,C., Wortman,J., Nusbaum,C., Birren,B.	
262	KJ627730	KJ627730.1	RSV-A/US/BID-V8538/2003	2003-XX-XX	North America	USA	Tennessee		Homo sapiens	2014-04-16		Newman et al		Newman,R.M., Zody,M.C., DeVincenzo,J.P., Grad,Y., Lipsitch,M., Murphy,R., Fitzgerald,M., Young,S., Gargeya,S., Poon,T.W., Charlebois,P., Weiner,B., Yang,X., Piper,M.E., McCowan,C., Ireland,A., Levin,J., Malboeuf,C., Qu,J., Chapman,S.B., Murphy,C., Wortman,J., Nusbaum,C., Birren,B.	
263	KJ627731	KJ627731.1	RSV-A/US/BID-V8540/2003	2003-XX-XX	North America	USA	Tennessee		Homo sapiens	2014-04-16		Newman et al		Newman,R.M., Zody,M.C., DeVincenzo,J.P., Grad,Y., Lipsitch,M., Murphy,R., Fitzgerald,M., Young,S., Gargeya,S., Poon,T.W., Charlebois,P., Weiner,B., Yang,X., Piper,M.E., McCowan,C., Ireland,A., Levin,J., Malboeuf,C., Qu,J., Chapman,S.B., Murphy,C., Wortman,J., Nusbaum,C., Birren,B.	
264	KJ627732	KJ627732.1	RSV-A/US/BID-V8543/2003	2003-XX-XX	North America	USA	Tennessee		Homo sapiens	2014-04-16		Newman et al		Newman,R.M., Zody,M.C., DeVincenzo,J.P., Grad,Y., Lipsitch,M., Murphy,R., Fitzgerald,M., Young,S., Gargeya,S., Poon,T.W., Charlebois,P., Weiner,B., Yang,X., Piper,M.E., McCowan,C., Ireland,A., Levin,J., Malboeuf,C., Qu,J., Chapman,S.B., Murphy,C., Wortman,J., Nusbaum,C., Birren,B.	
265	KJ627733	KJ627733.1	RSV-A/US/BID-V8547/2003	2003-XX-XX	North America	USA	Tennessee		Homo sapiens	2014-04-16		Newman et al		Newman,R.M., Zody,M.C., DeVincenzo,J.P., Grad,Y., Lipsitch,M., Murphy,R., Fitzgerald,M., Young,S., Gargeya,S., Poon,T.W., Charlebois,P., Weiner,B., Yang,X., Piper,M.E., McCowan,C., Ireland,A., Levin,J., Malboeuf,C., Qu,J., Chapman,S.B., Murphy,C., Wortman,J., Nusbaum,C., Birren,B.	
266	MF372402	MF372402.1	Bogota/2003/4323	2003-XX-XX	South America	Colombia			Homo sapiens	2017-10-25		Avila et al		Avila,V., Calvo,E.P., Barbosa,J., Velandia-Romero,M.L., Castellanos,J.E.	
267	MF496449	MF496449.1	R92-142	2003-XX-XX	Asia	Taiwan			Homo sapiens	2017-08-30		Chi et al		Chi,H., Hsiao,K.-L., Weng,L.-C., Chiu,N.-C., Huang,L.-M., Chiu,Y.-Y., Liu,C.-P., Liu,H.-F.	
268	MF496450	MF496450.1	R92-139	2003-XX-XX	Asia	Taiwan			Homo sapiens	2017-08-30		Chi et al		Chi,H., Hsiao,K.-L., Weng,L.-C., Chiu,N.-C., Huang,L.-M., Chiu,Y.-Y., Liu,C.-P., Liu,H.-F.	
269	MF496451	MF496451.1	R92-134	2003-XX-XX	Asia	Taiwan			Homo sapiens	2017-08-30		Chi et al		Chi,H., Hsiao,K.-L., Weng,L.-C., Chiu,N.-C., Huang,L.-M., Chiu,Y.-Y., Liu,C.-P., Liu,H.-F.	
270	MF496452	MF496452.1	R92-133	2003-XX-XX	Asia	Taiwan			Homo sapiens	2017-08-30		Chi et al		Chi,H., Hsiao,K.-L., Weng,L.-C., Chiu,N.-C., Huang,L.-M., Chiu,Y.-Y., Liu,C.-P., Liu,H.-F.	
271	MF496453	MF496453.1	R92-129	2003-XX-XX	Asia	Taiwan			Homo sapiens	2017-08-30		Chi et al		Chi,H., Hsiao,K.-L., Weng,L.-C., Chiu,N.-C., Huang,L.-M., Chiu,Y.-Y., Liu,C.-P., Liu,H.-F.	
272	MF496454	MF496454.1	R92-128	2003-XX-XX	Asia	Taiwan			Homo sapiens	2017-08-30		Chi et al		Chi,H., Hsiao,K.-L., Weng,L.-C., Chiu,N.-C., Huang,L.-M., Chiu,Y.-Y., Liu,C.-P., Liu,H.-F.	
273	MF496455	MF496455.1	R92-124	2003-XX-XX	Asia	Taiwan			Homo sapiens	2017-08-30		Chi et al		Chi,H., Hsiao,K.-L., Weng,L.-C., Chiu,N.-C., Huang,L.-M., Chiu,Y.-Y., Liu,C.-P., Liu,H.-F.	
274	MF496456	MF496456.1	R92-122	2003-XX-XX	Asia	Taiwan			Homo sapiens	2017-08-30		Chi et al		Chi,H., Hsiao,K.-L., Weng,L.-C., Chiu,N.-C., Huang,L.-M., Chiu,Y.-Y., Liu,C.-P., Liu,H.-F.	
275	MG027860	MG027860.1	RSV-A/US/BID-V8534/2003	2003-XX-XX	North America	USA			Homo sapiens	2017-12-27	SRR5408822	Newman et al		Newman,R.M., Zody,M.C., DeVincenzo,J.P., Grad,Y., Lipsitch,M., Murphy,R., Fitzgerald,M., Young,S., Gargeya,S., Poon,T.W., Charlebois,P., Weiner,B., Yang,X., Piper,M.E., McCowan,C., Ireland,A., Levin,J., Malboeuf,C., Qu,J., Chapman,S.B., Murphy,C., Wortman,J., Nusbaum,C., Birren,B.	
276	MG027861	MG027861.1	RSV-A/US/BID-V8368/2003	2003-XX-XX	North America	USA			Homo sapiens	2017-12-27	SRR5408828	Newman et al		Newman,R.M., Zody,M.C., DeVincenzo,J.P., Grad,Y., Lipsitch,M., Murphy,R., Fitzgerald,M., Young,S., Gargeya,S., Poon,T.W., Charlebois,P., Weiner,B., Yang,X., Piper,M.E., McCowan,C., Ireland,A., Levin,J., Malboeuf,C., Qu,J., Chapman,S.B., Murphy,C., Wortman,J., Nusbaum,C., Birren,B.	
277	MG027862	MG027862.1	RSV-A/US/BID-V8392/2003	2003-XX-XX	North America	USA			Homo sapiens	2017-12-27	SRR5408827	Newman et al		Newman,R.M., Zody,M.C., DeVincenzo,J.P., Grad,Y., Lipsitch,M., Murphy,R., Fitzgerald,M., Young,S., Gargeya,S., Poon,T.W., Charlebois,P., Weiner,B., Yang,X., Piper,M.E., McCowan,C., Ireland,A., Levin,J., Malboeuf,C., Qu,J., Chapman,S.B., Murphy,C., Wortman,J., Nusbaum,C., Birren,B.	
278	KT765833	KT765833.1	KEN/Kilifi/559_30/12/2003	2003-12-30	Africa	Kenya			Homo sapiens	2016-02-27		Otieno et al		Otieno,J.R., Agoti,C.N., Gitahi,C.W., Bett,A., Ngama,M., Medley,G.F., Cane,P.A., Nokes,D.J., Nokes,J.D.	
279	KJ627719	KJ627719.1	RSV-A/US/BID-V8518/2004	2004-XX-XX	North America	USA	Tennessee		Homo sapiens	2014-04-16		Newman et al		Newman,R.M., Zody,M.C., DeVincenzo,J.P., Grad,Y., Lipsitch,M., Murphy,R., Fitzgerald,M., Young,S., Gargeya,S., Poon,T.W., Charlebois,P., Weiner,B., Yang,X., Piper,M.E., McCowan,C., Ireland,A., Levin,J., Malboeuf,C., Qu,J., Chapman,S.B., Murphy,C., Wortman,J., Nusbaum,C., Birren,B.	
280	KJ627720	KJ627720.1	RSV-A/US/BID-V8521/2004	2004-XX-XX	North America	USA	Tennessee		Homo sapiens	2014-04-16		Newman et al		Newman,R.M., Zody,M.C., DeVincenzo,J.P., Grad,Y., Lipsitch,M., Murphy,R., Fitzgerald,M., Young,S., Gargeya,S., Poon,T.W., Charlebois,P., Weiner,B., Yang,X., Piper,M.E., McCowan,C., Ireland,A., Levin,J., Malboeuf,C., Qu,J., Chapman,S.B., Murphy,C., Wortman,J., Nusbaum,C., Birren,B.	
281	KJ627721	KJ627721.1	RSV-A/US/BID-V8522/2004	2004-XX-XX	North America	USA	Tennessee		Homo sapiens	2014-04-16		Newman et al		Newman,R.M., Zody,M.C., DeVincenzo,J.P., Grad,Y., Lipsitch,M., Murphy,R., Fitzgerald,M., Young,S., Gargeya,S., Poon,T.W., Charlebois,P., Weiner,B., Yang,X., Piper,M.E., McCowan,C., Ireland,A., Levin,J., Malboeuf,C., Qu,J., Chapman,S.B., Murphy,C., Wortman,J., Nusbaum,C., Birren,B.	
282	KJ627722	KJ627722.1	RSV-A/US/BID-V8523/2004	2004-XX-XX	North America	USA	Tennessee		Homo sapiens	2014-04-16		Newman et al		Newman,R.M., Zody,M.C., DeVincenzo,J.P., Grad,Y., Lipsitch,M., Murphy,R., Fitzgerald,M., Young,S., Gargeya,S., Poon,T.W., Charlebois,P., Weiner,B., Yang,X., Piper,M.E., McCowan,C., Ireland,A., Levin,J., Malboeuf,C., Qu,J., Chapman,S.B., Murphy,C., Wortman,J., Nusbaum,C., Birren,B.	
283	KJ627723	KJ627723.1	RSV-A/US/BID-V8524/2004	2004-XX-XX	North America	USA	Tennessee		Homo sapiens	2014-04-16		Newman et al		Newman,R.M., Zody,M.C., DeVincenzo,J.P., Grad,Y., Lipsitch,M., Murphy,R., Fitzgerald,M., Young,S., Gargeya,S., Poon,T.W., Charlebois,P., Weiner,B., Yang,X., Piper,M.E., McCowan,C., Ireland,A., Levin,J., Malboeuf,C., Qu,J., Chapman,S.B., Murphy,C., Wortman,J., Nusbaum,C., Birren,B.	
284	KJ627724	KJ627724.1	RSV-A/US/BID-V8525/2004	2004-XX-XX	North America	USA	Tennessee		Homo sapiens	2014-04-16		Newman et al		Newman,R.M., Zody,M.C., DeVincenzo,J.P., Grad,Y., Lipsitch,M., Murphy,R., Fitzgerald,M., Young,S., Gargeya,S., Poon,T.W., Charlebois,P., Weiner,B., Yang,X., Piper,M.E., McCowan,C., Ireland,A., Levin,J., Malboeuf,C., Qu,J., Chapman,S.B., Murphy,C., Wortman,J., Nusbaum,C., Birren,B.	
285	KJ627725	KJ627725.1	RSV-A/US/BID-V8526/2004	2004-XX-XX	North America	USA	Tennessee		Homo sapiens	2014-04-16		Newman et al		Newman,R.M., Zody,M.C., DeVincenzo,J.P., Grad,Y., Lipsitch,M., Murphy,R., Fitzgerald,M., Young,S., Gargeya,S., Poon,T.W., Charlebois,P., Weiner,B., Yang,X., Piper,M.E., McCowan,C., Ireland,A., Levin,J., Malboeuf,C., Qu,J., Chapman,S.B., Murphy,C., Wortman,J., Nusbaum,C., Birren,B.	
286	KJ627726	KJ627726.1	RSV-A/US/BID-V8528/2004	2004-XX-XX	North America	USA	Tennessee		Homo sapiens	2014-04-16		Newman et al		Newman,R.M., Zody,M.C., DeVincenzo,J.P., Grad,Y., Lipsitch,M., Murphy,R., Fitzgerald,M., Young,S., Gargeya,S., Poon,T.W., Charlebois,P., Weiner,B., Yang,X., Piper,M.E., McCowan,C., Ireland,A., Levin,J., Malboeuf,C., Qu,J., Chapman,S.B., Murphy,C., Wortman,J., Nusbaum,C., Birren,B.	
287	KY296708	KY296708.1	KY296708	2004-XX-XX	Asia	China			Homo sapiens	2018-12-10		Song et al		Song,J., Wang,H., Ng,T.I., Cui,A., Zhu,S., Huang,Y., Sun,L., Yang,Z., Yu,D., Yu,P., Zhang,H., Zhang,Y., Xu,W.	
288	KY296709	KY296709.1	KY296709	2004-XX-XX	Asia	China			Homo sapiens	2018-12-10		Song et al		Song,J., Wang,H., Ng,T.I., Cui,A., Zhu,S., Huang,Y., Sun,L., Yang,Z., Yu,D., Yu,P., Zhang,H., Zhang,Y., Xu,W.	
289	KY296710	KY296710.1	KY296710	2004-XX-XX	Asia	China			Homo sapiens	2018-12-10		Song et al		Song,J., Wang,H., Ng,T.I., Cui,A., Zhu,S., Huang,Y., Sun,L., Yang,Z., Yu,D., Yu,P., Zhang,H., Zhang,Y., Xu,W.	
290	KY296711	KY296711.1	KY296711	2004-XX-XX	Asia	China			Homo sapiens	2018-12-10		Song et al		Song,J., Wang,H., Ng,T.I., Cui,A., Zhu,S., Huang,Y., Sun,L., Yang,Z., Yu,D., Yu,P., Zhang,H., Zhang,Y., Xu,W.	
291	KY296712	KY296712.1	KY296712	2004-XX-XX	Asia	China			Homo sapiens	2018-12-10		Song et al		Song,J., Wang,H., Ng,T.I., Cui,A., Zhu,S., Huang,Y., Sun,L., Yang,Z., Yu,D., Yu,P., Zhang,H., Zhang,Y., Xu,W.	
292	MF173103	MF173103.1	Bogota/2004/4582	2004-XX-XX	South America	Colombia			Homo sapiens	2017-10-25		Avila et al		Avila,V., Calvo,E.P., Barbosa,J., Velandia-Romero,M.L., Castellanos,J.E.	
293	MF496443	MF496443.1	R93-190	2004-XX-XX	Asia	Taiwan			Homo sapiens	2017-08-30		Chi et al		Chi,H., Hsiao,K.-L., Weng,L.-C., Chiu,N.-C., Huang,L.-M., Chiu,Y.-Y., Liu,C.-P., Liu,H.-F.	
294	MF496444	MF496444.1	R93-186	2004-XX-XX	Asia	Taiwan			Homo sapiens	2017-08-30		Chi et al		Chi,H., Hsiao,K.-L., Weng,L.-C., Chiu,N.-C., Huang,L.-M., Chiu,Y.-Y., Liu,C.-P., Liu,H.-F.	
295	MF496445	MF496445.1	R93-184	2004-XX-XX	Asia	Taiwan			Homo sapiens	2017-08-30		Chi et al		Chi,H., Hsiao,K.-L., Weng,L.-C., Chiu,N.-C., Huang,L.-M., Chiu,Y.-Y., Liu,C.-P., Liu,H.-F.	
296	MF496446	MF496446.1	R93-174	2004-XX-XX	Asia	Taiwan			Homo sapiens	2017-08-30		Chi et al		Chi,H., Hsiao,K.-L., Weng,L.-C., Chiu,N.-C., Huang,L.-M., Chiu,Y.-Y., Liu,C.-P., Liu,H.-F.	
297	MF496447	MF496447.1	R93-170	2004-XX-XX	Asia	Taiwan			Homo sapiens	2017-08-30		Chi et al		Chi,H., Hsiao,K.-L., Weng,L.-C., Chiu,N.-C., Huang,L.-M., Chiu,Y.-Y., Liu,C.-P., Liu,H.-F.	
298	MF496448	MF496448.1	R93-168	2004-XX-XX	Asia	Taiwan			Homo sapiens	2017-08-30		Chi et al		Chi,H., Hsiao,K.-L., Weng,L.-C., Chiu,N.-C., Huang,L.-M., Chiu,Y.-Y., Liu,C.-P., Liu,H.-F.	
299	OK649677	OK649677.1	OK649677	2004-XX-XX	North America	USA			Homo sapiens	2021-11-07		Wang et al		Wang,L., Ng,T.F.F., Castro,C.J., Marine,R.L., Magana,L.C., Esona,M., Peret,T.C.T., Thornburg,N.J.	
300	KT765834	KT765834.1	KEN/Kilifi/560_12/02/2004	2004-02-12	Africa	Kenya			Homo sapiens	2016-02-27		Otieno et al		Otieno,J.R., Agoti,C.N., Gitahi,C.W., Bett,A., Ngama,M., Medley,G.F., Cane,P.A., Nokes,D.J., Nokes,J.D.	
301	JN968341	JN968341.1	V04-2205427	2004-02-14	Asia	Hong Kong			Homo sapiens	2012-01-10		Mak et al		Mak,G.C., Lau,C.S., Chiu,D.M.Y., Lim,W.	
302	KT765829	KT765829.1	KEN/Kilifi/561_25/02/2004	2004-02-25	Africa	Kenya			Homo sapiens	2016-02-27		Otieno et al		Otieno,J.R., Agoti,C.N., Gitahi,C.W., Bett,A., Ngama,M., Medley,G.F., Cane,P.A., Nokes,D.J., Nokes,J.D.	
303	KT765835	KT765835.1	KEN/Kilifi/562_26/02/2004	2004-02-26	Africa	Kenya			Homo sapiens	2016-02-27		Otieno et al		Otieno,J.R., Agoti,C.N., Gitahi,C.W., Bett,A., Ngama,M., Medley,G.F., Cane,P.A., Nokes,D.J., Nokes,J.D.	
304	KT765815	KT765815.1	KEN/Kilifi/563_02/04/2004	2004-04-02	Africa	Kenya			Homo sapiens	2016-02-27		Otieno et al		Otieno,J.R., Agoti,C.N., Gitahi,C.W., Bett,A., Ngama,M., Medley,G.F., Cane,P.A., Nokes,D.J., Nokes,J.D.	
305	KT765807	KT765807.1	KEN/Kilifi/564_12/04/2004	2004-04-12	Africa	Kenya			Homo sapiens	2016-02-27		Otieno et al		Otieno,J.R., Agoti,C.N., Gitahi,C.W., Bett,A., Ngama,M., Medley,G.F., Cane,P.A., Nokes,D.J., Nokes,J.D.	
306	KT765809	KT765809.1	KEN/Kilifi/565_22/04/2004	2004-04-22	Africa	Kenya			Homo sapiens	2016-02-27		Otieno et al		Otieno,J.R., Agoti,C.N., Gitahi,C.W., Bett,A., Ngama,M., Medley,G.F., Cane,P.A., Nokes,D.J., Nokes,J.D.	
307	KT765830	KT765830.1	KEN/Kilifi/566_24/11/2004	2004-11-24	Africa	Kenya			Homo sapiens	2016-02-27		Otieno et al		Otieno,J.R., Agoti,C.N., Gitahi,C.W., Bett,A., Ngama,M., Medley,G.F., Cane,P.A., Nokes,D.J., Nokes,J.D.	
308	KT765699	KT765699.1	KEN/Kilifi/567_28/12/2004	2004-12-28	Africa	Kenya			Homo sapiens	2016-02-27		Otieno et al		Otieno,J.R., Agoti,C.N., Gitahi,C.W., Bett,A., Ngama,M., Medley,G.F., Cane,P.A., Nokes,D.J., Nokes,J.D.	
309	KU954996	KU954996.1	KU954996	2005-XX-XX	Asia	China			Homo sapiens	2019-03-31		Jia et al		Jia,B., Xiao,Y., Wang,Y., Chen,L., Zhang,J., Ren,L., Wang,J.	
310	MF496438	MF496438.1	R94-968	2005-XX-XX	Asia	Taiwan			Homo sapiens	2017-08-30		Chi et al		Chi,H., Hsiao,K.-L., Weng,L.-C., Chiu,N.-C., Huang,L.-M., Chiu,Y.-Y., Liu,C.-P., Liu,H.-F.	
311	MF496439	MF496439.1	R94-963	2005-XX-XX	Asia	Taiwan			Homo sapiens	2017-08-30		Chi et al		Chi,H., Hsiao,K.-L., Weng,L.-C., Chiu,N.-C., Huang,L.-M., Chiu,Y.-Y., Liu,C.-P., Liu,H.-F.	
312	MF496440	MF496440.1	R94-962	2005-XX-XX	Asia	Taiwan			Homo sapiens	2017-08-30		Chi et al		Chi,H., Hsiao,K.-L., Weng,L.-C., Chiu,N.-C., Huang,L.-M., Chiu,Y.-Y., Liu,C.-P., Liu,H.-F.	
313	MF496441	MF496441.1	R94-956	2005-XX-XX	Asia	Taiwan			Homo sapiens	2017-08-30		Chi et al		Chi,H., Hsiao,K.-L., Weng,L.-C., Chiu,N.-C., Huang,L.-M., Chiu,Y.-Y., Liu,C.-P., Liu,H.-F.	
314	MF496442	MF496442.1	R94-1085	2005-XX-XX	Asia	Taiwan			Homo sapiens	2017-08-30		Chi et al		Chi,H., Hsiao,K.-L., Weng,L.-C., Chiu,N.-C., Huang,L.-M., Chiu,Y.-Y., Liu,C.-P., Liu,H.-F.	
315	OK649678	OK649678.1	OK649678	2005-XX-XX	North America	USA			Homo sapiens	2021-11-07		Wang et al		Wang,L., Ng,T.F.F., Castro,C.J., Marine,R.L., Magana,L.C., Esona,M., Peret,T.C.T., Thornburg,N.J.	
316	OK649679	OK649679.1	OK649679	2005-XX-XX	North America	USA			Homo sapiens	2021-11-07		Wang et al		Wang,L., Ng,T.F.F., Castro,C.J., Marine,R.L., Magana,L.C., Esona,M., Peret,T.C.T., Thornburg,N.J.	
317	KT765700	KT765700.1	KEN/Kilifi/568_04/01/2005	2005-01-04	Africa	Kenya			Homo sapiens	2016-02-27		Otieno et al		Otieno,J.R., Agoti,C.N., Gitahi,C.W., Bett,A., Ngama,M., Medley,G.F., Cane,P.A., Nokes,D.J., Nokes,J.D.	
318	KT765701	KT765701.1	KEN/Kilifi/569_14/01/2005	2005-01-14	Africa	Kenya			Homo sapiens	2016-02-27		Otieno et al		Otieno,J.R., Agoti,C.N., Gitahi,C.W., Bett,A., Ngama,M., Medley,G.F., Cane,P.A., Nokes,D.J., Nokes,J.D.	
319	KT765702	KT765702.1	KEN/Kilifi/570_14/01/2005	2005-01-14	Africa	Kenya			Homo sapiens	2016-02-27		Otieno et al		Otieno,J.R., Agoti,C.N., Gitahi,C.W., Bett,A., Ngama,M., Medley,G.F., Cane,P.A., Nokes,D.J., Nokes,J.D.	
320	KT765703	KT765703.1	KEN/Kilifi/572_17/01/2005	2005-01-17	Africa	Kenya			Homo sapiens	2016-02-27		Otieno et al		Otieno,J.R., Agoti,C.N., Gitahi,C.W., Bett,A., Ngama,M., Medley,G.F., Cane,P.A., Nokes,D.J., Nokes,J.D.	
321	KT765726	KT765726.1	KEN/Kilifi/571_17/01/2005	2005-01-17	Africa	Kenya			Homo sapiens	2016-02-27		Otieno et al		Otieno,J.R., Agoti,C.N., Gitahi,C.W., Bett,A., Ngama,M., Medley,G.F., Cane,P.A., Nokes,D.J., Nokes,J.D.	
322	KT765816	KT765816.1	KEN/Kilifi/573_19/01/2005	2005-01-19	Africa	Kenya			Homo sapiens	2016-02-27		Otieno et al		Otieno,J.R., Agoti,C.N., Gitahi,C.W., Bett,A., Ngama,M., Medley,G.F., Cane,P.A., Nokes,D.J., Nokes,J.D.	
323	KT765704	KT765704.1	KEN/Kilifi/574_21/01/2005	2005-01-21	Africa	Kenya			Homo sapiens	2016-02-27		Otieno et al		Otieno,J.R., Agoti,C.N., Gitahi,C.W., Bett,A., Ngama,M., Medley,G.F., Cane,P.A., Nokes,D.J., Nokes,J.D.	
324	KT765705	KT765705.1	KEN/Kilifi/575_24/01/2005	2005-01-24	Africa	Kenya			Homo sapiens	2016-02-27		Otieno et al		Otieno,J.R., Agoti,C.N., Gitahi,C.W., Bett,A., Ngama,M., Medley,G.F., Cane,P.A., Nokes,D.J., Nokes,J.D.	
325	KT765817	KT765817.1	KEN/Kilifi/576_31/01/2005	2005-01-31	Africa	Kenya			Homo sapiens	2016-02-27		Otieno et al		Otieno,J.R., Agoti,C.N., Gitahi,C.W., Bett,A., Ngama,M., Medley,G.F., Cane,P.A., Nokes,D.J., Nokes,J.D.	
326	KY296713	KY296713.1	KY296713	2005-06-30	Asia	China			Homo sapiens	2018-12-10		Song et al		Song,J., Wang,H., Ng,T.I., Cui,A., Zhu,S., Huang,Y., Sun,L., Yang,Z., Yu,D., Yu,P., Zhang,H., Zhang,Y., Xu,W.	
327	KY296714	KY296714.1	KY296714	2005-07-01	Asia	China			Homo sapiens	2018-12-10		Song et al		Song,J., Wang,H., Ng,T.I., Cui,A., Zhu,S., Huang,Y., Sun,L., Yang,Z., Yu,D., Yu,P., Zhang,H., Zhang,Y., Xu,W.	
328	KY296715	KY296715.1	KY296715	2005-07-01	Asia	China			Homo sapiens	2018-12-10		Song et al		Song,J., Wang,H., Ng,T.I., Cui,A., Zhu,S., Huang,Y., Sun,L., Yang,Z., Yu,D., Yu,P., Zhang,H., Zhang,Y., Xu,W.	
329	KY296716	KY296716.1	KY296716	2005-07-01	Asia	China			Homo sapiens	2018-12-10		Song et al		Song,J., Wang,H., Ng,T.I., Cui,A., Zhu,S., Huang,Y., Sun,L., Yang,Z., Yu,D., Yu,P., Zhang,H., Zhang,Y., Xu,W.	
330	KY296717	KY296717.1	KY296717	2005-07-01	Asia	China			Homo sapiens	2018-12-10		Song et al		Song,J., Wang,H., Ng,T.I., Cui,A., Zhu,S., Huang,Y., Sun,L., Yang,Z., Yu,D., Yu,P., Zhang,H., Zhang,Y., Xu,W.	
331	KY296718	KY296718.1	KY296718	2005-07-02	Asia	China			Homo sapiens	2018-12-10		Song et al		Song,J., Wang,H., Ng,T.I., Cui,A., Zhu,S., Huang,Y., Sun,L., Yang,Z., Yu,D., Yu,P., Zhang,H., Zhang,Y., Xu,W.	
332	KY296719	KY296719.1	KY296719	2005-07-02	Asia	China			Homo sapiens	2018-12-10		Song et al		Song,J., Wang,H., Ng,T.I., Cui,A., Zhu,S., Huang,Y., Sun,L., Yang,Z., Yu,D., Yu,P., Zhang,H., Zhang,Y., Xu,W.	
333	KY296734	KY296734.1	KY296734	2005-07-02	Asia	China			Homo sapiens	2018-12-10		Song et al		Song,J., Wang,H., Ng,T.I., Cui,A., Zhu,S., Huang,Y., Sun,L., Yang,Z., Yu,D., Yu,P., Zhang,H., Zhang,Y., Xu,W.	
334	KY296735	KY296735.1	KY296735	2005-07-02	Asia	China			Homo sapiens	2018-12-10		Song et al		Song,J., Wang,H., Ng,T.I., Cui,A., Zhu,S., Huang,Y., Sun,L., Yang,Z., Yu,D., Yu,P., Zhang,H., Zhang,Y., Xu,W.	
335	KY296740	KY296740.1	KY296740	2005-07-03	Asia	China			Homo sapiens	2018-12-10		Song et al		Song,J., Wang,H., Ng,T.I., Cui,A., Zhu,S., Huang,Y., Sun,L., Yang,Z., Yu,D., Yu,P., Zhang,H., Zhang,Y., Xu,W.	
336	KY296741	KY296741.1	KY296741	2005-07-03	Asia	China			Homo sapiens	2018-12-10		Song et al		Song,J., Wang,H., Ng,T.I., Cui,A., Zhu,S., Huang,Y., Sun,L., Yang,Z., Yu,D., Yu,P., Zhang,H., Zhang,Y., Xu,W.	
337	KY296742	KY296742.1	KY296742	2005-07-03	Asia	China			Homo sapiens	2018-12-10		Song et al		Song,J., Wang,H., Ng,T.I., Cui,A., Zhu,S., Huang,Y., Sun,L., Yang,Z., Yu,D., Yu,P., Zhang,H., Zhang,Y., Xu,W.	
338	KY296743	KY296743.1	KY296743	2005-07-03	Asia	China			Homo sapiens	2018-12-10		Song et al		Song,J., Wang,H., Ng,T.I., Cui,A., Zhu,S., Huang,Y., Sun,L., Yang,Z., Yu,D., Yu,P., Zhang,H., Zhang,Y., Xu,W.	
339	KY296744	KY296744.1	KY296744	2005-07-03	Asia	China			Homo sapiens	2018-12-10		Song et al		Song,J., Wang,H., Ng,T.I., Cui,A., Zhu,S., Huang,Y., Sun,L., Yang,Z., Yu,D., Yu,P., Zhang,H., Zhang,Y., Xu,W.	
340	KY296745	KY296745.1	KY296745	2005-07-03	Asia	China			Homo sapiens	2018-12-10		Song et al		Song,J., Wang,H., Ng,T.I., Cui,A., Zhu,S., Huang,Y., Sun,L., Yang,Z., Yu,D., Yu,P., Zhang,H., Zhang,Y., Xu,W.	
341	KY296746	KY296746.1	KY296746	2005-07-03	Asia	China			Homo sapiens	2018-12-10		Song et al		Song,J., Wang,H., Ng,T.I., Cui,A., Zhu,S., Huang,Y., Sun,L., Yang,Z., Yu,D., Yu,P., Zhang,H., Zhang,Y., Xu,W.	
342	KY296747	KY296747.1	KY296747	2005-07-03	Asia	China			Homo sapiens	2018-12-10		Song et al		Song,J., Wang,H., Ng,T.I., Cui,A., Zhu,S., Huang,Y., Sun,L., Yang,Z., Yu,D., Yu,P., Zhang,H., Zhang,Y., Xu,W.	
343	KY296748	KY296748.1	KY296748	2005-07-03	Asia	China			Homo sapiens	2018-12-10		Song et al		Song,J., Wang,H., Ng,T.I., Cui,A., Zhu,S., Huang,Y., Sun,L., Yang,Z., Yu,D., Yu,P., Zhang,H., Zhang,Y., Xu,W.	
344	KY296750	KY296750.1	KY296750	2005-07-03	Asia	China			Homo sapiens	2018-12-10		Song et al		Song,J., Wang,H., Ng,T.I., Cui,A., Zhu,S., Huang,Y., Sun,L., Yang,Z., Yu,D., Yu,P., Zhang,H., Zhang,Y., Xu,W.	
345	KY296751	KY296751.1	KY296751	2005-07-03	Asia	China			Homo sapiens	2018-12-10		Song et al		Song,J., Wang,H., Ng,T.I., Cui,A., Zhu,S., Huang,Y., Sun,L., Yang,Z., Yu,D., Yu,P., Zhang,H., Zhang,Y., Xu,W.	
346	KY296752	KY296752.1	KY296752	2005-07-03	Asia	China			Homo sapiens	2018-12-10		Song et al		Song,J., Wang,H., Ng,T.I., Cui,A., Zhu,S., Huang,Y., Sun,L., Yang,Z., Yu,D., Yu,P., Zhang,H., Zhang,Y., Xu,W.	
347	KY296753	KY296753.1	KY296753	2005-07-03	Asia	China			Homo sapiens	2018-12-10		Song et al		Song,J., Wang,H., Ng,T.I., Cui,A., Zhu,S., Huang,Y., Sun,L., Yang,Z., Yu,D., Yu,P., Zhang,H., Zhang,Y., Xu,W.	
348	KY296754	KY296754.1	KY296754	2005-07-03	Asia	China			Homo sapiens	2018-12-10		Song et al		Song,J., Wang,H., Ng,T.I., Cui,A., Zhu,S., Huang,Y., Sun,L., Yang,Z., Yu,D., Yu,P., Zhang,H., Zhang,Y., Xu,W.	
349	KY296755	KY296755.1	KY296755	2005-07-03	Asia	China			Homo sapiens	2018-12-10		Song et al		Song,J., Wang,H., Ng,T.I., Cui,A., Zhu,S., Huang,Y., Sun,L., Yang,Z., Yu,D., Yu,P., Zhang,H., Zhang,Y., Xu,W.	
350	KY296756	KY296756.1	KY296756	2005-07-03	Asia	China			Homo sapiens	2018-12-10		Song et al		Song,J., Wang,H., Ng,T.I., Cui,A., Zhu,S., Huang,Y., Sun,L., Yang,Z., Yu,D., Yu,P., Zhang,H., Zhang,Y., Xu,W.	
351	KY296768	KY296768.1	KY296768	2005-07-06	Asia	China			Homo sapiens	2018-12-10		Song et al		Song,J., Wang,H., Ng,T.I., Cui,A., Zhu,S., Huang,Y., Sun,L., Yang,Z., Yu,D., Yu,P., Zhang,H., Zhang,Y., Xu,W.	
352	KY296769	KY296769.1	KY296769	2005-07-06	Asia	China			Homo sapiens	2018-12-10		Song et al		Song,J., Wang,H., Ng,T.I., Cui,A., Zhu,S., Huang,Y., Sun,L., Yang,Z., Yu,D., Yu,P., Zhang,H., Zhang,Y., Xu,W.	
353	KY296770	KY296770.1	KY296770	2005-07-06	Asia	China			Homo sapiens	2018-12-10		Song et al		Song,J., Wang,H., Ng,T.I., Cui,A., Zhu,S., Huang,Y., Sun,L., Yang,Z., Yu,D., Yu,P., Zhang,H., Zhang,Y., Xu,W.	
354	JN968315	JN968315.1	V05-2246573	2005-10-03	Asia	Hong Kong			Homo sapiens	2012-01-10		Mak et al		Mak,G.C., Lau,C.S., Chiu,D.M.Y., Lim,W.	
355	KU955004	KU955004.1	KU955004	2006-XX-XX	Asia	China			Homo sapiens	2019-03-31		Jia et al		Jia,B., Xiao,Y., Wang,Y., Chen,L., Zhang,J., Ren,L., Wang,J.	
356	KU955005	KU955005.1	KU955005	2006-XX-XX	Asia	China			Homo sapiens	2019-03-31		Jia et al		Jia,B., Xiao,Y., Wang,Y., Chen,L., Zhang,J., Ren,L., Wang,J.	
357	KU962896	KU962896.1	KU962896	2006-XX-XX	Asia	China			Homo sapiens	2019-03-31		Jia et al		Jia,B., Xiao,Y., Wang,Y., Chen,L., Zhang,J., Ren,L., Wang,J.	
358	KU962897	KU962897.1	KU962897	2006-XX-XX	Asia	China			Homo sapiens	2019-03-31		Jia et al		Jia,B., Xiao,Y., Wang,Y., Chen,L., Zhang,J., Ren,L., Wang,J.	
359	MF372391	MF372391.1	Atlantico/2006/I7526	2006-XX-XX	South America	Colombia			Homo sapiens	2017-10-25		Avila et al		Avila,V., Calvo,E.P., Barbosa,J., Velandia-Romero,M.L., Castellanos,J.E.	
360	MF372399	MF372399.1	Caldas/2006/7257	2006-XX-XX	South America	Colombia			Homo sapiens	2017-10-25		Avila et al		Avila,V., Calvo,E.P., Barbosa,J., Velandia-Romero,M.L., Castellanos,J.E.	
361	MF496431	MF496431.1	R95-77	2006-XX-XX	Asia	Taiwan			Homo sapiens	2017-08-30		Chi et al		Chi,H., Hsiao,K.-L., Weng,L.-C., Chiu,N.-C., Huang,L.-M., Chiu,Y.-Y., Liu,C.-P., Liu,H.-F.	
362	MF496432	MF496432.1	R95-380	2006-XX-XX	Asia	Taiwan			Homo sapiens	2017-08-30		Chi et al		Chi,H., Hsiao,K.-L., Weng,L.-C., Chiu,N.-C., Huang,L.-M., Chiu,Y.-Y., Liu,C.-P., Liu,H.-F.	
363	MF496433	MF496433.1	R95-288	2006-XX-XX	Asia	Taiwan			Homo sapiens	2017-08-30		Chi et al		Chi,H., Hsiao,K.-L., Weng,L.-C., Chiu,N.-C., Huang,L.-M., Chiu,Y.-Y., Liu,C.-P., Liu,H.-F.	
364	MF496434	MF496434.1	R95-286	2006-XX-XX	Asia	Taiwan			Homo sapiens	2017-08-30		Chi et al		Chi,H., Hsiao,K.-L., Weng,L.-C., Chiu,N.-C., Huang,L.-M., Chiu,Y.-Y., Liu,C.-P., Liu,H.-F.	
365	MF496435	MF496435.1	R95-262	2006-XX-XX	Asia	Taiwan			Homo sapiens	2017-08-30		Chi et al		Chi,H., Hsiao,K.-L., Weng,L.-C., Chiu,N.-C., Huang,L.-M., Chiu,Y.-Y., Liu,C.-P., Liu,H.-F.	
366	MF496436	MF496436.1	R95-197	2006-XX-XX	Asia	Taiwan			Homo sapiens	2017-08-30		Chi et al		Chi,H., Hsiao,K.-L., Weng,L.-C., Chiu,N.-C., Huang,L.-M., Chiu,Y.-Y., Liu,C.-P., Liu,H.-F.	
367	MF496437	MF496437.1	R95-02	2006-XX-XX	Asia	Taiwan			Homo sapiens	2017-08-30		Chi et al		Chi,H., Hsiao,K.-L., Weng,L.-C., Chiu,N.-C., Huang,L.-M., Chiu,Y.-Y., Liu,C.-P., Liu,H.-F.	
368	OM962799	OM962799.1	MetroManila.PHL/2006/086	2006-XX-XX	Asia	Philippines			Homo sapiens	2022-06-29		Calaor-Morin et al		Calaor-Morin,J., Arguelles,V.L., Foronda,J.L., Tan,A., Lagamayo,E., Dapat,C., Lupisan,S., Morin,J.C., Foronda,J.L.M.	
369	KT765706	KT765706.1	KEN/Kilifi/577_02/01/2006	2006-01-02	Africa	Kenya			Homo sapiens	2016-02-27		Otieno et al		Otieno,J.R., Agoti,C.N., Gitahi,C.W., Bett,A., Ngama,M., Medley,G.F., Cane,P.A., Nokes,D.J., Nokes,J.D.	
370	KT765740	KT765740.1	KEN/Kilifi/578_04/01/2006	2006-01-04	Africa	Kenya			Homo sapiens	2016-02-27		Otieno et al		Otieno,J.R., Agoti,C.N., Gitahi,C.W., Bett,A., Ngama,M., Medley,G.F., Cane,P.A., Nokes,D.J., Nokes,J.D.	
371	KT765741	KT765741.1	KEN/Kilifi/579_04/01/2006	2006-01-04	Africa	Kenya			Homo sapiens	2016-02-27		Otieno et al		Otieno,J.R., Agoti,C.N., Gitahi,C.W., Bett,A., Ngama,M., Medley,G.F., Cane,P.A., Nokes,D.J., Nokes,J.D.	
372	KT765708	KT765708.1	KEN/Kilifi/581_05/01/2006	2006-01-05	Africa	Kenya			Homo sapiens	2016-02-27		Otieno et al		Otieno,J.R., Agoti,C.N., Gitahi,C.W., Bett,A., Ngama,M., Medley,G.F., Cane,P.A., Nokes,D.J., Nokes,J.D.	
373	KT765724	KT765724.1	KEN/Kilifi/580_05/01/2006	2006-01-05	Africa	Kenya			Homo sapiens	2016-02-27		Otieno et al		Otieno,J.R., Agoti,C.N., Gitahi,C.W., Bett,A., Ngama,M., Medley,G.F., Cane,P.A., Nokes,D.J., Nokes,J.D.	
374	KT765760	KT765760.1	KEN/Kilifi/582_09/01/2006	2006-01-09	Africa	Kenya			Homo sapiens	2016-02-27		Otieno et al		Otieno,J.R., Agoti,C.N., Gitahi,C.W., Bett,A., Ngama,M., Medley,G.F., Cane,P.A., Nokes,D.J., Nokes,J.D.	
375	KT765739	KT765739.1	KEN/Kilifi/583_12/01/2006	2006-01-12	Africa	Kenya			Homo sapiens	2016-02-27		Otieno et al		Otieno,J.R., Agoti,C.N., Gitahi,C.W., Bett,A., Ngama,M., Medley,G.F., Cane,P.A., Nokes,D.J., Nokes,J.D.	
376	KT765742	KT765742.1	KEN/Kilifi/584_13/01/2006	2006-01-13	Africa	Kenya			Homo sapiens	2016-02-27		Otieno et al		Otieno,J.R., Agoti,C.N., Gitahi,C.W., Bett,A., Ngama,M., Medley,G.F., Cane,P.A., Nokes,D.J., Nokes,J.D.	
377	KT765722	KT765722.1	KEN/Kilifi/585_23/01/2006	2006-01-23	Africa	Kenya			Homo sapiens	2016-02-27		Otieno et al		Otieno,J.R., Agoti,C.N., Gitahi,C.W., Bett,A., Ngama,M., Medley,G.F., Cane,P.A., Nokes,D.J., Nokes,J.D.	
378	KT765761	KT765761.1	KEN/Kilifi/586_25/01/2006	2006-01-25	Africa	Kenya			Homo sapiens	2016-02-27		Otieno et al		Otieno,J.R., Agoti,C.N., Gitahi,C.W., Bett,A., Ngama,M., Medley,G.F., Cane,P.A., Nokes,D.J., Nokes,J.D.	
379	KT765725	KT765725.1	KEN/Kilifi/588_31/01/2006	2006-01-31	Africa	Kenya			Homo sapiens	2016-02-27		Otieno et al		Otieno,J.R., Agoti,C.N., Gitahi,C.W., Bett,A., Ngama,M., Medley,G.F., Cane,P.A., Nokes,D.J., Nokes,J.D.	
380	KT765744	KT765744.1	KEN/Kilifi/587_31/01/2006	2006-01-31	Africa	Kenya			Homo sapiens	2016-02-27		Otieno et al		Otieno,J.R., Agoti,C.N., Gitahi,C.W., Bett,A., Ngama,M., Medley,G.F., Cane,P.A., Nokes,D.J., Nokes,J.D.	
381	KT765777	KT765777.1	KEN/Kilifi/589_01/02/2006	2006-02-01	Africa	Kenya			Homo sapiens	2016-02-27		Otieno et al		Otieno,J.R., Agoti,C.N., Gitahi,C.W., Bett,A., Ngama,M., Medley,G.F., Cane,P.A., Nokes,D.J., Nokes,J.D.	
382	KT765718	KT765718.1	KEN/Kilifi/590_05/02/2006	2006-02-05	Africa	Kenya			Homo sapiens	2016-02-27		Otieno et al		Otieno,J.R., Agoti,C.N., Gitahi,C.W., Bett,A., Ngama,M., Medley,G.F., Cane,P.A., Nokes,D.J., Nokes,J.D.	
383	KT765737	KT765737.1	KEN/Kilifi/593_06/02/2006	2006-02-06	Africa	Kenya			Homo sapiens	2016-02-27		Otieno et al		Otieno,J.R., Agoti,C.N., Gitahi,C.W., Bett,A., Ngama,M., Medley,G.F., Cane,P.A., Nokes,D.J., Nokes,J.D.	
384	KT765743	KT765743.1	KEN/Kilifi/597_06/02/2006	2006-02-06	Africa	Kenya			Homo sapiens	2016-02-27		Otieno et al		Otieno,J.R., Agoti,C.N., Gitahi,C.W., Bett,A., Ngama,M., Medley,G.F., Cane,P.A., Nokes,D.J., Nokes,J.D.	
385	KT765752	KT765752.1	KEN/Kilifi/592_06/02/2006	2006-02-06	Africa	Kenya			Homo sapiens	2016-02-27		Otieno et al		Otieno,J.R., Agoti,C.N., Gitahi,C.W., Bett,A., Ngama,M., Medley,G.F., Cane,P.A., Nokes,D.J., Nokes,J.D.	
386	KT765763	KT765763.1	KEN/Kilifi/591_06/02/2006	2006-02-06	Africa	Kenya			Homo sapiens	2016-02-27		Otieno et al		Otieno,J.R., Agoti,C.N., Gitahi,C.W., Bett,A., Ngama,M., Medley,G.F., Cane,P.A., Nokes,D.J., Nokes,J.D.	
387	KT765714	KT765714.1	KEN/Kilifi/594_07/02/2006	2006-02-07	Africa	Kenya			Homo sapiens	2016-02-27		Otieno et al		Otieno,J.R., Agoti,C.N., Gitahi,C.W., Bett,A., Ngama,M., Medley,G.F., Cane,P.A., Nokes,D.J., Nokes,J.D.	
388	KT765731	KT765731.1	KEN/Kilifi/595_08/02/2006	2006-02-08	Africa	Kenya			Homo sapiens	2016-02-27		Otieno et al		Otieno,J.R., Agoti,C.N., Gitahi,C.W., Bett,A., Ngama,M., Medley,G.F., Cane,P.A., Nokes,D.J., Nokes,J.D.	
389	KT765729	KT765729.1	KEN/Kilifi/596_09/02/2006	2006-02-09	Africa	Kenya			Homo sapiens	2016-02-27		Otieno et al		Otieno,J.R., Agoti,C.N., Gitahi,C.W., Bett,A., Ngama,M., Medley,G.F., Cane,P.A., Nokes,D.J., Nokes,J.D.	
390	KT765732	KT765732.1	KEN/Kilifi/598_19/02/2006	2006-02-19	Africa	Kenya			Homo sapiens	2016-02-27		Otieno et al		Otieno,J.R., Agoti,C.N., Gitahi,C.W., Bett,A., Ngama,M., Medley,G.F., Cane,P.A., Nokes,D.J., Nokes,J.D.	
391	KT765728	KT765728.1	KEN/Kilifi/599_20/02/2006	2006-02-20	Africa	Kenya			Homo sapiens	2016-02-27		Otieno et al		Otieno,J.R., Agoti,C.N., Gitahi,C.W., Bett,A., Ngama,M., Medley,G.F., Cane,P.A., Nokes,D.J., Nokes,J.D.	
392	KT765750	KT765750.1	KEN/Kilifi/601_21/02/2006	2006-02-21	Africa	Kenya			Homo sapiens	2016-02-27		Otieno et al		Otieno,J.R., Agoti,C.N., Gitahi,C.W., Bett,A., Ngama,M., Medley,G.F., Cane,P.A., Nokes,D.J., Nokes,J.D.	
393	KT765762	KT765762.1	KEN/Kilifi/600_21/02/2006	2006-02-21	Africa	Kenya			Homo sapiens	2016-02-27		Otieno et al		Otieno,J.R., Agoti,C.N., Gitahi,C.W., Bett,A., Ngama,M., Medley,G.F., Cane,P.A., Nokes,D.J., Nokes,J.D.	
394	KT765723	KT765723.1	KEN/Kilifi/604_22/02/2006	2006-02-22	Africa	Kenya			Homo sapiens	2016-02-27		Otieno et al		Otieno,J.R., Agoti,C.N., Gitahi,C.W., Bett,A., Ngama,M., Medley,G.F., Cane,P.A., Nokes,D.J., Nokes,J.D.	
395	KT765735	KT765735.1	KEN/Kilifi/602_22/02/2006	2006-02-22	Africa	Kenya			Homo sapiens	2016-02-27		Otieno et al		Otieno,J.R., Agoti,C.N., Gitahi,C.W., Bett,A., Ngama,M., Medley,G.F., Cane,P.A., Nokes,D.J., Nokes,J.D.	
396	KT765736	KT765736.1	KEN/Kilifi/605_22/02/2006	2006-02-22	Africa	Kenya			Homo sapiens	2016-02-27		Otieno et al		Otieno,J.R., Agoti,C.N., Gitahi,C.W., Bett,A., Ngama,M., Medley,G.F., Cane,P.A., Nokes,D.J., Nokes,J.D.	
397	KT765753	KT765753.1	KEN/Kilifi/603_22/02/2006	2006-02-22	Africa	Kenya			Homo sapiens	2016-02-27		Otieno et al		Otieno,J.R., Agoti,C.N., Gitahi,C.W., Bett,A., Ngama,M., Medley,G.F., Cane,P.A., Nokes,D.J., Nokes,J.D.	
398	KT765713	KT765713.1	KEN/Kilifi/606_23/02/2006	2006-02-23	Africa	Kenya			Homo sapiens	2016-02-27		Otieno et al		Otieno,J.R., Agoti,C.N., Gitahi,C.W., Bett,A., Ngama,M., Medley,G.F., Cane,P.A., Nokes,D.J., Nokes,J.D.	
399	KT765721	KT765721.1	KEN/Kilifi/607_26/02/2006	2006-02-26	Africa	Kenya			Homo sapiens	2016-02-27		Otieno et al		Otieno,J.R., Agoti,C.N., Gitahi,C.W., Bett,A., Ngama,M., Medley,G.F., Cane,P.A., Nokes,D.J., Nokes,J.D.	
400	KT765707	KT765707.1	KEN/Kilifi/608_06/03/2006	2006-03-06	Africa	Kenya			Homo sapiens	2016-02-27		Otieno et al		Otieno,J.R., Agoti,C.N., Gitahi,C.W., Bett,A., Ngama,M., Medley,G.F., Cane,P.A., Nokes,D.J., Nokes,J.D.	
401	KT765764	KT765764.1	KEN/Kilifi/609_06/03/2006	2006-03-06	Africa	Kenya			Homo sapiens	2016-02-27		Otieno et al		Otieno,J.R., Agoti,C.N., Gitahi,C.W., Bett,A., Ngama,M., Medley,G.F., Cane,P.A., Nokes,D.J., Nokes,J.D.	
402	KT765734	KT765734.1	KEN/Kilifi/610_07/03/2006	2006-03-07	Africa	Kenya			Homo sapiens	2016-02-27		Otieno et al		Otieno,J.R., Agoti,C.N., Gitahi,C.W., Bett,A., Ngama,M., Medley,G.F., Cane,P.A., Nokes,D.J., Nokes,J.D.	
403	KT765746	KT765746.1	KEN/Kilifi/611_08/03/2006	2006-03-08	Africa	Kenya			Homo sapiens	2016-02-27		Otieno et al		Otieno,J.R., Agoti,C.N., Gitahi,C.W., Bett,A., Ngama,M., Medley,G.F., Cane,P.A., Nokes,D.J., Nokes,J.D.	
404	KT765730	KT765730.1	KEN/Kilifi/612_16/03/2006	2006-03-16	Africa	Kenya			Homo sapiens	2016-02-27		Otieno et al		Otieno,J.R., Agoti,C.N., Gitahi,C.W., Bett,A., Ngama,M., Medley,G.F., Cane,P.A., Nokes,D.J., Nokes,J.D.	
405	KT765778	KT765778.1	KEN/Kilifi/613_17/03/2006	2006-03-17	Africa	Kenya			Homo sapiens	2016-02-27		Otieno et al		Otieno,J.R., Agoti,C.N., Gitahi,C.W., Bett,A., Ngama,M., Medley,G.F., Cane,P.A., Nokes,D.J., Nokes,J.D.	
406	KT765710	KT765710.1	KEN/Kilifi/615_18/03/2006	2006-03-18	Africa	Kenya			Homo sapiens	2016-02-27		Otieno et al		Otieno,J.R., Agoti,C.N., Gitahi,C.W., Bett,A., Ngama,M., Medley,G.F., Cane,P.A., Nokes,D.J., Nokes,J.D.	
407	KT765719	KT765719.1	KEN/Kilifi/614_18/03/2006	2006-03-18	Africa	Kenya			Homo sapiens	2016-02-27		Otieno et al		Otieno,J.R., Agoti,C.N., Gitahi,C.W., Bett,A., Ngama,M., Medley,G.F., Cane,P.A., Nokes,D.J., Nokes,J.D.	
408	KT765709	KT765709.1	KEN/Kilifi/616_19/03/2006	2006-03-19	Africa	Kenya			Homo sapiens	2016-02-27		Otieno et al		Otieno,J.R., Agoti,C.N., Gitahi,C.W., Bett,A., Ngama,M., Medley,G.F., Cane,P.A., Nokes,D.J., Nokes,J.D.	
409	KT765711	KT765711.1	KEN/Kilifi/618_21/03/2006	2006-03-21	Africa	Kenya			Homo sapiens	2016-02-27		Otieno et al		Otieno,J.R., Agoti,C.N., Gitahi,C.W., Bett,A., Ngama,M., Medley,G.F., Cane,P.A., Nokes,D.J., Nokes,J.D.	
410	KT765776	KT765776.1	KEN/Kilifi/617_21/03/2006	2006-03-21	Africa	Kenya			Homo sapiens	2016-02-27		Otieno et al		Otieno,J.R., Agoti,C.N., Gitahi,C.W., Bett,A., Ngama,M., Medley,G.F., Cane,P.A., Nokes,D.J., Nokes,J.D.	
411	KT765720	KT765720.1	KEN/Kilifi/619_22/03/2006	2006-03-22	Africa	Kenya			Homo sapiens	2016-02-27		Otieno et al		Otieno,J.R., Agoti,C.N., Gitahi,C.W., Bett,A., Ngama,M., Medley,G.F., Cane,P.A., Nokes,D.J., Nokes,J.D.	
412	KT765733	KT765733.1	KEN/Kilifi/621_23/03/2006	2006-03-23	Africa	Kenya			Homo sapiens	2016-02-27		Otieno et al		Otieno,J.R., Agoti,C.N., Gitahi,C.W., Bett,A., Ngama,M., Medley,G.F., Cane,P.A., Nokes,D.J., Nokes,J.D.	
413	KT765749	KT765749.1	KEN/Kilifi/620_23/03/2006	2006-03-23	Africa	Kenya			Homo sapiens	2016-02-27		Otieno et al		Otieno,J.R., Agoti,C.N., Gitahi,C.W., Bett,A., Ngama,M., Medley,G.F., Cane,P.A., Nokes,D.J., Nokes,J.D.	
414	KT765738	KT765738.1	KEN/Kilifi/622_24/03/2006	2006-03-24	Africa	Kenya			Homo sapiens	2016-02-27		Otieno et al		Otieno,J.R., Agoti,C.N., Gitahi,C.W., Bett,A., Ngama,M., Medley,G.F., Cane,P.A., Nokes,D.J., Nokes,J.D.	
415	KT765745	KT765745.1	KEN/Kilifi/624_26/03/2006	2006-03-26	Africa	Kenya			Homo sapiens	2016-02-27		Otieno et al		Otieno,J.R., Agoti,C.N., Gitahi,C.W., Bett,A., Ngama,M., Medley,G.F., Cane,P.A., Nokes,D.J., Nokes,J.D.	
416	KT765754	KT765754.1	KEN/Kilifi/623_27/03/2006	2006-03-27	Africa	Kenya			Homo sapiens	2016-02-27		Otieno et al		Otieno,J.R., Agoti,C.N., Gitahi,C.W., Bett,A., Ngama,M., Medley,G.F., Cane,P.A., Nokes,D.J., Nokes,J.D.	
417	KT765758	KT765758.1	KEN/Kilifi/625_28/03/2006	2006-03-28	Africa	Kenya			Homo sapiens	2016-02-27		Otieno et al		Otieno,J.R., Agoti,C.N., Gitahi,C.W., Bett,A., Ngama,M., Medley,G.F., Cane,P.A., Nokes,D.J., Nokes,J.D.	
418	JN968316	JN968316.1	V06-2215072	2006-04-04	Asia	Hong Kong			Homo sapiens	2012-01-10		Mak et al		Mak,G.C., Lau,C.S., Chiu,D.M.Y., Lim,W.	
419	JN968332	JN968332.1	V06-2224920	2006-06-03	Asia	Hong Kong			Homo sapiens	2012-01-10		Mak et al		Mak,G.C., Lau,C.S., Chiu,D.M.Y., Lim,W.	
420	KT765747	KT765747.1	KEN/Kilifi/626_08/06/2006	2006-06-08	Africa	Kenya			Homo sapiens	2016-02-27		Otieno et al		Otieno,J.R., Agoti,C.N., Gitahi,C.W., Bett,A., Ngama,M., Medley,G.F., Cane,P.A., Nokes,D.J., Nokes,J.D.	
421	KT765751	KT765751.1	KEN/Kilifi/627_09/06/2006	2006-06-09	Africa	Kenya			Homo sapiens	2016-02-27		Otieno et al		Otieno,J.R., Agoti,C.N., Gitahi,C.W., Bett,A., Ngama,M., Medley,G.F., Cane,P.A., Nokes,D.J., Nokes,J.D.	
422	KT765759	KT765759.1	KEN/Kilifi/628_12/06/2006	2006-06-12	Africa	Kenya			Homo sapiens	2016-02-27		Otieno et al		Otieno,J.R., Agoti,C.N., Gitahi,C.W., Bett,A., Ngama,M., Medley,G.F., Cane,P.A., Nokes,D.J., Nokes,J.D.	
423	KT765773	KT765773.1	KEN/Kilifi/629_02/07/2006	2006-07-02	Africa	Kenya			Homo sapiens	2016-02-27		Otieno et al		Otieno,J.R., Agoti,C.N., Gitahi,C.W., Bett,A., Ngama,M., Medley,G.F., Cane,P.A., Nokes,D.J., Nokes,J.D.	
424	KT765757	KT765757.1	KEN/Kilifi/630_27/07/2006	2006-07-27	Africa	Kenya			Homo sapiens	2016-02-27		Otieno et al		Otieno,J.R., Agoti,C.N., Gitahi,C.W., Bett,A., Ngama,M., Medley,G.F., Cane,P.A., Nokes,D.J., Nokes,J.D.	
425	KT765748	KT765748.1	KEN/Kilifi/631_28/07/2006	2006-07-28	Africa	Kenya			Homo sapiens	2016-02-27		Otieno et al		Otieno,J.R., Agoti,C.N., Gitahi,C.W., Bett,A., Ngama,M., Medley,G.F., Cane,P.A., Nokes,D.J., Nokes,J.D.	
426	JN968317	JN968317.1	V06-2240346	2006-08-01	Asia	Hong Kong			Homo sapiens	2012-01-10		Mak et al		Mak,G.C., Lau,C.S., Chiu,D.M.Y., Lim,W.	
427	KT765712	KT765712.1	KEN/Kilifi/633_30/08/2006	2006-08-30	Africa	Kenya			Homo sapiens	2016-02-27		Otieno et al		Otieno,J.R., Agoti,C.N., Gitahi,C.W., Bett,A., Ngama,M., Medley,G.F., Cane,P.A., Nokes,D.J., Nokes,J.D.	
428	KT765765	KT765765.1	KEN/Kilifi/634_03/09/2006	2006-09-03	Africa	Kenya			Homo sapiens	2016-02-27		Otieno et al		Otieno,J.R., Agoti,C.N., Gitahi,C.W., Bett,A., Ngama,M., Medley,G.F., Cane,P.A., Nokes,D.J., Nokes,J.D.	
429	KT765768	KT765768.1	KEN/Kilifi/632_03/09/2006	2006-09-03	Africa	Kenya			Homo sapiens	2016-02-27		Otieno et al		Otieno,J.R., Agoti,C.N., Gitahi,C.W., Bett,A., Ngama,M., Medley,G.F., Cane,P.A., Nokes,D.J., Nokes,J.D.	
430	KT765717	KT765717.1	KEN/Kilifi/635_11/09/2006	2006-09-11	Africa	Kenya			Homo sapiens	2016-02-27		Otieno et al		Otieno,J.R., Agoti,C.N., Gitahi,C.W., Bett,A., Ngama,M., Medley,G.F., Cane,P.A., Nokes,D.J., Nokes,J.D.	
431	KY911079	KY911079.1	GHA/RV034/2006	2006-10-02	Africa	Ghana			Homo sapiens	2018-09-24		Obodai et al		Obodai,E., Odoom,J.K., Adiku,T., Goka,B., Wolff,T., Biere,B., Schweiger,B., Reiche,J.	
432	JN968318	JN968318.1	V06-2262605	2006-12-04	Asia	Hong Kong			Homo sapiens	2012-01-10		Mak et al		Mak,G.C., Lau,C.S., Chiu,D.M.Y., Lim,W.	
433	KT765818	KT765818.1	KEN/Kilifi/636_13/12/2006	2006-12-13	Africa	Kenya			Homo sapiens	2016-02-27		Otieno et al		Otieno,J.R., Agoti,C.N., Gitahi,C.W., Bett,A., Ngama,M., Medley,G.F., Cane,P.A., Nokes,D.J., Nokes,J.D.	
434	KT765340	KT765340.1	KEN/Kilifi/637_15/12/2006	2006-12-15	Africa	Kenya			Homo sapiens	2016-02-27		Otieno et al		Otieno,J.R., Agoti,C.N., Gitahi,C.W., Bett,A., Ngama,M., Medley,G.F., Cane,P.A., Nokes,D.J., Nokes,J.D.	
435	KT765684	KT765684.1	KEN/Kilifi/638_18/12/2006	2006-12-18	Africa	Kenya			Homo sapiens	2016-02-27		Otieno et al		Otieno,J.R., Agoti,C.N., Gitahi,C.W., Bett,A., Ngama,M., Medley,G.F., Cane,P.A., Nokes,D.J., Nokes,J.D.	
436	KT765771	KT765771.1	KEN/Kilifi/639_18/12/2006	2006-12-18	Africa	Kenya			Homo sapiens	2016-02-27		Otieno et al		Otieno,J.R., Agoti,C.N., Gitahi,C.W., Bett,A., Ngama,M., Medley,G.F., Cane,P.A., Nokes,D.J., Nokes,J.D.	
437	KT765367	KT765367.1	KEN/Kilifi/640_20/12/2006	2006-12-20	Africa	Kenya			Homo sapiens	2016-02-27		Otieno et al		Otieno,J.R., Agoti,C.N., Gitahi,C.W., Bett,A., Ngama,M., Medley,G.F., Cane,P.A., Nokes,D.J., Nokes,J.D.	
438	KT765369	KT765369.1	KEN/Kilifi/641_21/12/2006	2006-12-21	Africa	Kenya			Homo sapiens	2016-02-27		Otieno et al		Otieno,J.R., Agoti,C.N., Gitahi,C.W., Bett,A., Ngama,M., Medley,G.F., Cane,P.A., Nokes,D.J., Nokes,J.D.	
439	KT765755	KT765755.1	KEN/Kilifi/642_21/12/2006	2006-12-21	Africa	Kenya			Homo sapiens	2016-02-27		Otieno et al		Otieno,J.R., Agoti,C.N., Gitahi,C.W., Bett,A., Ngama,M., Medley,G.F., Cane,P.A., Nokes,D.J., Nokes,J.D.	
440	KT765769	KT765769.1	KEN/Kilifi/645_26/12/2006	2006-12-26	Africa	Kenya			Homo sapiens	2016-02-27		Otieno et al		Otieno,J.R., Agoti,C.N., Gitahi,C.W., Bett,A., Ngama,M., Medley,G.F., Cane,P.A., Nokes,D.J., Nokes,J.D.	
441	KT765823	KT765823.1	KEN/Kilifi/644_26/12/2006	2006-12-26	Africa	Kenya			Homo sapiens	2016-02-27		Otieno et al		Otieno,J.R., Agoti,C.N., Gitahi,C.W., Bett,A., Ngama,M., Medley,G.F., Cane,P.A., Nokes,D.J., Nokes,J.D.	
442	KT765383	KT765383.1	KEN/Kilifi/646_28/12/2006	2006-12-28	Africa	Kenya			Homo sapiens	2016-02-27		Otieno et al		Otieno,J.R., Agoti,C.N., Gitahi,C.W., Bett,A., Ngama,M., Medley,G.F., Cane,P.A., Nokes,D.J., Nokes,J.D.	
443	KT765347	KT765347.1	KEN/Kilifi/647_29/12/2006	2006-12-29	Africa	Kenya			Homo sapiens	2016-02-27		Otieno et al		Otieno,J.R., Agoti,C.N., Gitahi,C.W., Bett,A., Ngama,M., Medley,G.F., Cane,P.A., Nokes,D.J., Nokes,J.D.	
444	AB687650	AB687650.1	AB687650	2007-XX-XX	Asia	Japan	Fukui		Homo sapiens	2011-12-14		Nakamura et al		Nakamura,M., Sugawara,T., Toho,M., Kawabata,M., Tsuchida,S., Maegawa,K., Hanaoka,N., Okusa,Y., Adhikary,A.K., Okabe,N., Fujimoto,T.	
445	AB687652	AB687652.1	AB687652	2007-XX-XX	Asia	Japan	Fukui		Homo sapiens	2011-12-14		Nakamura et al		Nakamura,M., Sugawara,T., Toho,M., Kawabata,M., Tsuchida,S., Maegawa,K., Hanaoka,N., Okusa,Y., Adhikary,A.K., Okabe,N., Fujimoto,T.	
446	AB687653	AB687653.1	AB687653	2007-XX-XX	Asia	Japan	Fukui		Homo sapiens	2011-12-14		Nakamura et al		Nakamura,M., Sugawara,T., Toho,M., Kawabata,M., Tsuchida,S., Maegawa,K., Hanaoka,N., Okusa,Y., Adhikary,A.K., Okabe,N., Fujimoto,T.	
447	AB687654	AB687654.1	AB687654	2007-XX-XX	Asia	Japan	Fukui		Homo sapiens	2011-12-14		Nakamura et al		Nakamura,M., Sugawara,T., Toho,M., Kawabata,M., Tsuchida,S., Maegawa,K., Hanaoka,N., Okusa,Y., Adhikary,A.K., Okabe,N., Fujimoto,T.	
448	AB687656	AB687656.1	AB687656	2007-XX-XX	Asia	Japan	Fukui		Homo sapiens	2011-12-14		Nakamura et al		Nakamura,M., Sugawara,T., Toho,M., Kawabata,M., Tsuchida,S., Maegawa,K., Hanaoka,N., Okusa,Y., Adhikary,A.K., Okabe,N., Fujimoto,T.	
449	KC297379	KC297379.1	KC297379	2007-XX-XX	Asia	China			Homo sapiens	2013-10-02		Cui et al		Cui,G., Zhu,R., Qian,Y., Deng,J., Zhao,L., Sun,Y., Wang,F.	
450	KC297380	KC297380.1	KC297380	2007-XX-XX	Asia	China			Homo sapiens	2013-10-02		Cui et al		Cui,G., Zhu,R., Qian,Y., Deng,J., Zhao,L., Sun,Y., Wang,F.	
451	KC297381	KC297381.1	KC297381	2007-XX-XX	Asia	China			Homo sapiens	2013-10-02		Cui et al		Cui,G., Zhu,R., Qian,Y., Deng,J., Zhao,L., Sun,Y., Wang,F.	
452	KC297382	KC297382.1	KC297382	2007-XX-XX	Asia	China			Homo sapiens	2013-10-02		Cui et al		Cui,G., Zhu,R., Qian,Y., Deng,J., Zhao,L., Sun,Y., Wang,F.	
453	KC297383	KC297383.1	KC297383	2007-XX-XX	Asia	China			Homo sapiens	2013-10-02		Cui et al		Cui,G., Zhu,R., Qian,Y., Deng,J., Zhao,L., Sun,Y., Wang,F.	
454	KC297384	KC297384.1	KC297384	2007-XX-XX	Asia	China			Homo sapiens	2013-10-02		Cui et al		Cui,G., Zhu,R., Qian,Y., Deng,J., Zhao,L., Sun,Y., Wang,F.	
455	KC297385	KC297385.1	KC297385	2007-XX-XX	Asia	China			Homo sapiens	2013-10-02		Cui et al		Cui,G., Zhu,R., Qian,Y., Deng,J., Zhao,L., Sun,Y., Wang,F.	
456	KC297386	KC297386.1	KC297386	2007-XX-XX	Asia	China			Homo sapiens	2013-10-02		Cui et al		Cui,G., Zhu,R., Qian,Y., Deng,J., Zhao,L., Sun,Y., Wang,F.	
457	KC297387	KC297387.1	KC297387	2007-XX-XX	Asia	China			Homo sapiens	2013-10-02		Cui et al		Cui,G., Zhu,R., Qian,Y., Deng,J., Zhao,L., Sun,Y., Wang,F.	
458	KC297388	KC297388.1	KC297388	2007-XX-XX	Asia	China			Homo sapiens	2013-10-02		Cui et al		Cui,G., Zhu,R., Qian,Y., Deng,J., Zhao,L., Sun,Y., Wang,F.	
459	KC297389	KC297389.1	KC297389	2007-XX-XX	Asia	China			Homo sapiens	2013-10-02		Cui et al		Cui,G., Zhu,R., Qian,Y., Deng,J., Zhao,L., Sun,Y., Wang,F.	
460	KC297390	KC297390.1	KC297390	2007-XX-XX	Asia	China			Homo sapiens	2013-10-02		Cui et al		Cui,G., Zhu,R., Qian,Y., Deng,J., Zhao,L., Sun,Y., Wang,F.	
461	KC297391	KC297391.1	KC297391	2007-XX-XX	Asia	China			Homo sapiens	2013-10-02		Cui et al		Cui,G., Zhu,R., Qian,Y., Deng,J., Zhao,L., Sun,Y., Wang,F.	
462	KC297392	KC297392.1	KC297392	2007-XX-XX	Asia	China			Homo sapiens	2013-10-02		Cui et al		Cui,G., Zhu,R., Qian,Y., Deng,J., Zhao,L., Sun,Y., Wang,F.	
463	KC297393	KC297393.1	KC297393	2007-XX-XX	Asia	China			Homo sapiens	2013-10-02		Cui et al		Cui,G., Zhu,R., Qian,Y., Deng,J., Zhao,L., Sun,Y., Wang,F.	
464	KC297394	KC297394.1	KC297394	2007-XX-XX	Asia	China			Homo sapiens	2013-10-02		Cui et al		Cui,G., Zhu,R., Qian,Y., Deng,J., Zhao,L., Sun,Y., Wang,F.	
465	KC297395	KC297395.1	KC297395	2007-XX-XX	Asia	China			Homo sapiens	2013-10-02		Cui et al		Cui,G., Zhu,R., Qian,Y., Deng,J., Zhao,L., Sun,Y., Wang,F.	
466	KC297396	KC297396.1	KC297396	2007-XX-XX	Asia	China			Homo sapiens	2013-10-02		Cui et al		Cui,G., Zhu,R., Qian,Y., Deng,J., Zhao,L., Sun,Y., Wang,F.	
467	KC297397	KC297397.1	KC297397	2007-XX-XX	Asia	China			Homo sapiens	2013-10-02		Cui et al		Cui,G., Zhu,R., Qian,Y., Deng,J., Zhao,L., Sun,Y., Wang,F.	
468	KC297398	KC297398.1	KC297398	2007-XX-XX	Asia	China			Homo sapiens	2013-10-02		Cui et al		Cui,G., Zhu,R., Qian,Y., Deng,J., Zhao,L., Sun,Y., Wang,F.	
469	KC297399	KC297399.1	KC297399	2007-XX-XX	Asia	China			Homo sapiens	2013-10-02		Cui et al		Cui,G., Zhu,R., Qian,Y., Deng,J., Zhao,L., Sun,Y., Wang,F.	
470	KC297400	KC297400.1	KC297400	2007-XX-XX	Asia	China			Homo sapiens	2013-10-02		Cui et al		Cui,G., Zhu,R., Qian,Y., Deng,J., Zhao,L., Sun,Y., Wang,F.	
471	KC297401	KC297401.1	KC297401	2007-XX-XX	Asia	China			Homo sapiens	2013-10-02		Cui et al		Cui,G., Zhu,R., Qian,Y., Deng,J., Zhao,L., Sun,Y., Wang,F.	
472	KC297402	KC297402.1	KC297402	2007-XX-XX	Asia	China			Homo sapiens	2013-10-02		Cui et al		Cui,G., Zhu,R., Qian,Y., Deng,J., Zhao,L., Sun,Y., Wang,F.	
473	KU955003	KU955003.1	KU955003	2007-XX-XX	Asia	China			Homo sapiens	2019-03-31		Jia et al		Jia,B., Xiao,Y., Wang,Y., Chen,L., Zhang,J., Ren,L., Wang,J.	
474	KU955022	KU955022.1	KU955022	2007-XX-XX	Asia	China			Homo sapiens	2019-03-31		Jia et al		Jia,B., Xiao,Y., Wang,Y., Chen,L., Zhang,J., Ren,L., Wang,J.	
475	KU955056	KU955056.1	KU955056	2007-XX-XX	Asia	China			Homo sapiens	2019-03-31		Jia et al		Jia,B., Xiao,Y., Wang,Y., Chen,L., Zhang,J., Ren,L., Wang,J.	
476	KU955077	KU955077.1	KU955077	2007-XX-XX	Asia	China			Homo sapiens	2019-03-31		Jia et al		Jia,B., Xiao,Y., Wang,Y., Chen,L., Zhang,J., Ren,L., Wang,J.	
477	KU955082	KU955082.1	KU955082	2007-XX-XX	Asia	China			Homo sapiens	2019-03-31		Jia et al		Jia,B., Xiao,Y., Wang,Y., Chen,L., Zhang,J., Ren,L., Wang,J.	
478	KU955083	KU955083.1	KU955083	2007-XX-XX	Asia	China			Homo sapiens	2019-03-31		Jia et al		Jia,B., Xiao,Y., Wang,Y., Chen,L., Zhang,J., Ren,L., Wang,J.	
479	KU955084	KU955084.1	KU955084	2007-XX-XX	Asia	China			Homo sapiens	2019-03-31		Jia et al		Jia,B., Xiao,Y., Wang,Y., Chen,L., Zhang,J., Ren,L., Wang,J.	
480	KU955085	KU955085.1	KU955085	2007-XX-XX	Asia	China			Homo sapiens	2019-03-31		Jia et al		Jia,B., Xiao,Y., Wang,Y., Chen,L., Zhang,J., Ren,L., Wang,J.	
481	KU955086	KU955086.1	KU955086	2007-XX-XX	Asia	China			Homo sapiens	2019-03-31		Jia et al		Jia,B., Xiao,Y., Wang,Y., Chen,L., Zhang,J., Ren,L., Wang,J.	
482	KU955087	KU955087.1	KU955087	2007-XX-XX	Asia	China			Homo sapiens	2019-03-31		Jia et al		Jia,B., Xiao,Y., Wang,Y., Chen,L., Zhang,J., Ren,L., Wang,J.	
483	KU955088	KU955088.1	KU955088	2007-XX-XX	Asia	China			Homo sapiens	2019-03-31		Jia et al		Jia,B., Xiao,Y., Wang,Y., Chen,L., Zhang,J., Ren,L., Wang,J.	
484	KU955089	KU955089.1	KU955089	2007-XX-XX	Asia	China			Homo sapiens	2019-03-31		Jia et al		Jia,B., Xiao,Y., Wang,Y., Chen,L., Zhang,J., Ren,L., Wang,J.	
485	KU955091	KU955091.1	KU955091	2007-XX-XX	Asia	China			Homo sapiens	2019-03-31		Jia et al		Jia,B., Xiao,Y., Wang,Y., Chen,L., Zhang,J., Ren,L., Wang,J.	
486	KU955093	KU955093.1	KU955093	2007-XX-XX	Asia	China			Homo sapiens	2019-03-31		Jia et al		Jia,B., Xiao,Y., Wang,Y., Chen,L., Zhang,J., Ren,L., Wang,J.	
487	KU955099	KU955099.1	KU955099	2007-XX-XX	Asia	China			Homo sapiens	2019-03-31		Jia et al		Jia,B., Xiao,Y., Wang,Y., Chen,L., Zhang,J., Ren,L., Wang,J.	
488	KU955100	KU955100.1	KU955100	2007-XX-XX	Asia	China			Homo sapiens	2019-03-31		Jia et al		Jia,B., Xiao,Y., Wang,Y., Chen,L., Zhang,J., Ren,L., Wang,J.	
489	KU955102	KU955102.1	KU955102	2007-XX-XX	Asia	China			Homo sapiens	2019-03-31		Jia et al		Jia,B., Xiao,Y., Wang,Y., Chen,L., Zhang,J., Ren,L., Wang,J.	
490	KU955106	KU955106.1	KU955106	2007-XX-XX	Asia	China			Homo sapiens	2019-03-31		Jia et al		Jia,B., Xiao,Y., Wang,Y., Chen,L., Zhang,J., Ren,L., Wang,J.	
491	KU955108	KU955108.1	KU955108	2007-XX-XX	Asia	China			Homo sapiens	2019-03-31		Jia et al		Jia,B., Xiao,Y., Wang,Y., Chen,L., Zhang,J., Ren,L., Wang,J.	
492	KU955109	KU955109.1	KU955109	2007-XX-XX	Asia	China			Homo sapiens	2019-03-31		Jia et al		Jia,B., Xiao,Y., Wang,Y., Chen,L., Zhang,J., Ren,L., Wang,J.	
493	KU955110	KU955110.1	KU955110	2007-XX-XX	Asia	China			Homo sapiens	2019-03-31		Jia et al		Jia,B., Xiao,Y., Wang,Y., Chen,L., Zhang,J., Ren,L., Wang,J.	
494	KU955111	KU955111.1	KU955111	2007-XX-XX	Asia	China			Homo sapiens	2019-03-31		Jia et al		Jia,B., Xiao,Y., Wang,Y., Chen,L., Zhang,J., Ren,L., Wang,J.	
495	KU955112	KU955112.1	KU955112	2007-XX-XX	Asia	China			Homo sapiens	2019-03-31		Jia et al		Jia,B., Xiao,Y., Wang,Y., Chen,L., Zhang,J., Ren,L., Wang,J.	
496	KU955113	KU955113.1	KU955113	2007-XX-XX	Asia	China			Homo sapiens	2019-03-31		Jia et al		Jia,B., Xiao,Y., Wang,Y., Chen,L., Zhang,J., Ren,L., Wang,J.	
497	KU955114	KU955114.1	KU955114	2007-XX-XX	Asia	China			Homo sapiens	2019-03-31		Jia et al		Jia,B., Xiao,Y., Wang,Y., Chen,L., Zhang,J., Ren,L., Wang,J.	
498	KU955115	KU955115.1	KU955115	2007-XX-XX	Asia	China			Homo sapiens	2019-03-31		Jia et al		Jia,B., Xiao,Y., Wang,Y., Chen,L., Zhang,J., Ren,L., Wang,J.	
499	KU955116	KU955116.1	KU955116	2007-XX-XX	Asia	China			Homo sapiens	2019-03-31		Jia et al		Jia,B., Xiao,Y., Wang,Y., Chen,L., Zhang,J., Ren,L., Wang,J.	
500	KU955117	KU955117.1	KU955117	2007-XX-XX	Asia	China			Homo sapiens	2019-03-31		Jia et al		Jia,B., Xiao,Y., Wang,Y., Chen,L., Zhang,J., Ren,L., Wang,J.	
501	KU955118	KU955118.1	KU955118	2007-XX-XX	Asia	China			Homo sapiens	2019-03-31		Jia et al		Jia,B., Xiao,Y., Wang,Y., Chen,L., Zhang,J., Ren,L., Wang,J.	
502	KU955119	KU955119.1	KU955119	2007-XX-XX	Asia	China			Homo sapiens	2019-03-31		Jia et al		Jia,B., Xiao,Y., Wang,Y., Chen,L., Zhang,J., Ren,L., Wang,J.	
503	KU955120	KU955120.1	KU955120	2007-XX-XX	Asia	China			Homo sapiens	2019-03-31		Jia et al		Jia,B., Xiao,Y., Wang,Y., Chen,L., Zhang,J., Ren,L., Wang,J.	
504	KU955143	KU955143.1	KU955143	2007-XX-XX	Asia	China			Homo sapiens	2019-03-31		Jia et al		Jia,B., Xiao,Y., Wang,Y., Chen,L., Zhang,J., Ren,L., Wang,J.	
505	KU955150	KU955150.1	KU955150	2007-XX-XX	Asia	China			Homo sapiens	2019-03-31		Jia et al		Jia,B., Xiao,Y., Wang,Y., Chen,L., Zhang,J., Ren,L., Wang,J.	
506	KU955153	KU955153.1	KU955153	2007-XX-XX	Asia	China			Homo sapiens	2019-03-31		Jia et al		Jia,B., Xiao,Y., Wang,Y., Chen,L., Zhang,J., Ren,L., Wang,J.	
507	KU955160	KU955160.1	KU955160	2007-XX-XX	Asia	China			Homo sapiens	2019-03-31		Jia et al		Jia,B., Xiao,Y., Wang,Y., Chen,L., Zhang,J., Ren,L., Wang,J.	
508	KU955161	KU955161.1	KU955161	2007-XX-XX	Asia	China			Homo sapiens	2019-03-31		Jia et al		Jia,B., Xiao,Y., Wang,Y., Chen,L., Zhang,J., Ren,L., Wang,J.	
509	KU955162	KU955162.1	KU955162	2007-XX-XX	Asia	China			Homo sapiens	2019-03-31		Jia et al		Jia,B., Xiao,Y., Wang,Y., Chen,L., Zhang,J., Ren,L., Wang,J.	
510	KU955163	KU955163.1	KU955163	2007-XX-XX	Asia	China			Homo sapiens	2019-03-31		Jia et al		Jia,B., Xiao,Y., Wang,Y., Chen,L., Zhang,J., Ren,L., Wang,J.	
511	KU955164	KU955164.1	KU955164	2007-XX-XX	Asia	China			Homo sapiens	2019-03-31		Jia et al		Jia,B., Xiao,Y., Wang,Y., Chen,L., Zhang,J., Ren,L., Wang,J.	
512	KU955165	KU955165.1	KU955165	2007-XX-XX	Asia	China			Homo sapiens	2019-03-31		Jia et al		Jia,B., Xiao,Y., Wang,Y., Chen,L., Zhang,J., Ren,L., Wang,J.	
513	KU955166	KU955166.1	KU955166	2007-XX-XX	Asia	China			Homo sapiens	2019-03-31		Jia et al		Jia,B., Xiao,Y., Wang,Y., Chen,L., Zhang,J., Ren,L., Wang,J.	
514	KU955167	KU955167.1	KU955167	2007-XX-XX	Asia	China			Homo sapiens	2019-03-31		Jia et al		Jia,B., Xiao,Y., Wang,Y., Chen,L., Zhang,J., Ren,L., Wang,J.	
515	KU955168	KU955168.1	KU955168	2007-XX-XX	Asia	China			Homo sapiens	2019-03-31		Jia et al		Jia,B., Xiao,Y., Wang,Y., Chen,L., Zhang,J., Ren,L., Wang,J.	
516	KU955169	KU955169.1	KU955169	2007-XX-XX	Asia	China			Homo sapiens	2019-03-31		Jia et al		Jia,B., Xiao,Y., Wang,Y., Chen,L., Zhang,J., Ren,L., Wang,J.	
517	KU955258	KU955258.1	KU955258	2007-XX-XX	Asia	China			Homo sapiens	2019-03-31		Jia et al		Jia,B., Xiao,Y., Wang,Y., Chen,L., Zhang,J., Ren,L., Wang,J.	
518	KU955281	KU955281.1	KU955281	2007-XX-XX	Asia	China			Homo sapiens	2019-03-31		Jia et al		Jia,B., Xiao,Y., Wang,Y., Chen,L., Zhang,J., Ren,L., Wang,J.	
519	KU955282	KU955282.1	KU955282	2007-XX-XX	Asia	China			Homo sapiens	2019-03-31		Jia et al		Jia,B., Xiao,Y., Wang,Y., Chen,L., Zhang,J., Ren,L., Wang,J.	
520	KU962200	KU962200.1	KU962200	2007-XX-XX	Asia	China			Homo sapiens	2019-03-31		Jia et al		Jia,B., Xiao,Y., Wang,Y., Chen,L., Zhang,J., Ren,L., Wang,J.	
521	KU962201	KU962201.1	KU962201	2007-XX-XX	Asia	China			Homo sapiens	2019-03-31		Jia et al		Jia,B., Xiao,Y., Wang,Y., Chen,L., Zhang,J., Ren,L., Wang,J.	
522	KU962202	KU962202.1	KU962202	2007-XX-XX	Asia	China			Homo sapiens	2019-03-31		Jia et al		Jia,B., Xiao,Y., Wang,Y., Chen,L., Zhang,J., Ren,L., Wang,J.	
523	KU962203	KU962203.1	KU962203	2007-XX-XX	Asia	China			Homo sapiens	2019-03-31		Jia et al		Jia,B., Xiao,Y., Wang,Y., Chen,L., Zhang,J., Ren,L., Wang,J.	
524	KU962520	KU962520.1	KU962520	2007-XX-XX	Asia	China			Homo sapiens	2019-03-31		Jia et al		Jia,B., Xiao,Y., Wang,Y., Chen,L., Zhang,J., Ren,L., Wang,J.	
525	KU962521	KU962521.1	KU962521	2007-XX-XX	Asia	China			Homo sapiens	2019-03-31		Jia et al		Jia,B., Xiao,Y., Wang,Y., Chen,L., Zhang,J., Ren,L., Wang,J.	
526	KU962522	KU962522.1	KU962522	2007-XX-XX	Asia	China			Homo sapiens	2019-03-31		Jia et al		Jia,B., Xiao,Y., Wang,Y., Chen,L., Zhang,J., Ren,L., Wang,J.	
527	KU962523	KU962523.1	KU962523	2007-XX-XX	Asia	China			Homo sapiens	2019-03-31		Jia et al		Jia,B., Xiao,Y., Wang,Y., Chen,L., Zhang,J., Ren,L., Wang,J.	
528	KU962524	KU962524.1	KU962524	2007-XX-XX	Asia	China			Homo sapiens	2019-03-31		Jia et al		Jia,B., Xiao,Y., Wang,Y., Chen,L., Zhang,J., Ren,L., Wang,J.	
529	KU962525	KU962525.1	KU962525	2007-XX-XX	Asia	China			Homo sapiens	2019-03-31		Jia et al		Jia,B., Xiao,Y., Wang,Y., Chen,L., Zhang,J., Ren,L., Wang,J.	
530	KU962526	KU962526.1	KU962526	2007-XX-XX	Asia	China			Homo sapiens	2019-03-31		Jia et al		Jia,B., Xiao,Y., Wang,Y., Chen,L., Zhang,J., Ren,L., Wang,J.	
531	KU962527	KU962527.1	KU962527	2007-XX-XX	Asia	China			Homo sapiens	2019-03-31		Jia et al		Jia,B., Xiao,Y., Wang,Y., Chen,L., Zhang,J., Ren,L., Wang,J.	
532	KU962528	KU962528.1	KU962528	2007-XX-XX	Asia	China			Homo sapiens	2019-03-31		Jia et al		Jia,B., Xiao,Y., Wang,Y., Chen,L., Zhang,J., Ren,L., Wang,J.	
533	KU962529	KU962529.1	KU962529	2007-XX-XX	Asia	China			Homo sapiens	2019-03-31		Jia et al		Jia,B., Xiao,Y., Wang,Y., Chen,L., Zhang,J., Ren,L., Wang,J.	
534	KU962530	KU962530.1	KU962530	2007-XX-XX	Asia	China			Homo sapiens	2019-03-31		Jia et al		Jia,B., Xiao,Y., Wang,Y., Chen,L., Zhang,J., Ren,L., Wang,J.	
535	KU962531	KU962531.1	KU962531	2007-XX-XX	Asia	China			Homo sapiens	2019-03-31		Jia et al		Jia,B., Xiao,Y., Wang,Y., Chen,L., Zhang,J., Ren,L., Wang,J.	
536	KU962532	KU962532.1	KU962532	2007-XX-XX	Asia	China			Homo sapiens	2019-03-31		Jia et al		Jia,B., Xiao,Y., Wang,Y., Chen,L., Zhang,J., Ren,L., Wang,J.	
537	KU962538	KU962538.1	KU962538	2007-XX-XX	Asia	China			Homo sapiens	2019-03-31		Jia et al		Jia,B., Xiao,Y., Wang,Y., Chen,L., Zhang,J., Ren,L., Wang,J.	
538	KU962541	KU962541.1	KU962541	2007-XX-XX	Asia	China			Homo sapiens	2019-03-31		Jia et al		Jia,B., Xiao,Y., Wang,Y., Chen,L., Zhang,J., Ren,L., Wang,J.	
539	KU962551	KU962551.1	KU962551	2007-XX-XX	Asia	China			Homo sapiens	2019-03-31		Jia et al		Jia,B., Xiao,Y., Wang,Y., Chen,L., Zhang,J., Ren,L., Wang,J.	
540	KU962552	KU962552.1	KU962552	2007-XX-XX	Asia	China			Homo sapiens	2019-03-31		Jia et al		Jia,B., Xiao,Y., Wang,Y., Chen,L., Zhang,J., Ren,L., Wang,J.	
541	KU962553	KU962553.1	KU962553	2007-XX-XX	Asia	China			Homo sapiens	2019-03-31		Jia et al		Jia,B., Xiao,Y., Wang,Y., Chen,L., Zhang,J., Ren,L., Wang,J.	
542	KU962554	KU962554.1	KU962554	2007-XX-XX	Asia	China			Homo sapiens	2019-03-31		Jia et al		Jia,B., Xiao,Y., Wang,Y., Chen,L., Zhang,J., Ren,L., Wang,J.	
543	KU962555	KU962555.1	KU962555	2007-XX-XX	Asia	China			Homo sapiens	2019-03-31		Jia et al		Jia,B., Xiao,Y., Wang,Y., Chen,L., Zhang,J., Ren,L., Wang,J.	
544	KU962556	KU962556.1	KU962556	2007-XX-XX	Asia	China			Homo sapiens	2019-03-31		Jia et al		Jia,B., Xiao,Y., Wang,Y., Chen,L., Zhang,J., Ren,L., Wang,J.	
545	KU962558	KU962558.1	KU962558	2007-XX-XX	Asia	China			Homo sapiens	2019-03-31		Jia et al		Jia,B., Xiao,Y., Wang,Y., Chen,L., Zhang,J., Ren,L., Wang,J.	
546	KU962559	KU962559.1	KU962559	2007-XX-XX	Asia	China			Homo sapiens	2019-03-31		Jia et al		Jia,B., Xiao,Y., Wang,Y., Chen,L., Zhang,J., Ren,L., Wang,J.	
547	KU962563	KU962563.1	KU962563	2007-XX-XX	Asia	China			Homo sapiens	2019-03-31		Jia et al		Jia,B., Xiao,Y., Wang,Y., Chen,L., Zhang,J., Ren,L., Wang,J.	
548	KU962573	KU962573.1	KU962573	2007-XX-XX	Asia	China			Homo sapiens	2019-03-31		Jia et al		Jia,B., Xiao,Y., Wang,Y., Chen,L., Zhang,J., Ren,L., Wang,J.	
549	KU962574	KU962574.1	KU962574	2007-XX-XX	Asia	China			Homo sapiens	2019-03-31		Jia et al		Jia,B., Xiao,Y., Wang,Y., Chen,L., Zhang,J., Ren,L., Wang,J.	
550	KU962583	KU962583.1	KU962583	2007-XX-XX	Asia	China			Homo sapiens	2019-03-31		Jia et al		Jia,B., Xiao,Y., Wang,Y., Chen,L., Zhang,J., Ren,L., Wang,J.	
551	KU962584	KU962584.1	KU962584	2007-XX-XX	Asia	China			Homo sapiens	2019-03-31		Jia et al		Jia,B., Xiao,Y., Wang,Y., Chen,L., Zhang,J., Ren,L., Wang,J.	
552	KU962585	KU962585.1	KU962585	2007-XX-XX	Asia	China			Homo sapiens	2019-03-31		Jia et al		Jia,B., Xiao,Y., Wang,Y., Chen,L., Zhang,J., Ren,L., Wang,J.	
553	KU962589	KU962589.1	KU962589	2007-XX-XX	Asia	China			Homo sapiens	2019-03-31		Jia et al		Jia,B., Xiao,Y., Wang,Y., Chen,L., Zhang,J., Ren,L., Wang,J.	
554	KU962611	KU962611.1	KU962611	2007-XX-XX	Asia	China			Homo sapiens	2019-03-31		Jia et al		Jia,B., Xiao,Y., Wang,Y., Chen,L., Zhang,J., Ren,L., Wang,J.	
555	KU962621	KU962621.1	KU962621	2007-XX-XX	Asia	China			Homo sapiens	2019-03-31		Jia et al		Jia,B., Xiao,Y., Wang,Y., Chen,L., Zhang,J., Ren,L., Wang,J.	
556	KU962624	KU962624.1	KU962624	2007-XX-XX	Asia	China			Homo sapiens	2019-03-31		Jia et al		Jia,B., Xiao,Y., Wang,Y., Chen,L., Zhang,J., Ren,L., Wang,J.	
557	KU962632	KU962632.1	KU962632	2007-XX-XX	Asia	China			Homo sapiens	2019-03-31		Jia et al		Jia,B., Xiao,Y., Wang,Y., Chen,L., Zhang,J., Ren,L., Wang,J.	
558	KU962646	KU962646.1	KU962646	2007-XX-XX	Asia	China			Homo sapiens	2019-03-31		Jia et al		Jia,B., Xiao,Y., Wang,Y., Chen,L., Zhang,J., Ren,L., Wang,J.	
559	KU962650	KU962650.1	KU962650	2007-XX-XX	Asia	China			Homo sapiens	2019-03-31		Jia et al		Jia,B., Xiao,Y., Wang,Y., Chen,L., Zhang,J., Ren,L., Wang,J.	
560	KU962651	KU962651.1	KU962651	2007-XX-XX	Asia	China			Homo sapiens	2019-03-31		Jia et al		Jia,B., Xiao,Y., Wang,Y., Chen,L., Zhang,J., Ren,L., Wang,J.	
561	KU962660	KU962660.1	KU962660	2007-XX-XX	Asia	China			Homo sapiens	2019-03-31		Jia et al		Jia,B., Xiao,Y., Wang,Y., Chen,L., Zhang,J., Ren,L., Wang,J.	
562	KU962711	KU962711.1	KU962711	2007-XX-XX	Asia	China			Homo sapiens	2019-03-31		Jia et al		Jia,B., Xiao,Y., Wang,Y., Chen,L., Zhang,J., Ren,L., Wang,J.	
563	KU962712	KU962712.1	KU962712	2007-XX-XX	Asia	China			Homo sapiens	2019-03-31		Jia et al		Jia,B., Xiao,Y., Wang,Y., Chen,L., Zhang,J., Ren,L., Wang,J.	
564	KU962713	KU962713.1	KU962713	2007-XX-XX	Asia	China			Homo sapiens	2019-03-31		Jia et al		Jia,B., Xiao,Y., Wang,Y., Chen,L., Zhang,J., Ren,L., Wang,J.	
565	KU962715	KU962715.1	KU962715	2007-XX-XX	Asia	China			Homo sapiens	2019-03-31		Jia et al		Jia,B., Xiao,Y., Wang,Y., Chen,L., Zhang,J., Ren,L., Wang,J.	
566	KU962725	KU962725.1	KU962725	2007-XX-XX	Asia	China			Homo sapiens	2019-03-31		Jia et al		Jia,B., Xiao,Y., Wang,Y., Chen,L., Zhang,J., Ren,L., Wang,J.	
567	KU962730	KU962730.1	KU962730	2007-XX-XX	Asia	China			Homo sapiens	2019-03-31		Jia et al		Jia,B., Xiao,Y., Wang,Y., Chen,L., Zhang,J., Ren,L., Wang,J.	
568	KU962738	KU962738.1	KU962738	2007-XX-XX	Asia	China			Homo sapiens	2019-03-31		Jia et al		Jia,B., Xiao,Y., Wang,Y., Chen,L., Zhang,J., Ren,L., Wang,J.	
569	KU962739	KU962739.1	KU962739	2007-XX-XX	Asia	China			Homo sapiens	2019-03-31		Jia et al		Jia,B., Xiao,Y., Wang,Y., Chen,L., Zhang,J., Ren,L., Wang,J.	
570	KU962740	KU962740.1	KU962740	2007-XX-XX	Asia	China			Homo sapiens	2019-03-31		Jia et al		Jia,B., Xiao,Y., Wang,Y., Chen,L., Zhang,J., Ren,L., Wang,J.	
571	KU962741	KU962741.1	KU962741	2007-XX-XX	Asia	China			Homo sapiens	2019-03-31		Jia et al		Jia,B., Xiao,Y., Wang,Y., Chen,L., Zhang,J., Ren,L., Wang,J.	
572	KU962742	KU962742.1	KU962742	2007-XX-XX	Asia	China			Homo sapiens	2019-03-31		Jia et al		Jia,B., Xiao,Y., Wang,Y., Chen,L., Zhang,J., Ren,L., Wang,J.	
573	KU962743	KU962743.1	KU962743	2007-XX-XX	Asia	China			Homo sapiens	2019-03-31		Jia et al		Jia,B., Xiao,Y., Wang,Y., Chen,L., Zhang,J., Ren,L., Wang,J.	
574	KU962744	KU962744.1	KU962744	2007-XX-XX	Asia	China			Homo sapiens	2019-03-31		Jia et al		Jia,B., Xiao,Y., Wang,Y., Chen,L., Zhang,J., Ren,L., Wang,J.	
575	KU962745	KU962745.1	KU962745	2007-XX-XX	Asia	China			Homo sapiens	2019-03-31		Jia et al		Jia,B., Xiao,Y., Wang,Y., Chen,L., Zhang,J., Ren,L., Wang,J.	
576	KU962746	KU962746.1	KU962746	2007-XX-XX	Asia	China			Homo sapiens	2019-03-31		Jia et al		Jia,B., Xiao,Y., Wang,Y., Chen,L., Zhang,J., Ren,L., Wang,J.	
577	KU962747	KU962747.1	KU962747	2007-XX-XX	Asia	China			Homo sapiens	2019-03-31		Jia et al		Jia,B., Xiao,Y., Wang,Y., Chen,L., Zhang,J., Ren,L., Wang,J.	
578	KU962749	KU962749.1	KU962749	2007-XX-XX	Asia	China			Homo sapiens	2019-03-31		Jia et al		Jia,B., Xiao,Y., Wang,Y., Chen,L., Zhang,J., Ren,L., Wang,J.	
579	KU962750	KU962750.1	KU962750	2007-XX-XX	Asia	China			Homo sapiens	2019-03-31		Jia et al		Jia,B., Xiao,Y., Wang,Y., Chen,L., Zhang,J., Ren,L., Wang,J.	
580	KU962751	KU962751.1	KU962751	2007-XX-XX	Asia	China			Homo sapiens	2019-03-31		Jia et al		Jia,B., Xiao,Y., Wang,Y., Chen,L., Zhang,J., Ren,L., Wang,J.	
581	KU962752	KU962752.1	KU962752	2007-XX-XX	Asia	China			Homo sapiens	2019-03-31		Jia et al		Jia,B., Xiao,Y., Wang,Y., Chen,L., Zhang,J., Ren,L., Wang,J.	
582	KU962753	KU962753.1	KU962753	2007-XX-XX	Asia	China			Homo sapiens	2019-03-31		Jia et al		Jia,B., Xiao,Y., Wang,Y., Chen,L., Zhang,J., Ren,L., Wang,J.	
583	KU962754	KU962754.1	KU962754	2007-XX-XX	Asia	China			Homo sapiens	2019-03-31		Jia et al		Jia,B., Xiao,Y., Wang,Y., Chen,L., Zhang,J., Ren,L., Wang,J.	
584	KU962755	KU962755.1	KU962755	2007-XX-XX	Asia	China			Homo sapiens	2019-03-31		Jia et al		Jia,B., Xiao,Y., Wang,Y., Chen,L., Zhang,J., Ren,L., Wang,J.	
585	KU962756	KU962756.1	KU962756	2007-XX-XX	Asia	China			Homo sapiens	2019-03-31		Jia et al		Jia,B., Xiao,Y., Wang,Y., Chen,L., Zhang,J., Ren,L., Wang,J.	
586	KU962757	KU962757.1	KU962757	2007-XX-XX	Asia	China			Homo sapiens	2019-03-31		Jia et al		Jia,B., Xiao,Y., Wang,Y., Chen,L., Zhang,J., Ren,L., Wang,J.	
587	KU962758	KU962758.1	KU962758	2007-XX-XX	Asia	China			Homo sapiens	2019-03-31		Jia et al		Jia,B., Xiao,Y., Wang,Y., Chen,L., Zhang,J., Ren,L., Wang,J.	
588	KU962759	KU962759.1	KU962759	2007-XX-XX	Asia	China			Homo sapiens	2019-03-31		Jia et al		Jia,B., Xiao,Y., Wang,Y., Chen,L., Zhang,J., Ren,L., Wang,J.	
589	KU962760	KU962760.1	KU962760	2007-XX-XX	Asia	China			Homo sapiens	2019-03-31		Jia et al		Jia,B., Xiao,Y., Wang,Y., Chen,L., Zhang,J., Ren,L., Wang,J.	
590	KU962761	KU962761.1	KU962761	2007-XX-XX	Asia	China			Homo sapiens	2019-03-31		Jia et al		Jia,B., Xiao,Y., Wang,Y., Chen,L., Zhang,J., Ren,L., Wang,J.	
591	KU962762	KU962762.1	KU962762	2007-XX-XX	Asia	China			Homo sapiens	2019-03-31		Jia et al		Jia,B., Xiao,Y., Wang,Y., Chen,L., Zhang,J., Ren,L., Wang,J.	
592	KU962763	KU962763.1	KU962763	2007-XX-XX	Asia	China			Homo sapiens	2019-03-31		Jia et al		Jia,B., Xiao,Y., Wang,Y., Chen,L., Zhang,J., Ren,L., Wang,J.	
593	KU962764	KU962764.1	KU962764	2007-XX-XX	Asia	China			Homo sapiens	2019-03-31		Jia et al		Jia,B., Xiao,Y., Wang,Y., Chen,L., Zhang,J., Ren,L., Wang,J.	
594	KU962766	KU962766.1	KU962766	2007-XX-XX	Asia	China			Homo sapiens	2019-03-31		Jia et al		Jia,B., Xiao,Y., Wang,Y., Chen,L., Zhang,J., Ren,L., Wang,J.	
595	KU962768	KU962768.1	KU962768	2007-XX-XX	Asia	China			Homo sapiens	2019-03-31		Jia et al		Jia,B., Xiao,Y., Wang,Y., Chen,L., Zhang,J., Ren,L., Wang,J.	
596	KU962771	KU962771.1	KU962771	2007-XX-XX	Asia	China			Homo sapiens	2019-03-31		Jia et al		Jia,B., Xiao,Y., Wang,Y., Chen,L., Zhang,J., Ren,L., Wang,J.	
597	KU962776	KU962776.1	KU962776	2007-XX-XX	Asia	China			Homo sapiens	2019-03-31		Jia et al		Jia,B., Xiao,Y., Wang,Y., Chen,L., Zhang,J., Ren,L., Wang,J.	
598	KU962779	KU962779.1	KU962779	2007-XX-XX	Asia	China			Homo sapiens	2019-03-31		Jia et al		Jia,B., Xiao,Y., Wang,Y., Chen,L., Zhang,J., Ren,L., Wang,J.	
599	KU962782	KU962782.1	KU962782	2007-XX-XX	Asia	China			Homo sapiens	2019-03-31		Jia et al		Jia,B., Xiao,Y., Wang,Y., Chen,L., Zhang,J., Ren,L., Wang,J.	
600	KU962784	KU962784.1	KU962784	2007-XX-XX	Asia	China			Homo sapiens	2019-03-31		Jia et al		Jia,B., Xiao,Y., Wang,Y., Chen,L., Zhang,J., Ren,L., Wang,J.	
601	KU962787	KU962787.1	KU962787	2007-XX-XX	Asia	China			Homo sapiens	2019-03-31		Jia et al		Jia,B., Xiao,Y., Wang,Y., Chen,L., Zhang,J., Ren,L., Wang,J.	
602	KU962788	KU962788.1	KU962788	2007-XX-XX	Asia	China			Homo sapiens	2019-03-31		Jia et al		Jia,B., Xiao,Y., Wang,Y., Chen,L., Zhang,J., Ren,L., Wang,J.	
603	KU962789	KU962789.1	KU962789	2007-XX-XX	Asia	China			Homo sapiens	2019-03-31		Jia et al		Jia,B., Xiao,Y., Wang,Y., Chen,L., Zhang,J., Ren,L., Wang,J.	
604	KU962790	KU962790.1	KU962790	2007-XX-XX	Asia	China			Homo sapiens	2019-03-31		Jia et al		Jia,B., Xiao,Y., Wang,Y., Chen,L., Zhang,J., Ren,L., Wang,J.	
605	KU962792	KU962792.1	KU962792	2007-XX-XX	Asia	China			Homo sapiens	2019-03-31		Jia et al		Jia,B., Xiao,Y., Wang,Y., Chen,L., Zhang,J., Ren,L., Wang,J.	
606	KU962793	KU962793.1	KU962793	2007-XX-XX	Asia	China			Homo sapiens	2019-03-31		Jia et al		Jia,B., Xiao,Y., Wang,Y., Chen,L., Zhang,J., Ren,L., Wang,J.	
607	KU962794	KU962794.1	KU962794	2007-XX-XX	Asia	China			Homo sapiens	2019-03-31		Jia et al		Jia,B., Xiao,Y., Wang,Y., Chen,L., Zhang,J., Ren,L., Wang,J.	
608	KU962795	KU962795.1	KU962795	2007-XX-XX	Asia	China			Homo sapiens	2019-03-31		Jia et al		Jia,B., Xiao,Y., Wang,Y., Chen,L., Zhang,J., Ren,L., Wang,J.	
609	KU962796	KU962796.1	KU962796	2007-XX-XX	Asia	China			Homo sapiens	2019-03-31		Jia et al		Jia,B., Xiao,Y., Wang,Y., Chen,L., Zhang,J., Ren,L., Wang,J.	
610	KU962797	KU962797.1	KU962797	2007-XX-XX	Asia	China			Homo sapiens	2019-03-31		Jia et al		Jia,B., Xiao,Y., Wang,Y., Chen,L., Zhang,J., Ren,L., Wang,J.	
611	KU962807	KU962807.1	KU962807	2007-XX-XX	Asia	China			Homo sapiens	2019-03-31		Jia et al		Jia,B., Xiao,Y., Wang,Y., Chen,L., Zhang,J., Ren,L., Wang,J.	
612	KU962814	KU962814.1	KU962814	2007-XX-XX	Asia	China			Homo sapiens	2019-03-31		Jia et al		Jia,B., Xiao,Y., Wang,Y., Chen,L., Zhang,J., Ren,L., Wang,J.	
613	KU962898	KU962898.1	KU962898	2007-XX-XX	Asia	China			Homo sapiens	2019-03-31		Jia et al		Jia,B., Xiao,Y., Wang,Y., Chen,L., Zhang,J., Ren,L., Wang,J.	
614	KU962899	KU962899.1	KU962899	2007-XX-XX	Asia	China			Homo sapiens	2019-03-31		Jia et al		Jia,B., Xiao,Y., Wang,Y., Chen,L., Zhang,J., Ren,L., Wang,J.	
615	KU962900	KU962900.1	KU962900	2007-XX-XX	Asia	China			Homo sapiens	2019-03-31		Jia et al		Jia,B., Xiao,Y., Wang,Y., Chen,L., Zhang,J., Ren,L., Wang,J.	
616	KU962901	KU962901.1	KU962901	2007-XX-XX	Asia	China			Homo sapiens	2019-03-31		Jia et al		Jia,B., Xiao,Y., Wang,Y., Chen,L., Zhang,J., Ren,L., Wang,J.	
617	KU962902	KU962902.1	KU962902	2007-XX-XX	Asia	China			Homo sapiens	2019-03-31		Jia et al		Jia,B., Xiao,Y., Wang,Y., Chen,L., Zhang,J., Ren,L., Wang,J.	
618	KU962903	KU962903.1	KU962903	2007-XX-XX	Asia	China			Homo sapiens	2019-03-31		Jia et al		Jia,B., Xiao,Y., Wang,Y., Chen,L., Zhang,J., Ren,L., Wang,J.	
619	MF104649	MF104649.1	HR6010-07	2007-XX-XX	Europe	Croatia			Homo sapiens	2017-12-31		Jagusic et al		Jagusic,M., Slovic,A., Santak,M., Kosutic-Gulija,T., Ivancic-Jelecki,J., Forcic,D.	
620	MF104650	MF104650.1	HR2672-07	2007-XX-XX	Europe	Croatia			Homo sapiens	2017-12-31		Jagusic et al		Jagusic,M., Slovic,A., Santak,M., Kosutic-Gulija,T., Ivancic-Jelecki,J., Forcic,D.	
621	MF173104	MF173104.1	Bogota/2007/I8729	2007-XX-XX	South America	Colombia			Homo sapiens	2017-10-25		Avila et al		Avila,V., Calvo,E.P., Barbosa,J., Velandia-Romero,M.L., Castellanos,J.E.	
622	MF372390	MF372390.1	Caldas/2007/I8670	2007-XX-XX	South America	Colombia			Homo sapiens	2017-10-25		Avila et al		Avila,V., Calvo,E.P., Barbosa,J., Velandia-Romero,M.L., Castellanos,J.E.	
623	MF372392	MF372392.1	Caldas/2007/I8381	2007-XX-XX	South America	Colombia			Homo sapiens	2017-10-25		Avila et al		Avila,V., Calvo,E.P., Barbosa,J., Velandia-Romero,M.L., Castellanos,J.E.	
624	MF372395	MF372395.1	Bogota/2007/I8818	2007-XX-XX	South America	Colombia			Homo sapiens	2017-10-25		Avila et al		Avila,V., Calvo,E.P., Barbosa,J., Velandia-Romero,M.L., Castellanos,J.E.	
625	MF372398	MF372398.1	Bogota/2007/I8581	2007-XX-XX	South America	Colombia			Homo sapiens	2017-10-25		Avila et al		Avila,V., Calvo,E.P., Barbosa,J., Velandia-Romero,M.L., Castellanos,J.E.	
626	MF372400	MF372400.1	Bogota/2007/I9748	2007-XX-XX	South America	Colombia			Homo sapiens	2017-10-25		Avila et al		Avila,V., Calvo,E.P., Barbosa,J., Velandia-Romero,M.L., Castellanos,J.E.	
627	MF372403	MF372403.1	Bogota/2007/I8816	2007-XX-XX	South America	Colombia			Homo sapiens	2017-10-25		Avila et al		Avila,V., Calvo,E.P., Barbosa,J., Velandia-Romero,M.L., Castellanos,J.E.	
628	MF496389	MF496389.1	R96-01	2007-XX-XX	Asia	Taiwan			Homo sapiens	2017-08-30		Chi et al		Chi,H., Hsiao,K.-L., Weng,L.-C., Chiu,N.-C., Huang,L.-M., Chiu,Y.-Y., Liu,C.-P., Liu,H.-F.	
629	MF496390	MF496390.1	R96-06	2007-XX-XX	Asia	Taiwan			Homo sapiens	2017-08-30		Chi et al		Chi,H., Hsiao,K.-L., Weng,L.-C., Chiu,N.-C., Huang,L.-M., Chiu,Y.-Y., Liu,C.-P., Liu,H.-F.	
630	MF496391	MF496391.1	R96-07	2007-XX-XX	Asia	Taiwan			Homo sapiens	2017-08-30		Chi et al		Chi,H., Hsiao,K.-L., Weng,L.-C., Chiu,N.-C., Huang,L.-M., Chiu,Y.-Y., Liu,C.-P., Liu,H.-F.	
631	MF496392	MF496392.1	R96-09	2007-XX-XX	Asia	Taiwan			Homo sapiens	2017-08-30		Chi et al		Chi,H., Hsiao,K.-L., Weng,L.-C., Chiu,N.-C., Huang,L.-M., Chiu,Y.-Y., Liu,C.-P., Liu,H.-F.	
632	MF496393	MF496393.1	R96-12	2007-XX-XX	Asia	Taiwan			Homo sapiens	2017-08-30		Chi et al		Chi,H., Hsiao,K.-L., Weng,L.-C., Chiu,N.-C., Huang,L.-M., Chiu,Y.-Y., Liu,C.-P., Liu,H.-F.	
633	MF496394	MF496394.1	R96-16	2007-XX-XX	Asia	Taiwan			Homo sapiens	2017-08-30		Chi et al		Chi,H., Hsiao,K.-L., Weng,L.-C., Chiu,N.-C., Huang,L.-M., Chiu,Y.-Y., Liu,C.-P., Liu,H.-F.	
634	MF496395	MF496395.1	R96-20	2007-XX-XX	Asia	Taiwan			Homo sapiens	2017-08-30		Chi et al		Chi,H., Hsiao,K.-L., Weng,L.-C., Chiu,N.-C., Huang,L.-M., Chiu,Y.-Y., Liu,C.-P., Liu,H.-F.	
635	OK649663	OK649663.1	OK649663	2007-XX-XX	Africa	Kenya			Homo sapiens	2021-11-07		Wang et al		Wang,L., Ng,T.F.F., Castro,C.J., Marine,R.L., Magana,L.C., Esona,M., Peret,T.C.T., Thornburg,N.J.	
636	OK649664	OK649664.1	OK649664	2007-XX-XX	Africa	Kenya			Homo sapiens	2021-11-07		Wang et al		Wang,L., Ng,T.F.F., Castro,C.J., Marine,R.L., Magana,L.C., Esona,M., Peret,T.C.T., Thornburg,N.J.	
637	OK649665	OK649665.1	OK649665	2007-XX-XX	Africa	Kenya			Homo sapiens	2021-11-07		Wang et al		Wang,L., Ng,T.F.F., Castro,C.J., Marine,R.L., Magana,L.C., Esona,M., Peret,T.C.T., Thornburg,N.J.	
638	OK649666	OK649666.1	OK649666	2007-XX-XX	Africa	Kenya			Homo sapiens	2021-11-07		Wang et al		Wang,L., Ng,T.F.F., Castro,C.J., Marine,R.L., Magana,L.C., Esona,M., Peret,T.C.T., Thornburg,N.J.	
639	OK649667	OK649667.1	OK649667	2007-XX-XX	Africa	Kenya			Homo sapiens	2021-11-07		Wang et al		Wang,L., Ng,T.F.F., Castro,C.J., Marine,R.L., Magana,L.C., Esona,M., Peret,T.C.T., Thornburg,N.J.	
640	OM962823	OM962823.1	MetroManila.PHL/2007/053	2007-XX-XX	Asia	Philippines			Homo sapiens	2022-06-29		Calaor-Morin et al		Calaor-Morin,J., Arguelles,V.L., Foronda,J.L., Tan,A., Lagamayo,E., Dapat,C., Lupisan,S., Morin,J.C., Foronda,J.L.M.	
641	OM962830	OM962830.1	MetroManila.PHL/2007/057	2007-XX-XX	Asia	Philippines			Homo sapiens	2022-06-29		Calaor-Morin et al		Calaor-Morin,J., Arguelles,V.L., Foronda,J.L., Tan,A., Lagamayo,E., Dapat,C., Lupisan,S., Morin,J.C., Foronda,J.L.M.	
642	KT765528	KT765528.1	KEN/Kilifi/650_03/01/2007	2007-01-03	Africa	Kenya			Homo sapiens	2016-02-27		Otieno et al		Otieno,J.R., Agoti,C.N., Gitahi,C.W., Bett,A., Ngama,M., Medley,G.F., Cane,P.A., Nokes,D.J., Nokes,J.D.	
643	KT765346	KT765346.1	KEN/Kilifi/648_04/01/2007	2007-01-04	Africa	Kenya			Homo sapiens	2016-02-27		Otieno et al		Otieno,J.R., Agoti,C.N., Gitahi,C.W., Bett,A., Ngama,M., Medley,G.F., Cane,P.A., Nokes,D.J., Nokes,J.D.	
644	KT765686	KT765686.1	KEN/Kilifi/651_04/01/2007	2007-01-04	Africa	Kenya			Homo sapiens	2016-02-27		Otieno et al		Otieno,J.R., Agoti,C.N., Gitahi,C.W., Bett,A., Ngama,M., Medley,G.F., Cane,P.A., Nokes,D.J., Nokes,J.D.	
645	KT765689	KT765689.1	KEN/Kilifi/649_04/01/2007	2007-01-04	Africa	Kenya			Homo sapiens	2016-02-27		Otieno et al		Otieno,J.R., Agoti,C.N., Gitahi,C.W., Bett,A., Ngama,M., Medley,G.F., Cane,P.A., Nokes,D.J., Nokes,J.D.	
646	KT765356	KT765356.1	KEN/Kilifi/653_05/01/2007	2007-01-05	Africa	Kenya			Homo sapiens	2016-02-27		Otieno et al		Otieno,J.R., Agoti,C.N., Gitahi,C.W., Bett,A., Ngama,M., Medley,G.F., Cane,P.A., Nokes,D.J., Nokes,J.D.	
647	KT765384	KT765384.1	KEN/Kilifi/652_05/01/2007	2007-01-05	Africa	Kenya			Homo sapiens	2016-02-27		Otieno et al		Otieno,J.R., Agoti,C.N., Gitahi,C.W., Bett,A., Ngama,M., Medley,G.F., Cane,P.A., Nokes,D.J., Nokes,J.D.	
648	KT765355	KT765355.1	KEN/Kilifi/654_07/01/2007	2007-01-07	Africa	Kenya			Homo sapiens	2016-02-27		Otieno et al		Otieno,J.R., Agoti,C.N., Gitahi,C.W., Bett,A., Ngama,M., Medley,G.F., Cane,P.A., Nokes,D.J., Nokes,J.D.	
649	KT765779	KT765779.1	KEN/Kilifi/655_07/01/2007	2007-01-07	Africa	Kenya			Homo sapiens	2016-02-27		Otieno et al		Otieno,J.R., Agoti,C.N., Gitahi,C.W., Bett,A., Ngama,M., Medley,G.F., Cane,P.A., Nokes,D.J., Nokes,J.D.	
650	KT765371	KT765371.1	KEN/Kilifi/656_09/01/2007	2007-01-09	Africa	Kenya			Homo sapiens	2016-02-27		Otieno et al		Otieno,J.R., Agoti,C.N., Gitahi,C.W., Bett,A., Ngama,M., Medley,G.F., Cane,P.A., Nokes,D.J., Nokes,J.D.	
651	KT765826	KT765826.1	KEN/Kilifi/657_11/01/2007	2007-01-11	Africa	Kenya			Homo sapiens	2016-02-27		Otieno et al		Otieno,J.R., Agoti,C.N., Gitahi,C.W., Bett,A., Ngama,M., Medley,G.F., Cane,P.A., Nokes,D.J., Nokes,J.D.	
652	KT765345	KT765345.1	KEN/Kilifi/660_13/01/2007	2007-01-13	Africa	Kenya			Homo sapiens	2016-02-27		Otieno et al		Otieno,J.R., Agoti,C.N., Gitahi,C.W., Bett,A., Ngama,M., Medley,G.F., Cane,P.A., Nokes,D.J., Nokes,J.D.	
653	KT765357	KT765357.1	KEN/Kilifi/658_13/01/2007	2007-01-13	Africa	Kenya			Homo sapiens	2016-02-27		Otieno et al		Otieno,J.R., Agoti,C.N., Gitahi,C.W., Bett,A., Ngama,M., Medley,G.F., Cane,P.A., Nokes,D.J., Nokes,J.D.	
654	KT765363	KT765363.1	KEN/Kilifi/659_13/01/2007	2007-01-13	Africa	Kenya			Homo sapiens	2016-02-27		Otieno et al		Otieno,J.R., Agoti,C.N., Gitahi,C.W., Bett,A., Ngama,M., Medley,G.F., Cane,P.A., Nokes,D.J., Nokes,J.D.	
655	KT765362	KT765362.1	KEN/Kilifi/661_14/01/2007	2007-01-14	Africa	Kenya			Homo sapiens	2016-02-27		Otieno et al		Otieno,J.R., Agoti,C.N., Gitahi,C.W., Bett,A., Ngama,M., Medley,G.F., Cane,P.A., Nokes,D.J., Nokes,J.D.	
656	KT765825	KT765825.1	KEN/Kilifi/662_15/01/2007	2007-01-15	Africa	Kenya			Homo sapiens	2016-02-27		Otieno et al		Otieno,J.R., Agoti,C.N., Gitahi,C.W., Bett,A., Ngama,M., Medley,G.F., Cane,P.A., Nokes,D.J., Nokes,J.D.	
657	KT765374	KT765374.1	KEN/Kilifi/664_16/01/2007	2007-01-16	Africa	Kenya			Homo sapiens	2016-02-27		Otieno et al		Otieno,J.R., Agoti,C.N., Gitahi,C.W., Bett,A., Ngama,M., Medley,G.F., Cane,P.A., Nokes,D.J., Nokes,J.D.	
658	KT765377	KT765377.1	KEN/Kilifi/663_16/01/2007	2007-01-16	Africa	Kenya			Homo sapiens	2016-02-27		Otieno et al		Otieno,J.R., Agoti,C.N., Gitahi,C.W., Bett,A., Ngama,M., Medley,G.F., Cane,P.A., Nokes,D.J., Nokes,J.D.	
659	KT765348	KT765348.1	KEN/Kilifi/665_17/01/2007	2007-01-17	Africa	Kenya			Homo sapiens	2016-02-27		Otieno et al		Otieno,J.R., Agoti,C.N., Gitahi,C.W., Bett,A., Ngama,M., Medley,G.F., Cane,P.A., Nokes,D.J., Nokes,J.D.	
660	KT765359	KT765359.1	KEN/Kilifi/667_18/01/2007	2007-01-18	Africa	Kenya			Homo sapiens	2016-02-27		Otieno et al		Otieno,J.R., Agoti,C.N., Gitahi,C.W., Bett,A., Ngama,M., Medley,G.F., Cane,P.A., Nokes,D.J., Nokes,J.D.	
661	KT765361	KT765361.1	KEN/Kilifi/666_18/01/2007	2007-01-18	Africa	Kenya			Homo sapiens	2016-02-27		Otieno et al		Otieno,J.R., Agoti,C.N., Gitahi,C.W., Bett,A., Ngama,M., Medley,G.F., Cane,P.A., Nokes,D.J., Nokes,J.D.	
662	KT765529	KT765529.1	KEN/Kilifi/669_19/01/2007	2007-01-19	Africa	Kenya			Homo sapiens	2016-02-27		Otieno et al		Otieno,J.R., Agoti,C.N., Gitahi,C.W., Bett,A., Ngama,M., Medley,G.F., Cane,P.A., Nokes,D.J., Nokes,J.D.	
663	KT765716	KT765716.1	KEN/Kilifi/668_19/01/2007	2007-01-19	Africa	Kenya			Homo sapiens	2016-02-27		Otieno et al		Otieno,J.R., Agoti,C.N., Gitahi,C.W., Bett,A., Ngama,M., Medley,G.F., Cane,P.A., Nokes,D.J., Nokes,J.D.	
664	KT765766	KT765766.1	KEN/Kilifi/670_26/01/2007	2007-01-26	Africa	Kenya			Homo sapiens	2016-02-27		Otieno et al		Otieno,J.R., Agoti,C.N., Gitahi,C.W., Bett,A., Ngama,M., Medley,G.F., Cane,P.A., Nokes,D.J., Nokes,J.D.	
665	KT765364	KT765364.1	KEN/Kilifi/672_29/01/2007	2007-01-29	Africa	Kenya			Homo sapiens	2016-02-27		Otieno et al		Otieno,J.R., Agoti,C.N., Gitahi,C.W., Bett,A., Ngama,M., Medley,G.F., Cane,P.A., Nokes,D.J., Nokes,J.D.	
666	KT765767	KT765767.1	KEN/Kilifi/671_29/01/2007	2007-01-29	Africa	Kenya			Homo sapiens	2016-02-27		Otieno et al		Otieno,J.R., Agoti,C.N., Gitahi,C.W., Bett,A., Ngama,M., Medley,G.F., Cane,P.A., Nokes,D.J., Nokes,J.D.	
667	KT765827	KT765827.1	KEN/Kilifi/673_29/01/2007	2007-01-29	Africa	Kenya			Homo sapiens	2016-02-27		Otieno et al		Otieno,J.R., Agoti,C.N., Gitahi,C.W., Bett,A., Ngama,M., Medley,G.F., Cane,P.A., Nokes,D.J., Nokes,J.D.	
668	KT765350	KT765350.1	KEN/Kilifi/674_30/01/2007	2007-01-30	Africa	Kenya			Homo sapiens	2016-02-27		Otieno et al		Otieno,J.R., Agoti,C.N., Gitahi,C.W., Bett,A., Ngama,M., Medley,G.F., Cane,P.A., Nokes,D.J., Nokes,J.D.	
669	KT765819	KT765819.1	KEN/Kilifi/675_30/01/2007	2007-01-30	Africa	Kenya			Homo sapiens	2016-02-27		Otieno et al		Otieno,J.R., Agoti,C.N., Gitahi,C.W., Bett,A., Ngama,M., Medley,G.F., Cane,P.A., Nokes,D.J., Nokes,J.D.	
670	KT765372	KT765372.1	KEN/Kilifi/676_31/01/2007	2007-01-31	Africa	Kenya			Homo sapiens	2016-02-27		Otieno et al		Otieno,J.R., Agoti,C.N., Gitahi,C.W., Bett,A., Ngama,M., Medley,G.F., Cane,P.A., Nokes,D.J., Nokes,J.D.	
671	FR681614	FR681614.1	FR681614	2007-02-XX	Europe	France	Normandie			2010-09-07		Bellot et al		Bellot,A., Leroux,M., Vabret,A., Freymuth,F., Dina,J.	
672	FR681615	FR681615.1	FR681615	2007-02-XX	Europe	France	Normandie			2010-09-07		Bellot et al		Bellot,A., Leroux,M., Vabret,A., Freymuth,F., Dina,J.	
673	FR681616	FR681616.1	FR681616	2007-02-XX	Europe	France	Normandie			2010-09-07		Bellot et al		Bellot,A., Leroux,M., Vabret,A., Freymuth,F., Dina,J.	
674	FR681646	FR681646.1	FR681646	2007-02-XX	Europe	France	Normandie			2010-09-07		Bellot et al		Bellot,A., Leroux,M., Vabret,A., Freymuth,F., Dina,J.	
675	FR681650	FR681650.1	FR681650	2007-02-XX	Europe	France	Normandie			2010-09-07		Bellot et al		Bellot,A., Leroux,M., Vabret,A., Freymuth,F., Dina,J.	
676	FR681651	FR681651.1	FR681651	2007-02-XX	Europe	France	Normandie			2010-09-07		Bellot et al		Bellot,A., Leroux,M., Vabret,A., Freymuth,F., Dina,J.	
677	FR681674	FR681674.1	FR681674	2007-02-XX	Europe	France	Normandie			2010-09-07		Bellot et al		Bellot,A., Leroux,M., Vabret,A., Freymuth,F., Dina,J.	
678	FR681675	FR681675.1	FR681675	2007-02-XX	Europe	France	Normandie			2010-09-07		Bellot et al		Bellot,A., Leroux,M., Vabret,A., Freymuth,F., Dina,J.	
679	FR681695	FR681695.1	FR681695	2007-02-XX	Europe	France	Normandie			2010-09-07		Bellot et al		Bellot,A., Leroux,M., Vabret,A., Freymuth,F., Dina,J.	
680	FR681696	FR681696.1	FR681696	2007-02-XX	Europe	France	Normandie			2010-09-07		Bellot et al		Bellot,A., Leroux,M., Vabret,A., Freymuth,F., Dina,J.	
681	FR681697	FR681697.1	FR681697	2007-02-XX	Europe	France	Normandie			2010-09-07		Bellot et al		Bellot,A., Leroux,M., Vabret,A., Freymuth,F., Dina,J.	
682	KT765353	KT765353.1	KEN/Kilifi/681_01/02/2007	2007-02-01	Africa	Kenya			Homo sapiens	2016-02-27		Otieno et al		Otieno,J.R., Agoti,C.N., Gitahi,C.W., Bett,A., Ngama,M., Medley,G.F., Cane,P.A., Nokes,D.J., Nokes,J.D.	
683	KT765385	KT765385.1	KEN/Kilifi/680_01/02/2007	2007-02-01	Africa	Kenya			Homo sapiens	2016-02-27		Otieno et al		Otieno,J.R., Agoti,C.N., Gitahi,C.W., Bett,A., Ngama,M., Medley,G.F., Cane,P.A., Nokes,D.J., Nokes,J.D.	
684	KT765772	KT765772.1	KEN/Kilifi/677_01/02/2007	2007-02-01	Africa	Kenya			Homo sapiens	2016-02-27		Otieno et al		Otieno,J.R., Agoti,C.N., Gitahi,C.W., Bett,A., Ngama,M., Medley,G.F., Cane,P.A., Nokes,D.J., Nokes,J.D.	
685	KT765774	KT765774.1	KEN/Kilifi/679_01/02/2007	2007-02-01	Africa	Kenya			Homo sapiens	2016-02-27		Otieno et al		Otieno,J.R., Agoti,C.N., Gitahi,C.W., Bett,A., Ngama,M., Medley,G.F., Cane,P.A., Nokes,D.J., Nokes,J.D.	
686	KT765820	KT765820.1	KEN/Kilifi/678_01/02/2007	2007-02-01	Africa	Kenya			Homo sapiens	2016-02-27		Otieno et al		Otieno,J.R., Agoti,C.N., Gitahi,C.W., Bett,A., Ngama,M., Medley,G.F., Cane,P.A., Nokes,D.J., Nokes,J.D.	
687	JN968319	JN968319.1	V07-2207622	2007-02-02	Asia	Hong Kong			Homo sapiens	2012-01-10		Mak et al		Mak,G.C., Lau,C.S., Chiu,D.M.Y., Lim,W.	
688	KT765378	KT765378.1	KEN/Kilifi/683_04/02/2007	2007-02-04	Africa	Kenya			Homo sapiens	2016-02-27		Otieno et al		Otieno,J.R., Agoti,C.N., Gitahi,C.W., Bett,A., Ngama,M., Medley,G.F., Cane,P.A., Nokes,D.J., Nokes,J.D.	
689	KT765822	KT765822.1	KEN/Kilifi/682_04/02/2007	2007-02-04	Africa	Kenya			Homo sapiens	2016-02-27		Otieno et al		Otieno,J.R., Agoti,C.N., Gitahi,C.W., Bett,A., Ngama,M., Medley,G.F., Cane,P.A., Nokes,D.J., Nokes,J.D.	
690	KT765349	KT765349.1	KEN/Kilifi/685_07/02/2007	2007-02-07	Africa	Kenya			Homo sapiens	2016-02-27		Otieno et al		Otieno,J.R., Agoti,C.N., Gitahi,C.W., Bett,A., Ngama,M., Medley,G.F., Cane,P.A., Nokes,D.J., Nokes,J.D.	
691	KT765756	KT765756.1	KEN/Kilifi/684_07/02/2007	2007-02-07	Africa	Kenya			Homo sapiens	2016-02-27		Otieno et al		Otieno,J.R., Agoti,C.N., Gitahi,C.W., Bett,A., Ngama,M., Medley,G.F., Cane,P.A., Nokes,D.J., Nokes,J.D.	
692	KT765351	KT765351.1	KEN/Kilifi/686_08/02/2007	2007-02-08	Africa	Kenya			Homo sapiens	2016-02-27		Otieno et al		Otieno,J.R., Agoti,C.N., Gitahi,C.W., Bett,A., Ngama,M., Medley,G.F., Cane,P.A., Nokes,D.J., Nokes,J.D.	
693	KT765824	KT765824.1	KEN/Kilifi/687_08/02/2007	2007-02-08	Africa	Kenya			Homo sapiens	2016-02-27		Otieno et al		Otieno,J.R., Agoti,C.N., Gitahi,C.W., Bett,A., Ngama,M., Medley,G.F., Cane,P.A., Nokes,D.J., Nokes,J.D.	
694	KT765381	KT765381.1	KEN/Kilifi/688_09/02/2007	2007-02-09	Africa	Kenya			Homo sapiens	2016-02-27		Otieno et al		Otieno,J.R., Agoti,C.N., Gitahi,C.W., Bett,A., Ngama,M., Medley,G.F., Cane,P.A., Nokes,D.J., Nokes,J.D.	
695	KT765375	KT765375.1	KEN/Kilifi/689_13/02/2007	2007-02-13	Africa	Kenya			Homo sapiens	2016-02-27		Otieno et al		Otieno,J.R., Agoti,C.N., Gitahi,C.W., Bett,A., Ngama,M., Medley,G.F., Cane,P.A., Nokes,D.J., Nokes,J.D.	
696	KT765341	KT765341.1	KEN/Kilifi/690_15/02/2007	2007-02-15	Africa	Kenya			Homo sapiens	2016-02-27		Otieno et al		Otieno,J.R., Agoti,C.N., Gitahi,C.W., Bett,A., Ngama,M., Medley,G.F., Cane,P.A., Nokes,D.J., Nokes,J.D.	
697	KT765343	KT765343.1	KEN/Kilifi/691_17/02/2007	2007-02-17	Africa	Kenya			Homo sapiens	2016-02-27		Otieno et al		Otieno,J.R., Agoti,C.N., Gitahi,C.W., Bett,A., Ngama,M., Medley,G.F., Cane,P.A., Nokes,D.J., Nokes,J.D.	
698	KT765365	KT765365.1	KEN/Kilifi/693_18/02/2007	2007-02-18	Africa	Kenya			Homo sapiens	2016-02-27		Otieno et al		Otieno,J.R., Agoti,C.N., Gitahi,C.W., Bett,A., Ngama,M., Medley,G.F., Cane,P.A., Nokes,D.J., Nokes,J.D.	
699	KT765775	KT765775.1	KEN/Kilifi/692_18/02/2007	2007-02-18	Africa	Kenya			Homo sapiens	2016-02-27		Otieno et al		Otieno,J.R., Agoti,C.N., Gitahi,C.W., Bett,A., Ngama,M., Medley,G.F., Cane,P.A., Nokes,D.J., Nokes,J.D.	
700	KT765354	KT765354.1	KEN/Kilifi/694_19/02/2007	2007-02-19	Africa	Kenya			Homo sapiens	2016-02-27		Otieno et al		Otieno,J.R., Agoti,C.N., Gitahi,C.W., Bett,A., Ngama,M., Medley,G.F., Cane,P.A., Nokes,D.J., Nokes,J.D.	
701	KT765366	KT765366.1	KEN/Kilifi/697_20/02/2007	2007-02-20	Africa	Kenya			Homo sapiens	2016-02-27		Otieno et al		Otieno,J.R., Agoti,C.N., Gitahi,C.W., Bett,A., Ngama,M., Medley,G.F., Cane,P.A., Nokes,D.J., Nokes,J.D.	
702	KT765368	KT765368.1	KEN/Kilifi/696_20/02/2007	2007-02-20	Africa	Kenya			Homo sapiens	2016-02-27		Otieno et al		Otieno,J.R., Agoti,C.N., Gitahi,C.W., Bett,A., Ngama,M., Medley,G.F., Cane,P.A., Nokes,D.J., Nokes,J.D.	
703	KT765526	KT765526.1	KEN/Kilifi/695_20/02/2007	2007-02-20	Africa	Kenya			Homo sapiens	2016-02-27		Otieno et al		Otieno,J.R., Agoti,C.N., Gitahi,C.W., Bett,A., Ngama,M., Medley,G.F., Cane,P.A., Nokes,D.J., Nokes,J.D.	
704	KT765370	KT765370.1	KEN/Kilifi/698_22/02/2007	2007-02-22	Africa	Kenya			Homo sapiens	2016-02-27		Otieno et al		Otieno,J.R., Agoti,C.N., Gitahi,C.W., Bett,A., Ngama,M., Medley,G.F., Cane,P.A., Nokes,D.J., Nokes,J.D.	
705	KT765821	KT765821.1	KEN/Kilifi/699_24/02/2007	2007-02-24	Africa	Kenya			Homo sapiens	2016-02-27		Otieno et al		Otieno,J.R., Agoti,C.N., Gitahi,C.W., Bett,A., Ngama,M., Medley,G.F., Cane,P.A., Nokes,D.J., Nokes,J.D.	
706	KT765828	KT765828.1	KEN/Kilifi/700_24/02/2007	2007-02-24	Africa	Kenya			Homo sapiens	2016-02-27		Otieno et al		Otieno,J.R., Agoti,C.N., Gitahi,C.W., Bett,A., Ngama,M., Medley,G.F., Cane,P.A., Nokes,D.J., Nokes,J.D.	
707	KT765373	KT765373.1	KEN/Kilifi/701_25/02/2007	2007-02-25	Africa	Kenya			Homo sapiens	2016-02-27		Otieno et al		Otieno,J.R., Agoti,C.N., Gitahi,C.W., Bett,A., Ngama,M., Medley,G.F., Cane,P.A., Nokes,D.J., Nokes,J.D.	
708	KT765376	KT765376.1	KEN/Kilifi/702_28/02/2007	2007-02-28	Africa	Kenya			Homo sapiens	2016-02-27		Otieno et al		Otieno,J.R., Agoti,C.N., Gitahi,C.W., Bett,A., Ngama,M., Medley,G.F., Cane,P.A., Nokes,D.J., Nokes,J.D.	
709	FR681617	FR681617.1	FR681617	2007-03-XX	Europe	France	Normandie			2010-09-07		Bellot et al		Bellot,A., Leroux,M., Vabret,A., Freymuth,F., Dina,J.	
710	FR681647	FR681647.1	FR681647	2007-03-XX	Europe	France	Normandie			2010-09-07		Bellot et al		Bellot,A., Leroux,M., Vabret,A., Freymuth,F., Dina,J.	
711	FR681676	FR681676.1	FR681676	2007-03-XX	Europe	France	Normandie			2010-09-07		Bellot et al		Bellot,A., Leroux,M., Vabret,A., Freymuth,F., Dina,J.	
712	FR681698	FR681698.1	FR681698	2007-03-XX	Europe	France	Normandie			2010-09-07		Bellot et al		Bellot,A., Leroux,M., Vabret,A., Freymuth,F., Dina,J.	
713	KT765342	KT765342.1	KEN/Kilifi/703_01/03/2007	2007-03-01	Africa	Kenya			Homo sapiens	2016-02-27		Otieno et al		Otieno,J.R., Agoti,C.N., Gitahi,C.W., Bett,A., Ngama,M., Medley,G.F., Cane,P.A., Nokes,D.J., Nokes,J.D.	
714	KT765380	KT765380.1	KEN/Kilifi/643_02/03/2007	2007-03-02	Africa	Kenya			Homo sapiens	2016-02-27		Otieno et al		Otieno,J.R., Agoti,C.N., Gitahi,C.W., Bett,A., Ngama,M., Medley,G.F., Cane,P.A., Nokes,D.J., Nokes,J.D.	
715	KT765360	KT765360.1	KEN/Kilifi/704_05/03/2007	2007-03-05	Africa	Kenya			Homo sapiens	2016-02-27		Otieno et al		Otieno,J.R., Agoti,C.N., Gitahi,C.W., Bett,A., Ngama,M., Medley,G.F., Cane,P.A., Nokes,D.J., Nokes,J.D.	
716	KT765715	KT765715.1	KEN/Kilifi/705_19/03/2007	2007-03-19	Africa	Kenya			Homo sapiens	2016-02-27		Otieno et al		Otieno,J.R., Agoti,C.N., Gitahi,C.W., Bett,A., Ngama,M., Medley,G.F., Cane,P.A., Nokes,D.J., Nokes,J.D.	
717	KT765344	KT765344.1	KEN/Kilifi/706_20/03/2007	2007-03-20	Africa	Kenya			Homo sapiens	2016-02-27		Otieno et al		Otieno,J.R., Agoti,C.N., Gitahi,C.W., Bett,A., Ngama,M., Medley,G.F., Cane,P.A., Nokes,D.J., Nokes,J.D.	
718	OK458616	OK458616.1	OK458616	2007-03-22	Africa	Kenya			Homo sapiens	2021-12-13		Wangui et al		Wangui,J.M., Nokes,J.D., Opot,B.H., Opanda,S.M., Agoti,C.N., Otieno,J.R., Bulimo,W.D.	
719	KT765770	KT765770.1	KEN/Kilifi/707_23/03/2007	2007-03-23	Africa	Kenya			Homo sapiens	2016-02-27		Otieno et al		Otieno,J.R., Agoti,C.N., Gitahi,C.W., Bett,A., Ngama,M., Medley,G.F., Cane,P.A., Nokes,D.J., Nokes,J.D.	
720	KT765525	KT765525.1	KEN/Kilifi/708_24/03/2007	2007-03-24	Africa	Kenya			Homo sapiens	2016-02-27		Otieno et al		Otieno,J.R., Agoti,C.N., Gitahi,C.W., Bett,A., Ngama,M., Medley,G.F., Cane,P.A., Nokes,D.J., Nokes,J.D.	
721	KT765352	KT765352.1	KEN/Kilifi/709_25/03/2007	2007-03-25	Africa	Kenya			Homo sapiens	2016-02-27		Otieno et al		Otieno,J.R., Agoti,C.N., Gitahi,C.W., Bett,A., Ngama,M., Medley,G.F., Cane,P.A., Nokes,D.J., Nokes,J.D.	
722	KT765727	KT765727.1	KEN/Kilifi/710_25/03/2007	2007-03-25	Africa	Kenya			Homo sapiens	2016-02-27		Otieno et al		Otieno,J.R., Agoti,C.N., Gitahi,C.W., Bett,A., Ngama,M., Medley,G.F., Cane,P.A., Nokes,D.J., Nokes,J.D.	
723	JN968320	JN968320.1	V07-2221632	2007-04-06	Asia	Hong Kong			Homo sapiens	2012-01-10		Mak et al		Mak,G.C., Lau,C.S., Chiu,D.M.Y., Lim,W.	
724	KT765358	KT765358.1	KEN/Kilifi/711_09/04/2007	2007-04-09	Africa	Kenya			Homo sapiens	2016-02-27		Otieno et al		Otieno,J.R., Agoti,C.N., Gitahi,C.W., Bett,A., Ngama,M., Medley,G.F., Cane,P.A., Nokes,D.J., Nokes,J.D.	
725	OK458605	OK458605.1	OK458605	2007-04-10	Africa	Kenya			Homo sapiens	2021-12-13		Wangui et al		Wangui,J.M., Nokes,J.D., Opot,B.H., Opanda,S.M., Agoti,C.N., Otieno,J.R., Bulimo,W.D.	
726	KT765379	KT765379.1	KEN/Kilifi/712_23/04/2007	2007-04-23	Africa	Kenya			Homo sapiens	2016-02-27		Otieno et al		Otieno,J.R., Agoti,C.N., Gitahi,C.W., Bett,A., Ngama,M., Medley,G.F., Cane,P.A., Nokes,D.J., Nokes,J.D.	
727	KT765382	KT765382.1	KEN/Kilifi/713_24/04/2007	2007-04-24	Africa	Kenya			Homo sapiens	2016-02-27		Otieno et al		Otieno,J.R., Agoti,C.N., Gitahi,C.W., Bett,A., Ngama,M., Medley,G.F., Cane,P.A., Nokes,D.J., Nokes,J.D.	
728	OK458671	OK458671.1	OK458671	2007-05-01	Africa	Kenya			Homo sapiens	2021-12-13		Wangui et al		Wangui,J.M., Nokes,J.D., Opot,B.H., Opanda,S.M., Agoti,C.N., Otieno,J.R., Bulimo,W.D.	
729	JN968298	JN968298.1	V07-2229208	2007-05-13	Asia	Hong Kong			Homo sapiens	2012-01-10		Mak et al		Mak,G.C., Lau,C.S., Chiu,D.M.Y., Lim,W.	
730	OK458617	OK458617.1	OK458617	2007-05-22	Africa	Kenya			Homo sapiens	2021-12-13		Wangui et al		Wangui,J.M., Nokes,J.D., Opot,B.H., Opanda,S.M., Agoti,C.N., Otieno,J.R., Bulimo,W.D.	
731	OK458575	OK458575.1	OK458575	2007-05-31	Africa	Kenya			Homo sapiens	2021-12-13		Wangui et al		Wangui,J.M., Nokes,J.D., Opot,B.H., Opanda,S.M., Agoti,C.N., Otieno,J.R., Bulimo,W.D.	
732	OK458578	OK458578.1	OK458578	2007-06-07	Africa	Kenya			Homo sapiens	2021-12-13		Wangui et al		Wangui,J.M., Nokes,J.D., Opot,B.H., Opanda,S.M., Agoti,C.N., Otieno,J.R., Bulimo,W.D.	
733	OK458610	OK458610.1	OK458610	2007-06-15	Africa	Kenya			Homo sapiens	2021-12-13		Wangui et al		Wangui,J.M., Nokes,J.D., Opot,B.H., Opanda,S.M., Agoti,C.N., Otieno,J.R., Bulimo,W.D.	
734	OK458609	OK458609.1	OK458609	2007-07-11	Africa	Kenya			Homo sapiens	2021-12-13		Wangui et al		Wangui,J.M., Nokes,J.D., Opot,B.H., Opanda,S.M., Agoti,C.N., Otieno,J.R., Bulimo,W.D.	
735	OK458679	OK458679.1	OK458679	2007-08-01	Africa	Kenya			Homo sapiens	2021-12-13		Wangui et al		Wangui,J.M., Nokes,J.D., Opot,B.H., Opanda,S.M., Agoti,C.N., Otieno,J.R., Bulimo,W.D.	
736	JN968321	JN968321.1	V07-2246878	2007-08-06	Asia	Hong Kong			Homo sapiens	2012-01-10		Mak et al		Mak,G.C., Lau,C.S., Chiu,D.M.Y., Lim,W.	
737	OK458604	OK458604.1	OK458604	2007-08-28	Africa	Kenya			Homo sapiens	2021-12-13		Wangui et al		Wangui,J.M., Nokes,J.D., Opot,B.H., Opanda,S.M., Agoti,C.N., Otieno,J.R., Bulimo,W.D.	
738	OK458613	OK458613.1	OK458613	2007-08-31	Africa	Kenya			Homo sapiens	2021-12-13		Wangui et al		Wangui,J.M., Nokes,J.D., Opot,B.H., Opanda,S.M., Agoti,C.N., Otieno,J.R., Bulimo,W.D.	
739	JN968322	JN968322.1	V07-2257560	2007-10-05	Asia	Hong Kong			Homo sapiens	2012-01-10		Mak et al		Mak,G.C., Lau,C.S., Chiu,D.M.Y., Lim,W.	
740	KT765685	KT765685.1	KEN/Kilifi/714_09/11/2007	2007-11-09	Africa	Kenya			Homo sapiens	2016-02-27		Otieno et al		Otieno,J.R., Agoti,C.N., Gitahi,C.W., Bett,A., Ngama,M., Medley,G.F., Cane,P.A., Nokes,D.J., Nokes,J.D.	
741	KT765551	KT765551.1	KEN/Kilifi/715_15/11/2007	2007-11-15	Africa	Kenya			Homo sapiens	2016-02-27		Otieno et al		Otieno,J.R., Agoti,C.N., Gitahi,C.W., Bett,A., Ngama,M., Medley,G.F., Cane,P.A., Nokes,D.J., Nokes,J.D.	
742	OK458674	OK458674.1	OK458674	2007-11-22	Africa	Kenya			Homo sapiens	2021-12-13		Wangui et al		Wangui,J.M., Nokes,J.D., Opot,B.H., Opanda,S.M., Agoti,C.N., Otieno,J.R., Bulimo,W.D.	
743	KT765505	KT765505.1	KEN/Kilifi/716_26/11/2007	2007-11-26	Africa	Kenya			Homo sapiens	2016-02-27		Otieno et al		Otieno,J.R., Agoti,C.N., Gitahi,C.W., Bett,A., Ngama,M., Medley,G.F., Cane,P.A., Nokes,D.J., Nokes,J.D.	
744	FR681618	FR681618.1	FR681618	2007-12-XX	Europe	France	Normandie			2010-09-07		Bellot et al		Bellot,A., Leroux,M., Vabret,A., Freymuth,F., Dina,J.	
745	FR681619	FR681619.1	FR681619	2007-12-XX	Europe	France	Normandie			2010-09-07		Bellot et al		Bellot,A., Leroux,M., Vabret,A., Freymuth,F., Dina,J.	
746	FR681620	FR681620.1	FR681620	2007-12-XX	Europe	France	Normandie			2010-09-07		Bellot et al		Bellot,A., Leroux,M., Vabret,A., Freymuth,F., Dina,J.	
747	FR681621	FR681621.1	FR681621	2007-12-XX	Europe	France	Normandie			2010-09-07		Bellot et al		Bellot,A., Leroux,M., Vabret,A., Freymuth,F., Dina,J.	
748	FR681648	FR681648.1	FR681648	2007-12-XX	Europe	France	Normandie			2010-09-07		Bellot et al		Bellot,A., Leroux,M., Vabret,A., Freymuth,F., Dina,J.	
749	FR681649	FR681649.1	FR681649	2007-12-XX	Europe	France	Normandie			2010-09-07		Bellot et al		Bellot,A., Leroux,M., Vabret,A., Freymuth,F., Dina,J.	
750	FR681677	FR681677.1	FR681677	2007-12-XX	Europe	France	Normandie			2010-09-07		Bellot et al		Bellot,A., Leroux,M., Vabret,A., Freymuth,F., Dina,J.	
751	FR681678	FR681678.1	FR681678	2007-12-XX	Europe	France	Normandie			2010-09-07		Bellot et al		Bellot,A., Leroux,M., Vabret,A., Freymuth,F., Dina,J.	
752	FR681679	FR681679.1	FR681679	2007-12-XX	Europe	France	Normandie			2010-09-07		Bellot et al		Bellot,A., Leroux,M., Vabret,A., Freymuth,F., Dina,J.	
753	FR681699	FR681699.1	FR681699	2007-12-XX	Europe	France	Normandie			2010-09-07		Bellot et al		Bellot,A., Leroux,M., Vabret,A., Freymuth,F., Dina,J.	
754	FR681700	FR681700.1	FR681700	2007-12-XX	Europe	France	Normandie			2010-09-07		Bellot et al		Bellot,A., Leroux,M., Vabret,A., Freymuth,F., Dina,J.	
755	FR681701	FR681701.1	FR681701	2007-12-XX	Europe	France	Normandie			2010-09-07		Bellot et al		Bellot,A., Leroux,M., Vabret,A., Freymuth,F., Dina,J.	
756	FR681702	FR681702.1	FR681702	2007-12-XX	Europe	France	Normandie			2010-09-07		Bellot et al		Bellot,A., Leroux,M., Vabret,A., Freymuth,F., Dina,J.	
757	KT765533	KT765533.1	KEN/Kilifi/717_04/12/2007	2007-12-04	Africa	Kenya			Homo sapiens	2016-02-27		Otieno et al		Otieno,J.R., Agoti,C.N., Gitahi,C.W., Bett,A., Ngama,M., Medley,G.F., Cane,P.A., Nokes,D.J., Nokes,J.D.	
758	KT765487	KT765487.1	KEN/Kilifi/718_13/12/2007	2007-12-13	Africa	Kenya			Homo sapiens	2016-02-27		Otieno et al		Otieno,J.R., Agoti,C.N., Gitahi,C.W., Bett,A., Ngama,M., Medley,G.F., Cane,P.A., Nokes,D.J., Nokes,J.D.	
759	KT765503	KT765503.1	KEN/Kilifi/719_19/12/2007	2007-12-19	Africa	Kenya			Homo sapiens	2016-02-27		Otieno et al		Otieno,J.R., Agoti,C.N., Gitahi,C.W., Bett,A., Ngama,M., Medley,G.F., Cane,P.A., Nokes,D.J., Nokes,J.D.	
760	KT765523	KT765523.1	KEN/Kilifi/720_25/12/2007	2007-12-25	Africa	Kenya			Homo sapiens	2016-02-27		Otieno et al		Otieno,J.R., Agoti,C.N., Gitahi,C.W., Bett,A., Ngama,M., Medley,G.F., Cane,P.A., Nokes,D.J., Nokes,J.D.	
761	KT765531	KT765531.1	KEN/Kilifi/721_30/12/2007	2007-12-30	Africa	Kenya			Homo sapiens	2016-02-27		Otieno et al		Otieno,J.R., Agoti,C.N., Gitahi,C.W., Bett,A., Ngama,M., Medley,G.F., Cane,P.A., Nokes,D.J., Nokes,J.D.	
762	KC297403	KC297403.1	KC297403	2008-XX-XX	Asia	China			Homo sapiens	2013-10-02		Cui et al		Cui,G., Zhu,R., Qian,Y., Deng,J., Zhao,L., Sun,Y., Wang,F.	
763	KC297404	KC297404.1	KC297404	2008-XX-XX	Asia	China			Homo sapiens	2013-10-02		Cui et al		Cui,G., Zhu,R., Qian,Y., Deng,J., Zhao,L., Sun,Y., Wang,F.	
764	KC297405	KC297405.1	KC297405	2008-XX-XX	Asia	China			Homo sapiens	2013-10-02		Cui et al		Cui,G., Zhu,R., Qian,Y., Deng,J., Zhao,L., Sun,Y., Wang,F.	
765	KC297406	KC297406.1	KC297406	2008-XX-XX	Asia	China			Homo sapiens	2013-10-02		Cui et al		Cui,G., Zhu,R., Qian,Y., Deng,J., Zhao,L., Sun,Y., Wang,F.	
766	KC297407	KC297407.1	KC297407	2008-XX-XX	Asia	China			Homo sapiens	2013-10-02		Cui et al		Cui,G., Zhu,R., Qian,Y., Deng,J., Zhao,L., Sun,Y., Wang,F.	
767	KC297408	KC297408.1	KC297408	2008-XX-XX	Asia	China			Homo sapiens	2013-10-02		Cui et al		Cui,G., Zhu,R., Qian,Y., Deng,J., Zhao,L., Sun,Y., Wang,F.	
768	KC297409	KC297409.1	KC297409	2008-XX-XX	Asia	China			Homo sapiens	2013-10-02		Cui et al		Cui,G., Zhu,R., Qian,Y., Deng,J., Zhao,L., Sun,Y., Wang,F.	
769	KC297410	KC297410.1	KC297410	2008-XX-XX	Asia	China			Homo sapiens	2013-10-02		Cui et al		Cui,G., Zhu,R., Qian,Y., Deng,J., Zhao,L., Sun,Y., Wang,F.	
770	KC297411	KC297411.1	KC297411	2008-XX-XX	Asia	China			Homo sapiens	2013-10-02		Cui et al		Cui,G., Zhu,R., Qian,Y., Deng,J., Zhao,L., Sun,Y., Wang,F.	
771	KC297412	KC297412.1	KC297412	2008-XX-XX	Asia	China			Homo sapiens	2013-10-02		Cui et al		Cui,G., Zhu,R., Qian,Y., Deng,J., Zhao,L., Sun,Y., Wang,F.	
772	KC297413	KC297413.1	KC297413	2008-XX-XX	Asia	China			Homo sapiens	2013-10-02		Cui et al		Cui,G., Zhu,R., Qian,Y., Deng,J., Zhao,L., Sun,Y., Wang,F.	
773	KC297414	KC297414.1	KC297414	2008-XX-XX	Asia	China			Homo sapiens	2013-10-02		Cui et al		Cui,G., Zhu,R., Qian,Y., Deng,J., Zhao,L., Sun,Y., Wang,F.	
774	KC297415	KC297415.1	KC297415	2008-XX-XX	Asia	China			Homo sapiens	2013-10-02		Cui et al		Cui,G., Zhu,R., Qian,Y., Deng,J., Zhao,L., Sun,Y., Wang,F.	
775	KC297416	KC297416.1	KC297416	2008-XX-XX	Asia	China			Homo sapiens	2013-10-02		Cui et al		Cui,G., Zhu,R., Qian,Y., Deng,J., Zhao,L., Sun,Y., Wang,F.	
776	KC297417	KC297417.1	KC297417	2008-XX-XX	Asia	China			Homo sapiens	2013-10-02		Cui et al		Cui,G., Zhu,R., Qian,Y., Deng,J., Zhao,L., Sun,Y., Wang,F.	
777	KC297418	KC297418.1	KC297418	2008-XX-XX	Asia	China			Homo sapiens	2013-10-02		Cui et al		Cui,G., Zhu,R., Qian,Y., Deng,J., Zhao,L., Sun,Y., Wang,F.	
778	KC297419	KC297419.1	KC297419	2008-XX-XX	Asia	China			Homo sapiens	2013-10-02		Cui et al		Cui,G., Zhu,R., Qian,Y., Deng,J., Zhao,L., Sun,Y., Wang,F.	
779	KU954998	KU954998.1	KU954998	2008-XX-XX	Asia	China			Homo sapiens	2019-03-31		Jia et al		Jia,B., Xiao,Y., Wang,Y., Chen,L., Zhang,J., Ren,L., Wang,J.	
780	KU954999	KU954999.1	KU954999	2008-XX-XX	Asia	China			Homo sapiens	2019-03-31		Jia et al		Jia,B., Xiao,Y., Wang,Y., Chen,L., Zhang,J., Ren,L., Wang,J.	
781	KU955000	KU955000.1	KU955000	2008-XX-XX	Asia	China			Homo sapiens	2019-03-31		Jia et al		Jia,B., Xiao,Y., Wang,Y., Chen,L., Zhang,J., Ren,L., Wang,J.	
782	KU955001	KU955001.1	KU955001	2008-XX-XX	Asia	China			Homo sapiens	2019-03-31		Jia et al		Jia,B., Xiao,Y., Wang,Y., Chen,L., Zhang,J., Ren,L., Wang,J.	
783	KU955002	KU955002.1	KU955002	2008-XX-XX	Asia	China			Homo sapiens	2019-03-31		Jia et al		Jia,B., Xiao,Y., Wang,Y., Chen,L., Zhang,J., Ren,L., Wang,J.	
784	KU955014	KU955014.1	KU955014	2008-XX-XX	Asia	China			Homo sapiens	2019-03-31		Jia et al		Jia,B., Xiao,Y., Wang,Y., Chen,L., Zhang,J., Ren,L., Wang,J.	
785	KU955015	KU955015.1	KU955015	2008-XX-XX	Asia	China			Homo sapiens	2019-03-31		Jia et al		Jia,B., Xiao,Y., Wang,Y., Chen,L., Zhang,J., Ren,L., Wang,J.	
786	KU955016	KU955016.1	KU955016	2008-XX-XX	Asia	China			Homo sapiens	2019-03-31		Jia et al		Jia,B., Xiao,Y., Wang,Y., Chen,L., Zhang,J., Ren,L., Wang,J.	
787	KU955017	KU955017.1	KU955017	2008-XX-XX	Asia	China			Homo sapiens	2019-03-31		Jia et al		Jia,B., Xiao,Y., Wang,Y., Chen,L., Zhang,J., Ren,L., Wang,J.	
788	KU955018	KU955018.1	KU955018	2008-XX-XX	Asia	China			Homo sapiens	2019-03-31		Jia et al		Jia,B., Xiao,Y., Wang,Y., Chen,L., Zhang,J., Ren,L., Wang,J.	
789	KU955019	KU955019.1	KU955019	2008-XX-XX	Asia	China			Homo sapiens	2019-03-31		Jia et al		Jia,B., Xiao,Y., Wang,Y., Chen,L., Zhang,J., Ren,L., Wang,J.	
790	KU955020	KU955020.1	KU955020	2008-XX-XX	Asia	China			Homo sapiens	2019-03-31		Jia et al		Jia,B., Xiao,Y., Wang,Y., Chen,L., Zhang,J., Ren,L., Wang,J.	
791	KU955021	KU955021.1	KU955021	2008-XX-XX	Asia	China			Homo sapiens	2019-03-31		Jia et al		Jia,B., Xiao,Y., Wang,Y., Chen,L., Zhang,J., Ren,L., Wang,J.	
792	KU955023	KU955023.1	KU955023	2008-XX-XX	Asia	China			Homo sapiens	2019-03-31		Jia et al		Jia,B., Xiao,Y., Wang,Y., Chen,L., Zhang,J., Ren,L., Wang,J.	
793	KU955024	KU955024.1	KU955024	2008-XX-XX	Asia	China			Homo sapiens	2019-03-31		Jia et al		Jia,B., Xiao,Y., Wang,Y., Chen,L., Zhang,J., Ren,L., Wang,J.	
794	KU955025	KU955025.1	KU955025	2008-XX-XX	Asia	China			Homo sapiens	2019-03-31		Jia et al		Jia,B., Xiao,Y., Wang,Y., Chen,L., Zhang,J., Ren,L., Wang,J.	
795	KU955026	KU955026.1	KU955026	2008-XX-XX	Asia	China			Homo sapiens	2019-03-31		Jia et al		Jia,B., Xiao,Y., Wang,Y., Chen,L., Zhang,J., Ren,L., Wang,J.	
796	KU955027	KU955027.1	KU955027	2008-XX-XX	Asia	China			Homo sapiens	2019-03-31		Jia et al		Jia,B., Xiao,Y., Wang,Y., Chen,L., Zhang,J., Ren,L., Wang,J.	
797	KU955028	KU955028.1	KU955028	2008-XX-XX	Asia	China			Homo sapiens	2019-03-31		Jia et al		Jia,B., Xiao,Y., Wang,Y., Chen,L., Zhang,J., Ren,L., Wang,J.	
798	KU955029	KU955029.1	KU955029	2008-XX-XX	Asia	China			Homo sapiens	2019-03-31		Jia et al		Jia,B., Xiao,Y., Wang,Y., Chen,L., Zhang,J., Ren,L., Wang,J.	
799	KU955030	KU955030.1	KU955030	2008-XX-XX	Asia	China			Homo sapiens	2019-03-31		Jia et al		Jia,B., Xiao,Y., Wang,Y., Chen,L., Zhang,J., Ren,L., Wang,J.	
800	KU955031	KU955031.1	KU955031	2008-XX-XX	Asia	China			Homo sapiens	2019-03-31		Jia et al		Jia,B., Xiao,Y., Wang,Y., Chen,L., Zhang,J., Ren,L., Wang,J.	
801	KU955032	KU955032.1	KU955032	2008-XX-XX	Asia	China			Homo sapiens	2019-03-31		Jia et al		Jia,B., Xiao,Y., Wang,Y., Chen,L., Zhang,J., Ren,L., Wang,J.	
802	KU955033	KU955033.1	KU955033	2008-XX-XX	Asia	China			Homo sapiens	2019-03-31		Jia et al		Jia,B., Xiao,Y., Wang,Y., Chen,L., Zhang,J., Ren,L., Wang,J.	
803	KU955034	KU955034.1	KU955034	2008-XX-XX	Asia	China			Homo sapiens	2019-03-31		Jia et al		Jia,B., Xiao,Y., Wang,Y., Chen,L., Zhang,J., Ren,L., Wang,J.	
804	KU955035	KU955035.1	KU955035	2008-XX-XX	Asia	China			Homo sapiens	2019-03-31		Jia et al		Jia,B., Xiao,Y., Wang,Y., Chen,L., Zhang,J., Ren,L., Wang,J.	
805	KU955036	KU955036.1	KU955036	2008-XX-XX	Asia	China			Homo sapiens	2019-03-31		Jia et al		Jia,B., Xiao,Y., Wang,Y., Chen,L., Zhang,J., Ren,L., Wang,J.	
806	KU955037	KU955037.1	KU955037	2008-XX-XX	Asia	China			Homo sapiens	2019-03-31		Jia et al		Jia,B., Xiao,Y., Wang,Y., Chen,L., Zhang,J., Ren,L., Wang,J.	
807	KU955038	KU955038.1	KU955038	2008-XX-XX	Asia	China			Homo sapiens	2019-03-31		Jia et al		Jia,B., Xiao,Y., Wang,Y., Chen,L., Zhang,J., Ren,L., Wang,J.	
808	KU955039	KU955039.1	KU955039	2008-XX-XX	Asia	China			Homo sapiens	2019-03-31		Jia et al		Jia,B., Xiao,Y., Wang,Y., Chen,L., Zhang,J., Ren,L., Wang,J.	
809	KU955040	KU955040.1	KU955040	2008-XX-XX	Asia	China			Homo sapiens	2019-03-31		Jia et al		Jia,B., Xiao,Y., Wang,Y., Chen,L., Zhang,J., Ren,L., Wang,J.	
810	KU955041	KU955041.1	KU955041	2008-XX-XX	Asia	China			Homo sapiens	2019-03-31		Jia et al		Jia,B., Xiao,Y., Wang,Y., Chen,L., Zhang,J., Ren,L., Wang,J.	
811	KU955042	KU955042.1	KU955042	2008-XX-XX	Asia	China			Homo sapiens	2019-03-31		Jia et al		Jia,B., Xiao,Y., Wang,Y., Chen,L., Zhang,J., Ren,L., Wang,J.	
812	KU955043	KU955043.1	KU955043	2008-XX-XX	Asia	China			Homo sapiens	2019-03-31		Jia et al		Jia,B., Xiao,Y., Wang,Y., Chen,L., Zhang,J., Ren,L., Wang,J.	
813	KU955044	KU955044.1	KU955044	2008-XX-XX	Asia	China			Homo sapiens	2019-03-31		Jia et al		Jia,B., Xiao,Y., Wang,Y., Chen,L., Zhang,J., Ren,L., Wang,J.	
814	KU955045	KU955045.1	KU955045	2008-XX-XX	Asia	China			Homo sapiens	2019-03-31		Jia et al		Jia,B., Xiao,Y., Wang,Y., Chen,L., Zhang,J., Ren,L., Wang,J.	
815	KU955046	KU955046.1	KU955046	2008-XX-XX	Asia	China			Homo sapiens	2019-03-31		Jia et al		Jia,B., Xiao,Y., Wang,Y., Chen,L., Zhang,J., Ren,L., Wang,J.	
816	KU955047	KU955047.1	KU955047	2008-XX-XX	Asia	China			Homo sapiens	2019-03-31		Jia et al		Jia,B., Xiao,Y., Wang,Y., Chen,L., Zhang,J., Ren,L., Wang,J.	
817	KU955048	KU955048.1	KU955048	2008-XX-XX	Asia	China			Homo sapiens	2019-03-31		Jia et al		Jia,B., Xiao,Y., Wang,Y., Chen,L., Zhang,J., Ren,L., Wang,J.	
818	KU955049	KU955049.1	KU955049	2008-XX-XX	Asia	China			Homo sapiens	2019-03-31		Jia et al		Jia,B., Xiao,Y., Wang,Y., Chen,L., Zhang,J., Ren,L., Wang,J.	
819	KU955050	KU955050.1	KU955050	2008-XX-XX	Asia	China			Homo sapiens	2019-03-31		Jia et al		Jia,B., Xiao,Y., Wang,Y., Chen,L., Zhang,J., Ren,L., Wang,J.	
820	KU955051	KU955051.1	KU955051	2008-XX-XX	Asia	China			Homo sapiens	2019-03-31		Jia et al		Jia,B., Xiao,Y., Wang,Y., Chen,L., Zhang,J., Ren,L., Wang,J.	
821	KU955052	KU955052.1	KU955052	2008-XX-XX	Asia	China			Homo sapiens	2019-03-31		Jia et al		Jia,B., Xiao,Y., Wang,Y., Chen,L., Zhang,J., Ren,L., Wang,J.	
822	KU955053	KU955053.1	KU955053	2008-XX-XX	Asia	China			Homo sapiens	2019-03-31		Jia et al		Jia,B., Xiao,Y., Wang,Y., Chen,L., Zhang,J., Ren,L., Wang,J.	
823	KU955054	KU955054.1	KU955054	2008-XX-XX	Asia	China			Homo sapiens	2019-03-31		Jia et al		Jia,B., Xiao,Y., Wang,Y., Chen,L., Zhang,J., Ren,L., Wang,J.	
824	KU955055	KU955055.1	KU955055	2008-XX-XX	Asia	China			Homo sapiens	2019-03-31		Jia et al		Jia,B., Xiao,Y., Wang,Y., Chen,L., Zhang,J., Ren,L., Wang,J.	
825	KU955272	KU955272.1	KU955272	2008-XX-XX	Asia	China			Homo sapiens	2019-03-31		Jia et al		Jia,B., Xiao,Y., Wang,Y., Chen,L., Zhang,J., Ren,L., Wang,J.	
826	KU955273	KU955273.1	KU955273	2008-XX-XX	Asia	China			Homo sapiens	2019-03-31		Jia et al		Jia,B., Xiao,Y., Wang,Y., Chen,L., Zhang,J., Ren,L., Wang,J.	
827	KU955274	KU955274.1	KU955274	2008-XX-XX	Asia	China			Homo sapiens	2019-03-31		Jia et al		Jia,B., Xiao,Y., Wang,Y., Chen,L., Zhang,J., Ren,L., Wang,J.	
828	KU955275	KU955275.1	KU955275	2008-XX-XX	Asia	China			Homo sapiens	2019-03-31		Jia et al		Jia,B., Xiao,Y., Wang,Y., Chen,L., Zhang,J., Ren,L., Wang,J.	
829	KU955276	KU955276.1	KU955276	2008-XX-XX	Asia	China			Homo sapiens	2019-03-31		Jia et al		Jia,B., Xiao,Y., Wang,Y., Chen,L., Zhang,J., Ren,L., Wang,J.	
830	KU955277	KU955277.1	KU955277	2008-XX-XX	Asia	China			Homo sapiens	2019-03-31		Jia et al		Jia,B., Xiao,Y., Wang,Y., Chen,L., Zhang,J., Ren,L., Wang,J.	
831	KU955278	KU955278.1	KU955278	2008-XX-XX	Asia	China			Homo sapiens	2019-03-31		Jia et al		Jia,B., Xiao,Y., Wang,Y., Chen,L., Zhang,J., Ren,L., Wang,J.	
832	KU955279	KU955279.1	KU955279	2008-XX-XX	Asia	China			Homo sapiens	2019-03-31		Jia et al		Jia,B., Xiao,Y., Wang,Y., Chen,L., Zhang,J., Ren,L., Wang,J.	
833	KU955280	KU955280.1	KU955280	2008-XX-XX	Asia	China			Homo sapiens	2019-03-31		Jia et al		Jia,B., Xiao,Y., Wang,Y., Chen,L., Zhang,J., Ren,L., Wang,J.	
834	KU962533	KU962533.1	KU962533	2008-XX-XX	Asia	China			Homo sapiens	2019-03-31		Jia et al		Jia,B., Xiao,Y., Wang,Y., Chen,L., Zhang,J., Ren,L., Wang,J.	
835	KU962534	KU962534.1	KU962534	2008-XX-XX	Asia	China			Homo sapiens	2019-03-31		Jia et al		Jia,B., Xiao,Y., Wang,Y., Chen,L., Zhang,J., Ren,L., Wang,J.	
836	KU962535	KU962535.1	KU962535	2008-XX-XX	Asia	China			Homo sapiens	2019-03-31		Jia et al		Jia,B., Xiao,Y., Wang,Y., Chen,L., Zhang,J., Ren,L., Wang,J.	
837	KU962536	KU962536.1	KU962536	2008-XX-XX	Asia	China			Homo sapiens	2019-03-31		Jia et al		Jia,B., Xiao,Y., Wang,Y., Chen,L., Zhang,J., Ren,L., Wang,J.	
838	KU962537	KU962537.1	KU962537	2008-XX-XX	Asia	China			Homo sapiens	2019-03-31		Jia et al		Jia,B., Xiao,Y., Wang,Y., Chen,L., Zhang,J., Ren,L., Wang,J.	
839	KU962808	KU962808.1	KU962808	2008-XX-XX	Asia	China			Homo sapiens	2019-03-31		Jia et al		Jia,B., Xiao,Y., Wang,Y., Chen,L., Zhang,J., Ren,L., Wang,J.	
840	KU962809	KU962809.1	KU962809	2008-XX-XX	Asia	China			Homo sapiens	2019-03-31		Jia et al		Jia,B., Xiao,Y., Wang,Y., Chen,L., Zhang,J., Ren,L., Wang,J.	
841	KU962810	KU962810.1	KU962810	2008-XX-XX	Asia	China			Homo sapiens	2019-03-31		Jia et al		Jia,B., Xiao,Y., Wang,Y., Chen,L., Zhang,J., Ren,L., Wang,J.	
842	KU962811	KU962811.1	KU962811	2008-XX-XX	Asia	China			Homo sapiens	2019-03-31		Jia et al		Jia,B., Xiao,Y., Wang,Y., Chen,L., Zhang,J., Ren,L., Wang,J.	
843	KU962812	KU962812.1	KU962812	2008-XX-XX	Asia	China			Homo sapiens	2019-03-31		Jia et al		Jia,B., Xiao,Y., Wang,Y., Chen,L., Zhang,J., Ren,L., Wang,J.	
844	KU962813	KU962813.1	KU962813	2008-XX-XX	Asia	China			Homo sapiens	2019-03-31		Jia et al		Jia,B., Xiao,Y., Wang,Y., Chen,L., Zhang,J., Ren,L., Wang,J.	
845	KU962815	KU962815.1	KU962815	2008-XX-XX	Asia	China			Homo sapiens	2019-03-31		Jia et al		Jia,B., Xiao,Y., Wang,Y., Chen,L., Zhang,J., Ren,L., Wang,J.	
846	KU962816	KU962816.1	KU962816	2008-XX-XX	Asia	China			Homo sapiens	2019-03-31		Jia et al		Jia,B., Xiao,Y., Wang,Y., Chen,L., Zhang,J., Ren,L., Wang,J.	
847	KU962817	KU962817.1	KU962817	2008-XX-XX	Asia	China			Homo sapiens	2019-03-31		Jia et al		Jia,B., Xiao,Y., Wang,Y., Chen,L., Zhang,J., Ren,L., Wang,J.	
848	KU962818	KU962818.1	KU962818	2008-XX-XX	Asia	China			Homo sapiens	2019-03-31		Jia et al		Jia,B., Xiao,Y., Wang,Y., Chen,L., Zhang,J., Ren,L., Wang,J.	
849	KU962819	KU962819.1	KU962819	2008-XX-XX	Asia	China			Homo sapiens	2019-03-31		Jia et al		Jia,B., Xiao,Y., Wang,Y., Chen,L., Zhang,J., Ren,L., Wang,J.	
850	KU962820	KU962820.1	KU962820	2008-XX-XX	Asia	China			Homo sapiens	2019-03-31		Jia et al		Jia,B., Xiao,Y., Wang,Y., Chen,L., Zhang,J., Ren,L., Wang,J.	
851	KU962821	KU962821.1	KU962821	2008-XX-XX	Asia	China			Homo sapiens	2019-03-31		Jia et al		Jia,B., Xiao,Y., Wang,Y., Chen,L., Zhang,J., Ren,L., Wang,J.	
852	KU962822	KU962822.1	KU962822	2008-XX-XX	Asia	China			Homo sapiens	2019-03-31		Jia et al		Jia,B., Xiao,Y., Wang,Y., Chen,L., Zhang,J., Ren,L., Wang,J.	
853	KU962823	KU962823.1	KU962823	2008-XX-XX	Asia	China			Homo sapiens	2019-03-31		Jia et al		Jia,B., Xiao,Y., Wang,Y., Chen,L., Zhang,J., Ren,L., Wang,J.	
854	KU962824	KU962824.1	KU962824	2008-XX-XX	Asia	China			Homo sapiens	2019-03-31		Jia et al		Jia,B., Xiao,Y., Wang,Y., Chen,L., Zhang,J., Ren,L., Wang,J.	
855	KU962825	KU962825.1	KU962825	2008-XX-XX	Asia	China			Homo sapiens	2019-03-31		Jia et al		Jia,B., Xiao,Y., Wang,Y., Chen,L., Zhang,J., Ren,L., Wang,J.	
856	KU962826	KU962826.1	KU962826	2008-XX-XX	Asia	China			Homo sapiens	2019-03-31		Jia et al		Jia,B., Xiao,Y., Wang,Y., Chen,L., Zhang,J., Ren,L., Wang,J.	
857	KU962827	KU962827.1	KU962827	2008-XX-XX	Asia	China			Homo sapiens	2019-03-31		Jia et al		Jia,B., Xiao,Y., Wang,Y., Chen,L., Zhang,J., Ren,L., Wang,J.	
858	KU962828	KU962828.1	KU962828	2008-XX-XX	Asia	China			Homo sapiens	2019-03-31		Jia et al		Jia,B., Xiao,Y., Wang,Y., Chen,L., Zhang,J., Ren,L., Wang,J.	
859	KU962829	KU962829.1	KU962829	2008-XX-XX	Asia	China			Homo sapiens	2019-03-31		Jia et al		Jia,B., Xiao,Y., Wang,Y., Chen,L., Zhang,J., Ren,L., Wang,J.	
860	KU962830	KU962830.1	KU962830	2008-XX-XX	Asia	China			Homo sapiens	2019-03-31		Jia et al		Jia,B., Xiao,Y., Wang,Y., Chen,L., Zhang,J., Ren,L., Wang,J.	
861	KU962831	KU962831.1	KU962831	2008-XX-XX	Asia	China			Homo sapiens	2019-03-31		Jia et al		Jia,B., Xiao,Y., Wang,Y., Chen,L., Zhang,J., Ren,L., Wang,J.	
862	KU962832	KU962832.1	KU962832	2008-XX-XX	Asia	China			Homo sapiens	2019-03-31		Jia et al		Jia,B., Xiao,Y., Wang,Y., Chen,L., Zhang,J., Ren,L., Wang,J.	
863	KU962833	KU962833.1	KU962833	2008-XX-XX	Asia	China			Homo sapiens	2019-03-31		Jia et al		Jia,B., Xiao,Y., Wang,Y., Chen,L., Zhang,J., Ren,L., Wang,J.	
864	KU962834	KU962834.1	KU962834	2008-XX-XX	Asia	China			Homo sapiens	2019-03-31		Jia et al		Jia,B., Xiao,Y., Wang,Y., Chen,L., Zhang,J., Ren,L., Wang,J.	
865	KU962835	KU962835.1	KU962835	2008-XX-XX	Asia	China			Homo sapiens	2019-03-31		Jia et al		Jia,B., Xiao,Y., Wang,Y., Chen,L., Zhang,J., Ren,L., Wang,J.	
866	KU962836	KU962836.1	KU962836	2008-XX-XX	Asia	China			Homo sapiens	2019-03-31		Jia et al		Jia,B., Xiao,Y., Wang,Y., Chen,L., Zhang,J., Ren,L., Wang,J.	
867	KU962837	KU962837.1	KU962837	2008-XX-XX	Asia	China			Homo sapiens	2019-03-31		Jia et al		Jia,B., Xiao,Y., Wang,Y., Chen,L., Zhang,J., Ren,L., Wang,J.	
868	KU962838	KU962838.1	KU962838	2008-XX-XX	Asia	China			Homo sapiens	2019-03-31		Jia et al		Jia,B., Xiao,Y., Wang,Y., Chen,L., Zhang,J., Ren,L., Wang,J.	
869	KU962839	KU962839.1	KU962839	2008-XX-XX	Asia	China			Homo sapiens	2019-03-31		Jia et al		Jia,B., Xiao,Y., Wang,Y., Chen,L., Zhang,J., Ren,L., Wang,J.	
870	KU962840	KU962840.1	KU962840	2008-XX-XX	Asia	China			Homo sapiens	2019-03-31		Jia et al		Jia,B., Xiao,Y., Wang,Y., Chen,L., Zhang,J., Ren,L., Wang,J.	
871	KU962841	KU962841.1	KU962841	2008-XX-XX	Asia	China			Homo sapiens	2019-03-31		Jia et al		Jia,B., Xiao,Y., Wang,Y., Chen,L., Zhang,J., Ren,L., Wang,J.	
872	KU962842	KU962842.1	KU962842	2008-XX-XX	Asia	China			Homo sapiens	2019-03-31		Jia et al		Jia,B., Xiao,Y., Wang,Y., Chen,L., Zhang,J., Ren,L., Wang,J.	
873	KU962843	KU962843.1	KU962843	2008-XX-XX	Asia	China			Homo sapiens	2019-03-31		Jia et al		Jia,B., Xiao,Y., Wang,Y., Chen,L., Zhang,J., Ren,L., Wang,J.	
874	KU962844	KU962844.1	KU962844	2008-XX-XX	Asia	China			Homo sapiens	2019-03-31		Jia et al		Jia,B., Xiao,Y., Wang,Y., Chen,L., Zhang,J., Ren,L., Wang,J.	
875	KU962845	KU962845.1	KU962845	2008-XX-XX	Asia	China			Homo sapiens	2019-03-31		Jia et al		Jia,B., Xiao,Y., Wang,Y., Chen,L., Zhang,J., Ren,L., Wang,J.	
876	KU962846	KU962846.1	KU962846	2008-XX-XX	Asia	China			Homo sapiens	2019-03-31		Jia et al		Jia,B., Xiao,Y., Wang,Y., Chen,L., Zhang,J., Ren,L., Wang,J.	
877	KU962847	KU962847.1	KU962847	2008-XX-XX	Asia	China			Homo sapiens	2019-03-31		Jia et al		Jia,B., Xiao,Y., Wang,Y., Chen,L., Zhang,J., Ren,L., Wang,J.	
878	KU962848	KU962848.1	KU962848	2008-XX-XX	Asia	China			Homo sapiens	2019-03-31		Jia et al		Jia,B., Xiao,Y., Wang,Y., Chen,L., Zhang,J., Ren,L., Wang,J.	
879	KU962849	KU962849.1	KU962849	2008-XX-XX	Asia	China			Homo sapiens	2019-03-31		Jia et al		Jia,B., Xiao,Y., Wang,Y., Chen,L., Zhang,J., Ren,L., Wang,J.	
880	KU962850	KU962850.1	KU962850	2008-XX-XX	Asia	China			Homo sapiens	2019-03-31		Jia et al		Jia,B., Xiao,Y., Wang,Y., Chen,L., Zhang,J., Ren,L., Wang,J.	
881	KU962851	KU962851.1	KU962851	2008-XX-XX	Asia	China			Homo sapiens	2019-03-31		Jia et al		Jia,B., Xiao,Y., Wang,Y., Chen,L., Zhang,J., Ren,L., Wang,J.	
882	KU962852	KU962852.1	KU962852	2008-XX-XX	Asia	China			Homo sapiens	2019-03-31		Jia et al		Jia,B., Xiao,Y., Wang,Y., Chen,L., Zhang,J., Ren,L., Wang,J.	
883	KU962853	KU962853.1	KU962853	2008-XX-XX	Asia	China			Homo sapiens	2019-03-31		Jia et al		Jia,B., Xiao,Y., Wang,Y., Chen,L., Zhang,J., Ren,L., Wang,J.	
884	KU962854	KU962854.1	KU962854	2008-XX-XX	Asia	China			Homo sapiens	2019-03-31		Jia et al		Jia,B., Xiao,Y., Wang,Y., Chen,L., Zhang,J., Ren,L., Wang,J.	
885	KU962855	KU962855.1	KU962855	2008-XX-XX	Asia	China			Homo sapiens	2019-03-31		Jia et al		Jia,B., Xiao,Y., Wang,Y., Chen,L., Zhang,J., Ren,L., Wang,J.	
886	KU962856	KU962856.1	KU962856	2008-XX-XX	Asia	China			Homo sapiens	2019-03-31		Jia et al		Jia,B., Xiao,Y., Wang,Y., Chen,L., Zhang,J., Ren,L., Wang,J.	
887	KU962857	KU962857.1	KU962857	2008-XX-XX	Asia	China			Homo sapiens	2019-03-31		Jia et al		Jia,B., Xiao,Y., Wang,Y., Chen,L., Zhang,J., Ren,L., Wang,J.	
888	KU962858	KU962858.1	KU962858	2008-XX-XX	Asia	China			Homo sapiens	2019-03-31		Jia et al		Jia,B., Xiao,Y., Wang,Y., Chen,L., Zhang,J., Ren,L., Wang,J.	
889	KU962859	KU962859.1	KU962859	2008-XX-XX	Asia	China			Homo sapiens	2019-03-31		Jia et al		Jia,B., Xiao,Y., Wang,Y., Chen,L., Zhang,J., Ren,L., Wang,J.	
890	KU962860	KU962860.1	KU962860	2008-XX-XX	Asia	China			Homo sapiens	2019-03-31		Jia et al		Jia,B., Xiao,Y., Wang,Y., Chen,L., Zhang,J., Ren,L., Wang,J.	
891	KU962861	KU962861.1	KU962861	2008-XX-XX	Asia	China			Homo sapiens	2019-03-31		Jia et al		Jia,B., Xiao,Y., Wang,Y., Chen,L., Zhang,J., Ren,L., Wang,J.	
892	KU962862	KU962862.1	KU962862	2008-XX-XX	Asia	China			Homo sapiens	2019-03-31		Jia et al		Jia,B., Xiao,Y., Wang,Y., Chen,L., Zhang,J., Ren,L., Wang,J.	
893	KU962863	KU962863.1	KU962863	2008-XX-XX	Asia	China			Homo sapiens	2019-03-31		Jia et al		Jia,B., Xiao,Y., Wang,Y., Chen,L., Zhang,J., Ren,L., Wang,J.	
894	KU962864	KU962864.1	KU962864	2008-XX-XX	Asia	China			Homo sapiens	2019-03-31		Jia et al		Jia,B., Xiao,Y., Wang,Y., Chen,L., Zhang,J., Ren,L., Wang,J.	
895	KU962865	KU962865.1	KU962865	2008-XX-XX	Asia	China			Homo sapiens	2019-03-31		Jia et al		Jia,B., Xiao,Y., Wang,Y., Chen,L., Zhang,J., Ren,L., Wang,J.	
896	KU962866	KU962866.1	KU962866	2008-XX-XX	Asia	China			Homo sapiens	2019-03-31		Jia et al		Jia,B., Xiao,Y., Wang,Y., Chen,L., Zhang,J., Ren,L., Wang,J.	
897	KU962867	KU962867.1	KU962867	2008-XX-XX	Asia	China			Homo sapiens	2019-03-31		Jia et al		Jia,B., Xiao,Y., Wang,Y., Chen,L., Zhang,J., Ren,L., Wang,J.	
898	KU962868	KU962868.1	KU962868	2008-XX-XX	Asia	China			Homo sapiens	2019-03-31		Jia et al		Jia,B., Xiao,Y., Wang,Y., Chen,L., Zhang,J., Ren,L., Wang,J.	
899	KU962869	KU962869.1	KU962869	2008-XX-XX	Asia	China			Homo sapiens	2019-03-31		Jia et al		Jia,B., Xiao,Y., Wang,Y., Chen,L., Zhang,J., Ren,L., Wang,J.	
900	KU962870	KU962870.1	KU962870	2008-XX-XX	Asia	China			Homo sapiens	2019-03-31		Jia et al		Jia,B., Xiao,Y., Wang,Y., Chen,L., Zhang,J., Ren,L., Wang,J.	
901	KU962871	KU962871.1	KU962871	2008-XX-XX	Asia	China			Homo sapiens	2019-03-31		Jia et al		Jia,B., Xiao,Y., Wang,Y., Chen,L., Zhang,J., Ren,L., Wang,J.	
902	KU962872	KU962872.1	KU962872	2008-XX-XX	Asia	China			Homo sapiens	2019-03-31		Jia et al		Jia,B., Xiao,Y., Wang,Y., Chen,L., Zhang,J., Ren,L., Wang,J.	
903	KU962873	KU962873.1	KU962873	2008-XX-XX	Asia	China			Homo sapiens	2019-03-31		Jia et al		Jia,B., Xiao,Y., Wang,Y., Chen,L., Zhang,J., Ren,L., Wang,J.	
904	KU962874	KU962874.1	KU962874	2008-XX-XX	Asia	China			Homo sapiens	2019-03-31		Jia et al		Jia,B., Xiao,Y., Wang,Y., Chen,L., Zhang,J., Ren,L., Wang,J.	
905	KU962875	KU962875.1	KU962875	2008-XX-XX	Asia	China			Homo sapiens	2019-03-31		Jia et al		Jia,B., Xiao,Y., Wang,Y., Chen,L., Zhang,J., Ren,L., Wang,J.	
906	KU962876	KU962876.1	KU962876	2008-XX-XX	Asia	China			Homo sapiens	2019-03-31		Jia et al		Jia,B., Xiao,Y., Wang,Y., Chen,L., Zhang,J., Ren,L., Wang,J.	
907	KU962877	KU962877.1	KU962877	2008-XX-XX	Asia	China			Homo sapiens	2019-03-31		Jia et al		Jia,B., Xiao,Y., Wang,Y., Chen,L., Zhang,J., Ren,L., Wang,J.	
908	KU962878	KU962878.1	KU962878	2008-XX-XX	Asia	China			Homo sapiens	2019-03-31		Jia et al		Jia,B., Xiao,Y., Wang,Y., Chen,L., Zhang,J., Ren,L., Wang,J.	
909	KU962879	KU962879.1	KU962879	2008-XX-XX	Asia	China			Homo sapiens	2019-03-31		Jia et al		Jia,B., Xiao,Y., Wang,Y., Chen,L., Zhang,J., Ren,L., Wang,J.	
910	KU962904	KU962904.1	KU962904	2008-XX-XX	Asia	China			Homo sapiens	2019-03-31		Jia et al		Jia,B., Xiao,Y., Wang,Y., Chen,L., Zhang,J., Ren,L., Wang,J.	
911	KU962905	KU962905.1	KU962905	2008-XX-XX	Asia	China			Homo sapiens	2019-03-31		Jia et al		Jia,B., Xiao,Y., Wang,Y., Chen,L., Zhang,J., Ren,L., Wang,J.	
912	KU962906	KU962906.1	KU962906	2008-XX-XX	Asia	China			Homo sapiens	2019-03-31		Jia et al		Jia,B., Xiao,Y., Wang,Y., Chen,L., Zhang,J., Ren,L., Wang,J.	
913	KU962907	KU962907.1	KU962907	2008-XX-XX	Asia	China			Homo sapiens	2019-03-31		Jia et al		Jia,B., Xiao,Y., Wang,Y., Chen,L., Zhang,J., Ren,L., Wang,J.	
914	KU962908	KU962908.1	KU962908	2008-XX-XX	Asia	China			Homo sapiens	2019-03-31		Jia et al		Jia,B., Xiao,Y., Wang,Y., Chen,L., Zhang,J., Ren,L., Wang,J.	
915	KU962909	KU962909.1	KU962909	2008-XX-XX	Asia	China			Homo sapiens	2019-03-31		Jia et al		Jia,B., Xiao,Y., Wang,Y., Chen,L., Zhang,J., Ren,L., Wang,J.	
916	KX533718	KX533718.1	KX533718	2008-XX-XX	Asia	China			Homo sapiens	2017-09-28		Song et al		Song,J., Zhang,Y., Wang,H., Shi,J., Sun,L., Zhang,X., Yang,Z., Guan,W., Zhang,H., Yu,P., Xie,Z., Cui,A., Ng,T.I., Xu,W.	
917	KX533877	KX533877.1	KX533877	2008-XX-XX	Asia	China			Homo sapiens	2017-09-28		Song et al		Song,J., Zhang,Y., Wang,H., Shi,J., Sun,L., Zhang,X., Yang,Z., Guan,W., Zhang,H., Yu,P., Xie,Z., Cui,A., Ng,T.I., Xu,W.	
918	MF104641	MF104641.1	HR19501-08	2008-XX-XX	Europe	Croatia			Homo sapiens	2017-12-31		Jagusic et al		Jagusic,M., Slovic,A., Santak,M., Kosutic-Gulija,T., Ivancic-Jelecki,J., Forcic,D.	
919	MF104642	MF104642.1	HR18945-08	2008-XX-XX	Europe	Croatia			Homo sapiens	2017-12-31		Jagusic et al		Jagusic,M., Slovic,A., Santak,M., Kosutic-Gulija,T., Ivancic-Jelecki,J., Forcic,D.	
920	MF104644	MF104644.1	HR6855-08	2008-XX-XX	Europe	Croatia			Homo sapiens	2017-12-31		Jagusic et al		Jagusic,M., Slovic,A., Santak,M., Kosutic-Gulija,T., Ivancic-Jelecki,J., Forcic,D.	
921	MF496426	MF496426.1	R97-70	2008-XX-XX	Asia	Taiwan			Homo sapiens	2017-08-30		Chi et al		Chi,H., Hsiao,K.-L., Weng,L.-C., Chiu,N.-C., Huang,L.-M., Chiu,Y.-Y., Liu,C.-P., Liu,H.-F.	
922	MF496427	MF496427.1	R97-68	2008-XX-XX	Asia	Taiwan			Homo sapiens	2017-08-30		Chi et al		Chi,H., Hsiao,K.-L., Weng,L.-C., Chiu,N.-C., Huang,L.-M., Chiu,Y.-Y., Liu,C.-P., Liu,H.-F.	
923	MF496428	MF496428.1	R97-42	2008-XX-XX	Asia	Taiwan			Homo sapiens	2017-08-30		Chi et al		Chi,H., Hsiao,K.-L., Weng,L.-C., Chiu,N.-C., Huang,L.-M., Chiu,Y.-Y., Liu,C.-P., Liu,H.-F.	
924	MF496429	MF496429.1	R97-22	2008-XX-XX	Asia	Taiwan			Homo sapiens	2017-08-30		Chi et al		Chi,H., Hsiao,K.-L., Weng,L.-C., Chiu,N.-C., Huang,L.-M., Chiu,Y.-Y., Liu,C.-P., Liu,H.-F.	
925	MF496430	MF496430.1	R97-05	2008-XX-XX	Asia	Taiwan			Homo sapiens	2017-08-30		Chi et al		Chi,H., Hsiao,K.-L., Weng,L.-C., Chiu,N.-C., Huang,L.-M., Chiu,Y.-Y., Liu,C.-P., Liu,H.-F.	
926	MK167035	MK167035.1	MK167035	2008-XX-XX	North America	USA			Homo sapiens	2019-01-09		Greninger et al		Greninger,A.L., Shean,R.C., Makhsous,N.	
927	MK344675	MK344675.1	MK344675	2008-XX-XX	Asia	Taiwan			Homo sapiens	2020-01-11		Lee et al		Lee,C.-Y.	
928	MK344676	MK344676.1	MK344676	2008-XX-XX	Asia	Taiwan			Homo sapiens	2020-01-11		Lee et al		Lee,C.-Y.	
929	MK344677	MK344677.1	MK344677	2008-XX-XX	Asia	Taiwan			Homo sapiens	2020-01-11		Lee et al		Lee,C.-Y.	
930	MK344678	MK344678.1	MK344678	2008-XX-XX	Asia	Taiwan			Homo sapiens	2020-01-11		Lee et al		Lee,C.-Y.	
931	MK344679	MK344679.1	MK344679	2008-XX-XX	Asia	Taiwan			Homo sapiens	2020-01-11		Lee et al		Lee,C.-Y.	
932	MK344680	MK344680.1	MK344680	2008-XX-XX	Asia	Taiwan			Homo sapiens	2020-01-11		Lee et al		Lee,C.-Y.	
933	MK443500	MK443500.1	MK443500	2008-XX-XX	Asia	Taiwan			Homo sapiens	2020-01-11		Lee et al		Lee,C.-Y.	
934	MW306451	MW306451.1	BGD/101812/RSV_A/2008	2008-XX-XX	Asia	Bangladesh			Homo sapiens	2021-11-01		Rahman et al		Rahman,M.Z., Hossain,M.E., Sumiya,M.K., Islam,M.M., Begum,M.N., Hoque,A.F., Uddin,K.M.M., Hassan,M.Z., Rahman,M., Goswami,D.R., Brooks,W.A.	
935	MW306452	MW306452.1	BGD/231567/RSV_A/2008	2008-XX-XX	Asia	Bangladesh			Homo sapiens	2021-11-01		Rahman et al		Rahman,M.Z., Hossain,M.E., Sumiya,M.K., Islam,M.M., Begum,M.N., Hoque,A.F., Uddin,K.M.M., Hassan,M.Z., Rahman,M., Goswami,D.R., Brooks,W.A.	
936	MW306453	MW306453.1	BGD/282293/RSV_A/2008	2008-XX-XX	Asia	Bangladesh			Homo sapiens	2021-11-01		Rahman et al		Rahman,M.Z., Hossain,M.E., Sumiya,M.K., Islam,M.M., Begum,M.N., Hoque,A.F., Uddin,K.M.M., Hassan,M.Z., Rahman,M., Goswami,D.R., Brooks,W.A.	
937	MW306454	MW306454.1	BGD/336905/RSV_A/2008	2008-XX-XX	Asia	Bangladesh			Homo sapiens	2021-11-01		Rahman et al		Rahman,M.Z., Hossain,M.E., Sumiya,M.K., Islam,M.M., Begum,M.N., Hoque,A.F., Uddin,K.M.M., Hassan,M.Z., Rahman,M., Goswami,D.R., Brooks,W.A.	
938	OK649595	OK649595.1	OK649595	2008-XX-XX	South America	Brazil			Homo sapiens	2021-11-07		Wang et al		Wang,L., Ng,T.F.F., Castro,C.J., Marine,R.L., Magana,L.C., Esona,M., Peret,T.C.T., Thornburg,N.J.	
939	OK649596	OK649596.1	OK649596	2008-XX-XX	South America	Brazil			Homo sapiens	2021-11-07		Wang et al		Wang,L., Ng,T.F.F., Castro,C.J., Marine,R.L., Magana,L.C., Esona,M., Peret,T.C.T., Thornburg,N.J.	
940	OK649597	OK649597.1	OK649597	2008-XX-XX	South America	Brazil			Homo sapiens	2021-11-07		Wang et al		Wang,L., Ng,T.F.F., Castro,C.J., Marine,R.L., Magana,L.C., Esona,M., Peret,T.C.T., Thornburg,N.J.	
941	OK649598	OK649598.1	OK649598	2008-XX-XX	South America	Brazil			Homo sapiens	2021-11-07		Wang et al		Wang,L., Ng,T.F.F., Castro,C.J., Marine,R.L., Magana,L.C., Esona,M., Peret,T.C.T., Thornburg,N.J.	
942	OK649599	OK649599.1	OK649599	2008-XX-XX	South America	Brazil			Homo sapiens	2021-11-07		Wang et al		Wang,L., Ng,T.F.F., Castro,C.J., Marine,R.L., Magana,L.C., Esona,M., Peret,T.C.T., Thornburg,N.J.	
943	OK649600	OK649600.1	OK649600	2008-XX-XX	South America	Brazil			Homo sapiens	2021-11-07		Wang et al		Wang,L., Ng,T.F.F., Castro,C.J., Marine,R.L., Magana,L.C., Esona,M., Peret,T.C.T., Thornburg,N.J.	
944	OK649601	OK649601.1	OK649601	2008-XX-XX	South America	Brazil			Homo sapiens	2021-11-07		Wang et al		Wang,L., Ng,T.F.F., Castro,C.J., Marine,R.L., Magana,L.C., Esona,M., Peret,T.C.T., Thornburg,N.J.	
945	OK649602	OK649602.1	OK649602	2008-XX-XX	South America	Brazil			Homo sapiens	2021-11-07		Wang et al		Wang,L., Ng,T.F.F., Castro,C.J., Marine,R.L., Magana,L.C., Esona,M., Peret,T.C.T., Thornburg,N.J.	
946	OK649603	OK649603.1	OK649603	2008-XX-XX	South America	Brazil			Homo sapiens	2021-11-07		Wang et al		Wang,L., Ng,T.F.F., Castro,C.J., Marine,R.L., Magana,L.C., Esona,M., Peret,T.C.T., Thornburg,N.J.	
947	OK649604	OK649604.1	OK649604	2008-XX-XX	South America	Brazil			Homo sapiens	2021-11-07		Wang et al		Wang,L., Ng,T.F.F., Castro,C.J., Marine,R.L., Magana,L.C., Esona,M., Peret,T.C.T., Thornburg,N.J.	
948	OK649605	OK649605.1	OK649605	2008-XX-XX	South America	Brazil			Homo sapiens	2021-11-07		Wang et al		Wang,L., Ng,T.F.F., Castro,C.J., Marine,R.L., Magana,L.C., Esona,M., Peret,T.C.T., Thornburg,N.J.	
949	OK649606	OK649606.1	OK649606	2008-XX-XX	South America	Brazil			Homo sapiens	2021-11-07		Wang et al		Wang,L., Ng,T.F.F., Castro,C.J., Marine,R.L., Magana,L.C., Esona,M., Peret,T.C.T., Thornburg,N.J.	
950	OK649607	OK649607.1	OK649607	2008-XX-XX	South America	Brazil			Homo sapiens	2021-11-07		Wang et al		Wang,L., Ng,T.F.F., Castro,C.J., Marine,R.L., Magana,L.C., Esona,M., Peret,T.C.T., Thornburg,N.J.	
951	OK649608	OK649608.1	OK649608	2008-XX-XX	South America	Brazil			Homo sapiens	2021-11-07		Wang et al		Wang,L., Ng,T.F.F., Castro,C.J., Marine,R.L., Magana,L.C., Esona,M., Peret,T.C.T., Thornburg,N.J.	
952	OK649609	OK649609.1	OK649609	2008-XX-XX	South America	Brazil			Homo sapiens	2021-11-07		Wang et al		Wang,L., Ng,T.F.F., Castro,C.J., Marine,R.L., Magana,L.C., Esona,M., Peret,T.C.T., Thornburg,N.J.	
953	OK649610	OK649610.1	OK649610	2008-XX-XX	South America	Brazil			Homo sapiens	2021-11-07		Wang et al		Wang,L., Ng,T.F.F., Castro,C.J., Marine,R.L., Magana,L.C., Esona,M., Peret,T.C.T., Thornburg,N.J.	
954	OK649611	OK649611.1	OK649611	2008-XX-XX	South America	Brazil			Homo sapiens	2021-11-07		Wang et al		Wang,L., Ng,T.F.F., Castro,C.J., Marine,R.L., Magana,L.C., Esona,M., Peret,T.C.T., Thornburg,N.J.	
955	OK649612	OK649612.1	OK649612	2008-XX-XX	South America	Brazil			Homo sapiens	2021-11-07		Wang et al		Wang,L., Ng,T.F.F., Castro,C.J., Marine,R.L., Magana,L.C., Esona,M., Peret,T.C.T., Thornburg,N.J.	
956	OK649613	OK649613.1	OK649613	2008-XX-XX	South America	Brazil			Homo sapiens	2021-11-07		Wang et al		Wang,L., Ng,T.F.F., Castro,C.J., Marine,R.L., Magana,L.C., Esona,M., Peret,T.C.T., Thornburg,N.J.	
957	OK649614	OK649614.1	OK649614	2008-XX-XX	South America	Brazil			Homo sapiens	2021-11-07		Wang et al		Wang,L., Ng,T.F.F., Castro,C.J., Marine,R.L., Magana,L.C., Esona,M., Peret,T.C.T., Thornburg,N.J.	
958	OK649615	OK649615.1	OK649615	2008-XX-XX	South America	Brazil			Homo sapiens	2021-11-07		Wang et al		Wang,L., Ng,T.F.F., Castro,C.J., Marine,R.L., Magana,L.C., Esona,M., Peret,T.C.T., Thornburg,N.J.	
959	OK649616	OK649616.1	OK649616	2008-XX-XX	South America	Brazil			Homo sapiens	2021-11-07		Wang et al		Wang,L., Ng,T.F.F., Castro,C.J., Marine,R.L., Magana,L.C., Esona,M., Peret,T.C.T., Thornburg,N.J.	
960	OK649617	OK649617.1	OK649617	2008-XX-XX	South America	Brazil			Homo sapiens	2021-11-07		Wang et al		Wang,L., Ng,T.F.F., Castro,C.J., Marine,R.L., Magana,L.C., Esona,M., Peret,T.C.T., Thornburg,N.J.	
961	OK649618	OK649618.1	OK649618	2008-XX-XX	South America	Brazil			Homo sapiens	2021-11-07		Wang et al		Wang,L., Ng,T.F.F., Castro,C.J., Marine,R.L., Magana,L.C., Esona,M., Peret,T.C.T., Thornburg,N.J.	
962	OK649619	OK649619.1	OK649619	2008-XX-XX	South America	Brazil			Homo sapiens	2021-11-07		Wang et al		Wang,L., Ng,T.F.F., Castro,C.J., Marine,R.L., Magana,L.C., Esona,M., Peret,T.C.T., Thornburg,N.J.	
963	OK649620	OK649620.1	OK649620	2008-XX-XX	South America	Brazil			Homo sapiens	2021-11-07		Wang et al		Wang,L., Ng,T.F.F., Castro,C.J., Marine,R.L., Magana,L.C., Esona,M., Peret,T.C.T., Thornburg,N.J.	
964	OK649621	OK649621.1	OK649621	2008-XX-XX	South America	Brazil			Homo sapiens	2021-11-07		Wang et al		Wang,L., Ng,T.F.F., Castro,C.J., Marine,R.L., Magana,L.C., Esona,M., Peret,T.C.T., Thornburg,N.J.	
965	OK649622	OK649622.1	OK649622	2008-XX-XX	South America	Brazil			Homo sapiens	2021-11-07		Wang et al		Wang,L., Ng,T.F.F., Castro,C.J., Marine,R.L., Magana,L.C., Esona,M., Peret,T.C.T., Thornburg,N.J.	
966	OK649623	OK649623.1	OK649623	2008-XX-XX	South America	Brazil			Homo sapiens	2021-11-07		Wang et al		Wang,L., Ng,T.F.F., Castro,C.J., Marine,R.L., Magana,L.C., Esona,M., Peret,T.C.T., Thornburg,N.J.	
967	OK649624	OK649624.1	OK649624	2008-XX-XX	South America	Brazil			Homo sapiens	2021-11-07		Wang et al		Wang,L., Ng,T.F.F., Castro,C.J., Marine,R.L., Magana,L.C., Esona,M., Peret,T.C.T., Thornburg,N.J.	
968	OK649625	OK649625.1	OK649625	2008-XX-XX	South America	Brazil			Homo sapiens	2021-11-07		Wang et al		Wang,L., Ng,T.F.F., Castro,C.J., Marine,R.L., Magana,L.C., Esona,M., Peret,T.C.T., Thornburg,N.J.	
969	OK649626	OK649626.1	OK649626	2008-XX-XX	South America	Brazil			Homo sapiens	2021-11-07		Wang et al		Wang,L., Ng,T.F.F., Castro,C.J., Marine,R.L., Magana,L.C., Esona,M., Peret,T.C.T., Thornburg,N.J.	
970	OK649627	OK649627.1	OK649627	2008-XX-XX	South America	Brazil			Homo sapiens	2021-11-07		Wang et al		Wang,L., Ng,T.F.F., Castro,C.J., Marine,R.L., Magana,L.C., Esona,M., Peret,T.C.T., Thornburg,N.J.	
971	OK649628	OK649628.1	OK649628	2008-XX-XX	South America	Brazil			Homo sapiens	2021-11-07		Wang et al		Wang,L., Ng,T.F.F., Castro,C.J., Marine,R.L., Magana,L.C., Esona,M., Peret,T.C.T., Thornburg,N.J.	
972	OK649629	OK649629.1	OK649629	2008-XX-XX	South America	Brazil			Homo sapiens	2021-11-07		Wang et al		Wang,L., Ng,T.F.F., Castro,C.J., Marine,R.L., Magana,L.C., Esona,M., Peret,T.C.T., Thornburg,N.J.	
973	OK649630	OK649630.1	OK649630	2008-XX-XX	South America	Brazil			Homo sapiens	2021-11-07		Wang et al		Wang,L., Ng,T.F.F., Castro,C.J., Marine,R.L., Magana,L.C., Esona,M., Peret,T.C.T., Thornburg,N.J.	
974	OK649631	OK649631.1	OK649631	2008-XX-XX	South America	Brazil			Homo sapiens	2021-11-07		Wang et al		Wang,L., Ng,T.F.F., Castro,C.J., Marine,R.L., Magana,L.C., Esona,M., Peret,T.C.T., Thornburg,N.J.	
975	OK649632	OK649632.1	OK649632	2008-XX-XX	South America	Brazil			Homo sapiens	2021-11-07		Wang et al		Wang,L., Ng,T.F.F., Castro,C.J., Marine,R.L., Magana,L.C., Esona,M., Peret,T.C.T., Thornburg,N.J.	
976	OK649633	OK649633.1	OK649633	2008-XX-XX	South America	Brazil			Homo sapiens	2021-11-07		Wang et al		Wang,L., Ng,T.F.F., Castro,C.J., Marine,R.L., Magana,L.C., Esona,M., Peret,T.C.T., Thornburg,N.J.	
977	OK649634	OK649634.1	OK649634	2008-XX-XX	South America	Brazil			Homo sapiens	2021-11-07		Wang et al		Wang,L., Ng,T.F.F., Castro,C.J., Marine,R.L., Magana,L.C., Esona,M., Peret,T.C.T., Thornburg,N.J.	
978	OM962805	OM962805.1	Capiz.PHL/2008/003	2008-XX-XX	Asia	Philippines			Homo sapiens	2022-06-29		Calaor-Morin et al		Calaor-Morin,J., Arguelles,V.L., Foronda,J.L., Tan,A., Lagamayo,E., Dapat,C., Lupisan,S., Morin,J.C., Foronda,J.L.M.	
979	OM962824	OM962824.1	Cotabato.PHL/2008/004	2008-XX-XX	Asia	Philippines			Homo sapiens	2022-06-29		Calaor-Morin et al		Calaor-Morin,J., Arguelles,V.L., Foronda,J.L., Tan,A., Lagamayo,E., Dapat,C., Lupisan,S., Morin,J.C., Foronda,J.L.M.	
980	OM962825	OM962825.1	MetroManila.PHL/2008/006	2008-XX-XX	Asia	Philippines			Homo sapiens	2022-06-29		Calaor-Morin et al		Calaor-Morin,J., Arguelles,V.L., Foronda,J.L., Tan,A., Lagamayo,E., Dapat,C., Lupisan,S., Morin,J.C., Foronda,J.L.M.	
981	OM962826	OM962826.1	ZamboangaDS.PHL/2008/007	2008-XX-XX	Asia	Philippines			Homo sapiens	2022-06-29		Calaor-Morin et al		Calaor-Morin,J., Arguelles,V.L., Foronda,J.L., Tan,A., Lagamayo,E., Dapat,C., Lupisan,S., Morin,J.C., Foronda,J.L.M.	
982	OM962827	OM962827.1	Cotabato.PHL/2008/005	2008-XX-XX	Asia	Philippines			Homo sapiens	2022-06-29		Calaor-Morin et al		Calaor-Morin,J., Arguelles,V.L., Foronda,J.L., Tan,A., Lagamayo,E., Dapat,C., Lupisan,S., Morin,J.C., Foronda,J.L.M.	
983	KT765836	KT765836.1	KEN/Kilifi/722_09/01/2008	2008-01-09	Africa	Kenya			Homo sapiens	2016-02-27		Otieno et al		Otieno,J.R., Agoti,C.N., Gitahi,C.W., Bett,A., Ngama,M., Medley,G.F., Cane,P.A., Nokes,D.J., Nokes,J.D.	
984	MF445778	MF445778.1	MF445778	2008-01-13	Asia	China			Homo sapiens	2019-12-31		Su et al		Su,Y., Wu,Y., Tian,R., Liang,G.	
985	KT765506	KT765506.1	KEN/Kilifi/723_15/01/2008	2008-01-15	Africa	Kenya			Homo sapiens	2016-02-27		Otieno et al		Otieno,J.R., Agoti,C.N., Gitahi,C.W., Bett,A., Ngama,M., Medley,G.F., Cane,P.A., Nokes,D.J., Nokes,J.D.	
986	KF156377	KF156377.1	KF156377	2008-01-21	Africa	Kenya			Homo sapiens	2013-11-30		Agoti et al		Agoti,C.N., Mayieka,L.M., Otieno,J.R., Ahmed,J.A., Fields,B.S., Waiboci,L.W., Nyoka,R., Eidex,R.B., Marano,N., Burton,W., Montgomery,J.M., Breiman,R.F., Nokes,D.J., Mayieka,L., Fields,B., Waiboci,L.B., Eidex,R., Morano,N., Montgomery,J., Breiman,R.	
987	KT765532	KT765532.1	KEN/Kilifi/724_28/01/2008	2008-01-28	Africa	Kenya			Homo sapiens	2016-02-27		Otieno et al		Otieno,J.R., Agoti,C.N., Gitahi,C.W., Bett,A., Ngama,M., Medley,G.F., Cane,P.A., Nokes,D.J., Nokes,J.D.	
988	FR681622	FR681622.1	FR681622	2008-02-XX	Europe	France	Normandie			2010-09-07		Bellot et al		Bellot,A., Leroux,M., Vabret,A., Freymuth,F., Dina,J.	
989	FR681652	FR681652.1	FR681652	2008-02-XX	Europe	France	Normandie			2010-09-07		Bellot et al		Bellot,A., Leroux,M., Vabret,A., Freymuth,F., Dina,J.	
990	FR681680	FR681680.1	FR681680	2008-02-XX	Europe	France	Normandie			2010-09-07		Bellot et al		Bellot,A., Leroux,M., Vabret,A., Freymuth,F., Dina,J.	
991	FR681703	FR681703.1	FR681703	2008-02-XX	Europe	France	Normandie			2010-09-07		Bellot et al		Bellot,A., Leroux,M., Vabret,A., Freymuth,F., Dina,J.	
992	KT765510	KT765510.1	KEN/Kilifi/725_02/02/2008	2008-02-02	Africa	Kenya			Homo sapiens	2016-02-27		Otieno et al		Otieno,J.R., Agoti,C.N., Gitahi,C.W., Bett,A., Ngama,M., Medley,G.F., Cane,P.A., Nokes,D.J., Nokes,J.D.	
993	KF156341	KF156341.1	KF156341	2008-02-04	Africa	Kenya			Homo sapiens	2013-11-30		Agoti et al		Agoti,C.N., Mayieka,L.M., Otieno,J.R., Ahmed,J.A., Fields,B.S., Waiboci,L.W., Nyoka,R., Eidex,R.B., Marano,N., Burton,W., Montgomery,J.M., Breiman,R.F., Nokes,D.J., Mayieka,L., Fields,B., Waiboci,L.B., Eidex,R., Morano,N., Montgomery,J., Breiman,R.	
994	KT765504	KT765504.1	KEN/Kilifi/726_06/02/2008	2008-02-06	Africa	Kenya			Homo sapiens	2016-02-27		Otieno et al		Otieno,J.R., Agoti,C.N., Gitahi,C.W., Bett,A., Ngama,M., Medley,G.F., Cane,P.A., Nokes,D.J., Nokes,J.D.	
995	JN968325	JN968325.1	V08-2206709	2008-02-08	Asia	Hong Kong			Homo sapiens	2012-01-10		Mak et al		Mak,G.C., Lau,C.S., Chiu,D.M.Y., Lim,W.	
996	KT765691	KT765691.1	KEN/Kilifi/727_18/02/2008	2008-02-18	Africa	Kenya			Homo sapiens	2016-02-27		Otieno et al		Otieno,J.R., Agoti,C.N., Gitahi,C.W., Bett,A., Ngama,M., Medley,G.F., Cane,P.A., Nokes,D.J., Nokes,J.D.	
997	OK458603	OK458603.1	OK458603	2008-02-20	Africa	Kenya			Homo sapiens	2021-12-13		Wangui et al		Wangui,J.M., Nokes,J.D., Opot,B.H., Opanda,S.M., Agoti,C.N., Otieno,J.R., Bulimo,W.D.	
998	KF156342	KF156342.1	KF156342	2008-02-27	Africa	Kenya			Homo sapiens	2013-11-30		Agoti et al		Agoti,C.N., Mayieka,L.M., Otieno,J.R., Ahmed,J.A., Fields,B.S., Waiboci,L.W., Nyoka,R., Eidex,R.B., Marano,N., Burton,W., Montgomery,J.M., Breiman,R.F., Nokes,D.J., Mayieka,L., Fields,B., Waiboci,L.B., Eidex,R., Morano,N., Montgomery,J., Breiman,R.	
999	KT765690	KT765690.1	KEN/Kilifi/729_04/03/2008	2008-03-04	Africa	Kenya			Homo sapiens	2016-02-27		Otieno et al		Otieno,J.R., Agoti,C.N., Gitahi,C.W., Bett,A., Ngama,M., Medley,G.F., Cane,P.A., Nokes,D.J., Nokes,J.D.	
1000	OK458563	OK458563.1	OK458563	2008-03-04	Africa	Kenya			Homo sapiens	2021-12-13		Wangui et al		Wangui,J.M., Nokes,J.D., Opot,B.H., Opanda,S.M., Agoti,C.N., Otieno,J.R., Bulimo,W.D.	
1001	KT765524	KT765524.1	KEN/Kilifi/728_06/03/2008	2008-03-06	Africa	Kenya			Homo sapiens	2016-02-27		Otieno et al		Otieno,J.R., Agoti,C.N., Gitahi,C.W., Bett,A., Ngama,M., Medley,G.F., Cane,P.A., Nokes,D.J., Nokes,J.D.	
1002	OK458574	OK458574.1	OK458574	2008-03-07	Africa	Kenya			Homo sapiens	2021-12-13		Wangui et al		Wangui,J.M., Nokes,J.D., Opot,B.H., Opanda,S.M., Agoti,C.N., Otieno,J.R., Bulimo,W.D.	
1003	OK458582	OK458582.1	OK458582	2008-03-13	Africa	Kenya			Homo sapiens	2021-12-13		Wangui et al		Wangui,J.M., Nokes,J.D., Opot,B.H., Opanda,S.M., Agoti,C.N., Otieno,J.R., Bulimo,W.D.	
1004	OK458584	OK458584.1	OK458584	2008-03-13	Africa	Kenya			Homo sapiens	2021-12-13		Wangui et al		Wangui,J.M., Nokes,J.D., Opot,B.H., Opanda,S.M., Agoti,C.N., Otieno,J.R., Bulimo,W.D.	
1005	KT765489	KT765489.1	KEN/Kilifi/730_22/03/2008	2008-03-22	Africa	Kenya			Homo sapiens	2016-02-27		Otieno et al		Otieno,J.R., Agoti,C.N., Gitahi,C.W., Bett,A., Ngama,M., Medley,G.F., Cane,P.A., Nokes,D.J., Nokes,J.D.	
1006	FR681653	FR681653.1	FR681653	2008-04-XX	Europe	France	Normandie			2010-09-07		Bellot et al		Bellot,A., Leroux,M., Vabret,A., Freymuth,F., Dina,J.	
1007	FR681681	FR681681.1	FR681681	2008-04-XX	Europe	France	Normandie			2010-09-07		Bellot et al		Bellot,A., Leroux,M., Vabret,A., Freymuth,F., Dina,J.	
1008	FR681704	FR681704.1	FR681704	2008-04-XX	Europe	France	Normandie			2010-09-07		Bellot et al		Bellot,A., Leroux,M., Vabret,A., Freymuth,F., Dina,J.	
1009	OK458611	OK458611.1	OK458611	2008-04-01	Africa	Kenya			Homo sapiens	2021-12-13		Wangui et al		Wangui,J.M., Nokes,J.D., Opot,B.H., Opanda,S.M., Agoti,C.N., Otieno,J.R., Bulimo,W.D.	
1010	KF156378	KF156378.1	KF156378	2008-04-04	Africa	Kenya			Homo sapiens	2013-11-30		Agoti et al		Agoti,C.N., Mayieka,L.M., Otieno,J.R., Ahmed,J.A., Fields,B.S., Waiboci,L.W., Nyoka,R., Eidex,R.B., Marano,N., Burton,W., Montgomery,J.M., Breiman,R.F., Nokes,D.J., Mayieka,L., Fields,B., Waiboci,L.B., Eidex,R., Morano,N., Montgomery,J., Breiman,R.	
1011	JN968323	JN968323.1	V08-2220141	2008-04-06	Asia	Hong Kong			Homo sapiens	2012-01-10		Mak et al		Mak,G.C., Lau,C.S., Chiu,D.M.Y., Lim,W.	
1012	KF156343	KF156343.1	KF156343	2008-04-09	Africa	Kenya			Homo sapiens	2013-11-30		Agoti et al		Agoti,C.N., Mayieka,L.M., Otieno,J.R., Ahmed,J.A., Fields,B.S., Waiboci,L.W., Nyoka,R., Eidex,R.B., Marano,N., Burton,W., Montgomery,J.M., Breiman,R.F., Nokes,D.J., Mayieka,L., Fields,B., Waiboci,L.B., Eidex,R., Morano,N., Montgomery,J., Breiman,R.	
1013	OK458565	OK458565.1	OK458565	2008-04-11	Africa	Kenya			Homo sapiens	2021-12-13		Wangui et al		Wangui,J.M., Nokes,J.D., Opot,B.H., Opanda,S.M., Agoti,C.N., Otieno,J.R., Bulimo,W.D.	
1014	KT765512	KT765512.1	KEN/Kilifi/731_17/04/2008	2008-04-17	Africa	Kenya			Homo sapiens	2016-02-27		Otieno et al		Otieno,J.R., Agoti,C.N., Gitahi,C.W., Bett,A., Ngama,M., Medley,G.F., Cane,P.A., Nokes,D.J., Nokes,J.D.	
1015	OK458573	OK458573.1	OK458573	2008-04-22	Africa	Kenya			Homo sapiens	2021-12-13		Wangui et al		Wangui,J.M., Nokes,J.D., Opot,B.H., Opanda,S.M., Agoti,C.N., Otieno,J.R., Bulimo,W.D.	
1016	OK458572	OK458572.1	OK458572	2008-04-23	Africa	Kenya			Homo sapiens	2021-12-13		Wangui et al		Wangui,J.M., Nokes,J.D., Opot,B.H., Opanda,S.M., Agoti,C.N., Otieno,J.R., Bulimo,W.D.	
1017	OK458675	OK458675.1	OK458675	2008-04-25	Africa	Kenya			Homo sapiens	2021-12-13		Wangui et al		Wangui,J.M., Nokes,J.D., Opot,B.H., Opanda,S.M., Agoti,C.N., Otieno,J.R., Bulimo,W.D.	
1018	HQ699265	HQ699265.1	HQ699265	2008-05-XX	Asia	South Korea			Homo sapiens	2011-07-13		Baek et al		Baek,Y.H., Choi,E.H., Song,M.S., Pascua,P.N., Kwon,H.I., Park,S.J., Lee,J.H., Woo,S.I., Ahn,B.H., Han,H.S., Hahn,Y.S., Shin,K.S., Jang,H.L., Kim,S.Y., Choi,Y.K., Park,S.-J., Song,M.-S., Choi,Y.-K.	
1019	KF156379	KF156379.1	KF156379	2008-05-07	Africa	Kenya			Homo sapiens	2013-11-30		Agoti et al		Agoti,C.N., Mayieka,L.M., Otieno,J.R., Ahmed,J.A., Fields,B.S., Waiboci,L.W., Nyoka,R., Eidex,R.B., Marano,N., Burton,W., Montgomery,J.M., Breiman,R.F., Nokes,D.J., Mayieka,L., Fields,B., Waiboci,L.B., Eidex,R., Morano,N., Montgomery,J., Breiman,R.	
1020	OK458566	OK458566.1	OK458566	2008-05-08	Africa	Kenya			Homo sapiens	2021-12-13		Wangui et al		Wangui,J.M., Nokes,J.D., Opot,B.H., Opanda,S.M., Agoti,C.N., Otieno,J.R., Bulimo,W.D.	
1021	OK458678	OK458678.1	OK458678	2008-05-08	Africa	Kenya			Homo sapiens	2021-12-13		Wangui et al		Wangui,J.M., Nokes,J.D., Opot,B.H., Opanda,S.M., Agoti,C.N., Otieno,J.R., Bulimo,W.D.	
1022	KF156380	KF156380.1	KF156380	2008-05-14	Africa	Kenya			Homo sapiens	2013-11-30		Agoti et al		Agoti,C.N., Mayieka,L.M., Otieno,J.R., Ahmed,J.A., Fields,B.S., Waiboci,L.W., Nyoka,R., Eidex,R.B., Marano,N., Burton,W., Montgomery,J.M., Breiman,R.F., Nokes,D.J., Mayieka,L., Fields,B., Waiboci,L.B., Eidex,R., Morano,N., Montgomery,J., Breiman,R.	
1023	OK458672	OK458672.1	OK458672	2008-05-14	Africa	Kenya			Homo sapiens	2021-12-13		Wangui et al		Wangui,J.M., Nokes,J.D., Opot,B.H., Opanda,S.M., Agoti,C.N., Otieno,J.R., Bulimo,W.D.	
1024	OK458564	OK458564.1	OK458564	2008-05-20	Africa	Kenya			Homo sapiens	2021-12-13		Wangui et al		Wangui,J.M., Nokes,J.D., Opot,B.H., Opanda,S.M., Agoti,C.N., Otieno,J.R., Bulimo,W.D.	
1025	OK458607	OK458607.1	OK458607	2008-05-20	Africa	Kenya			Homo sapiens	2021-12-13		Wangui et al		Wangui,J.M., Nokes,J.D., Opot,B.H., Opanda,S.M., Agoti,C.N., Otieno,J.R., Bulimo,W.D.	
1026	OK458630	OK458630.1	OK458630	2008-05-26	Africa	Kenya			Homo sapiens	2021-12-13		Wangui et al		Wangui,J.M., Nokes,J.D., Opot,B.H., Opanda,S.M., Agoti,C.N., Otieno,J.R., Bulimo,W.D.	
1027	KF156344	KF156344.1	KF156344	2008-05-28	Africa	Kenya			Homo sapiens	2013-11-30		Agoti et al		Agoti,C.N., Mayieka,L.M., Otieno,J.R., Ahmed,J.A., Fields,B.S., Waiboci,L.W., Nyoka,R., Eidex,R.B., Marano,N., Burton,W., Montgomery,J.M., Breiman,R.F., Nokes,D.J., Mayieka,L., Fields,B., Waiboci,L.B., Eidex,R., Morano,N., Montgomery,J., Breiman,R.	
1028	KF156381	KF156381.1	KF156381	2008-05-28	Africa	Kenya			Homo sapiens	2013-11-30		Agoti et al		Agoti,C.N., Mayieka,L.M., Otieno,J.R., Ahmed,J.A., Fields,B.S., Waiboci,L.W., Nyoka,R., Eidex,R.B., Marano,N., Burton,W., Montgomery,J.M., Breiman,R.F., Nokes,D.J., Mayieka,L., Fields,B., Waiboci,L.B., Eidex,R., Morano,N., Montgomery,J., Breiman,R.	
1029	OK458567	OK458567.1	OK458567	2008-05-28	Africa	Kenya			Homo sapiens	2021-12-13		Wangui et al		Wangui,J.M., Nokes,J.D., Opot,B.H., Opanda,S.M., Agoti,C.N., Otieno,J.R., Bulimo,W.D.	
1030	KF156382	KF156382.1	KF156382	2008-06-02	Africa	Kenya			Homo sapiens	2013-11-30		Agoti et al		Agoti,C.N., Mayieka,L.M., Otieno,J.R., Ahmed,J.A., Fields,B.S., Waiboci,L.W., Nyoka,R., Eidex,R.B., Marano,N., Burton,W., Montgomery,J.M., Breiman,R.F., Nokes,D.J., Mayieka,L., Fields,B., Waiboci,L.B., Eidex,R., Morano,N., Montgomery,J., Breiman,R.	
1031	OK458568	OK458568.1	OK458568	2008-06-03	Africa	Kenya			Homo sapiens	2021-12-13		Wangui et al		Wangui,J.M., Nokes,J.D., Opot,B.H., Opanda,S.M., Agoti,C.N., Otieno,J.R., Bulimo,W.D.	
1032	OK458673	OK458673.1	OK458673	2008-06-12	Africa	Kenya			Homo sapiens	2021-12-13		Wangui et al		Wangui,J.M., Nokes,J.D., Opot,B.H., Opanda,S.M., Agoti,C.N., Otieno,J.R., Bulimo,W.D.	
1033	KF156383	KF156383.1	KF156383	2008-06-16	Africa	Kenya			Homo sapiens	2013-11-30		Agoti et al		Agoti,C.N., Mayieka,L.M., Otieno,J.R., Ahmed,J.A., Fields,B.S., Waiboci,L.W., Nyoka,R., Eidex,R.B., Marano,N., Burton,W., Montgomery,J.M., Breiman,R.F., Nokes,D.J., Mayieka,L., Fields,B., Waiboci,L.B., Eidex,R., Morano,N., Montgomery,J., Breiman,R.	
1034	KF156384	KF156384.1	KF156384	2008-06-16	Africa	Kenya			Homo sapiens	2013-11-30		Agoti et al		Agoti,C.N., Mayieka,L.M., Otieno,J.R., Ahmed,J.A., Fields,B.S., Waiboci,L.W., Nyoka,R., Eidex,R.B., Marano,N., Burton,W., Montgomery,J.M., Breiman,R.F., Nokes,D.J., Mayieka,L., Fields,B., Waiboci,L.B., Eidex,R., Morano,N., Montgomery,J., Breiman,R.	
1035	KF156385	KF156385.1	KF156385	2008-06-16	Africa	Kenya			Homo sapiens	2013-11-30		Agoti et al		Agoti,C.N., Mayieka,L.M., Otieno,J.R., Ahmed,J.A., Fields,B.S., Waiboci,L.W., Nyoka,R., Eidex,R.B., Marano,N., Burton,W., Montgomery,J.M., Breiman,R.F., Nokes,D.J., Mayieka,L., Fields,B., Waiboci,L.B., Eidex,R., Morano,N., Montgomery,J., Breiman,R.	
1036	OK458571	OK458571.1	OK458571	2008-06-17	Africa	Kenya			Homo sapiens	2021-12-13		Wangui et al		Wangui,J.M., Nokes,J.D., Opot,B.H., Opanda,S.M., Agoti,C.N., Otieno,J.R., Bulimo,W.D.	
1037	OK458677	OK458677.1	OK458677	2008-06-17	Africa	Kenya			Homo sapiens	2021-12-13		Wangui et al		Wangui,J.M., Nokes,J.D., Opot,B.H., Opanda,S.M., Agoti,C.N., Otieno,J.R., Bulimo,W.D.	
1038	OK458614	OK458614.1	OK458614	2008-06-19	Africa	Kenya			Homo sapiens	2021-12-13		Wangui et al		Wangui,J.M., Nokes,J.D., Opot,B.H., Opanda,S.M., Agoti,C.N., Otieno,J.R., Bulimo,W.D.	
1039	KT765488	KT765488.1	KEN/Kilifi/732_30/06/2008	2008-06-30	Africa	Kenya			Homo sapiens	2016-02-27		Otieno et al		Otieno,J.R., Agoti,C.N., Gitahi,C.W., Bett,A., Ngama,M., Medley,G.F., Cane,P.A., Nokes,D.J., Nokes,J.D.	
1040	OK458615	OK458615.1	OK458615	2008-06-30	Africa	Kenya			Homo sapiens	2021-12-13		Wangui et al		Wangui,J.M., Nokes,J.D., Opot,B.H., Opanda,S.M., Agoti,C.N., Otieno,J.R., Bulimo,W.D.	
1041	OK458640	OK458640.1	OK458640	2008-07-01	Africa	Kenya			Homo sapiens	2021-12-13		Wangui et al		Wangui,J.M., Nokes,J.D., Opot,B.H., Opanda,S.M., Agoti,C.N., Otieno,J.R., Bulimo,W.D.	
1042	OK458569	OK458569.1	OK458569	2008-07-11	Africa	Kenya			Homo sapiens	2021-12-13		Wangui et al		Wangui,J.M., Nokes,J.D., Opot,B.H., Opanda,S.M., Agoti,C.N., Otieno,J.R., Bulimo,W.D.	
1043	KF156386	KF156386.1	KF156386	2008-07-21	Africa	Kenya			Homo sapiens	2013-11-30		Agoti et al		Agoti,C.N., Mayieka,L.M., Otieno,J.R., Ahmed,J.A., Fields,B.S., Waiboci,L.W., Nyoka,R., Eidex,R.B., Marano,N., Burton,W., Montgomery,J.M., Breiman,R.F., Nokes,D.J., Mayieka,L., Fields,B., Waiboci,L.B., Eidex,R., Morano,N., Montgomery,J., Breiman,R.	
1044	KF156387	KF156387.1	KF156387	2008-07-23	Africa	Kenya			Homo sapiens	2013-11-30		Agoti et al		Agoti,C.N., Mayieka,L.M., Otieno,J.R., Ahmed,J.A., Fields,B.S., Waiboci,L.W., Nyoka,R., Eidex,R.B., Marano,N., Burton,W., Montgomery,J.M., Breiman,R.F., Nokes,D.J., Mayieka,L., Fields,B., Waiboci,L.B., Eidex,R., Morano,N., Montgomery,J., Breiman,R.	
1045	JN968324	JN968324.1	V08-2242908	2008-08-01	Asia	Hong Kong			Homo sapiens	2012-01-10		Mak et al		Mak,G.C., Lau,C.S., Chiu,D.M.Y., Lim,W.	
1046	KF156388	KF156388.1	KF156388	2008-08-04	Africa	Kenya			Homo sapiens	2013-11-30		Agoti et al		Agoti,C.N., Mayieka,L.M., Otieno,J.R., Ahmed,J.A., Fields,B.S., Waiboci,L.W., Nyoka,R., Eidex,R.B., Marano,N., Burton,W., Montgomery,J.M., Breiman,R.F., Nokes,D.J., Mayieka,L., Fields,B., Waiboci,L.B., Eidex,R., Morano,N., Montgomery,J., Breiman,R.	
1047	OK458583	OK458583.1	OK458583	2008-08-04	Africa	Kenya			Homo sapiens	2021-12-13		Wangui et al		Wangui,J.M., Nokes,J.D., Opot,B.H., Opanda,S.M., Agoti,C.N., Otieno,J.R., Bulimo,W.D.	
1048	KF156345	KF156345.1	KF156345	2008-08-06	Africa	Kenya			Homo sapiens	2013-11-30		Agoti et al		Agoti,C.N., Mayieka,L.M., Otieno,J.R., Ahmed,J.A., Fields,B.S., Waiboci,L.W., Nyoka,R., Eidex,R.B., Marano,N., Burton,W., Montgomery,J.M., Breiman,R.F., Nokes,D.J., Mayieka,L., Fields,B., Waiboci,L.B., Eidex,R., Morano,N., Montgomery,J., Breiman,R.	
1049	KF156389	KF156389.1	KF156389	2008-08-06	Africa	Kenya			Homo sapiens	2013-11-30		Agoti et al		Agoti,C.N., Mayieka,L.M., Otieno,J.R., Ahmed,J.A., Fields,B.S., Waiboci,L.W., Nyoka,R., Eidex,R.B., Marano,N., Burton,W., Montgomery,J.M., Breiman,R.F., Nokes,D.J., Mayieka,L., Fields,B., Waiboci,L.B., Eidex,R., Morano,N., Montgomery,J., Breiman,R.	
1050	OK458606	OK458606.1	OK458606	2008-08-10	Africa	Kenya			Homo sapiens	2021-12-13		Wangui et al		Wangui,J.M., Nokes,J.D., Opot,B.H., Opanda,S.M., Agoti,C.N., Otieno,J.R., Bulimo,W.D.	
1051	KF156390	KF156390.1	KF156390	2008-08-11	Africa	Kenya			Homo sapiens	2013-11-30		Agoti et al		Agoti,C.N., Mayieka,L.M., Otieno,J.R., Ahmed,J.A., Fields,B.S., Waiboci,L.W., Nyoka,R., Eidex,R.B., Marano,N., Burton,W., Montgomery,J.M., Breiman,R.F., Nokes,D.J., Mayieka,L., Fields,B., Waiboci,L.B., Eidex,R., Morano,N., Montgomery,J., Breiman,R.	
1052	KF156391	KF156391.1	KF156391	2008-08-11	Africa	Kenya			Homo sapiens	2013-11-30		Agoti et al		Agoti,C.N., Mayieka,L.M., Otieno,J.R., Ahmed,J.A., Fields,B.S., Waiboci,L.W., Nyoka,R., Eidex,R.B., Marano,N., Burton,W., Montgomery,J.M., Breiman,R.F., Nokes,D.J., Mayieka,L., Fields,B., Waiboci,L.B., Eidex,R., Morano,N., Montgomery,J., Breiman,R.	
1053	KF156392	KF156392.1	KF156392	2008-08-11	Africa	Kenya			Homo sapiens	2013-11-30		Agoti et al		Agoti,C.N., Mayieka,L.M., Otieno,J.R., Ahmed,J.A., Fields,B.S., Waiboci,L.W., Nyoka,R., Eidex,R.B., Marano,N., Burton,W., Montgomery,J.M., Breiman,R.F., Nokes,D.J., Mayieka,L., Fields,B., Waiboci,L.B., Eidex,R., Morano,N., Montgomery,J., Breiman,R.	
1054	OK458570	OK458570.1	OK458570	2008-08-14	Africa	Kenya			Homo sapiens	2021-12-13		Wangui et al		Wangui,J.M., Nokes,J.D., Opot,B.H., Opanda,S.M., Agoti,C.N., Otieno,J.R., Bulimo,W.D.	
1055	OK458602	OK458602.1	OK458602	2008-08-20	Africa	Kenya			Homo sapiens	2021-12-13		Wangui et al		Wangui,J.M., Nokes,J.D., Opot,B.H., Opanda,S.M., Agoti,C.N., Otieno,J.R., Bulimo,W.D.	
1056	OK458632	OK458632.1	OK458632	2008-08-21	Africa	Kenya			Homo sapiens	2021-12-13		Wangui et al		Wangui,J.M., Nokes,J.D., Opot,B.H., Opanda,S.M., Agoti,C.N., Otieno,J.R., Bulimo,W.D.	
1057	KF156393	KF156393.1	KF156393	2008-08-25	Africa	Kenya			Homo sapiens	2013-11-30		Agoti et al		Agoti,C.N., Mayieka,L.M., Otieno,J.R., Ahmed,J.A., Fields,B.S., Waiboci,L.W., Nyoka,R., Eidex,R.B., Marano,N., Burton,W., Montgomery,J.M., Breiman,R.F., Nokes,D.J., Mayieka,L., Fields,B., Waiboci,L.B., Eidex,R., Morano,N., Montgomery,J., Breiman,R.	
1058	OK664827	OK664827.1	VR/2008/0408	2008-08-30	Africa	Senegal			Homo sapiens	2022-01-19		Fall A et al		Fall A, Elawar F, Hodcroft EB, Jallow MM, Toure CT, Barry MA, Kiori DE, Sy S, Diaw Y, Goudiaby D, Niang MN, Dia N, Fall,A., Jallow,M.M., Toure,C.T., Kiori,D.E., sy,S., Diaw,Y., Goudiaby,D., Niang,M.N., Dia,N.	
1059	HQ699282	HQ699282.1	HQ699282	2008-09-XX	Asia	South Korea			Homo sapiens	2011-07-13		Baek et al		Baek,Y.H., Choi,E.H., Song,M.S., Pascua,P.N., Kwon,H.I., Park,S.J., Lee,J.H., Woo,S.I., Ahn,B.H., Han,H.S., Hahn,Y.S., Shin,K.S., Jang,H.L., Kim,S.Y., Choi,Y.K., Park,S.-J., Song,M.-S., Choi,Y.-K.	
1060	KF156346	KF156346.1	KF156346	2008-09-10	Africa	Kenya			Homo sapiens	2013-11-30		Agoti et al		Agoti,C.N., Mayieka,L.M., Otieno,J.R., Ahmed,J.A., Fields,B.S., Waiboci,L.W., Nyoka,R., Eidex,R.B., Marano,N., Burton,W., Montgomery,J.M., Breiman,R.F., Nokes,D.J., Mayieka,L., Fields,B., Waiboci,L.B., Eidex,R., Morano,N., Montgomery,J., Breiman,R.	
1061	KF156347	KF156347.1	KF156347	2008-09-10	Africa	Kenya			Homo sapiens	2013-11-30		Agoti et al		Agoti,C.N., Mayieka,L.M., Otieno,J.R., Ahmed,J.A., Fields,B.S., Waiboci,L.W., Nyoka,R., Eidex,R.B., Marano,N., Burton,W., Montgomery,J.M., Breiman,R.F., Nokes,D.J., Mayieka,L., Fields,B., Waiboci,L.B., Eidex,R., Morano,N., Montgomery,J., Breiman,R.	
1062	KF156348	KF156348.1	KF156348	2008-09-17	Africa	Kenya			Homo sapiens	2013-11-30		Agoti et al		Agoti,C.N., Mayieka,L.M., Otieno,J.R., Ahmed,J.A., Fields,B.S., Waiboci,L.W., Nyoka,R., Eidex,R.B., Marano,N., Burton,W., Montgomery,J.M., Breiman,R.F., Nokes,D.J., Mayieka,L., Fields,B., Waiboci,L.B., Eidex,R., Morano,N., Montgomery,J., Breiman,R.	
1063	OK664828	OK664828.1	VR/2008/0554	2008-09-23	Africa	Senegal			Homo sapiens	2022-01-19		Fall A et al		Fall A, Elawar F, Hodcroft EB, Jallow MM, Toure CT, Barry MA, Kiori DE, Sy S, Diaw Y, Goudiaby D, Niang MN, Dia N, Fall,A., Jallow,M.M., Toure,C.T., Kiori,D.E., sy,S., Diaw,Y., Goudiaby,D., Niang,M.N., Dia,N.	
1064	OK458601	OK458601.1	OK458601	2008-09-24	Africa	Kenya			Homo sapiens	2021-12-13		Wangui et al		Wangui,J.M., Nokes,J.D., Opot,B.H., Opanda,S.M., Agoti,C.N., Otieno,J.R., Bulimo,W.D.	
1065	OK458621	OK458621.1	OK458621	2008-10-21	Africa	Kenya			Homo sapiens	2021-12-13		Wangui et al		Wangui,J.M., Nokes,J.D., Opot,B.H., Opanda,S.M., Agoti,C.N., Otieno,J.R., Bulimo,W.D.	
1066	OK458586	OK458586.1	OK458586	2008-10-24	Africa	Kenya			Homo sapiens	2021-12-13		Wangui et al		Wangui,J.M., Nokes,J.D., Opot,B.H., Opanda,S.M., Agoti,C.N., Otieno,J.R., Bulimo,W.D.	
1067	OK458576	OK458576.1	OK458576	2008-10-30	Africa	Kenya			Homo sapiens	2021-12-13		Wangui et al		Wangui,J.M., Nokes,J.D., Opot,B.H., Opanda,S.M., Agoti,C.N., Otieno,J.R., Bulimo,W.D.	
1068	FR681623	FR681623.1	FR681623	2008-11-XX	Europe	France	Normandie			2010-09-07		Bellot et al		Bellot,A., Leroux,M., Vabret,A., Freymuth,F., Dina,J.	
1069	FR681654	FR681654.1	FR681654	2008-11-XX	Europe	France	Normandie			2010-09-07		Bellot et al		Bellot,A., Leroux,M., Vabret,A., Freymuth,F., Dina,J.	
1070	FR681655	FR681655.1	FR681655	2008-11-XX	Europe	France	Normandie			2010-09-07		Bellot et al		Bellot,A., Leroux,M., Vabret,A., Freymuth,F., Dina,J.	
1071	FR681705	FR681705.1	FR681705	2008-11-XX	Europe	France	Normandie			2010-09-07		Bellot et al		Bellot,A., Leroux,M., Vabret,A., Freymuth,F., Dina,J.	
1072	HQ699266	HQ699266.1	HQ699266	2008-11-XX	Asia	South Korea			Homo sapiens	2011-07-13		Baek et al		Baek,Y.H., Choi,E.H., Song,M.S., Pascua,P.N., Kwon,H.I., Park,S.J., Lee,J.H., Woo,S.I., Ahn,B.H., Han,H.S., Hahn,Y.S., Shin,K.S., Jang,H.L., Kim,S.Y., Choi,Y.K., Park,S.-J., Song,M.-S., Choi,Y.-K.	
1073	HQ699267	HQ699267.1	HQ699267	2008-11-XX	Asia	South Korea			Homo sapiens	2011-07-13		Baek et al		Baek,Y.H., Choi,E.H., Song,M.S., Pascua,P.N., Kwon,H.I., Park,S.J., Lee,J.H., Woo,S.I., Ahn,B.H., Han,H.S., Hahn,Y.S., Shin,K.S., Jang,H.L., Kim,S.Y., Choi,Y.K., Park,S.-J., Song,M.-S., Choi,Y.-K.	
1074	HQ699268	HQ699268.1	HQ699268	2008-11-XX	Asia	South Korea			Homo sapiens	2011-07-13		Baek et al		Baek,Y.H., Choi,E.H., Song,M.S., Pascua,P.N., Kwon,H.I., Park,S.J., Lee,J.H., Woo,S.I., Ahn,B.H., Han,H.S., Hahn,Y.S., Shin,K.S., Jang,H.L., Kim,S.Y., Choi,Y.K., Park,S.-J., Song,M.-S., Choi,Y.-K.	
1075	MF445965	MF445965.1	MF445965	2008-11-03	Asia	China			Homo sapiens	2019-12-31		Su et al		Su,Y., Wu,Y., Tian,R., Liang,G.	
1076	OK458585	OK458585.1	OK458585	2008-11-14	Africa	Kenya			Homo sapiens	2021-12-13		Wangui et al		Wangui,J.M., Nokes,J.D., Opot,B.H., Opanda,S.M., Agoti,C.N., Otieno,J.R., Bulimo,W.D.	
1077	KF156394	KF156394.1	KF156394	2008-11-15	Africa	Kenya			Homo sapiens	2013-11-30		Agoti et al		Agoti,C.N., Mayieka,L.M., Otieno,J.R., Ahmed,J.A., Fields,B.S., Waiboci,L.W., Nyoka,R., Eidex,R.B., Marano,N., Burton,W., Montgomery,J.M., Breiman,R.F., Nokes,D.J., Mayieka,L., Fields,B., Waiboci,L.B., Eidex,R., Morano,N., Montgomery,J., Breiman,R.	
1078	KF156395	KF156395.1	KF156395	2008-11-15	Africa	Kenya			Homo sapiens	2013-11-30		Agoti et al		Agoti,C.N., Mayieka,L.M., Otieno,J.R., Ahmed,J.A., Fields,B.S., Waiboci,L.W., Nyoka,R., Eidex,R.B., Marano,N., Burton,W., Montgomery,J.M., Breiman,R.F., Nokes,D.J., Mayieka,L., Fields,B., Waiboci,L.B., Eidex,R., Morano,N., Montgomery,J., Breiman,R.	
1079	KF156349	KF156349.1	KF156349	2008-11-17	Africa	Kenya			Homo sapiens	2013-11-30		Agoti et al		Agoti,C.N., Mayieka,L.M., Otieno,J.R., Ahmed,J.A., Fields,B.S., Waiboci,L.W., Nyoka,R., Eidex,R.B., Marano,N., Burton,W., Montgomery,J.M., Breiman,R.F., Nokes,D.J., Mayieka,L., Fields,B., Waiboci,L.B., Eidex,R., Morano,N., Montgomery,J., Breiman,R.	
1080	KF156396	KF156396.1	KF156396	2008-11-17	Africa	Kenya			Homo sapiens	2013-11-30		Agoti et al		Agoti,C.N., Mayieka,L.M., Otieno,J.R., Ahmed,J.A., Fields,B.S., Waiboci,L.W., Nyoka,R., Eidex,R.B., Marano,N., Burton,W., Montgomery,J.M., Breiman,R.F., Nokes,D.J., Mayieka,L., Fields,B., Waiboci,L.B., Eidex,R., Morano,N., Montgomery,J., Breiman,R.	
1081	KF156397	KF156397.1	KF156397	2008-11-18	Africa	Kenya			Homo sapiens	2013-11-30		Agoti et al		Agoti,C.N., Mayieka,L.M., Otieno,J.R., Ahmed,J.A., Fields,B.S., Waiboci,L.W., Nyoka,R., Eidex,R.B., Marano,N., Burton,W., Montgomery,J.M., Breiman,R.F., Nokes,D.J., Mayieka,L., Fields,B., Waiboci,L.B., Eidex,R., Morano,N., Montgomery,J., Breiman,R.	
1082	KF156398	KF156398.1	KF156398	2008-11-19	Africa	Kenya			Homo sapiens	2013-11-30		Agoti et al		Agoti,C.N., Mayieka,L.M., Otieno,J.R., Ahmed,J.A., Fields,B.S., Waiboci,L.W., Nyoka,R., Eidex,R.B., Marano,N., Burton,W., Montgomery,J.M., Breiman,R.F., Nokes,D.J., Mayieka,L., Fields,B., Waiboci,L.B., Eidex,R., Morano,N., Montgomery,J., Breiman,R.	
1083	KF156399	KF156399.1	KF156399	2008-11-19	Africa	Kenya			Homo sapiens	2013-11-30		Agoti et al		Agoti,C.N., Mayieka,L.M., Otieno,J.R., Ahmed,J.A., Fields,B.S., Waiboci,L.W., Nyoka,R., Eidex,R.B., Marano,N., Burton,W., Montgomery,J.M., Breiman,R.F., Nokes,D.J., Mayieka,L., Fields,B., Waiboci,L.B., Eidex,R., Morano,N., Montgomery,J., Breiman,R.	
1084	KF156400	KF156400.1	KF156400	2008-11-22	Africa	Kenya			Homo sapiens	2013-11-30		Agoti et al		Agoti,C.N., Mayieka,L.M., Otieno,J.R., Ahmed,J.A., Fields,B.S., Waiboci,L.W., Nyoka,R., Eidex,R.B., Marano,N., Burton,W., Montgomery,J.M., Breiman,R.F., Nokes,D.J., Mayieka,L., Fields,B., Waiboci,L.B., Eidex,R., Morano,N., Montgomery,J., Breiman,R.	
1085	KF156401	KF156401.1	KF156401	2008-11-24	Africa	Kenya			Homo sapiens	2013-11-30		Agoti et al		Agoti,C.N., Mayieka,L.M., Otieno,J.R., Ahmed,J.A., Fields,B.S., Waiboci,L.W., Nyoka,R., Eidex,R.B., Marano,N., Burton,W., Montgomery,J.M., Breiman,R.F., Nokes,D.J., Mayieka,L., Fields,B., Waiboci,L.B., Eidex,R., Morano,N., Montgomery,J., Breiman,R.	
1086	KF156402	KF156402.1	KF156402	2008-11-24	Africa	Kenya			Homo sapiens	2013-11-30		Agoti et al		Agoti,C.N., Mayieka,L.M., Otieno,J.R., Ahmed,J.A., Fields,B.S., Waiboci,L.W., Nyoka,R., Eidex,R.B., Marano,N., Burton,W., Montgomery,J.M., Breiman,R.F., Nokes,D.J., Mayieka,L., Fields,B., Waiboci,L.B., Eidex,R., Morano,N., Montgomery,J., Breiman,R.	
1087	OK458577	OK458577.1	OK458577	2008-11-24	Africa	Kenya			Homo sapiens	2021-12-13		Wangui et al		Wangui,J.M., Nokes,J.D., Opot,B.H., Opanda,S.M., Agoti,C.N., Otieno,J.R., Bulimo,W.D.	
1088	OK458588	OK458588.1	OK458588	2008-11-24	Africa	Kenya			Homo sapiens	2021-12-13		Wangui et al		Wangui,J.M., Nokes,J.D., Opot,B.H., Opanda,S.M., Agoti,C.N., Otieno,J.R., Bulimo,W.D.	
1089	KF156350	KF156350.1	KF156350	2008-11-25	Africa	Kenya			Homo sapiens	2013-11-30		Agoti et al		Agoti,C.N., Mayieka,L.M., Otieno,J.R., Ahmed,J.A., Fields,B.S., Waiboci,L.W., Nyoka,R., Eidex,R.B., Marano,N., Burton,W., Montgomery,J.M., Breiman,R.F., Nokes,D.J., Mayieka,L., Fields,B., Waiboci,L.B., Eidex,R., Morano,N., Montgomery,J., Breiman,R.	
1090	KF156403	KF156403.1	KF156403	2008-11-25	Africa	Kenya			Homo sapiens	2013-11-30		Agoti et al		Agoti,C.N., Mayieka,L.M., Otieno,J.R., Ahmed,J.A., Fields,B.S., Waiboci,L.W., Nyoka,R., Eidex,R.B., Marano,N., Burton,W., Montgomery,J.M., Breiman,R.F., Nokes,D.J., Mayieka,L., Fields,B., Waiboci,L.B., Eidex,R., Morano,N., Montgomery,J., Breiman,R.	
1091	KF156404	KF156404.1	KF156404	2008-11-25	Africa	Kenya			Homo sapiens	2013-11-30		Agoti et al		Agoti,C.N., Mayieka,L.M., Otieno,J.R., Ahmed,J.A., Fields,B.S., Waiboci,L.W., Nyoka,R., Eidex,R.B., Marano,N., Burton,W., Montgomery,J.M., Breiman,R.F., Nokes,D.J., Mayieka,L., Fields,B., Waiboci,L.B., Eidex,R., Morano,N., Montgomery,J., Breiman,R.	
1092	KT765490	KT765490.1	KEN/Kilifi/733_27/11/2008	2008-11-27	Africa	Kenya			Homo sapiens	2016-02-27		Otieno et al		Otieno,J.R., Agoti,C.N., Gitahi,C.W., Bett,A., Ngama,M., Medley,G.F., Cane,P.A., Nokes,D.J., Nokes,J.D.	
1093	OK458618	OK458618.1	OK458618	2008-11-27	Africa	Kenya			Homo sapiens	2021-12-13		Wangui et al		Wangui,J.M., Nokes,J.D., Opot,B.H., Opanda,S.M., Agoti,C.N., Otieno,J.R., Bulimo,W.D.	
1094	KF156405	KF156405.1	KF156405	2008-11-28	Africa	Kenya			Homo sapiens	2013-11-30		Agoti et al		Agoti,C.N., Mayieka,L.M., Otieno,J.R., Ahmed,J.A., Fields,B.S., Waiboci,L.W., Nyoka,R., Eidex,R.B., Marano,N., Burton,W., Montgomery,J.M., Breiman,R.F., Nokes,D.J., Mayieka,L., Fields,B., Waiboci,L.B., Eidex,R., Morano,N., Montgomery,J., Breiman,R.	
1095	KF156406	KF156406.1	KF156406	2008-11-29	Africa	Kenya			Homo sapiens	2013-11-30		Agoti et al		Agoti,C.N., Mayieka,L.M., Otieno,J.R., Ahmed,J.A., Fields,B.S., Waiboci,L.W., Nyoka,R., Eidex,R.B., Marano,N., Burton,W., Montgomery,J.M., Breiman,R.F., Nokes,D.J., Mayieka,L., Fields,B., Waiboci,L.B., Eidex,R., Morano,N., Montgomery,J., Breiman,R.	
1096	FR681624	FR681624.1	FR681624	2008-12-XX	Europe	France	Normandie			2010-09-07		Bellot et al		Bellot,A., Leroux,M., Vabret,A., Freymuth,F., Dina,J.	
1097	FR681625	FR681625.1	FR681625	2008-12-XX	Europe	France	Normandie			2010-09-07		Bellot et al		Bellot,A., Leroux,M., Vabret,A., Freymuth,F., Dina,J.	
1098	FR681626	FR681626.1	FR681626	2008-12-XX	Europe	France	Normandie			2010-09-07		Bellot et al		Bellot,A., Leroux,M., Vabret,A., Freymuth,F., Dina,J.	
1099	FR681627	FR681627.1	FR681627	2008-12-XX	Europe	France	Normandie			2010-09-07		Bellot et al		Bellot,A., Leroux,M., Vabret,A., Freymuth,F., Dina,J.	
1100	FR681656	FR681656.1	FR681656	2008-12-XX	Europe	France	Normandie			2010-09-07		Bellot et al		Bellot,A., Leroux,M., Vabret,A., Freymuth,F., Dina,J.	
1101	FR681657	FR681657.1	FR681657	2008-12-XX	Europe	France	Normandie			2010-09-07		Bellot et al		Bellot,A., Leroux,M., Vabret,A., Freymuth,F., Dina,J.	
1102	FR681658	FR681658.1	FR681658	2008-12-XX	Europe	France	Normandie			2010-09-07		Bellot et al		Bellot,A., Leroux,M., Vabret,A., Freymuth,F., Dina,J.	
1103	FR681659	FR681659.1	FR681659	2008-12-XX	Europe	France	Normandie			2010-09-07		Bellot et al		Bellot,A., Leroux,M., Vabret,A., Freymuth,F., Dina,J.	
1104	FR681682	FR681682.1	FR681682	2008-12-XX	Europe	France	Normandie			2010-09-07		Bellot et al		Bellot,A., Leroux,M., Vabret,A., Freymuth,F., Dina,J.	
1105	FR681683	FR681683.1	FR681683	2008-12-XX	Europe	France	Normandie			2010-09-07		Bellot et al		Bellot,A., Leroux,M., Vabret,A., Freymuth,F., Dina,J.	
1106	FR681684	FR681684.1	FR681684	2008-12-XX	Europe	France	Normandie			2010-09-07		Bellot et al		Bellot,A., Leroux,M., Vabret,A., Freymuth,F., Dina,J.	
1107	FR681685	FR681685.1	FR681685	2008-12-XX	Europe	France	Normandie			2010-09-07		Bellot et al		Bellot,A., Leroux,M., Vabret,A., Freymuth,F., Dina,J.	
1108	FR681706	FR681706.1	FR681706	2008-12-XX	Europe	France	Normandie			2010-09-07		Bellot et al		Bellot,A., Leroux,M., Vabret,A., Freymuth,F., Dina,J.	
1109	FR681707	FR681707.1	FR681707	2008-12-XX	Europe	France	Normandie			2010-09-07		Bellot et al		Bellot,A., Leroux,M., Vabret,A., Freymuth,F., Dina,J.	
1110	FR681708	FR681708.1	FR681708	2008-12-XX	Europe	France	Normandie			2010-09-07		Bellot et al		Bellot,A., Leroux,M., Vabret,A., Freymuth,F., Dina,J.	
1111	FR681709	FR681709.1	FR681709	2008-12-XX	Europe	France	Normandie			2010-09-07		Bellot et al		Bellot,A., Leroux,M., Vabret,A., Freymuth,F., Dina,J.	
1112	FR681710	FR681710.1	FR681710	2008-12-XX	Europe	France	Normandie			2010-09-07		Bellot et al		Bellot,A., Leroux,M., Vabret,A., Freymuth,F., Dina,J.	
1113	JN968299	JN968299.1	V08-2265345	2008-12-01	Asia	Hong Kong			Homo sapiens	2012-01-10		Mak et al		Mak,G.C., Lau,C.S., Chiu,D.M.Y., Lim,W.	
1114	KF156351	KF156351.1	KF156351	2008-12-01	Africa	Kenya			Homo sapiens	2013-11-30		Agoti et al		Agoti,C.N., Mayieka,L.M., Otieno,J.R., Ahmed,J.A., Fields,B.S., Waiboci,L.W., Nyoka,R., Eidex,R.B., Marano,N., Burton,W., Montgomery,J.M., Breiman,R.F., Nokes,D.J., Mayieka,L., Fields,B., Waiboci,L.B., Eidex,R., Morano,N., Montgomery,J., Breiman,R.	
1115	KF156352	KF156352.1	KF156352	2008-12-02	Africa	Kenya			Homo sapiens	2013-11-30		Agoti et al		Agoti,C.N., Mayieka,L.M., Otieno,J.R., Ahmed,J.A., Fields,B.S., Waiboci,L.W., Nyoka,R., Eidex,R.B., Marano,N., Burton,W., Montgomery,J.M., Breiman,R.F., Nokes,D.J., Mayieka,L., Fields,B., Waiboci,L.B., Eidex,R., Morano,N., Montgomery,J., Breiman,R.	
1116	KF156407	KF156407.1	KF156407	2008-12-02	Africa	Kenya			Homo sapiens	2013-11-30		Agoti et al		Agoti,C.N., Mayieka,L.M., Otieno,J.R., Ahmed,J.A., Fields,B.S., Waiboci,L.W., Nyoka,R., Eidex,R.B., Marano,N., Burton,W., Montgomery,J.M., Breiman,R.F., Nokes,D.J., Mayieka,L., Fields,B., Waiboci,L.B., Eidex,R., Morano,N., Montgomery,J., Breiman,R.	
1117	KT765558	KT765558.1	KEN/Kilifi/734_03/12/2008	2008-12-03	Africa	Kenya			Homo sapiens	2016-02-27		Otieno et al		Otieno,J.R., Agoti,C.N., Gitahi,C.W., Bett,A., Ngama,M., Medley,G.F., Cane,P.A., Nokes,D.J., Nokes,J.D.	
1118	OK458676	OK458676.1	OK458676	2008-12-05	Africa	Kenya			Homo sapiens	2021-12-13		Wangui et al		Wangui,J.M., Nokes,J.D., Opot,B.H., Opanda,S.M., Agoti,C.N., Otieno,J.R., Bulimo,W.D.	
1119	KF156408	KF156408.1	KF156408	2008-12-06	Africa	Kenya			Homo sapiens	2013-11-30		Agoti et al		Agoti,C.N., Mayieka,L.M., Otieno,J.R., Ahmed,J.A., Fields,B.S., Waiboci,L.W., Nyoka,R., Eidex,R.B., Marano,N., Burton,W., Montgomery,J.M., Breiman,R.F., Nokes,D.J., Mayieka,L., Fields,B., Waiboci,L.B., Eidex,R., Morano,N., Montgomery,J., Breiman,R.	
1120	KT765559	KT765559.1	KEN/Kilifi/736_06/12/2008	2008-12-06	Africa	Kenya			Homo sapiens	2016-02-27		Otieno et al		Otieno,J.R., Agoti,C.N., Gitahi,C.W., Bett,A., Ngama,M., Medley,G.F., Cane,P.A., Nokes,D.J., Nokes,J.D.	
1121	KT765693	KT765693.1	KEN/Kilifi/735_06/12/2008	2008-12-06	Africa	Kenya			Homo sapiens	2016-02-27		Otieno et al		Otieno,J.R., Agoti,C.N., Gitahi,C.W., Bett,A., Ngama,M., Medley,G.F., Cane,P.A., Nokes,D.J., Nokes,J.D.	
1122	OK458638	OK458638.1	OK458638	2008-12-06	Africa	Kenya			Homo sapiens	2021-12-13		Wangui et al		Wangui,J.M., Nokes,J.D., Opot,B.H., Opanda,S.M., Agoti,C.N., Otieno,J.R., Bulimo,W.D.	
1123	KT765560	KT765560.1	KEN/Kilifi/737_07/12/2008	2008-12-07	Africa	Kenya			Homo sapiens	2016-02-27		Otieno et al		Otieno,J.R., Agoti,C.N., Gitahi,C.W., Bett,A., Ngama,M., Medley,G.F., Cane,P.A., Nokes,D.J., Nokes,J.D.	
1124	KF156353	KF156353.1	KF156353	2008-12-09	Africa	Kenya			Homo sapiens	2013-11-30		Agoti et al		Agoti,C.N., Mayieka,L.M., Otieno,J.R., Ahmed,J.A., Fields,B.S., Waiboci,L.W., Nyoka,R., Eidex,R.B., Marano,N., Burton,W., Montgomery,J.M., Breiman,R.F., Nokes,D.J., Mayieka,L., Fields,B., Waiboci,L.B., Eidex,R., Morano,N., Montgomery,J., Breiman,R.	
1125	KF156409	KF156409.1	KF156409	2008-12-09	Africa	Kenya			Homo sapiens	2013-11-30		Agoti et al		Agoti,C.N., Mayieka,L.M., Otieno,J.R., Ahmed,J.A., Fields,B.S., Waiboci,L.W., Nyoka,R., Eidex,R.B., Marano,N., Burton,W., Montgomery,J.M., Breiman,R.F., Nokes,D.J., Mayieka,L., Fields,B., Waiboci,L.B., Eidex,R., Morano,N., Montgomery,J., Breiman,R.	
1126	KF156410	KF156410.1	KF156410	2008-12-09	Africa	Kenya			Homo sapiens	2013-11-30		Agoti et al		Agoti,C.N., Mayieka,L.M., Otieno,J.R., Ahmed,J.A., Fields,B.S., Waiboci,L.W., Nyoka,R., Eidex,R.B., Marano,N., Burton,W., Montgomery,J.M., Breiman,R.F., Nokes,D.J., Mayieka,L., Fields,B., Waiboci,L.B., Eidex,R., Morano,N., Montgomery,J., Breiman,R.	
1127	KF156411	KF156411.1	KF156411	2008-12-10	Africa	Kenya			Homo sapiens	2013-11-30		Agoti et al		Agoti,C.N., Mayieka,L.M., Otieno,J.R., Ahmed,J.A., Fields,B.S., Waiboci,L.W., Nyoka,R., Eidex,R.B., Marano,N., Burton,W., Montgomery,J.M., Breiman,R.F., Nokes,D.J., Mayieka,L., Fields,B., Waiboci,L.B., Eidex,R., Morano,N., Montgomery,J., Breiman,R.	
1128	KF156412	KF156412.1	KF156412	2008-12-10	Africa	Kenya			Homo sapiens	2013-11-30		Agoti et al		Agoti,C.N., Mayieka,L.M., Otieno,J.R., Ahmed,J.A., Fields,B.S., Waiboci,L.W., Nyoka,R., Eidex,R.B., Marano,N., Burton,W., Montgomery,J.M., Breiman,R.F., Nokes,D.J., Mayieka,L., Fields,B., Waiboci,L.B., Eidex,R., Morano,N., Montgomery,J., Breiman,R.	
1129	KF156413	KF156413.1	KF156413	2008-12-10	Africa	Kenya			Homo sapiens	2013-11-30		Agoti et al		Agoti,C.N., Mayieka,L.M., Otieno,J.R., Ahmed,J.A., Fields,B.S., Waiboci,L.W., Nyoka,R., Eidex,R.B., Marano,N., Burton,W., Montgomery,J.M., Breiman,R.F., Nokes,D.J., Mayieka,L., Fields,B., Waiboci,L.B., Eidex,R., Morano,N., Montgomery,J., Breiman,R.	
1130	KF156416	KF156416.1	KF156416	2008-12-11	Africa	Kenya			Homo sapiens	2013-11-30		Agoti et al		Agoti,C.N., Mayieka,L.M., Otieno,J.R., Ahmed,J.A., Fields,B.S., Waiboci,L.W., Nyoka,R., Eidex,R.B., Marano,N., Burton,W., Montgomery,J.M., Breiman,R.F., Nokes,D.J., Mayieka,L., Fields,B., Waiboci,L.B., Eidex,R., Morano,N., Montgomery,J., Breiman,R.	
1131	OK458631	OK458631.1	OK458631	2008-12-11	Africa	Kenya			Homo sapiens	2021-12-13		Wangui et al		Wangui,J.M., Nokes,J.D., Opot,B.H., Opanda,S.M., Agoti,C.N., Otieno,J.R., Bulimo,W.D.	
1132	KF156414	KF156414.1	KF156414	2008-12-13	Africa	Kenya			Homo sapiens	2013-11-30		Agoti et al		Agoti,C.N., Mayieka,L.M., Otieno,J.R., Ahmed,J.A., Fields,B.S., Waiboci,L.W., Nyoka,R., Eidex,R.B., Marano,N., Burton,W., Montgomery,J.M., Breiman,R.F., Nokes,D.J., Mayieka,L., Fields,B., Waiboci,L.B., Eidex,R., Morano,N., Montgomery,J., Breiman,R.	
1133	KF156415	KF156415.1	KF156415	2008-12-13	Africa	Kenya			Homo sapiens	2013-11-30		Agoti et al		Agoti,C.N., Mayieka,L.M., Otieno,J.R., Ahmed,J.A., Fields,B.S., Waiboci,L.W., Nyoka,R., Eidex,R.B., Marano,N., Burton,W., Montgomery,J.M., Breiman,R.F., Nokes,D.J., Mayieka,L., Fields,B., Waiboci,L.B., Eidex,R., Morano,N., Montgomery,J., Breiman,R.	
1134	KF156354	KF156354.1	KF156354	2008-12-15	Africa	Kenya			Homo sapiens	2013-11-30		Agoti et al		Agoti,C.N., Mayieka,L.M., Otieno,J.R., Ahmed,J.A., Fields,B.S., Waiboci,L.W., Nyoka,R., Eidex,R.B., Marano,N., Burton,W., Montgomery,J.M., Breiman,R.F., Nokes,D.J., Mayieka,L., Fields,B., Waiboci,L.B., Eidex,R., Morano,N., Montgomery,J., Breiman,R.	
1135	KT765500	KT765500.1	KEN/Kilifi/738_15/12/2008	2008-12-15	Africa	Kenya			Homo sapiens	2016-02-27		Otieno et al		Otieno,J.R., Agoti,C.N., Gitahi,C.W., Bett,A., Ngama,M., Medley,G.F., Cane,P.A., Nokes,D.J., Nokes,J.D.	
1136	KF156355	KF156355.1	KF156355	2008-12-16	Africa	Kenya			Homo sapiens	2013-11-30		Agoti et al		Agoti,C.N., Mayieka,L.M., Otieno,J.R., Ahmed,J.A., Fields,B.S., Waiboci,L.W., Nyoka,R., Eidex,R.B., Marano,N., Burton,W., Montgomery,J.M., Breiman,R.F., Nokes,D.J., Mayieka,L., Fields,B., Waiboci,L.B., Eidex,R., Morano,N., Montgomery,J., Breiman,R.	
1137	OK458592	OK458592.1	OK458592	2008-12-16	Africa	Kenya			Homo sapiens	2021-12-13		Wangui et al		Wangui,J.M., Nokes,J.D., Opot,B.H., Opanda,S.M., Agoti,C.N., Otieno,J.R., Bulimo,W.D.	
1138	KF156417	KF156417.1	KF156417	2008-12-17	Africa	Kenya			Homo sapiens	2013-11-30		Agoti et al		Agoti,C.N., Mayieka,L.M., Otieno,J.R., Ahmed,J.A., Fields,B.S., Waiboci,L.W., Nyoka,R., Eidex,R.B., Marano,N., Burton,W., Montgomery,J.M., Breiman,R.F., Nokes,D.J., Mayieka,L., Fields,B., Waiboci,L.B., Eidex,R., Morano,N., Montgomery,J., Breiman,R.	
1139	KF156418	KF156418.1	KF156418	2008-12-20	Africa	Kenya			Homo sapiens	2013-11-30		Agoti et al		Agoti,C.N., Mayieka,L.M., Otieno,J.R., Ahmed,J.A., Fields,B.S., Waiboci,L.W., Nyoka,R., Eidex,R.B., Marano,N., Burton,W., Montgomery,J.M., Breiman,R.F., Nokes,D.J., Mayieka,L., Fields,B., Waiboci,L.B., Eidex,R., Morano,N., Montgomery,J., Breiman,R.	
1140	KF156419	KF156419.1	KF156419	2008-12-27	Africa	Kenya			Homo sapiens	2013-11-30		Agoti et al		Agoti,C.N., Mayieka,L.M., Otieno,J.R., Ahmed,J.A., Fields,B.S., Waiboci,L.W., Nyoka,R., Eidex,R.B., Marano,N., Burton,W., Montgomery,J.M., Breiman,R.F., Nokes,D.J., Mayieka,L., Fields,B., Waiboci,L.B., Eidex,R., Morano,N., Montgomery,J., Breiman,R.	
1141	KF156420	KF156420.1	KF156420	2008-12-27	Africa	Kenya			Homo sapiens	2013-11-30		Agoti et al		Agoti,C.N., Mayieka,L.M., Otieno,J.R., Ahmed,J.A., Fields,B.S., Waiboci,L.W., Nyoka,R., Eidex,R.B., Marano,N., Burton,W., Montgomery,J.M., Breiman,R.F., Nokes,D.J., Mayieka,L., Fields,B., Waiboci,L.B., Eidex,R., Morano,N., Montgomery,J., Breiman,R.	
1142	KF156421	KF156421.1	KF156421	2008-12-27	Africa	Kenya			Homo sapiens	2013-11-30		Agoti et al		Agoti,C.N., Mayieka,L.M., Otieno,J.R., Ahmed,J.A., Fields,B.S., Waiboci,L.W., Nyoka,R., Eidex,R.B., Marano,N., Burton,W., Montgomery,J.M., Breiman,R.F., Nokes,D.J., Mayieka,L., Fields,B., Waiboci,L.B., Eidex,R., Morano,N., Montgomery,J., Breiman,R.	
1143	KF156422	KF156422.1	KF156422	2008-12-27	Africa	Kenya			Homo sapiens	2013-11-30		Agoti et al		Agoti,C.N., Mayieka,L.M., Otieno,J.R., Ahmed,J.A., Fields,B.S., Waiboci,L.W., Nyoka,R., Eidex,R.B., Marano,N., Burton,W., Montgomery,J.M., Breiman,R.F., Nokes,D.J., Mayieka,L., Fields,B., Waiboci,L.B., Eidex,R., Morano,N., Montgomery,J., Breiman,R.	
1144	KC297233	KC297233.1	KC297233	2009-XX-XX	Asia	China			Homo sapiens	2013-10-02		Cui et al		Cui,G., Zhu,R., Qian,Y., Deng,J., Zhao,L., Sun,Y., Wang,F.	
1145	KC297234	KC297234.1	KC297234	2009-XX-XX	Asia	China			Homo sapiens	2013-10-02		Cui et al		Cui,G., Zhu,R., Qian,Y., Deng,J., Zhao,L., Sun,Y., Wang,F.	
1146	KC297235	KC297235.1	KC297235	2009-XX-XX	Asia	China			Homo sapiens	2013-10-02		Cui et al		Cui,G., Zhu,R., Qian,Y., Deng,J., Zhao,L., Sun,Y., Wang,F.	
1147	KC297236	KC297236.1	KC297236	2009-XX-XX	Asia	China			Homo sapiens	2013-10-02		Cui et al		Cui,G., Zhu,R., Qian,Y., Deng,J., Zhao,L., Sun,Y., Wang,F.	
1148	KC297237	KC297237.1	KC297237	2009-XX-XX	Asia	China			Homo sapiens	2013-10-02		Cui et al		Cui,G., Zhu,R., Qian,Y., Deng,J., Zhao,L., Sun,Y., Wang,F.	
1149	KC297238	KC297238.1	KC297238	2009-XX-XX	Asia	China			Homo sapiens	2013-10-02		Cui et al		Cui,G., Zhu,R., Qian,Y., Deng,J., Zhao,L., Sun,Y., Wang,F.	
1150	KC297239	KC297239.1	KC297239	2009-XX-XX	Asia	China			Homo sapiens	2013-10-02		Cui et al		Cui,G., Zhu,R., Qian,Y., Deng,J., Zhao,L., Sun,Y., Wang,F.	
1151	KC297240	KC297240.1	KC297240	2009-XX-XX	Asia	China			Homo sapiens	2013-10-02		Cui et al		Cui,G., Zhu,R., Qian,Y., Deng,J., Zhao,L., Sun,Y., Wang,F.	
1152	KC297420	KC297420.1	KC297420	2009-XX-XX	Asia	China			Homo sapiens	2013-10-02		Cui et al		Cui,G., Zhu,R., Qian,Y., Deng,J., Zhao,L., Sun,Y., Wang,F.	
1153	KC297421	KC297421.1	KC297421	2009-XX-XX	Asia	China			Homo sapiens	2013-10-02		Cui et al		Cui,G., Zhu,R., Qian,Y., Deng,J., Zhao,L., Sun,Y., Wang,F.	
1154	KR607995	KR607995.1	KR607995	2009-XX-XX	Asia	China			Homo sapiens	2015-10-24		Wang et al		Wang,Y., Tan,W.	
1155	KR607996	KR607996.1	KR607996	2009-XX-XX	Asia	China			Homo sapiens	2015-10-24		Wang et al		Wang,Y., Tan,W.	
1156	KU954997	KU954997.1	KU954997	2009-XX-XX	Asia	China			Homo sapiens	2019-03-31		Jia et al		Jia,B., Xiao,Y., Wang,Y., Chen,L., Zhang,J., Ren,L., Wang,J.	
1157	KU955262	KU955262.1	KU955262	2009-XX-XX	Asia	China			Homo sapiens	2019-03-31		Jia et al		Jia,B., Xiao,Y., Wang,Y., Chen,L., Zhang,J., Ren,L., Wang,J.	
1158	KU955263	KU955263.1	KU955263	2009-XX-XX	Asia	China			Homo sapiens	2019-03-31		Jia et al		Jia,B., Xiao,Y., Wang,Y., Chen,L., Zhang,J., Ren,L., Wang,J.	
1159	KU955264	KU955264.1	KU955264	2009-XX-XX	Asia	China			Homo sapiens	2019-03-31		Jia et al		Jia,B., Xiao,Y., Wang,Y., Chen,L., Zhang,J., Ren,L., Wang,J.	
1160	KU955265	KU955265.1	KU955265	2009-XX-XX	Asia	China			Homo sapiens	2019-03-31		Jia et al		Jia,B., Xiao,Y., Wang,Y., Chen,L., Zhang,J., Ren,L., Wang,J.	
1161	KU955266	KU955266.1	KU955266	2009-XX-XX	Asia	China			Homo sapiens	2019-03-31		Jia et al		Jia,B., Xiao,Y., Wang,Y., Chen,L., Zhang,J., Ren,L., Wang,J.	
1162	KU955267	KU955267.1	KU955267	2009-XX-XX	Asia	China			Homo sapiens	2019-03-31		Jia et al		Jia,B., Xiao,Y., Wang,Y., Chen,L., Zhang,J., Ren,L., Wang,J.	
1163	KU955268	KU955268.1	KU955268	2009-XX-XX	Asia	China			Homo sapiens	2019-03-31		Jia et al		Jia,B., Xiao,Y., Wang,Y., Chen,L., Zhang,J., Ren,L., Wang,J.	
1164	KU955269	KU955269.1	KU955269	2009-XX-XX	Asia	China			Homo sapiens	2019-03-31		Jia et al		Jia,B., Xiao,Y., Wang,Y., Chen,L., Zhang,J., Ren,L., Wang,J.	
1165	KU955270	KU955270.1	KU955270	2009-XX-XX	Asia	China			Homo sapiens	2019-03-31		Jia et al		Jia,B., Xiao,Y., Wang,Y., Chen,L., Zhang,J., Ren,L., Wang,J.	
1166	KU955271	KU955271.1	KU955271	2009-XX-XX	Asia	China			Homo sapiens	2019-03-31		Jia et al		Jia,B., Xiao,Y., Wang,Y., Chen,L., Zhang,J., Ren,L., Wang,J.	
1167	KU962539	KU962539.1	KU962539	2009-XX-XX	Asia	China			Homo sapiens	2019-03-31		Jia et al		Jia,B., Xiao,Y., Wang,Y., Chen,L., Zhang,J., Ren,L., Wang,J.	
1168	KU962540	KU962540.1	KU962540	2009-XX-XX	Asia	China			Homo sapiens	2019-03-31		Jia et al		Jia,B., Xiao,Y., Wang,Y., Chen,L., Zhang,J., Ren,L., Wang,J.	
1169	KU962542	KU962542.1	KU962542	2009-XX-XX	Asia	China			Homo sapiens	2019-03-31		Jia et al		Jia,B., Xiao,Y., Wang,Y., Chen,L., Zhang,J., Ren,L., Wang,J.	
1170	KU962543	KU962543.1	KU962543	2009-XX-XX	Asia	China			Homo sapiens	2019-03-31		Jia et al		Jia,B., Xiao,Y., Wang,Y., Chen,L., Zhang,J., Ren,L., Wang,J.	
1171	KU962910	KU962910.1	KU962910	2009-XX-XX	Asia	China			Homo sapiens	2019-03-31		Jia et al		Jia,B., Xiao,Y., Wang,Y., Chen,L., Zhang,J., Ren,L., Wang,J.	
1172	KX533719	KX533719.1	KX533719	2009-XX-XX	Asia	China			Homo sapiens	2017-09-28		Song et al		Song,J., Zhang,Y., Wang,H., Shi,J., Sun,L., Zhang,X., Yang,Z., Guan,W., Zhang,H., Yu,P., Xie,Z., Cui,A., Ng,T.I., Xu,W.	
1173	KX533720	KX533720.1	KX533720	2009-XX-XX	Asia	China			Homo sapiens	2017-09-28		Song et al		Song,J., Zhang,Y., Wang,H., Shi,J., Sun,L., Zhang,X., Yang,Z., Guan,W., Zhang,H., Yu,P., Xie,Z., Cui,A., Ng,T.I., Xu,W.	
1174	KX533721	KX533721.1	KX533721	2009-XX-XX	Asia	China			Homo sapiens	2017-09-28		Song et al		Song,J., Zhang,Y., Wang,H., Shi,J., Sun,L., Zhang,X., Yang,Z., Guan,W., Zhang,H., Yu,P., Xie,Z., Cui,A., Ng,T.I., Xu,W.	
1175	KX533722	KX533722.1	KX533722	2009-XX-XX	Asia	China			Homo sapiens	2017-09-28		Song et al		Song,J., Zhang,Y., Wang,H., Shi,J., Sun,L., Zhang,X., Yang,Z., Guan,W., Zhang,H., Yu,P., Xie,Z., Cui,A., Ng,T.I., Xu,W.	
1176	KX533871	KX533871.1	KX533871	2009-XX-XX	Asia	China			Homo sapiens	2017-09-28		Song et al		Song,J., Zhang,Y., Wang,H., Shi,J., Sun,L., Zhang,X., Yang,Z., Guan,W., Zhang,H., Yu,P., Xie,Z., Cui,A., Ng,T.I., Xu,W.	
1177	KX533878	KX533878.1	KX533878	2009-XX-XX	Asia	China			Homo sapiens	2017-09-28		Song et al		Song,J., Zhang,Y., Wang,H., Shi,J., Sun,L., Zhang,X., Yang,Z., Guan,W., Zhang,H., Yu,P., Xie,Z., Cui,A., Ng,T.I., Xu,W.	
1178	MF173105	MF173105.1	Tolima/2009/I14505	2009-XX-XX	South America	Colombia			Homo sapiens	2017-10-25		Avila et al		Avila,V., Calvo,E.P., Barbosa,J., Velandia-Romero,M.L., Castellanos,J.E.	
1179	MF372396	MF372396.1	Cundinamarca/2009/20242	2009-XX-XX	South America	Colombia			Homo sapiens	2017-10-25		Avila et al		Avila,V., Calvo,E.P., Barbosa,J., Velandia-Romero,M.L., Castellanos,J.E.	
1180	MF496418	MF496418.1	R98-65	2009-XX-XX	Asia	Taiwan			Homo sapiens	2017-08-30		Chi et al		Chi,H., Hsiao,K.-L., Weng,L.-C., Chiu,N.-C., Huang,L.-M., Chiu,Y.-Y., Liu,C.-P., Liu,H.-F.	
1181	MF496419	MF496419.1	R98-63	2009-XX-XX	Asia	Taiwan			Homo sapiens	2017-08-30		Chi et al		Chi,H., Hsiao,K.-L., Weng,L.-C., Chiu,N.-C., Huang,L.-M., Chiu,Y.-Y., Liu,C.-P., Liu,H.-F.	
1182	MF496420	MF496420.1	R98-35	2009-XX-XX	Asia	Taiwan			Homo sapiens	2017-08-30		Chi et al		Chi,H., Hsiao,K.-L., Weng,L.-C., Chiu,N.-C., Huang,L.-M., Chiu,Y.-Y., Liu,C.-P., Liu,H.-F.	
1183	MF496421	MF496421.1	R98-28	2009-XX-XX	Asia	Taiwan			Homo sapiens	2017-08-30		Chi et al		Chi,H., Hsiao,K.-L., Weng,L.-C., Chiu,N.-C., Huang,L.-M., Chiu,Y.-Y., Liu,C.-P., Liu,H.-F.	
1184	MF496422	MF496422.1	R98-24	2009-XX-XX	Asia	Taiwan			Homo sapiens	2017-08-30		Chi et al		Chi,H., Hsiao,K.-L., Weng,L.-C., Chiu,N.-C., Huang,L.-M., Chiu,Y.-Y., Liu,C.-P., Liu,H.-F.	
1185	MF496423	MF496423.1	R98-16	2009-XX-XX	Asia	Taiwan			Homo sapiens	2017-08-30		Chi et al		Chi,H., Hsiao,K.-L., Weng,L.-C., Chiu,N.-C., Huang,L.-M., Chiu,Y.-Y., Liu,C.-P., Liu,H.-F.	
1186	MF496424	MF496424.1	R98-11	2009-XX-XX	Asia	Taiwan			Homo sapiens	2017-08-30		Chi et al		Chi,H., Hsiao,K.-L., Weng,L.-C., Chiu,N.-C., Huang,L.-M., Chiu,Y.-Y., Liu,C.-P., Liu,H.-F.	
1187	MF496425	MF496425.1	R98-03	2009-XX-XX	Asia	Taiwan			Homo sapiens	2017-08-30		Chi et al		Chi,H., Hsiao,K.-L., Weng,L.-C., Chiu,N.-C., Huang,L.-M., Chiu,Y.-Y., Liu,C.-P., Liu,H.-F.	
1188	MK344681	MK344681.1	MK344681	2009-XX-XX	Asia	Taiwan			Homo sapiens	2020-01-11		Lee et al		Lee,C.-Y.	
1189	MK344682	MK344682.1	MK344682	2009-XX-XX	Asia	Taiwan			Homo sapiens	2020-01-11		Lee et al		Lee,C.-Y.	
1190	MK344683	MK344683.1	MK344683	2009-XX-XX	Asia	Taiwan			Homo sapiens	2020-01-11		Lee et al		Lee,C.-Y.	
1191	MK344684	MK344684.1	MK344684	2009-XX-XX	Asia	Taiwan			Homo sapiens	2020-01-11		Lee et al		Lee,C.-Y.	
1192	MK344685	MK344685.1	MK344685	2009-XX-XX	Asia	Taiwan			Homo sapiens	2020-01-11		Lee et al		Lee,C.-Y.	
1193	MK344686	MK344686.1	MK344686	2009-XX-XX	Asia	Taiwan			Homo sapiens	2020-01-11		Lee et al		Lee,C.-Y.	
1194	MK344687	MK344687.1	MK344687	2009-XX-XX	Asia	Taiwan			Homo sapiens	2020-01-11		Lee et al		Lee,C.-Y.	
1195	MK344688	MK344688.1	MK344688	2009-XX-XX	Asia	Taiwan			Homo sapiens	2020-01-11		Lee et al		Lee,C.-Y.	
1196	MK344689	MK344689.1	MK344689	2009-XX-XX	Asia	Taiwan			Homo sapiens	2020-01-11		Lee et al		Lee,C.-Y.	
1197	MK344690	MK344690.1	MK344690	2009-XX-XX	Asia	Taiwan			Homo sapiens	2020-01-11		Lee et al		Lee,C.-Y.	
1198	MW306458	MW306458.1	BGD/239928/RSV_A/2009	2009-XX-XX	Asia	Bangladesh			Homo sapiens	2021-11-01		Rahman et al		Rahman,M.Z., Hossain,M.E., Sumiya,M.K., Islam,M.M., Begum,M.N., Hoque,A.F., Uddin,K.M.M., Hassan,M.Z., Rahman,M., Goswami,D.R., Brooks,W.A.	
1199	MW306470	MW306470.1	BDG/343226/RSV_A/2009	2009-XX-XX	Asia	Bangladesh			Homo sapiens	2021-11-01		Rahman et al		Rahman,M.Z., Hossain,M.E., Sumiya,M.K., Islam,M.M., Begum,M.N., Hoque,A.F., Uddin,K.M.M., Hassan,M.Z., Rahman,M., Goswami,D.R., Brooks,W.A.	
1200	MW306475	MW306475.1	BGD/363369/RSV_A/2009	2009-XX-XX	Asia	Bangladesh			Homo sapiens	2021-11-01		Rahman et al		Rahman,M.Z., Hossain,M.E., Sumiya,M.K., Islam,M.M., Begum,M.N., Hoque,A.F., Uddin,K.M.M., Hassan,M.Z., Rahman,M., Goswami,D.R., Brooks,W.A.	
1201	OK649635	OK649635.1	OK649635	2009-XX-XX	South America	Brazil			Homo sapiens	2021-11-07		Wang et al		Wang,L., Ng,T.F.F., Castro,C.J., Marine,R.L., Magana,L.C., Esona,M., Peret,T.C.T., Thornburg,N.J.	
1202	OK649636	OK649636.1	OK649636	2009-XX-XX	South America	Brazil			Homo sapiens	2021-11-07		Wang et al		Wang,L., Ng,T.F.F., Castro,C.J., Marine,R.L., Magana,L.C., Esona,M., Peret,T.C.T., Thornburg,N.J.	
1203	OK649637	OK649637.1	OK649637	2009-XX-XX	South America	Brazil			Homo sapiens	2021-11-07		Wang et al		Wang,L., Ng,T.F.F., Castro,C.J., Marine,R.L., Magana,L.C., Esona,M., Peret,T.C.T., Thornburg,N.J.	
1204	OK649638	OK649638.1	OK649638	2009-XX-XX	South America	Brazil			Homo sapiens	2021-11-07		Wang et al		Wang,L., Ng,T.F.F., Castro,C.J., Marine,R.L., Magana,L.C., Esona,M., Peret,T.C.T., Thornburg,N.J.	
1205	OK649639	OK649639.1	OK649639	2009-XX-XX	South America	Brazil			Homo sapiens	2021-11-07		Wang et al		Wang,L., Ng,T.F.F., Castro,C.J., Marine,R.L., Magana,L.C., Esona,M., Peret,T.C.T., Thornburg,N.J.	
1206	OK649640	OK649640.1	OK649640	2009-XX-XX	South America	Brazil			Homo sapiens	2021-11-07		Wang et al		Wang,L., Ng,T.F.F., Castro,C.J., Marine,R.L., Magana,L.C., Esona,M., Peret,T.C.T., Thornburg,N.J.	
1207	OK649641	OK649641.1	OK649641	2009-XX-XX	South America	Brazil			Homo sapiens	2021-11-07		Wang et al		Wang,L., Ng,T.F.F., Castro,C.J., Marine,R.L., Magana,L.C., Esona,M., Peret,T.C.T., Thornburg,N.J.	
1208	OM962820	OM962820.1	Benguet.PHL/2009/002	2009-XX-XX	Asia	Philippines			Homo sapiens	2022-06-29		Calaor-Morin et al		Calaor-Morin,J., Arguelles,V.L., Foronda,J.L., Tan,A., Lagamayo,E., Dapat,C., Lupisan,S., Morin,J.C., Foronda,J.L.M.	
1209	OM962821	OM962821.1	Cagayan.PHL/2009/004	2009-XX-XX	Asia	Philippines			Homo sapiens	2022-06-29		Calaor-Morin et al		Calaor-Morin,J., Arguelles,V.L., Foronda,J.L., Tan,A., Lagamayo,E., Dapat,C., Lupisan,S., Morin,J.C., Foronda,J.L.M.	
1210	OM962822	OM962822.1	Benguet.PHL/2009/003	2009-XX-XX	Asia	Philippines			Homo sapiens	2022-06-29		Calaor-Morin et al		Calaor-Morin,J., Arguelles,V.L., Foronda,J.L., Tan,A., Lagamayo,E., Dapat,C., Lupisan,S., Morin,J.C., Foronda,J.L.M.	
1211	FR681628	FR681628.1	FR681628	2009-01-XX	Europe	France	Normandie			2010-09-07		Bellot et al		Bellot,A., Leroux,M., Vabret,A., Freymuth,F., Dina,J.	
1212	FR681660	FR681660.1	FR681660	2009-01-XX	Europe	France	Normandie			2010-09-07		Bellot et al		Bellot,A., Leroux,M., Vabret,A., Freymuth,F., Dina,J.	
1213	FR681686	FR681686.1	FR681686	2009-01-XX	Europe	France	Normandie			2010-09-07		Bellot et al		Bellot,A., Leroux,M., Vabret,A., Freymuth,F., Dina,J.	
1214	FR681711	FR681711.1	FR681711	2009-01-XX	Europe	France	Normandie			2010-09-07		Bellot et al		Bellot,A., Leroux,M., Vabret,A., Freymuth,F., Dina,J.	
1215	KF156423	KF156423.1	KF156423	2009-01-02	Africa	Kenya			Homo sapiens	2013-11-30		Agoti et al		Agoti,C.N., Mayieka,L.M., Otieno,J.R., Ahmed,J.A., Fields,B.S., Waiboci,L.W., Nyoka,R., Eidex,R.B., Marano,N., Burton,W., Montgomery,J.M., Breiman,R.F., Nokes,D.J., Mayieka,L., Fields,B., Waiboci,L.B., Eidex,R., Morano,N., Montgomery,J., Breiman,R.	
1216	KF156424	KF156424.1	KF156424	2009-01-02	Africa	Kenya			Homo sapiens	2013-11-30		Agoti et al		Agoti,C.N., Mayieka,L.M., Otieno,J.R., Ahmed,J.A., Fields,B.S., Waiboci,L.W., Nyoka,R., Eidex,R.B., Marano,N., Burton,W., Montgomery,J.M., Breiman,R.F., Nokes,D.J., Mayieka,L., Fields,B., Waiboci,L.B., Eidex,R., Morano,N., Montgomery,J., Breiman,R.	
1217	KF156425	KF156425.1	KF156425	2009-01-02	Africa	Kenya			Homo sapiens	2013-11-30		Agoti et al		Agoti,C.N., Mayieka,L.M., Otieno,J.R., Ahmed,J.A., Fields,B.S., Waiboci,L.W., Nyoka,R., Eidex,R.B., Marano,N., Burton,W., Montgomery,J.M., Breiman,R.F., Nokes,D.J., Mayieka,L., Fields,B., Waiboci,L.B., Eidex,R., Morano,N., Montgomery,J., Breiman,R.	
1218	KF156430	KF156430.1	KF156430	2009-01-02	Africa	Kenya			Homo sapiens	2013-11-30		Agoti et al		Agoti,C.N., Mayieka,L.M., Otieno,J.R., Ahmed,J.A., Fields,B.S., Waiboci,L.W., Nyoka,R., Eidex,R.B., Marano,N., Burton,W., Montgomery,J.M., Breiman,R.F., Nokes,D.J., Mayieka,L., Fields,B., Waiboci,L.B., Eidex,R., Morano,N., Montgomery,J., Breiman,R.	
1219	MF445779	MF445779.1	MF445779	2009-01-04	Asia	China			Homo sapiens	2019-12-31		Su et al		Su,Y., Wu,Y., Tian,R., Liang,G.	
1220	MF445966	MF445966.1	MF445966	2009-01-04	Asia	China			Homo sapiens	2019-12-31		Su et al		Su,Y., Wu,Y., Tian,R., Liang,G.	
1221	KF156426	KF156426.1	KF156426	2009-01-05	Africa	Kenya			Homo sapiens	2013-11-30		Agoti et al		Agoti,C.N., Mayieka,L.M., Otieno,J.R., Ahmed,J.A., Fields,B.S., Waiboci,L.W., Nyoka,R., Eidex,R.B., Marano,N., Burton,W., Montgomery,J.M., Breiman,R.F., Nokes,D.J., Mayieka,L., Fields,B., Waiboci,L.B., Eidex,R., Morano,N., Montgomery,J., Breiman,R.	
1222	AB978289	AB978289.1	AB978289	2009-01-06	Asia	Japan	Fukui		Homo sapiens	2014-10-04		Hirano et al		Hirano,E., Kobayashi,M., Tsukagoshi,H., Yoshida,L.M., Kuroda,M., Noda,M., Ishioka,T., Kozawa,K., Ishii,H., Yoshida,A., Oishi,K., Ryo,A., Kimura,H.	
1223	KF156427	KF156427.1	KF156427	2009-01-06	Africa	Kenya			Homo sapiens	2013-11-30		Agoti et al		Agoti,C.N., Mayieka,L.M., Otieno,J.R., Ahmed,J.A., Fields,B.S., Waiboci,L.W., Nyoka,R., Eidex,R.B., Marano,N., Burton,W., Montgomery,J.M., Breiman,R.F., Nokes,D.J., Mayieka,L., Fields,B., Waiboci,L.B., Eidex,R., Morano,N., Montgomery,J., Breiman,R.	
1224	KF156428	KF156428.1	KF156428	2009-01-06	Africa	Kenya			Homo sapiens	2013-11-30		Agoti et al		Agoti,C.N., Mayieka,L.M., Otieno,J.R., Ahmed,J.A., Fields,B.S., Waiboci,L.W., Nyoka,R., Eidex,R.B., Marano,N., Burton,W., Montgomery,J.M., Breiman,R.F., Nokes,D.J., Mayieka,L., Fields,B., Waiboci,L.B., Eidex,R., Morano,N., Montgomery,J., Breiman,R.	
1225	KF156429	KF156429.1	KF156429	2009-01-07	Africa	Kenya			Homo sapiens	2013-11-30		Agoti et al		Agoti,C.N., Mayieka,L.M., Otieno,J.R., Ahmed,J.A., Fields,B.S., Waiboci,L.W., Nyoka,R., Eidex,R.B., Marano,N., Burton,W., Montgomery,J.M., Breiman,R.F., Nokes,D.J., Mayieka,L., Fields,B., Waiboci,L.B., Eidex,R., Morano,N., Montgomery,J., Breiman,R.	
1226	KT765549	KT765549.1	KEN/Kilifi/739_09/01/2009	2009-01-09	Africa	Kenya			Homo sapiens	2016-02-27		Otieno et al		Otieno,J.R., Agoti,C.N., Gitahi,C.W., Bett,A., Ngama,M., Medley,G.F., Cane,P.A., Nokes,D.J., Nokes,J.D.	
1227	KT765511	KT765511.1	KEN/Kilifi/741_10/01/2009	2009-01-10	Africa	Kenya			Homo sapiens	2016-02-27		Otieno et al		Otieno,J.R., Agoti,C.N., Gitahi,C.W., Bett,A., Ngama,M., Medley,G.F., Cane,P.A., Nokes,D.J., Nokes,J.D.	
1228	KT765516	KT765516.1	KEN/Kilifi/740_10/01/2009	2009-01-10	Africa	Kenya			Homo sapiens	2016-02-27		Otieno et al		Otieno,J.R., Agoti,C.N., Gitahi,C.W., Bett,A., Ngama,M., Medley,G.F., Cane,P.A., Nokes,D.J., Nokes,J.D.	
1229	KT765491	KT765491.1	KEN/Kilifi/742_12/01/2009	2009-01-12	Africa	Kenya			Homo sapiens	2016-02-27		Otieno et al		Otieno,J.R., Agoti,C.N., Gitahi,C.W., Bett,A., Ngama,M., Medley,G.F., Cane,P.A., Nokes,D.J., Nokes,J.D.	
1230	KT765694	KT765694.1	KEN/Kilifi/743_12/01/2009	2009-01-12	Africa	Kenya			Homo sapiens	2016-02-27		Otieno et al		Otieno,J.R., Agoti,C.N., Gitahi,C.W., Bett,A., Ngama,M., Medley,G.F., Cane,P.A., Nokes,D.J., Nokes,J.D.	
1231	JX976374	JX976374.1	JX976374	2009-01-13	North America	Cuba			Homo sapiens	2014-09-25		Valdes et al		Valdes,O., Corso,M., Pinon,A., Acosta,B., Savon,C., Gonzalez,G., Mune,M., Hernandez,B., Echevarria,Y., Oropesa,S.	
1232	KF156356	KF156356.1	KF156356	2009-01-13	Africa	Kenya			Homo sapiens	2013-11-30		Agoti et al		Agoti,C.N., Mayieka,L.M., Otieno,J.R., Ahmed,J.A., Fields,B.S., Waiboci,L.W., Nyoka,R., Eidex,R.B., Marano,N., Burton,W., Montgomery,J.M., Breiman,R.F., Nokes,D.J., Mayieka,L., Fields,B., Waiboci,L.B., Eidex,R., Morano,N., Montgomery,J., Breiman,R.	
1233	KF156431	KF156431.1	KF156431	2009-01-13	Africa	Kenya			Homo sapiens	2013-11-30		Agoti et al		Agoti,C.N., Mayieka,L.M., Otieno,J.R., Ahmed,J.A., Fields,B.S., Waiboci,L.W., Nyoka,R., Eidex,R.B., Marano,N., Burton,W., Montgomery,J.M., Breiman,R.F., Nokes,D.J., Mayieka,L., Fields,B., Waiboci,L.B., Eidex,R., Morano,N., Montgomery,J., Breiman,R.	
1234	KF156432	KF156432.1	KF156432	2009-01-13	Africa	Kenya			Homo sapiens	2013-11-30		Agoti et al		Agoti,C.N., Mayieka,L.M., Otieno,J.R., Ahmed,J.A., Fields,B.S., Waiboci,L.W., Nyoka,R., Eidex,R.B., Marano,N., Burton,W., Montgomery,J.M., Breiman,R.F., Nokes,D.J., Mayieka,L., Fields,B., Waiboci,L.B., Eidex,R., Morano,N., Montgomery,J., Breiman,R.	
1235	KT765508	KT765508.1	KEN/Kilifi/744_13/01/2009	2009-01-13	Africa	Kenya			Homo sapiens	2016-02-27		Otieno et al		Otieno,J.R., Agoti,C.N., Gitahi,C.W., Bett,A., Ngama,M., Medley,G.F., Cane,P.A., Nokes,D.J., Nokes,J.D.	
1236	KF156357	KF156357.1	KF156357	2009-01-14	Africa	Kenya			Homo sapiens	2013-11-30		Agoti et al		Agoti,C.N., Mayieka,L.M., Otieno,J.R., Ahmed,J.A., Fields,B.S., Waiboci,L.W., Nyoka,R., Eidex,R.B., Marano,N., Burton,W., Montgomery,J.M., Breiman,R.F., Nokes,D.J., Mayieka,L., Fields,B., Waiboci,L.B., Eidex,R., Morano,N., Montgomery,J., Breiman,R.	
1237	KF156358	KF156358.1	KF156358	2009-01-14	Africa	Kenya			Homo sapiens	2013-11-30		Agoti et al		Agoti,C.N., Mayieka,L.M., Otieno,J.R., Ahmed,J.A., Fields,B.S., Waiboci,L.W., Nyoka,R., Eidex,R.B., Marano,N., Burton,W., Montgomery,J.M., Breiman,R.F., Nokes,D.J., Mayieka,L., Fields,B., Waiboci,L.B., Eidex,R., Morano,N., Montgomery,J., Breiman,R.	
1238	KT765692	KT765692.1	KEN/Kilifi/745_14/01/2009	2009-01-14	Africa	Kenya			Homo sapiens	2016-02-27		Otieno et al		Otieno,J.R., Agoti,C.N., Gitahi,C.W., Bett,A., Ngama,M., Medley,G.F., Cane,P.A., Nokes,D.J., Nokes,J.D.	
1239	KT765513	KT765513.1	KEN/Kilifi/746_15/01/2009	2009-01-15	Africa	Kenya			Homo sapiens	2016-02-27		Otieno et al		Otieno,J.R., Agoti,C.N., Gitahi,C.W., Bett,A., Ngama,M., Medley,G.F., Cane,P.A., Nokes,D.J., Nokes,J.D.	
1240	KF156433	KF156433.1	KF156433	2009-01-17	Africa	Kenya			Homo sapiens	2013-11-30		Agoti et al		Agoti,C.N., Mayieka,L.M., Otieno,J.R., Ahmed,J.A., Fields,B.S., Waiboci,L.W., Nyoka,R., Eidex,R.B., Marano,N., Burton,W., Montgomery,J.M., Breiman,R.F., Nokes,D.J., Mayieka,L., Fields,B., Waiboci,L.B., Eidex,R., Morano,N., Montgomery,J., Breiman,R.	
1241	KT765501	KT765501.1	KEN/Kilifi/747_18/01/2009	2009-01-18	Africa	Kenya			Homo sapiens	2016-02-27		Otieno et al		Otieno,J.R., Agoti,C.N., Gitahi,C.W., Bett,A., Ngama,M., Medley,G.F., Cane,P.A., Nokes,D.J., Nokes,J.D.	
1242	KF156434	KF156434.1	KF156434	2009-01-21	Africa	Kenya			Homo sapiens	2013-11-30		Agoti et al		Agoti,C.N., Mayieka,L.M., Otieno,J.R., Ahmed,J.A., Fields,B.S., Waiboci,L.W., Nyoka,R., Eidex,R.B., Marano,N., Burton,W., Montgomery,J.M., Breiman,R.F., Nokes,D.J., Mayieka,L., Fields,B., Waiboci,L.B., Eidex,R., Morano,N., Montgomery,J., Breiman,R.	
1243	KF156435	KF156435.1	KF156435	2009-01-23	Africa	Kenya			Homo sapiens	2013-11-30		Agoti et al		Agoti,C.N., Mayieka,L.M., Otieno,J.R., Ahmed,J.A., Fields,B.S., Waiboci,L.W., Nyoka,R., Eidex,R.B., Marano,N., Burton,W., Montgomery,J.M., Breiman,R.F., Nokes,D.J., Mayieka,L., Fields,B., Waiboci,L.B., Eidex,R., Morano,N., Montgomery,J., Breiman,R.	
1244	KF156436	KF156436.1	KF156436	2009-01-24	Africa	Kenya			Homo sapiens	2013-11-30		Agoti et al		Agoti,C.N., Mayieka,L.M., Otieno,J.R., Ahmed,J.A., Fields,B.S., Waiboci,L.W., Nyoka,R., Eidex,R.B., Marano,N., Burton,W., Montgomery,J.M., Breiman,R.F., Nokes,D.J., Mayieka,L., Fields,B., Waiboci,L.B., Eidex,R., Morano,N., Montgomery,J., Breiman,R.	
1245	KT765517	KT765517.1	KEN/Kilifi/748_27/01/2009	2009-01-27	Africa	Kenya			Homo sapiens	2016-02-27		Otieno et al		Otieno,J.R., Agoti,C.N., Gitahi,C.W., Bett,A., Ngama,M., Medley,G.F., Cane,P.A., Nokes,D.J., Nokes,J.D.	
1246	OK458639	OK458639.1	OK458639	2009-01-27	Africa	Kenya			Homo sapiens	2021-12-13		Wangui et al		Wangui,J.M., Nokes,J.D., Opot,B.H., Opanda,S.M., Agoti,C.N., Otieno,J.R., Bulimo,W.D.	
1247	KF156437	KF156437.1	KF156437	2009-01-28	Africa	Kenya			Homo sapiens	2013-11-30		Agoti et al		Agoti,C.N., Mayieka,L.M., Otieno,J.R., Ahmed,J.A., Fields,B.S., Waiboci,L.W., Nyoka,R., Eidex,R.B., Marano,N., Burton,W., Montgomery,J.M., Breiman,R.F., Nokes,D.J., Mayieka,L., Fields,B., Waiboci,L.B., Eidex,R., Morano,N., Montgomery,J., Breiman,R.	
1248	KT765520	KT765520.1	KEN/Kilifi/749_29/01/2009	2009-01-29	Africa	Kenya			Homo sapiens	2016-02-27		Otieno et al		Otieno,J.R., Agoti,C.N., Gitahi,C.W., Bett,A., Ngama,M., Medley,G.F., Cane,P.A., Nokes,D.J., Nokes,J.D.	
1249	KF156438	KF156438.1	KF156438	2009-01-30	Africa	Kenya			Homo sapiens	2013-11-30		Agoti et al		Agoti,C.N., Mayieka,L.M., Otieno,J.R., Ahmed,J.A., Fields,B.S., Waiboci,L.W., Nyoka,R., Eidex,R.B., Marano,N., Burton,W., Montgomery,J.M., Breiman,R.F., Nokes,D.J., Mayieka,L., Fields,B., Waiboci,L.B., Eidex,R., Morano,N., Montgomery,J., Breiman,R.	
1250	KT765519	KT765519.1	KEN/Kilifi/750_30/01/2009	2009-01-30	Africa	Kenya			Homo sapiens	2016-02-27		Otieno et al		Otieno,J.R., Agoti,C.N., Gitahi,C.W., Bett,A., Ngama,M., Medley,G.F., Cane,P.A., Nokes,D.J., Nokes,J.D.	
1251	KF156439	KF156439.1	KF156439	2009-01-31	Africa	Kenya			Homo sapiens	2013-11-30		Agoti et al		Agoti,C.N., Mayieka,L.M., Otieno,J.R., Ahmed,J.A., Fields,B.S., Waiboci,L.W., Nyoka,R., Eidex,R.B., Marano,N., Burton,W., Montgomery,J.M., Breiman,R.F., Nokes,D.J., Mayieka,L., Fields,B., Waiboci,L.B., Eidex,R., Morano,N., Montgomery,J., Breiman,R.	
1252	HQ699269	HQ699269.1	HQ699269	2009-02-XX	Asia	South Korea			Homo sapiens	2011-07-13		Baek et al		Baek,Y.H., Choi,E.H., Song,M.S., Pascua,P.N., Kwon,H.I., Park,S.J., Lee,J.H., Woo,S.I., Ahn,B.H., Han,H.S., Hahn,Y.S., Shin,K.S., Jang,H.L., Kim,S.Y., Choi,Y.K., Park,S.-J., Song,M.-S., Choi,Y.-K.	
1253	OK458589	OK458589.1	OK458589	2009-02-01	Africa	Kenya			Homo sapiens	2021-12-13		Wangui et al		Wangui,J.M., Nokes,J.D., Opot,B.H., Opanda,S.M., Agoti,C.N., Otieno,J.R., Bulimo,W.D.	
1254	JN968313	JN968313.1	V09-2206560	2009-02-02	Asia	Hong Kong			Homo sapiens	2012-01-10		Mak et al		Mak,G.C., Lau,C.S., Chiu,D.M.Y., Lim,W.	
1255	KT765527	KT765527.1	KEN/Kilifi/751_02/02/2009	2009-02-02	Africa	Kenya			Homo sapiens	2016-02-27		Otieno et al		Otieno,J.R., Agoti,C.N., Gitahi,C.W., Bett,A., Ngama,M., Medley,G.F., Cane,P.A., Nokes,D.J., Nokes,J.D.	
1256	OK458620	OK458620.1	OK458620	2009-02-03	Africa	Kenya			Homo sapiens	2021-12-13		Wangui et al		Wangui,J.M., Nokes,J.D., Opot,B.H., Opanda,S.M., Agoti,C.N., Otieno,J.R., Bulimo,W.D.	
1257	KT765494	KT765494.1	KEN/Kilifi/752_04/02/2009	2009-02-04	Africa	Kenya			Homo sapiens	2016-02-27		Otieno et al		Otieno,J.R., Agoti,C.N., Gitahi,C.W., Bett,A., Ngama,M., Medley,G.F., Cane,P.A., Nokes,D.J., Nokes,J.D.	
1258	KT765386	KT765386.1	KEN/Kilifi/753_06/02/2009	2009-02-06	Africa	Kenya			Homo sapiens	2016-02-27		Otieno et al		Otieno,J.R., Agoti,C.N., Gitahi,C.W., Bett,A., Ngama,M., Medley,G.F., Cane,P.A., Nokes,D.J., Nokes,J.D.	
1259	KF156440	KF156440.1	KF156440	2009-02-07	Africa	Kenya			Homo sapiens	2013-11-30		Agoti et al		Agoti,C.N., Mayieka,L.M., Otieno,J.R., Ahmed,J.A., Fields,B.S., Waiboci,L.W., Nyoka,R., Eidex,R.B., Marano,N., Burton,W., Montgomery,J.M., Breiman,R.F., Nokes,D.J., Mayieka,L., Fields,B., Waiboci,L.B., Eidex,R., Morano,N., Montgomery,J., Breiman,R.	
1260	OK664829	OK664829.1	VR/2009/0096	2009-02-07	Africa	Senegal			Homo sapiens	2022-01-19		Fall A et al		Fall A, Elawar F, Hodcroft EB, Jallow MM, Toure CT, Barry MA, Kiori DE, Sy S, Diaw Y, Goudiaby D, Niang MN, Dia N, Fall,A., Jallow,M.M., Toure,C.T., Kiori,D.E., sy,S., Diaw,Y., Goudiaby,D., Niang,M.N., Dia,N.	
1261	KF156441	KF156441.1	KF156441	2009-02-10	Africa	Kenya			Homo sapiens	2013-11-30		Agoti et al		Agoti,C.N., Mayieka,L.M., Otieno,J.R., Ahmed,J.A., Fields,B.S., Waiboci,L.W., Nyoka,R., Eidex,R.B., Marano,N., Burton,W., Montgomery,J.M., Breiman,R.F., Nokes,D.J., Mayieka,L., Fields,B., Waiboci,L.B., Eidex,R., Morano,N., Montgomery,J., Breiman,R.	
1262	KT765695	KT765695.1	KEN/Kilifi/754_10/02/2009	2009-02-10	Africa	Kenya			Homo sapiens	2016-02-27		Otieno et al		Otieno,J.R., Agoti,C.N., Gitahi,C.W., Bett,A., Ngama,M., Medley,G.F., Cane,P.A., Nokes,D.J., Nokes,J.D.	
1263	OK458595	OK458595.1	OK458595	2009-02-10	Africa	Kenya			Homo sapiens	2021-12-13		Wangui et al		Wangui,J.M., Nokes,J.D., Opot,B.H., Opanda,S.M., Agoti,C.N., Otieno,J.R., Bulimo,W.D.	
1264	OK458623	OK458623.1	OK458623	2009-02-10	Africa	Kenya			Homo sapiens	2021-12-13		Wangui et al		Wangui,J.M., Nokes,J.D., Opot,B.H., Opanda,S.M., Agoti,C.N., Otieno,J.R., Bulimo,W.D.	
1265	KT765696	KT765696.1	KEN/Kilifi/755_13/02/2009	2009-02-13	Africa	Kenya			Homo sapiens	2016-02-27		Otieno et al		Otieno,J.R., Agoti,C.N., Gitahi,C.W., Bett,A., Ngama,M., Medley,G.F., Cane,P.A., Nokes,D.J., Nokes,J.D.	
1266	KT765697	KT765697.1	KEN/Kilifi/756_13/02/2009	2009-02-13	Africa	Kenya			Homo sapiens	2016-02-27		Otieno et al		Otieno,J.R., Agoti,C.N., Gitahi,C.W., Bett,A., Ngama,M., Medley,G.F., Cane,P.A., Nokes,D.J., Nokes,J.D.	
1267	KT765387	KT765387.1	KEN/Kilifi/757_14/02/2009	2009-02-14	Africa	Kenya			Homo sapiens	2016-02-27		Otieno et al		Otieno,J.R., Agoti,C.N., Gitahi,C.W., Bett,A., Ngama,M., Medley,G.F., Cane,P.A., Nokes,D.J., Nokes,J.D.	
1268	KT765698	KT765698.1	KEN/Kilifi/758_15/02/2009	2009-02-15	Africa	Kenya			Homo sapiens	2016-02-27		Otieno et al		Otieno,J.R., Agoti,C.N., Gitahi,C.W., Bett,A., Ngama,M., Medley,G.F., Cane,P.A., Nokes,D.J., Nokes,J.D.	
1269	KF156442	KF156442.1	KF156442	2009-02-16	Africa	Kenya			Homo sapiens	2013-11-30		Agoti et al		Agoti,C.N., Mayieka,L.M., Otieno,J.R., Ahmed,J.A., Fields,B.S., Waiboci,L.W., Nyoka,R., Eidex,R.B., Marano,N., Burton,W., Montgomery,J.M., Breiman,R.F., Nokes,D.J., Mayieka,L., Fields,B., Waiboci,L.B., Eidex,R., Morano,N., Montgomery,J., Breiman,R.	
1270	OK458593	OK458593.1	OK458593	2009-02-16	Africa	Kenya			Homo sapiens	2021-12-13		Wangui et al		Wangui,J.M., Nokes,J.D., Opot,B.H., Opanda,S.M., Agoti,C.N., Otieno,J.R., Bulimo,W.D.	
1271	KF156443	KF156443.1	KF156443	2009-02-17	Africa	Kenya			Homo sapiens	2013-11-30		Agoti et al		Agoti,C.N., Mayieka,L.M., Otieno,J.R., Ahmed,J.A., Fields,B.S., Waiboci,L.W., Nyoka,R., Eidex,R.B., Marano,N., Burton,W., Montgomery,J.M., Breiman,R.F., Nokes,D.J., Mayieka,L., Fields,B., Waiboci,L.B., Eidex,R., Morano,N., Montgomery,J., Breiman,R.	
1272	OK458581	OK458581.1	OK458581	2009-02-17	Africa	Kenya			Homo sapiens	2021-12-13		Wangui et al		Wangui,J.M., Nokes,J.D., Opot,B.H., Opanda,S.M., Agoti,C.N., Otieno,J.R., Bulimo,W.D.	
1273	KF156444	KF156444.1	KF156444	2009-02-18	Africa	Kenya			Homo sapiens	2013-11-30		Agoti et al		Agoti,C.N., Mayieka,L.M., Otieno,J.R., Ahmed,J.A., Fields,B.S., Waiboci,L.W., Nyoka,R., Eidex,R.B., Marano,N., Burton,W., Montgomery,J.M., Breiman,R.F., Nokes,D.J., Mayieka,L., Fields,B., Waiboci,L.B., Eidex,R., Morano,N., Montgomery,J., Breiman,R.	
1274	KF156445	KF156445.1	KF156445	2009-02-18	Africa	Kenya			Homo sapiens	2013-11-30		Agoti et al		Agoti,C.N., Mayieka,L.M., Otieno,J.R., Ahmed,J.A., Fields,B.S., Waiboci,L.W., Nyoka,R., Eidex,R.B., Marano,N., Burton,W., Montgomery,J.M., Breiman,R.F., Nokes,D.J., Mayieka,L., Fields,B., Waiboci,L.B., Eidex,R., Morano,N., Montgomery,J., Breiman,R.	
1275	JX976375	JX976375.1	JX976375	2009-02-19	North America	Cuba			Homo sapiens	2014-09-25		Valdes et al		Valdes,O., Corso,M., Pinon,A., Acosta,B., Savon,C., Gonzalez,G., Mune,M., Hernandez,B., Echevarria,Y., Oropesa,S.	
1276	JX976376	JX976376.1	JX976376	2009-02-19	North America	Cuba			Homo sapiens	2014-09-25		Valdes et al		Valdes,O., Corso,M., Pinon,A., Acosta,B., Savon,C., Gonzalez,G., Mune,M., Hernandez,B., Echevarria,Y., Oropesa,S.	
1277	KT765497	KT765497.1	KEN/Kilifi/759_19/02/2009	2009-02-19	Africa	Kenya			Homo sapiens	2016-02-27		Otieno et al		Otieno,J.R., Agoti,C.N., Gitahi,C.W., Bett,A., Ngama,M., Medley,G.F., Cane,P.A., Nokes,D.J., Nokes,J.D.	
1278	KT765498	KT765498.1	KEN/Kilifi/760_20/02/2009	2009-02-20	Africa	Kenya			Homo sapiens	2016-02-27		Otieno et al		Otieno,J.R., Agoti,C.N., Gitahi,C.W., Bett,A., Ngama,M., Medley,G.F., Cane,P.A., Nokes,D.J., Nokes,J.D.	
1279	KT765390	KT765390.1	KEN/Kilifi/762_21/02/2009	2009-02-21	Africa	Kenya			Homo sapiens	2016-02-27		Otieno et al		Otieno,J.R., Agoti,C.N., Gitahi,C.W., Bett,A., Ngama,M., Medley,G.F., Cane,P.A., Nokes,D.J., Nokes,J.D.	
1280	KT765514	KT765514.1	KEN/Kilifi/761_21/02/2009	2009-02-21	Africa	Kenya			Homo sapiens	2016-02-27		Otieno et al		Otieno,J.R., Agoti,C.N., Gitahi,C.W., Bett,A., Ngama,M., Medley,G.F., Cane,P.A., Nokes,D.J., Nokes,J.D.	
1281	KT765391	KT765391.1	KEN/Kilifi/764_22/02/2009	2009-02-22	Africa	Kenya			Homo sapiens	2016-02-27		Otieno et al		Otieno,J.R., Agoti,C.N., Gitahi,C.W., Bett,A., Ngama,M., Medley,G.F., Cane,P.A., Nokes,D.J., Nokes,J.D.	
1282	KT765561	KT765561.1	KEN/Kilifi/763_22/02/2009	2009-02-22	Africa	Kenya			Homo sapiens	2016-02-27		Otieno et al		Otieno,J.R., Agoti,C.N., Gitahi,C.W., Bett,A., Ngama,M., Medley,G.F., Cane,P.A., Nokes,D.J., Nokes,J.D.	
1283	KT765687	KT765687.1	KEN/Kilifi/765_22/02/2009	2009-02-22	Africa	Kenya			Homo sapiens	2016-02-27		Otieno et al		Otieno,J.R., Agoti,C.N., Gitahi,C.W., Bett,A., Ngama,M., Medley,G.F., Cane,P.A., Nokes,D.J., Nokes,J.D.	
1284	KT765507	KT765507.1	KEN/Kilifi/766_23/02/2009	2009-02-23	Africa	Kenya			Homo sapiens	2016-02-27		Otieno et al		Otieno,J.R., Agoti,C.N., Gitahi,C.W., Bett,A., Ngama,M., Medley,G.F., Cane,P.A., Nokes,D.J., Nokes,J.D.	
1285	KF156446	KF156446.1	KF156446	2009-02-27	Africa	Kenya			Homo sapiens	2013-11-30		Agoti et al		Agoti,C.N., Mayieka,L.M., Otieno,J.R., Ahmed,J.A., Fields,B.S., Waiboci,L.W., Nyoka,R., Eidex,R.B., Marano,N., Burton,W., Montgomery,J.M., Breiman,R.F., Nokes,D.J., Mayieka,L., Fields,B., Waiboci,L.B., Eidex,R., Morano,N., Montgomery,J., Breiman,R.	
1286	HQ699270	HQ699270.1	HQ699270	2009-03-XX	Asia	South Korea			Homo sapiens	2011-07-13		Baek et al		Baek,Y.H., Choi,E.H., Song,M.S., Pascua,P.N., Kwon,H.I., Park,S.J., Lee,J.H., Woo,S.I., Ahn,B.H., Han,H.S., Hahn,Y.S., Shin,K.S., Jang,H.L., Kim,S.Y., Choi,Y.K., Park,S.-J., Song,M.-S., Choi,Y.-K.	
1287	KT765496	KT765496.1	KEN/Kilifi/767_01/03/2009	2009-03-01	Africa	Kenya			Homo sapiens	2016-02-27		Otieno et al		Otieno,J.R., Agoti,C.N., Gitahi,C.W., Bett,A., Ngama,M., Medley,G.F., Cane,P.A., Nokes,D.J., Nokes,J.D.	
1288	KF156447	KF156447.1	KF156447	2009-03-02	Africa	Kenya			Homo sapiens	2013-11-30		Agoti et al		Agoti,C.N., Mayieka,L.M., Otieno,J.R., Ahmed,J.A., Fields,B.S., Waiboci,L.W., Nyoka,R., Eidex,R.B., Marano,N., Burton,W., Montgomery,J.M., Breiman,R.F., Nokes,D.J., Mayieka,L., Fields,B., Waiboci,L.B., Eidex,R., Morano,N., Montgomery,J., Breiman,R.	
1289	KT765493	KT765493.1	KEN/Kilifi/768_02/03/2009	2009-03-02	Africa	Kenya			Homo sapiens	2016-02-27		Otieno et al		Otieno,J.R., Agoti,C.N., Gitahi,C.W., Bett,A., Ngama,M., Medley,G.F., Cane,P.A., Nokes,D.J., Nokes,J.D.	
1290	MF445780	MF445780.1	MF445780	2009-03-02	Asia	China			Homo sapiens	2019-12-31		Su et al		Su,Y., Wu,Y., Tian,R., Liang,G.	
1291	MF445967	MF445967.1	MF445967	2009-03-02	Asia	China			Homo sapiens	2019-12-31		Su et al		Su,Y., Wu,Y., Tian,R., Liang,G.	
1292	OK458636	OK458636.1	OK458636	2009-03-02	Africa	Kenya			Homo sapiens	2021-12-13		Wangui et al		Wangui,J.M., Nokes,J.D., Opot,B.H., Opanda,S.M., Agoti,C.N., Otieno,J.R., Bulimo,W.D.	
1293	KF156448	KF156448.1	KF156448	2009-03-03	Africa	Kenya			Homo sapiens	2013-11-30		Agoti et al		Agoti,C.N., Mayieka,L.M., Otieno,J.R., Ahmed,J.A., Fields,B.S., Waiboci,L.W., Nyoka,R., Eidex,R.B., Marano,N., Burton,W., Montgomery,J.M., Breiman,R.F., Nokes,D.J., Mayieka,L., Fields,B., Waiboci,L.B., Eidex,R., Morano,N., Montgomery,J., Breiman,R.	
1294	OK458579	OK458579.1	OK458579	2009-03-03	Africa	Kenya			Homo sapiens	2021-12-13		Wangui et al		Wangui,J.M., Nokes,J.D., Opot,B.H., Opanda,S.M., Agoti,C.N., Otieno,J.R., Bulimo,W.D.	
1295	OK458587	OK458587.1	OK458587	2009-03-03	Africa	Kenya			Homo sapiens	2021-12-13		Wangui et al		Wangui,J.M., Nokes,J.D., Opot,B.H., Opanda,S.M., Agoti,C.N., Otieno,J.R., Bulimo,W.D.	
1296	OK458590	OK458590.1	OK458590	2009-03-04	Africa	Kenya			Homo sapiens	2021-12-13		Wangui et al		Wangui,J.M., Nokes,J.D., Opot,B.H., Opanda,S.M., Agoti,C.N., Otieno,J.R., Bulimo,W.D.	
1297	OK458591	OK458591.1	OK458591	2009-03-04	Africa	Kenya			Homo sapiens	2021-12-13		Wangui et al		Wangui,J.M., Nokes,J.D., Opot,B.H., Opanda,S.M., Agoti,C.N., Otieno,J.R., Bulimo,W.D.	
1298	KT765509	KT765509.1	KEN/Kilifi/769_05/03/2009	2009-03-05	Africa	Kenya			Homo sapiens	2016-02-27		Otieno et al		Otieno,J.R., Agoti,C.N., Gitahi,C.W., Bett,A., Ngama,M., Medley,G.F., Cane,P.A., Nokes,D.J., Nokes,J.D.	
1299	KT765275	KT765275.1	KEN/Kilifi/770_08/03/2009	2009-03-08	Africa	Kenya			Homo sapiens	2016-02-27		Otieno et al		Otieno,J.R., Agoti,C.N., Gitahi,C.W., Bett,A., Ngama,M., Medley,G.F., Cane,P.A., Nokes,D.J., Nokes,J.D.	
1300	KT765518	KT765518.1	KEN/Kilifi/771_10/03/2009	2009-03-10	Africa	Kenya			Homo sapiens	2016-02-27		Otieno et al		Otieno,J.R., Agoti,C.N., Gitahi,C.W., Bett,A., Ngama,M., Medley,G.F., Cane,P.A., Nokes,D.J., Nokes,J.D.	
1301	OK458594	OK458594.1	OK458594	2009-03-10	Africa	Kenya			Homo sapiens	2021-12-13		Wangui et al		Wangui,J.M., Nokes,J.D., Opot,B.H., Opanda,S.M., Agoti,C.N., Otieno,J.R., Bulimo,W.D.	
1302	KT765499	KT765499.1	KEN/Kilifi/772_11/03/2009	2009-03-11	Africa	Kenya			Homo sapiens	2016-02-27		Otieno et al		Otieno,J.R., Agoti,C.N., Gitahi,C.W., Bett,A., Ngama,M., Medley,G.F., Cane,P.A., Nokes,D.J., Nokes,J.D.	
1303	OK458619	OK458619.1	OK458619	2009-03-12	Africa	Kenya			Homo sapiens	2021-12-13		Wangui et al		Wangui,J.M., Nokes,J.D., Opot,B.H., Opanda,S.M., Agoti,C.N., Otieno,J.R., Bulimo,W.D.	
1304	OK458622	OK458622.1	OK458622	2009-03-19	Africa	Kenya			Homo sapiens	2021-12-13		Wangui et al		Wangui,J.M., Nokes,J.D., Opot,B.H., Opanda,S.M., Agoti,C.N., Otieno,J.R., Bulimo,W.D.	
1305	OK458626	OK458626.1	OK458626	2009-03-19	Africa	Kenya			Homo sapiens	2021-12-13		Wangui et al		Wangui,J.M., Nokes,J.D., Opot,B.H., Opanda,S.M., Agoti,C.N., Otieno,J.R., Bulimo,W.D.	
1306	KT765287	KT765287.1	KEN/Kilifi/773_23/03/2009	2009-03-23	Africa	Kenya			Homo sapiens	2016-02-27		Otieno et al		Otieno,J.R., Agoti,C.N., Gitahi,C.W., Bett,A., Ngama,M., Medley,G.F., Cane,P.A., Nokes,D.J., Nokes,J.D.	
1307	OK458608	OK458608.1	OK458608	2009-03-23	Africa	Kenya			Homo sapiens	2021-12-13		Wangui et al		Wangui,J.M., Nokes,J.D., Opot,B.H., Opanda,S.M., Agoti,C.N., Otieno,J.R., Bulimo,W.D.	
1308	KT765502	KT765502.1	KEN/Kilifi/774_25/03/2009	2009-03-25	Africa	Kenya			Homo sapiens	2016-02-27		Otieno et al		Otieno,J.R., Agoti,C.N., Gitahi,C.W., Bett,A., Ngama,M., Medley,G.F., Cane,P.A., Nokes,D.J., Nokes,J.D.	
1309	JX976338	JX976338.1	JX976338	2009-03-26	North America	Cuba			Homo sapiens	2014-09-25		Valdes et al		Valdes,O., Corso,M., Pinon,A., Acosta,B., Savon,C., Gonzalez,G., Mune,M., Hernandez,B., Echevarria,Y., Oropesa,S.	
1310	JX976366	JX976366.1	JX976366	2009-03-26	North America	Cuba			Homo sapiens	2014-09-25		Valdes et al		Valdes,O., Corso,M., Pinon,A., Acosta,B., Savon,C., Gonzalez,G., Mune,M., Hernandez,B., Echevarria,Y., Oropesa,S.	
1311	JX976367	JX976367.1	JX976367	2009-03-26	North America	Cuba			Homo sapiens	2014-09-25		Valdes et al		Valdes,O., Corso,M., Pinon,A., Acosta,B., Savon,C., Gonzalez,G., Mune,M., Hernandez,B., Echevarria,Y., Oropesa,S.	
1312	JX976368	JX976368.1	JX976368	2009-03-27	North America	Cuba			Homo sapiens	2014-09-25		Valdes et al		Valdes,O., Corso,M., Pinon,A., Acosta,B., Savon,C., Gonzalez,G., Mune,M., Hernandez,B., Echevarria,Y., Oropesa,S.	
1313	KF156449	KF156449.1	KF156449	2009-03-27	Africa	Kenya			Homo sapiens	2013-11-30		Agoti et al		Agoti,C.N., Mayieka,L.M., Otieno,J.R., Ahmed,J.A., Fields,B.S., Waiboci,L.W., Nyoka,R., Eidex,R.B., Marano,N., Burton,W., Montgomery,J.M., Breiman,R.F., Nokes,D.J., Mayieka,L., Fields,B., Waiboci,L.B., Eidex,R., Morano,N., Montgomery,J., Breiman,R.	
1314	HQ699271	HQ699271.1	HQ699271	2009-04-XX	Asia	South Korea			Homo sapiens	2011-07-13		Baek et al		Baek,Y.H., Choi,E.H., Song,M.S., Pascua,P.N., Kwon,H.I., Park,S.J., Lee,J.H., Woo,S.I., Ahn,B.H., Han,H.S., Hahn,Y.S., Shin,K.S., Jang,H.L., Kim,S.Y., Choi,Y.K., Park,S.-J., Song,M.-S., Choi,Y.-K.	
1315	KT765688	KT765688.1	KEN/Kilifi/775_03/04/2009	2009-04-03	Africa	Kenya			Homo sapiens	2016-02-27		Otieno et al		Otieno,J.R., Agoti,C.N., Gitahi,C.W., Bett,A., Ngama,M., Medley,G.F., Cane,P.A., Nokes,D.J., Nokes,J.D.	
1316	KT765492	KT765492.1	KEN/Kilifi/777_04/04/2009	2009-04-04	Africa	Kenya			Homo sapiens	2016-02-27		Otieno et al		Otieno,J.R., Agoti,C.N., Gitahi,C.W., Bett,A., Ngama,M., Medley,G.F., Cane,P.A., Nokes,D.J., Nokes,J.D.	
1317	KT765495	KT765495.1	KEN/Kilifi/776_04/04/2009	2009-04-04	Africa	Kenya			Homo sapiens	2016-02-27		Otieno et al		Otieno,J.R., Agoti,C.N., Gitahi,C.W., Bett,A., Ngama,M., Medley,G.F., Cane,P.A., Nokes,D.J., Nokes,J.D.	
1318	OK458580	OK458580.1	OK458580	2009-04-06	Africa	Kenya			Homo sapiens	2021-12-13		Wangui et al		Wangui,J.M., Nokes,J.D., Opot,B.H., Opanda,S.M., Agoti,C.N., Otieno,J.R., Bulimo,W.D.	
1319	OK458656	OK458656.1	OK458656	2009-04-06	Africa	Kenya			Homo sapiens	2021-12-13		Wangui et al		Wangui,J.M., Nokes,J.D., Opot,B.H., Opanda,S.M., Agoti,C.N., Otieno,J.R., Bulimo,W.D.	
1320	OK458598	OK458598.1	OK458598	2009-04-14	Africa	Kenya			Homo sapiens	2021-12-13		Wangui et al		Wangui,J.M., Nokes,J.D., Opot,B.H., Opanda,S.M., Agoti,C.N., Otieno,J.R., Bulimo,W.D.	
1321	OK458633	OK458633.1	OK458633	2009-04-23	Africa	Kenya			Homo sapiens	2021-12-13		Wangui et al		Wangui,J.M., Nokes,J.D., Opot,B.H., Opanda,S.M., Agoti,C.N., Otieno,J.R., Bulimo,W.D.	
1322	OK458635	OK458635.1	OK458635	2009-04-30	Africa	Kenya			Homo sapiens	2021-12-13		Wangui et al		Wangui,J.M., Nokes,J.D., Opot,B.H., Opanda,S.M., Agoti,C.N., Otieno,J.R., Bulimo,W.D.	
1323	KF156450	KF156450.1	KF156450	2009-05-02	Africa	Kenya			Homo sapiens	2013-11-30		Agoti et al		Agoti,C.N., Mayieka,L.M., Otieno,J.R., Ahmed,J.A., Fields,B.S., Waiboci,L.W., Nyoka,R., Eidex,R.B., Marano,N., Burton,W., Montgomery,J.M., Breiman,R.F., Nokes,D.J., Mayieka,L., Fields,B., Waiboci,L.B., Eidex,R., Morano,N., Montgomery,J., Breiman,R.	
1324	KF156451	KF156451.1	KF156451	2009-05-05	Africa	Kenya			Homo sapiens	2013-11-30		Agoti et al		Agoti,C.N., Mayieka,L.M., Otieno,J.R., Ahmed,J.A., Fields,B.S., Waiboci,L.W., Nyoka,R., Eidex,R.B., Marano,N., Burton,W., Montgomery,J.M., Breiman,R.F., Nokes,D.J., Mayieka,L., Fields,B., Waiboci,L.B., Eidex,R., Morano,N., Montgomery,J., Breiman,R.	
1325	KF156452	KF156452.1	KF156452	2009-05-11	Africa	Kenya			Homo sapiens	2013-11-30		Agoti et al		Agoti,C.N., Mayieka,L.M., Otieno,J.R., Ahmed,J.A., Fields,B.S., Waiboci,L.W., Nyoka,R., Eidex,R.B., Marano,N., Burton,W., Montgomery,J.M., Breiman,R.F., Nokes,D.J., Mayieka,L., Fields,B., Waiboci,L.B., Eidex,R., Morano,N., Montgomery,J., Breiman,R.	
1326	OK458650	OK458650.1	OK458650	2009-05-11	Africa	Kenya			Homo sapiens	2021-12-13		Wangui et al		Wangui,J.M., Nokes,J.D., Opot,B.H., Opanda,S.M., Agoti,C.N., Otieno,J.R., Bulimo,W.D.	
1327	OK458599	OK458599.1	OK458599	2009-05-14	Africa	Kenya			Homo sapiens	2021-12-13		Wangui et al		Wangui,J.M., Nokes,J.D., Opot,B.H., Opanda,S.M., Agoti,C.N., Otieno,J.R., Bulimo,W.D.	
1328	KF156453	KF156453.1	KF156453	2009-05-15	Africa	Kenya			Homo sapiens	2013-11-30		Agoti et al		Agoti,C.N., Mayieka,L.M., Otieno,J.R., Ahmed,J.A., Fields,B.S., Waiboci,L.W., Nyoka,R., Eidex,R.B., Marano,N., Burton,W., Montgomery,J.M., Breiman,R.F., Nokes,D.J., Mayieka,L., Fields,B., Waiboci,L.B., Eidex,R., Morano,N., Montgomery,J., Breiman,R.	
1329	KF156454	KF156454.1	KF156454	2009-05-18	Africa	Kenya			Homo sapiens	2013-11-30		Agoti et al		Agoti,C.N., Mayieka,L.M., Otieno,J.R., Ahmed,J.A., Fields,B.S., Waiboci,L.W., Nyoka,R., Eidex,R.B., Marano,N., Burton,W., Montgomery,J.M., Breiman,R.F., Nokes,D.J., Mayieka,L., Fields,B., Waiboci,L.B., Eidex,R., Morano,N., Montgomery,J., Breiman,R.	
1330	KT765388	KT765388.1	KEN/Kilifi/778_20/05/2009	2009-05-20	Africa	Kenya			Homo sapiens	2016-02-27		Otieno et al		Otieno,J.R., Agoti,C.N., Gitahi,C.W., Bett,A., Ngama,M., Medley,G.F., Cane,P.A., Nokes,D.J., Nokes,J.D.	
1331	OK458597	OK458597.1	OK458597	2009-05-20	Africa	Kenya			Homo sapiens	2021-12-13		Wangui et al		Wangui,J.M., Nokes,J.D., Opot,B.H., Opanda,S.M., Agoti,C.N., Otieno,J.R., Bulimo,W.D.	
1332	OK458663	OK458663.1	OK458663	2009-05-21	Africa	Kenya			Homo sapiens	2021-12-13		Wangui et al		Wangui,J.M., Nokes,J.D., Opot,B.H., Opanda,S.M., Agoti,C.N., Otieno,J.R., Bulimo,W.D.	
1333	OK458627	OK458627.1	OK458627	2009-05-22	Africa	Kenya			Homo sapiens	2021-12-13		Wangui et al		Wangui,J.M., Nokes,J.D., Opot,B.H., Opanda,S.M., Agoti,C.N., Otieno,J.R., Bulimo,W.D.	
1334	KF156455	KF156455.1	KF156455	2009-05-23	Africa	Kenya			Homo sapiens	2013-11-30		Agoti et al		Agoti,C.N., Mayieka,L.M., Otieno,J.R., Ahmed,J.A., Fields,B.S., Waiboci,L.W., Nyoka,R., Eidex,R.B., Marano,N., Burton,W., Montgomery,J.M., Breiman,R.F., Nokes,D.J., Mayieka,L., Fields,B., Waiboci,L.B., Eidex,R., Morano,N., Montgomery,J., Breiman,R.	
1335	KT765389	KT765389.1	KEN/Kilifi/779_29/05/2009	2009-05-29	Africa	Kenya			Homo sapiens	2016-02-27		Otieno et al		Otieno,J.R., Agoti,C.N., Gitahi,C.W., Bett,A., Ngama,M., Medley,G.F., Cane,P.A., Nokes,D.J., Nokes,J.D.	
1336	OK458637	OK458637.1	OK458637	2009-05-29	Africa	Kenya			Homo sapiens	2021-12-13		Wangui et al		Wangui,J.M., Nokes,J.D., Opot,B.H., Opanda,S.M., Agoti,C.N., Otieno,J.R., Bulimo,W.D.	
1337	OK458600	OK458600.1	OK458600	2009-06-02	Africa	Kenya			Homo sapiens	2021-12-13		Wangui et al		Wangui,J.M., Nokes,J.D., Opot,B.H., Opanda,S.M., Agoti,C.N., Otieno,J.R., Bulimo,W.D.	
1338	OK458665	OK458665.1	OK458665	2009-06-03	Africa	Kenya			Homo sapiens	2021-12-13		Wangui et al		Wangui,J.M., Nokes,J.D., Opot,B.H., Opanda,S.M., Agoti,C.N., Otieno,J.R., Bulimo,W.D.	
1339	KF156456	KF156456.1	KF156456	2009-06-05	Africa	Kenya			Homo sapiens	2013-11-30		Agoti et al		Agoti,C.N., Mayieka,L.M., Otieno,J.R., Ahmed,J.A., Fields,B.S., Waiboci,L.W., Nyoka,R., Eidex,R.B., Marano,N., Burton,W., Montgomery,J.M., Breiman,R.F., Nokes,D.J., Mayieka,L., Fields,B., Waiboci,L.B., Eidex,R., Morano,N., Montgomery,J., Breiman,R.	
1340	KF156460	KF156460.1	KF156460	2009-06-05	Africa	Kenya			Homo sapiens	2013-11-30		Agoti et al		Agoti,C.N., Mayieka,L.M., Otieno,J.R., Ahmed,J.A., Fields,B.S., Waiboci,L.W., Nyoka,R., Eidex,R.B., Marano,N., Burton,W., Montgomery,J.M., Breiman,R.F., Nokes,D.J., Mayieka,L., Fields,B., Waiboci,L.B., Eidex,R., Morano,N., Montgomery,J., Breiman,R.	
1341	KF156457	KF156457.1	KF156457	2009-06-06	Africa	Kenya			Homo sapiens	2013-11-30		Agoti et al		Agoti,C.N., Mayieka,L.M., Otieno,J.R., Ahmed,J.A., Fields,B.S., Waiboci,L.W., Nyoka,R., Eidex,R.B., Marano,N., Burton,W., Montgomery,J.M., Breiman,R.F., Nokes,D.J., Mayieka,L., Fields,B., Waiboci,L.B., Eidex,R., Morano,N., Montgomery,J., Breiman,R.	
1342	KF156458	KF156458.1	KF156458	2009-06-06	Africa	Kenya			Homo sapiens	2013-11-30		Agoti et al		Agoti,C.N., Mayieka,L.M., Otieno,J.R., Ahmed,J.A., Fields,B.S., Waiboci,L.W., Nyoka,R., Eidex,R.B., Marano,N., Burton,W., Montgomery,J.M., Breiman,R.F., Nokes,D.J., Mayieka,L., Fields,B., Waiboci,L.B., Eidex,R., Morano,N., Montgomery,J., Breiman,R.	
1343	KF156459	KF156459.1	KF156459	2009-06-08	Africa	Kenya			Homo sapiens	2013-11-30		Agoti et al		Agoti,C.N., Mayieka,L.M., Otieno,J.R., Ahmed,J.A., Fields,B.S., Waiboci,L.W., Nyoka,R., Eidex,R.B., Marano,N., Burton,W., Montgomery,J.M., Breiman,R.F., Nokes,D.J., Mayieka,L., Fields,B., Waiboci,L.B., Eidex,R., Morano,N., Montgomery,J., Breiman,R.	
1344	OK458596	OK458596.1	OK458596	2009-06-09	Africa	Kenya			Homo sapiens	2021-12-13		Wangui et al		Wangui,J.M., Nokes,J.D., Opot,B.H., Opanda,S.M., Agoti,C.N., Otieno,J.R., Bulimo,W.D.	
1345	OK458658	OK458658.1	OK458658	2009-06-11	Africa	Kenya			Homo sapiens	2021-12-13		Wangui et al		Wangui,J.M., Nokes,J.D., Opot,B.H., Opanda,S.M., Agoti,C.N., Otieno,J.R., Bulimo,W.D.	
1346	KF156461	KF156461.1	KF156461	2009-06-20	Africa	Kenya			Homo sapiens	2013-11-30		Agoti et al		Agoti,C.N., Mayieka,L.M., Otieno,J.R., Ahmed,J.A., Fields,B.S., Waiboci,L.W., Nyoka,R., Eidex,R.B., Marano,N., Burton,W., Montgomery,J.M., Breiman,R.F., Nokes,D.J., Mayieka,L., Fields,B., Waiboci,L.B., Eidex,R., Morano,N., Montgomery,J., Breiman,R.	
1347	KF156462	KF156462.1	KF156462	2009-06-20	Africa	Kenya			Homo sapiens	2013-11-30		Agoti et al		Agoti,C.N., Mayieka,L.M., Otieno,J.R., Ahmed,J.A., Fields,B.S., Waiboci,L.W., Nyoka,R., Eidex,R.B., Marano,N., Burton,W., Montgomery,J.M., Breiman,R.F., Nokes,D.J., Mayieka,L., Fields,B., Waiboci,L.B., Eidex,R., Morano,N., Montgomery,J., Breiman,R.	
1348	KF156359	KF156359.1	KF156359	2009-06-23	Africa	Kenya			Homo sapiens	2013-11-30		Agoti et al		Agoti,C.N., Mayieka,L.M., Otieno,J.R., Ahmed,J.A., Fields,B.S., Waiboci,L.W., Nyoka,R., Eidex,R.B., Marano,N., Burton,W., Montgomery,J.M., Breiman,R.F., Nokes,D.J., Mayieka,L., Fields,B., Waiboci,L.B., Eidex,R., Morano,N., Montgomery,J., Breiman,R.	
1349	OK458667	OK458667.1	OK458667	2009-06-24	Africa	Kenya			Homo sapiens	2021-12-13		Wangui et al		Wangui,J.M., Nokes,J.D., Opot,B.H., Opanda,S.M., Agoti,C.N., Otieno,J.R., Bulimo,W.D.	
1350	OK458662	OK458662.1	OK458662	2009-06-25	Africa	Kenya			Homo sapiens	2021-12-13		Wangui et al		Wangui,J.M., Nokes,J.D., Opot,B.H., Opanda,S.M., Agoti,C.N., Otieno,J.R., Bulimo,W.D.	
1351	OK458629	OK458629.1	OK458629	2009-06-26	Africa	Kenya			Homo sapiens	2021-12-13		Wangui et al		Wangui,J.M., Nokes,J.D., Opot,B.H., Opanda,S.M., Agoti,C.N., Otieno,J.R., Bulimo,W.D.	
1352	KF156463	KF156463.1	KF156463	2009-06-27	Africa	Kenya			Homo sapiens	2013-11-30		Agoti et al		Agoti,C.N., Mayieka,L.M., Otieno,J.R., Ahmed,J.A., Fields,B.S., Waiboci,L.W., Nyoka,R., Eidex,R.B., Marano,N., Burton,W., Montgomery,J.M., Breiman,R.F., Nokes,D.J., Mayieka,L., Fields,B., Waiboci,L.B., Eidex,R., Morano,N., Montgomery,J., Breiman,R.	
1353	KC461269	KC461269.1	CQ120-0709	2009-07-XX	Asia	China			Homo sapiens	2013-04-15		Ren et al		Ren,L., Liu,E.	
1354	OK458651	OK458651.1	OK458651	2009-07-02	Africa	Kenya			Homo sapiens	2021-12-13		Wangui et al		Wangui,J.M., Nokes,J.D., Opot,B.H., Opanda,S.M., Agoti,C.N., Otieno,J.R., Bulimo,W.D.	
1355	JX976369	JX976369.1	JX976369	2009-07-07	North America	Cuba			Homo sapiens	2014-09-25		Valdes et al		Valdes,O., Corso,M., Pinon,A., Acosta,B., Savon,C., Gonzalez,G., Mune,M., Hernandez,B., Echevarria,Y., Oropesa,S.	
1356	KF156360	KF156360.1	KF156360	2009-07-07	Africa	Kenya			Homo sapiens	2013-11-30		Agoti et al		Agoti,C.N., Mayieka,L.M., Otieno,J.R., Ahmed,J.A., Fields,B.S., Waiboci,L.W., Nyoka,R., Eidex,R.B., Marano,N., Burton,W., Montgomery,J.M., Breiman,R.F., Nokes,D.J., Mayieka,L., Fields,B., Waiboci,L.B., Eidex,R., Morano,N., Montgomery,J., Breiman,R.	
1357	JX976371	JX976371.1	JX976371	2009-07-10	North America	Cuba			Homo sapiens	2014-09-25		Valdes et al		Valdes,O., Corso,M., Pinon,A., Acosta,B., Savon,C., Gonzalez,G., Mune,M., Hernandez,B., Echevarria,Y., Oropesa,S.	
1358	JX976370	JX976370.1	JX976370	2009-07-11	North America	Cuba			Homo sapiens	2014-09-25		Valdes et al		Valdes,O., Corso,M., Pinon,A., Acosta,B., Savon,C., Gonzalez,G., Mune,M., Hernandez,B., Echevarria,Y., Oropesa,S.	
1359	KF156464	KF156464.1	KF156464	2009-07-11	Africa	Kenya			Homo sapiens	2013-11-30		Agoti et al		Agoti,C.N., Mayieka,L.M., Otieno,J.R., Ahmed,J.A., Fields,B.S., Waiboci,L.W., Nyoka,R., Eidex,R.B., Marano,N., Burton,W., Montgomery,J.M., Breiman,R.F., Nokes,D.J., Mayieka,L., Fields,B., Waiboci,L.B., Eidex,R., Morano,N., Montgomery,J., Breiman,R.	
1360	KF156361	KF156361.1	KF156361	2009-07-13	Africa	Kenya			Homo sapiens	2013-11-30		Agoti et al		Agoti,C.N., Mayieka,L.M., Otieno,J.R., Ahmed,J.A., Fields,B.S., Waiboci,L.W., Nyoka,R., Eidex,R.B., Marano,N., Burton,W., Montgomery,J.M., Breiman,R.F., Nokes,D.J., Mayieka,L., Fields,B., Waiboci,L.B., Eidex,R., Morano,N., Montgomery,J., Breiman,R.	
1361	KF156465	KF156465.1	KF156465	2009-07-18	Africa	Kenya			Homo sapiens	2013-11-30		Agoti et al		Agoti,C.N., Mayieka,L.M., Otieno,J.R., Ahmed,J.A., Fields,B.S., Waiboci,L.W., Nyoka,R., Eidex,R.B., Marano,N., Burton,W., Montgomery,J.M., Breiman,R.F., Nokes,D.J., Mayieka,L., Fields,B., Waiboci,L.B., Eidex,R., Morano,N., Montgomery,J., Breiman,R.	
1362	KF156466	KF156466.1	KF156466	2009-07-20	Africa	Kenya			Homo sapiens	2013-11-30		Agoti et al		Agoti,C.N., Mayieka,L.M., Otieno,J.R., Ahmed,J.A., Fields,B.S., Waiboci,L.W., Nyoka,R., Eidex,R.B., Marano,N., Burton,W., Montgomery,J.M., Breiman,R.F., Nokes,D.J., Mayieka,L., Fields,B., Waiboci,L.B., Eidex,R., Morano,N., Montgomery,J., Breiman,R.	
1363	JX976372	JX976372.1	JX976372	2009-07-22	North America	Cuba			Homo sapiens	2014-09-25		Valdes et al		Valdes,O., Corso,M., Pinon,A., Acosta,B., Savon,C., Gonzalez,G., Mune,M., Hernandez,B., Echevarria,Y., Oropesa,S.	
1364	OK458634	OK458634.1	OK458634	2009-07-23	Africa	Kenya			Homo sapiens	2021-12-13		Wangui et al		Wangui,J.M., Nokes,J.D., Opot,B.H., Opanda,S.M., Agoti,C.N., Otieno,J.R., Bulimo,W.D.	
1365	KF156467	KF156467.1	KF156467	2009-07-27	Africa	Kenya			Homo sapiens	2013-11-30		Agoti et al		Agoti,C.N., Mayieka,L.M., Otieno,J.R., Ahmed,J.A., Fields,B.S., Waiboci,L.W., Nyoka,R., Eidex,R.B., Marano,N., Burton,W., Montgomery,J.M., Breiman,R.F., Nokes,D.J., Mayieka,L., Fields,B., Waiboci,L.B., Eidex,R., Morano,N., Montgomery,J., Breiman,R.	
1366	KF156468	KF156468.1	KF156468	2009-07-29	Africa	Kenya			Homo sapiens	2013-11-30		Agoti et al		Agoti,C.N., Mayieka,L.M., Otieno,J.R., Ahmed,J.A., Fields,B.S., Waiboci,L.W., Nyoka,R., Eidex,R.B., Marano,N., Burton,W., Montgomery,J.M., Breiman,R.F., Nokes,D.J., Mayieka,L., Fields,B., Waiboci,L.B., Eidex,R., Morano,N., Montgomery,J., Breiman,R.	
1367	OK458641	OK458641.1	OK458641	2009-07-29	Africa	Kenya			Homo sapiens	2021-12-13		Wangui et al		Wangui,J.M., Nokes,J.D., Opot,B.H., Opanda,S.M., Agoti,C.N., Otieno,J.R., Bulimo,W.D.	
1368	OK458648	OK458648.1	OK458648	2009-07-29	Africa	Kenya			Homo sapiens	2021-12-13		Wangui et al		Wangui,J.M., Nokes,J.D., Opot,B.H., Opanda,S.M., Agoti,C.N., Otieno,J.R., Bulimo,W.D.	
1369	OK458628	OK458628.1	OK458628	2009-08-03	Africa	Kenya			Homo sapiens	2021-12-13		Wangui et al		Wangui,J.M., Nokes,J.D., Opot,B.H., Opanda,S.M., Agoti,C.N., Otieno,J.R., Bulimo,W.D.	
1370	OK458624	OK458624.1	OK458624	2009-08-04	Africa	Kenya			Homo sapiens	2021-12-13		Wangui et al		Wangui,J.M., Nokes,J.D., Opot,B.H., Opanda,S.M., Agoti,C.N., Otieno,J.R., Bulimo,W.D.	
1371	KF156469	KF156469.1	KF156469	2009-08-07	Africa	Kenya			Homo sapiens	2013-11-30		Agoti et al		Agoti,C.N., Mayieka,L.M., Otieno,J.R., Ahmed,J.A., Fields,B.S., Waiboci,L.W., Nyoka,R., Eidex,R.B., Marano,N., Burton,W., Montgomery,J.M., Breiman,R.F., Nokes,D.J., Mayieka,L., Fields,B., Waiboci,L.B., Eidex,R., Morano,N., Montgomery,J., Breiman,R.	
1372	OK664830	OK664830.1	VR/2009/0552	2009-08-10	Africa	Senegal			Homo sapiens	2022-01-19		Fall A et al		Fall A, Elawar F, Hodcroft EB, Jallow MM, Toure CT, Barry MA, Kiori DE, Sy S, Diaw Y, Goudiaby D, Niang MN, Dia N, Fall,A., Jallow,M.M., Toure,C.T., Kiori,D.E., sy,S., Diaw,Y., Goudiaby,D., Niang,M.N., Dia,N.	
1373	KF156470	KF156470.1	KF156470	2009-08-15	Africa	Kenya			Homo sapiens	2013-11-30		Agoti et al		Agoti,C.N., Mayieka,L.M., Otieno,J.R., Ahmed,J.A., Fields,B.S., Waiboci,L.W., Nyoka,R., Eidex,R.B., Marano,N., Burton,W., Montgomery,J.M., Breiman,R.F., Nokes,D.J., Mayieka,L., Fields,B., Waiboci,L.B., Eidex,R., Morano,N., Montgomery,J., Breiman,R.	
1374	JX976373	JX976373.1	JX976373	2009-08-17	North America	Cuba			Homo sapiens	2014-09-25		Valdes et al		Valdes,O., Corso,M., Pinon,A., Acosta,B., Savon,C., Gonzalez,G., Mune,M., Hernandez,B., Echevarria,Y., Oropesa,S.	
1375	AB978290	AB978290.1	AB978290	2009-08-25	Asia	Japan	Fukui		Homo sapiens	2014-10-04		Hirano et al		Hirano,E., Kobayashi,M., Tsukagoshi,H., Yoshida,L.M., Kuroda,M., Noda,M., Ishioka,T., Kozawa,K., Ishii,H., Yoshida,A., Oishi,K., Ryo,A., Kimura,H.	
1376	OK458670	OK458670.1	OK458670	2009-08-28	Africa	Kenya			Homo sapiens	2021-12-13		Wangui et al		Wangui,J.M., Nokes,J.D., Opot,B.H., Opanda,S.M., Agoti,C.N., Otieno,J.R., Bulimo,W.D.	
1377	KY782635	KY782635.1	KY782635	2009-09-01	Asia	China			Homo sapiens	2017-05-07		Zhu et al		Zhu,C., Fu,S., Yu,L., Zhou,X.	
1378	KX533725	KX533725.1	KX533725	2009-09-15	Asia	China			Homo sapiens	2017-09-28		Song et al		Song,J., Zhang,Y., Wang,H., Shi,J., Sun,L., Zhang,X., Yang,Z., Guan,W., Zhang,H., Yu,P., Xie,Z., Cui,A., Ng,T.I., Xu,W.	
1379	KY296721	KY296721.1	KY296721	2009-09-15	Asia	China			Homo sapiens	2018-12-10		Song et al		Song,J., Wang,H., Ng,T.I., Cui,A., Zhu,S., Huang,Y., Sun,L., Yang,Z., Yu,D., Yu,P., Zhang,H., Zhang,Y., Xu,W.	
1380	OK458661	OK458661.1	OK458661	2009-09-22	Africa	Kenya			Homo sapiens	2021-12-13		Wangui et al		Wangui,J.M., Nokes,J.D., Opot,B.H., Opanda,S.M., Agoti,C.N., Otieno,J.R., Bulimo,W.D.	
1381	JX976339	JX976339.1	JX976339	2009-10-24	North America	Cuba			Homo sapiens	2014-09-25		Valdes et al		Valdes,O., Corso,M., Pinon,A., Acosta,B., Savon,C., Gonzalez,G., Mune,M., Hernandez,B., Echevarria,Y., Oropesa,S.	
1382	HQ699263	HQ699263.1	HQ699263	2009-11-XX	Asia	South Korea			Homo sapiens	2011-07-13		Baek et al		Baek,Y.H., Choi,E.H., Song,M.S., Pascua,P.N., Kwon,H.I., Park,S.J., Lee,J.H., Woo,S.I., Ahn,B.H., Han,H.S., Hahn,Y.S., Shin,K.S., Jang,H.L., Kim,S.Y., Choi,Y.K., Park,S.-J., Song,M.-S., Choi,Y.-K.	
1383	HQ699272	HQ699272.1	HQ699272	2009-11-XX	Asia	South Korea			Homo sapiens	2011-07-13		Baek et al		Baek,Y.H., Choi,E.H., Song,M.S., Pascua,P.N., Kwon,H.I., Park,S.J., Lee,J.H., Woo,S.I., Ahn,B.H., Han,H.S., Hahn,Y.S., Shin,K.S., Jang,H.L., Kim,S.Y., Choi,Y.K., Park,S.-J., Song,M.-S., Choi,Y.-K.	
1384	HQ699278	HQ699278.1	HQ699278	2009-11-XX	Asia	South Korea			Homo sapiens	2011-07-13		Baek et al		Baek,Y.H., Choi,E.H., Song,M.S., Pascua,P.N., Kwon,H.I., Park,S.J., Lee,J.H., Woo,S.I., Ahn,B.H., Han,H.S., Hahn,Y.S., Shin,K.S., Jang,H.L., Kim,S.Y., Choi,Y.K., Park,S.-J., Song,M.-S., Choi,Y.-K.	
1385	HQ699283	HQ699283.1	HQ699283	2009-11-XX	Asia	South Korea			Homo sapiens	2011-07-13		Baek et al		Baek,Y.H., Choi,E.H., Song,M.S., Pascua,P.N., Kwon,H.I., Park,S.J., Lee,J.H., Woo,S.I., Ahn,B.H., Han,H.S., Hahn,Y.S., Shin,K.S., Jang,H.L., Kim,S.Y., Choi,Y.K., Park,S.-J., Song,M.-S., Choi,Y.-K.	
1386	JX976340	JX976340.1	JX976340	2009-11-08	North America	Cuba			Homo sapiens	2014-09-25		Valdes et al		Valdes,O., Corso,M., Pinon,A., Acosta,B., Savon,C., Gonzalez,G., Mune,M., Hernandez,B., Echevarria,Y., Oropesa,S.	
1387	MF445781	MF445781.1	MF445781	2009-11-13	Asia	China			Homo sapiens	2019-12-31		Su et al		Su,Y., Wu,Y., Tian,R., Liang,G.	
1388	MF445974	MF445974.1	MF445974	2009-11-13	Asia	China			Homo sapiens	2019-12-31		Su et al		Su,Y., Wu,Y., Tian,R., Liang,G.	
1389	KJ658811	KJ658811.1	SH09111606NA1	2009-11-16	Asia	China			Homo sapiens	2014-12-20		Liu et al		Liu,J., Mu,Y., Dong,W., Yao,F., Wang,L., Yan,H., Lan,K., Zhang,C.	
1390	KF156471	KF156471.1	KF156471	2009-11-23	Africa	Kenya			Homo sapiens	2013-11-30		Agoti et al		Agoti,C.N., Mayieka,L.M., Otieno,J.R., Ahmed,J.A., Fields,B.S., Waiboci,L.W., Nyoka,R., Eidex,R.B., Marano,N., Burton,W., Montgomery,J.M., Breiman,R.F., Nokes,D.J., Mayieka,L., Fields,B., Waiboci,L.B., Eidex,R., Morano,N., Montgomery,J., Breiman,R.	
1391	KF156472	KF156472.1	KF156472	2009-11-23	Africa	Kenya			Homo sapiens	2013-11-30		Agoti et al		Agoti,C.N., Mayieka,L.M., Otieno,J.R., Ahmed,J.A., Fields,B.S., Waiboci,L.W., Nyoka,R., Eidex,R.B., Marano,N., Burton,W., Montgomery,J.M., Breiman,R.F., Nokes,D.J., Mayieka,L., Fields,B., Waiboci,L.B., Eidex,R., Morano,N., Montgomery,J., Breiman,R.	
1392	KJ658812	KJ658812.1	SH09112306NA1	2009-11-23	Asia	China			Homo sapiens	2014-12-20		Liu et al		Liu,J., Mu,Y., Dong,W., Yao,F., Wang,L., Yan,H., Lan,K., Zhang,C.	
1393	KF156473	KF156473.1	KF156473	2009-11-24	Africa	Kenya			Homo sapiens	2013-11-30		Agoti et al		Agoti,C.N., Mayieka,L.M., Otieno,J.R., Ahmed,J.A., Fields,B.S., Waiboci,L.W., Nyoka,R., Eidex,R.B., Marano,N., Burton,W., Montgomery,J.M., Breiman,R.F., Nokes,D.J., Mayieka,L., Fields,B., Waiboci,L.B., Eidex,R., Morano,N., Montgomery,J., Breiman,R.	
1394	OK458664	OK458664.1	OK458664	2009-11-27	Africa	Kenya			Homo sapiens	2021-12-13		Wangui et al		Wangui,J.M., Nokes,J.D., Opot,B.H., Opanda,S.M., Agoti,C.N., Otieno,J.R., Bulimo,W.D.	
1395	AB978291	AB978291.1	AB978291	2009-11-28	Asia	Japan	Fukui		Homo sapiens	2014-10-04		Hirano et al		Hirano,E., Kobayashi,M., Tsukagoshi,H., Yoshida,L.M., Kuroda,M., Noda,M., Ishioka,T., Kozawa,K., Ishii,H., Yoshida,A., Oishi,K., Ryo,A., Kimura,H.	
1396	KY773693	KY773693.1	KY773693	2009-11-28	Asia	South Korea			Homo sapiens	2017-10-26		Park et al		Park,E., Park,P.H., Huh,J.W., Yun,H.J., Lee,H.K., Yoon,M.H., Lee,S., Ko,G., Park,P., Huh,J., Yun,H., Lee,H., Yoon,M.	
1397	OK458643	OK458643.1	OK458643	2009-11-30	Africa	Kenya			Homo sapiens	2021-12-13		Wangui et al		Wangui,J.M., Nokes,J.D., Opot,B.H., Opanda,S.M., Agoti,C.N., Otieno,J.R., Bulimo,W.D.	
1398	HQ699273	HQ699273.1	HQ699273	2009-12-XX	Asia	South Korea			Homo sapiens	2011-07-13		Baek et al		Baek,Y.H., Choi,E.H., Song,M.S., Pascua,P.N., Kwon,H.I., Park,S.J., Lee,J.H., Woo,S.I., Ahn,B.H., Han,H.S., Hahn,Y.S., Shin,K.S., Jang,H.L., Kim,S.Y., Choi,Y.K., Park,S.-J., Song,M.-S., Choi,Y.-K.	
1399	HQ699274	HQ699274.1	HQ699274	2009-12-XX	Asia	South Korea			Homo sapiens	2011-07-13		Baek et al		Baek,Y.H., Choi,E.H., Song,M.S., Pascua,P.N., Kwon,H.I., Park,S.J., Lee,J.H., Woo,S.I., Ahn,B.H., Han,H.S., Hahn,Y.S., Shin,K.S., Jang,H.L., Kim,S.Y., Choi,Y.K., Park,S.-J., Song,M.-S., Choi,Y.-K.	
1400	HQ699279	HQ699279.1	HQ699279	2009-12-XX	Asia	South Korea			Homo sapiens	2011-07-13		Baek et al		Baek,Y.H., Choi,E.H., Song,M.S., Pascua,P.N., Kwon,H.I., Park,S.J., Lee,J.H., Woo,S.I., Ahn,B.H., Han,H.S., Hahn,Y.S., Shin,K.S., Jang,H.L., Kim,S.Y., Choi,Y.K., Park,S.-J., Song,M.-S., Choi,Y.-K.	
1401	HQ699280	HQ699280.1	HQ699280	2009-12-XX	Asia	South Korea			Homo sapiens	2011-07-13		Baek et al		Baek,Y.H., Choi,E.H., Song,M.S., Pascua,P.N., Kwon,H.I., Park,S.J., Lee,J.H., Woo,S.I., Ahn,B.H., Han,H.S., Hahn,Y.S., Shin,K.S., Jang,H.L., Kim,S.Y., Choi,Y.K., Park,S.-J., Song,M.-S., Choi,Y.-K.	
1402	KP284664	KP284664.1	KP284664	2009-12-XX	Europe	Italy			Homo sapiens	2015-05-16		Esposito et al		Esposito,S., Piralla,A., Zampiero,A., Bianchini,S., Di Pietro,G., Scala,A., Pinzani,R., Fossali,E., Baldanti,F., Principi,N.	
1403	KP284665	KP284665.1	KP284665	2009-12-XX	Europe	Italy			Homo sapiens	2015-05-16		Esposito et al		Esposito,S., Piralla,A., Zampiero,A., Bianchini,S., Di Pietro,G., Scala,A., Pinzani,R., Fossali,E., Baldanti,F., Principi,N.	
1404	KP284697	KP284697.1	KP284697	2009-12-XX	Europe	Italy			Homo sapiens	2015-05-16		Esposito et al		Esposito,S., Piralla,A., Zampiero,A., Bianchini,S., Di Pietro,G., Scala,A., Pinzani,R., Fossali,E., Baldanti,F., Principi,N.	
1405	KP284698	KP284698.1	KP284698	2009-12-XX	Europe	Italy			Homo sapiens	2015-05-16		Esposito et al		Esposito,S., Piralla,A., Zampiero,A., Bianchini,S., Di Pietro,G., Scala,A., Pinzani,R., Fossali,E., Baldanti,F., Principi,N.	
1406	KP284699	KP284699.1	KP284699	2009-12-XX	Europe	Italy			Homo sapiens	2015-05-16		Esposito et al		Esposito,S., Piralla,A., Zampiero,A., Bianchini,S., Di Pietro,G., Scala,A., Pinzani,R., Fossali,E., Baldanti,F., Principi,N.	
1407	KP284700	KP284700.1	KP284700	2009-12-XX	Europe	Italy			Homo sapiens	2015-05-16		Esposito et al		Esposito,S., Piralla,A., Zampiero,A., Bianchini,S., Di Pietro,G., Scala,A., Pinzani,R., Fossali,E., Baldanti,F., Principi,N.	
1408	KP284701	KP284701.1	KP284701	2009-12-XX	Europe	Italy			Homo sapiens	2015-05-16		Esposito et al		Esposito,S., Piralla,A., Zampiero,A., Bianchini,S., Di Pietro,G., Scala,A., Pinzani,R., Fossali,E., Baldanti,F., Principi,N.	
1409	KP284702	KP284702.1	KP284702	2009-12-XX	Europe	Italy			Homo sapiens	2015-05-16		Esposito et al		Esposito,S., Piralla,A., Zampiero,A., Bianchini,S., Di Pietro,G., Scala,A., Pinzani,R., Fossali,E., Baldanti,F., Principi,N.	
1410	KF156474	KF156474.1	KF156474	2009-12-02	Africa	Kenya			Homo sapiens	2013-11-30		Agoti et al		Agoti,C.N., Mayieka,L.M., Otieno,J.R., Ahmed,J.A., Fields,B.S., Waiboci,L.W., Nyoka,R., Eidex,R.B., Marano,N., Burton,W., Montgomery,J.M., Breiman,R.F., Nokes,D.J., Mayieka,L., Fields,B., Waiboci,L.B., Eidex,R., Morano,N., Montgomery,J., Breiman,R.	
1411	KF156362	KF156362.1	KF156362	2009-12-04	Africa	Kenya			Homo sapiens	2013-11-30		Agoti et al		Agoti,C.N., Mayieka,L.M., Otieno,J.R., Ahmed,J.A., Fields,B.S., Waiboci,L.W., Nyoka,R., Eidex,R.B., Marano,N., Burton,W., Montgomery,J.M., Breiman,R.F., Nokes,D.J., Mayieka,L., Fields,B., Waiboci,L.B., Eidex,R., Morano,N., Montgomery,J., Breiman,R.	
1412	KF156475	KF156475.1	KF156475	2009-12-04	Africa	Kenya			Homo sapiens	2013-11-30		Agoti et al		Agoti,C.N., Mayieka,L.M., Otieno,J.R., Ahmed,J.A., Fields,B.S., Waiboci,L.W., Nyoka,R., Eidex,R.B., Marano,N., Burton,W., Montgomery,J.M., Breiman,R.F., Nokes,D.J., Mayieka,L., Fields,B., Waiboci,L.B., Eidex,R., Morano,N., Montgomery,J., Breiman,R.	
1413	KF156476	KF156476.1	KF156476	2009-12-05	Africa	Kenya			Homo sapiens	2013-11-30		Agoti et al		Agoti,C.N., Mayieka,L.M., Otieno,J.R., Ahmed,J.A., Fields,B.S., Waiboci,L.W., Nyoka,R., Eidex,R.B., Marano,N., Burton,W., Montgomery,J.M., Breiman,R.F., Nokes,D.J., Mayieka,L., Fields,B., Waiboci,L.B., Eidex,R., Morano,N., Montgomery,J., Breiman,R.	
1414	KF156477	KF156477.1	KF156477	2009-12-05	Africa	Kenya			Homo sapiens	2013-11-30		Agoti et al		Agoti,C.N., Mayieka,L.M., Otieno,J.R., Ahmed,J.A., Fields,B.S., Waiboci,L.W., Nyoka,R., Eidex,R.B., Marano,N., Burton,W., Montgomery,J.M., Breiman,R.F., Nokes,D.J., Mayieka,L., Fields,B., Waiboci,L.B., Eidex,R., Morano,N., Montgomery,J., Breiman,R.	
1415	KF156363	KF156363.1	KF156363	2009-12-08	Africa	Kenya			Homo sapiens	2013-11-30		Agoti et al		Agoti,C.N., Mayieka,L.M., Otieno,J.R., Ahmed,J.A., Fields,B.S., Waiboci,L.W., Nyoka,R., Eidex,R.B., Marano,N., Burton,W., Montgomery,J.M., Breiman,R.F., Nokes,D.J., Mayieka,L., Fields,B., Waiboci,L.B., Eidex,R., Morano,N., Montgomery,J., Breiman,R.	
1416	KF156364	KF156364.1	KF156364	2009-12-08	Africa	Kenya			Homo sapiens	2013-11-30		Agoti et al		Agoti,C.N., Mayieka,L.M., Otieno,J.R., Ahmed,J.A., Fields,B.S., Waiboci,L.W., Nyoka,R., Eidex,R.B., Marano,N., Burton,W., Montgomery,J.M., Breiman,R.F., Nokes,D.J., Mayieka,L., Fields,B., Waiboci,L.B., Eidex,R., Morano,N., Montgomery,J., Breiman,R.	
1417	KF156478	KF156478.1	KF156478	2009-12-08	Africa	Kenya			Homo sapiens	2013-11-30		Agoti et al		Agoti,C.N., Mayieka,L.M., Otieno,J.R., Ahmed,J.A., Fields,B.S., Waiboci,L.W., Nyoka,R., Eidex,R.B., Marano,N., Burton,W., Montgomery,J.M., Breiman,R.F., Nokes,D.J., Mayieka,L., Fields,B., Waiboci,L.B., Eidex,R., Morano,N., Montgomery,J., Breiman,R.	
1418	KF156479	KF156479.1	KF156479	2009-12-08	Africa	Kenya			Homo sapiens	2013-11-30		Agoti et al		Agoti,C.N., Mayieka,L.M., Otieno,J.R., Ahmed,J.A., Fields,B.S., Waiboci,L.W., Nyoka,R., Eidex,R.B., Marano,N., Burton,W., Montgomery,J.M., Breiman,R.F., Nokes,D.J., Mayieka,L., Fields,B., Waiboci,L.B., Eidex,R., Morano,N., Montgomery,J., Breiman,R.	
1419	KF156480	KF156480.1	KF156480	2009-12-08	Africa	Kenya			Homo sapiens	2013-11-30		Agoti et al		Agoti,C.N., Mayieka,L.M., Otieno,J.R., Ahmed,J.A., Fields,B.S., Waiboci,L.W., Nyoka,R., Eidex,R.B., Marano,N., Burton,W., Montgomery,J.M., Breiman,R.F., Nokes,D.J., Mayieka,L., Fields,B., Waiboci,L.B., Eidex,R., Morano,N., Montgomery,J., Breiman,R.	
1420	KT765253	KT765253.1	KEN/Kilifi/780_08/12/2009	2009-12-08	Africa	Kenya			Homo sapiens	2016-02-27		Otieno et al		Otieno,J.R., Agoti,C.N., Gitahi,C.W., Bett,A., Ngama,M., Medley,G.F., Cane,P.A., Nokes,D.J., Nokes,J.D.	
1421	KF156365	KF156365.1	KF156365	2009-12-09	Africa	Kenya			Homo sapiens	2013-11-30		Agoti et al		Agoti,C.N., Mayieka,L.M., Otieno,J.R., Ahmed,J.A., Fields,B.S., Waiboci,L.W., Nyoka,R., Eidex,R.B., Marano,N., Burton,W., Montgomery,J.M., Breiman,R.F., Nokes,D.J., Mayieka,L., Fields,B., Waiboci,L.B., Eidex,R., Morano,N., Montgomery,J., Breiman,R.	
1422	KY773699	KY773699.1	KY773699	2009-12-10	Asia	South Korea			Homo sapiens	2017-10-26		Park et al		Park,E., Park,P.H., Huh,J.W., Yun,H.J., Lee,H.K., Yoon,M.H., Lee,S., Ko,G., Park,P., Huh,J., Yun,H., Lee,H., Yoon,M.	
1423	OK458625	OK458625.1	OK458625	2009-12-10	Africa	Kenya			Homo sapiens	2021-12-13		Wangui et al		Wangui,J.M., Nokes,J.D., Opot,B.H., Opanda,S.M., Agoti,C.N., Otieno,J.R., Bulimo,W.D.	
1424	OK458642	OK458642.1	OK458642	2009-12-14	Africa	Kenya			Homo sapiens	2021-12-13		Wangui et al		Wangui,J.M., Nokes,J.D., Opot,B.H., Opanda,S.M., Agoti,C.N., Otieno,J.R., Bulimo,W.D.	
1425	OK458645	OK458645.1	OK458645	2009-12-14	Africa	Kenya			Homo sapiens	2021-12-13		Wangui et al		Wangui,J.M., Nokes,J.D., Opot,B.H., Opanda,S.M., Agoti,C.N., Otieno,J.R., Bulimo,W.D.	
1426	OK458659	OK458659.1	OK458659	2009-12-14	Africa	Kenya			Homo sapiens	2021-12-13		Wangui et al		Wangui,J.M., Nokes,J.D., Opot,B.H., Opanda,S.M., Agoti,C.N., Otieno,J.R., Bulimo,W.D.	
1427	KF156366	KF156366.1	KF156366	2009-12-15	Africa	Kenya			Homo sapiens	2013-11-30		Agoti et al		Agoti,C.N., Mayieka,L.M., Otieno,J.R., Ahmed,J.A., Fields,B.S., Waiboci,L.W., Nyoka,R., Eidex,R.B., Marano,N., Burton,W., Montgomery,J.M., Breiman,R.F., Nokes,D.J., Mayieka,L., Fields,B., Waiboci,L.B., Eidex,R., Morano,N., Montgomery,J., Breiman,R.	
1428	KF156367	KF156367.1	KF156367	2009-12-15	Africa	Kenya			Homo sapiens	2013-11-30		Agoti et al		Agoti,C.N., Mayieka,L.M., Otieno,J.R., Ahmed,J.A., Fields,B.S., Waiboci,L.W., Nyoka,R., Eidex,R.B., Marano,N., Burton,W., Montgomery,J.M., Breiman,R.F., Nokes,D.J., Mayieka,L., Fields,B., Waiboci,L.B., Eidex,R., Morano,N., Montgomery,J., Breiman,R.	
1429	KF156368	KF156368.1	KF156368	2009-12-16	Africa	Kenya			Homo sapiens	2013-11-30		Agoti et al		Agoti,C.N., Mayieka,L.M., Otieno,J.R., Ahmed,J.A., Fields,B.S., Waiboci,L.W., Nyoka,R., Eidex,R.B., Marano,N., Burton,W., Montgomery,J.M., Breiman,R.F., Nokes,D.J., Mayieka,L., Fields,B., Waiboci,L.B., Eidex,R., Morano,N., Montgomery,J., Breiman,R.	
1430	KF156481	KF156481.1	KF156481	2009-12-16	Africa	Kenya			Homo sapiens	2013-11-30		Agoti et al		Agoti,C.N., Mayieka,L.M., Otieno,J.R., Ahmed,J.A., Fields,B.S., Waiboci,L.W., Nyoka,R., Eidex,R.B., Marano,N., Burton,W., Montgomery,J.M., Breiman,R.F., Nokes,D.J., Mayieka,L., Fields,B., Waiboci,L.B., Eidex,R., Morano,N., Montgomery,J., Breiman,R.	
1431	KF156482	KF156482.1	KF156482	2009-12-16	Africa	Kenya			Homo sapiens	2013-11-30		Agoti et al		Agoti,C.N., Mayieka,L.M., Otieno,J.R., Ahmed,J.A., Fields,B.S., Waiboci,L.W., Nyoka,R., Eidex,R.B., Marano,N., Burton,W., Montgomery,J.M., Breiman,R.F., Nokes,D.J., Mayieka,L., Fields,B., Waiboci,L.B., Eidex,R., Morano,N., Montgomery,J., Breiman,R.	
1432	KF156483	KF156483.1	KF156483	2009-12-18	Africa	Kenya			Homo sapiens	2013-11-30		Agoti et al		Agoti,C.N., Mayieka,L.M., Otieno,J.R., Ahmed,J.A., Fields,B.S., Waiboci,L.W., Nyoka,R., Eidex,R.B., Marano,N., Burton,W., Montgomery,J.M., Breiman,R.F., Nokes,D.J., Mayieka,L., Fields,B., Waiboci,L.B., Eidex,R., Morano,N., Montgomery,J., Breiman,R.	
1433	KF156484	KF156484.1	KF156484	2009-12-18	Africa	Kenya			Homo sapiens	2013-11-30		Agoti et al		Agoti,C.N., Mayieka,L.M., Otieno,J.R., Ahmed,J.A., Fields,B.S., Waiboci,L.W., Nyoka,R., Eidex,R.B., Marano,N., Burton,W., Montgomery,J.M., Breiman,R.F., Nokes,D.J., Mayieka,L., Fields,B., Waiboci,L.B., Eidex,R., Morano,N., Montgomery,J., Breiman,R.	
1434	KF156485	KF156485.1	KF156485	2009-12-18	Africa	Kenya			Homo sapiens	2013-11-30		Agoti et al		Agoti,C.N., Mayieka,L.M., Otieno,J.R., Ahmed,J.A., Fields,B.S., Waiboci,L.W., Nyoka,R., Eidex,R.B., Marano,N., Burton,W., Montgomery,J.M., Breiman,R.F., Nokes,D.J., Mayieka,L., Fields,B., Waiboci,L.B., Eidex,R., Morano,N., Montgomery,J., Breiman,R.	
1435	KF156486	KF156486.1	KF156486	2009-12-18	Africa	Kenya			Homo sapiens	2013-11-30		Agoti et al		Agoti,C.N., Mayieka,L.M., Otieno,J.R., Ahmed,J.A., Fields,B.S., Waiboci,L.W., Nyoka,R., Eidex,R.B., Marano,N., Burton,W., Montgomery,J.M., Breiman,R.F., Nokes,D.J., Mayieka,L., Fields,B., Waiboci,L.B., Eidex,R., Morano,N., Montgomery,J., Breiman,R.	
1436	KF156487	KF156487.1	KF156487	2009-12-19	Africa	Kenya			Homo sapiens	2013-11-30		Agoti et al		Agoti,C.N., Mayieka,L.M., Otieno,J.R., Ahmed,J.A., Fields,B.S., Waiboci,L.W., Nyoka,R., Eidex,R.B., Marano,N., Burton,W., Montgomery,J.M., Breiman,R.F., Nokes,D.J., Mayieka,L., Fields,B., Waiboci,L.B., Eidex,R., Morano,N., Montgomery,J., Breiman,R.	
1437	KF156488	KF156488.1	KF156488	2009-12-19	Africa	Kenya			Homo sapiens	2013-11-30		Agoti et al		Agoti,C.N., Mayieka,L.M., Otieno,J.R., Ahmed,J.A., Fields,B.S., Waiboci,L.W., Nyoka,R., Eidex,R.B., Marano,N., Burton,W., Montgomery,J.M., Breiman,R.F., Nokes,D.J., Mayieka,L., Fields,B., Waiboci,L.B., Eidex,R., Morano,N., Montgomery,J., Breiman,R.	
1438	KF156489	KF156489.1	KF156489	2009-12-19	Africa	Kenya			Homo sapiens	2013-11-30		Agoti et al		Agoti,C.N., Mayieka,L.M., Otieno,J.R., Ahmed,J.A., Fields,B.S., Waiboci,L.W., Nyoka,R., Eidex,R.B., Marano,N., Burton,W., Montgomery,J.M., Breiman,R.F., Nokes,D.J., Mayieka,L., Fields,B., Waiboci,L.B., Eidex,R., Morano,N., Montgomery,J., Breiman,R.	
1439	KT765407	KT765407.1	KEN/Kilifi/781_20/12/2009	2009-12-20	Africa	Kenya			Homo sapiens	2016-02-27		Otieno et al		Otieno,J.R., Agoti,C.N., Gitahi,C.W., Bett,A., Ngama,M., Medley,G.F., Cane,P.A., Nokes,D.J., Nokes,J.D.	
1440	KF156490	KF156490.1	KF156490	2009-12-21	Africa	Kenya			Homo sapiens	2013-11-30		Agoti et al		Agoti,C.N., Mayieka,L.M., Otieno,J.R., Ahmed,J.A., Fields,B.S., Waiboci,L.W., Nyoka,R., Eidex,R.B., Marano,N., Burton,W., Montgomery,J.M., Breiman,R.F., Nokes,D.J., Mayieka,L., Fields,B., Waiboci,L.B., Eidex,R., Morano,N., Montgomery,J., Breiman,R.	
1441	KF156491	KF156491.1	KF156491	2009-12-21	Africa	Kenya			Homo sapiens	2013-11-30		Agoti et al		Agoti,C.N., Mayieka,L.M., Otieno,J.R., Ahmed,J.A., Fields,B.S., Waiboci,L.W., Nyoka,R., Eidex,R.B., Marano,N., Burton,W., Montgomery,J.M., Breiman,R.F., Nokes,D.J., Mayieka,L., Fields,B., Waiboci,L.B., Eidex,R., Morano,N., Montgomery,J., Breiman,R.	
1442	KJ658814	KJ658814.1	SH09122102NA1	2009-12-21	Asia	China			Homo sapiens	2014-12-20		Liu et al		Liu,J., Mu,Y., Dong,W., Yao,F., Wang,L., Yan,H., Lan,K., Zhang,C.	
1443	MF445782	MF445782.1	MF445782	2009-12-21	Asia	China			Homo sapiens	2019-12-31		Su et al		Su,Y., Wu,Y., Tian,R., Liang,G.	
1444	MF445975	MF445975.1	MF445975	2009-12-21	Asia	China			Homo sapiens	2019-12-31		Su et al		Su,Y., Wu,Y., Tian,R., Liang,G.	
1445	OK458644	OK458644.1	OK458644	2009-12-21	Africa	Kenya			Homo sapiens	2021-12-13		Wangui et al		Wangui,J.M., Nokes,J.D., Opot,B.H., Opanda,S.M., Agoti,C.N., Otieno,J.R., Bulimo,W.D.	
1446	KF156492	KF156492.1	KF156492	2009-12-22	Africa	Kenya			Homo sapiens	2013-11-30		Agoti et al		Agoti,C.N., Mayieka,L.M., Otieno,J.R., Ahmed,J.A., Fields,B.S., Waiboci,L.W., Nyoka,R., Eidex,R.B., Marano,N., Burton,W., Montgomery,J.M., Breiman,R.F., Nokes,D.J., Mayieka,L., Fields,B., Waiboci,L.B., Eidex,R., Morano,N., Montgomery,J., Breiman,R.	
1447	KF156493	KF156493.1	KF156493	2009-12-22	Africa	Kenya			Homo sapiens	2013-11-30		Agoti et al		Agoti,C.N., Mayieka,L.M., Otieno,J.R., Ahmed,J.A., Fields,B.S., Waiboci,L.W., Nyoka,R., Eidex,R.B., Marano,N., Burton,W., Montgomery,J.M., Breiman,R.F., Nokes,D.J., Mayieka,L., Fields,B., Waiboci,L.B., Eidex,R., Morano,N., Montgomery,J., Breiman,R.	
1448	KF156494	KF156494.1	KF156494	2009-12-22	Africa	Kenya			Homo sapiens	2013-11-30		Agoti et al		Agoti,C.N., Mayieka,L.M., Otieno,J.R., Ahmed,J.A., Fields,B.S., Waiboci,L.W., Nyoka,R., Eidex,R.B., Marano,N., Burton,W., Montgomery,J.M., Breiman,R.F., Nokes,D.J., Mayieka,L., Fields,B., Waiboci,L.B., Eidex,R., Morano,N., Montgomery,J., Breiman,R.	
1449	KF156495	KF156495.1	KF156495	2009-12-22	Africa	Kenya			Homo sapiens	2013-11-30		Agoti et al		Agoti,C.N., Mayieka,L.M., Otieno,J.R., Ahmed,J.A., Fields,B.S., Waiboci,L.W., Nyoka,R., Eidex,R.B., Marano,N., Burton,W., Montgomery,J.M., Breiman,R.F., Nokes,D.J., Mayieka,L., Fields,B., Waiboci,L.B., Eidex,R., Morano,N., Montgomery,J., Breiman,R.	
1450	KF156496	KF156496.1	KF156496	2009-12-22	Africa	Kenya			Homo sapiens	2013-11-30		Agoti et al		Agoti,C.N., Mayieka,L.M., Otieno,J.R., Ahmed,J.A., Fields,B.S., Waiboci,L.W., Nyoka,R., Eidex,R.B., Marano,N., Burton,W., Montgomery,J.M., Breiman,R.F., Nokes,D.J., Mayieka,L., Fields,B., Waiboci,L.B., Eidex,R., Morano,N., Montgomery,J., Breiman,R.	
1451	AB978292	AB978292.1	AB978292	2009-12-23	Asia	Japan	Fukui		Homo sapiens	2014-10-04		Hirano et al		Hirano,E., Kobayashi,M., Tsukagoshi,H., Yoshida,L.M., Kuroda,M., Noda,M., Ishioka,T., Kozawa,K., Ishii,H., Yoshida,A., Oishi,K., Ryo,A., Kimura,H.	
1452	KF156369	KF156369.1	KF156369	2009-12-23	Africa	Kenya			Homo sapiens	2013-11-30		Agoti et al		Agoti,C.N., Mayieka,L.M., Otieno,J.R., Ahmed,J.A., Fields,B.S., Waiboci,L.W., Nyoka,R., Eidex,R.B., Marano,N., Burton,W., Montgomery,J.M., Breiman,R.F., Nokes,D.J., Mayieka,L., Fields,B., Waiboci,L.B., Eidex,R., Morano,N., Montgomery,J., Breiman,R.	
1453	KF156497	KF156497.1	KF156497	2009-12-23	Africa	Kenya			Homo sapiens	2013-11-30		Agoti et al		Agoti,C.N., Mayieka,L.M., Otieno,J.R., Ahmed,J.A., Fields,B.S., Waiboci,L.W., Nyoka,R., Eidex,R.B., Marano,N., Burton,W., Montgomery,J.M., Breiman,R.F., Nokes,D.J., Mayieka,L., Fields,B., Waiboci,L.B., Eidex,R., Morano,N., Montgomery,J., Breiman,R.	
1454	KT765226	KT765226.1	KEN/Kilifi/782_26/12/2009	2009-12-26	Africa	Kenya			Homo sapiens	2016-02-27		Otieno et al		Otieno,J.R., Agoti,C.N., Gitahi,C.W., Bett,A., Ngama,M., Medley,G.F., Cane,P.A., Nokes,D.J., Nokes,J.D.	
1455	KT765282	KT765282.1	KEN/Kilifi/783_28/12/2009	2009-12-28	Africa	Kenya			Homo sapiens	2016-02-27		Otieno et al		Otieno,J.R., Agoti,C.N., Gitahi,C.W., Bett,A., Ngama,M., Medley,G.F., Cane,P.A., Nokes,D.J., Nokes,J.D.	
1456	KF156498	KF156498.1	KF156498	2009-12-29	Africa	Kenya			Homo sapiens	2013-11-30		Agoti et al		Agoti,C.N., Mayieka,L.M., Otieno,J.R., Ahmed,J.A., Fields,B.S., Waiboci,L.W., Nyoka,R., Eidex,R.B., Marano,N., Burton,W., Montgomery,J.M., Breiman,R.F., Nokes,D.J., Mayieka,L., Fields,B., Waiboci,L.B., Eidex,R., Morano,N., Montgomery,J., Breiman,R.	
1457	KF156499	KF156499.1	KF156499	2009-12-29	Africa	Kenya			Homo sapiens	2013-11-30		Agoti et al		Agoti,C.N., Mayieka,L.M., Otieno,J.R., Ahmed,J.A., Fields,B.S., Waiboci,L.W., Nyoka,R., Eidex,R.B., Marano,N., Burton,W., Montgomery,J.M., Breiman,R.F., Nokes,D.J., Mayieka,L., Fields,B., Waiboci,L.B., Eidex,R., Morano,N., Montgomery,J., Breiman,R.	
1458	KF156500	KF156500.1	KF156500	2009-12-29	Africa	Kenya			Homo sapiens	2013-11-30		Agoti et al		Agoti,C.N., Mayieka,L.M., Otieno,J.R., Ahmed,J.A., Fields,B.S., Waiboci,L.W., Nyoka,R., Eidex,R.B., Marano,N., Burton,W., Montgomery,J.M., Breiman,R.F., Nokes,D.J., Mayieka,L., Fields,B., Waiboci,L.B., Eidex,R., Morano,N., Montgomery,J., Breiman,R.	
1459	KT765261	KT765261.1	KEN/Kilifi/784_29/12/2009	2009-12-29	Africa	Kenya			Homo sapiens	2016-02-27		Otieno et al		Otieno,J.R., Agoti,C.N., Gitahi,C.W., Bett,A., Ngama,M., Medley,G.F., Cane,P.A., Nokes,D.J., Nokes,J.D.	
1460	KT765265	KT765265.1	KEN/Kilifi/785_29/12/2009	2009-12-29	Africa	Kenya			Homo sapiens	2016-02-27		Otieno et al		Otieno,J.R., Agoti,C.N., Gitahi,C.W., Bett,A., Ngama,M., Medley,G.F., Cane,P.A., Nokes,D.J., Nokes,J.D.	
1461	KC297241	KC297241.1	KC297241	2010-XX-XX	Asia	China			Homo sapiens	2013-10-02		Cui et al		Cui,G., Zhu,R., Qian,Y., Deng,J., Zhao,L., Sun,Y., Wang,F.	
1462	KC297242	KC297242.1	KC297242	2010-XX-XX	Asia	China			Homo sapiens	2013-10-02		Cui et al		Cui,G., Zhu,R., Qian,Y., Deng,J., Zhao,L., Sun,Y., Wang,F.	
1463	KC297243	KC297243.1	KC297243	2010-XX-XX	Asia	China			Homo sapiens	2013-10-02		Cui et al		Cui,G., Zhu,R., Qian,Y., Deng,J., Zhao,L., Sun,Y., Wang,F.	
1464	KC297244	KC297244.1	KC297244	2010-XX-XX	Asia	China			Homo sapiens	2013-10-02		Cui et al		Cui,G., Zhu,R., Qian,Y., Deng,J., Zhao,L., Sun,Y., Wang,F.	
1465	KC297245	KC297245.1	KC297245	2010-XX-XX	Asia	China			Homo sapiens	2013-10-02		Cui et al		Cui,G., Zhu,R., Qian,Y., Deng,J., Zhao,L., Sun,Y., Wang,F.	
1466	KC297246	KC297246.1	KC297246	2010-XX-XX	Asia	China			Homo sapiens	2013-10-02		Cui et al		Cui,G., Zhu,R., Qian,Y., Deng,J., Zhao,L., Sun,Y., Wang,F.	
1467	KC297247	KC297247.1	KC297247	2010-XX-XX	Asia	China			Homo sapiens	2013-10-02		Cui et al		Cui,G., Zhu,R., Qian,Y., Deng,J., Zhao,L., Sun,Y., Wang,F.	
1468	KC297248	KC297248.1	KC297248	2010-XX-XX	Asia	China			Homo sapiens	2013-10-02		Cui et al		Cui,G., Zhu,R., Qian,Y., Deng,J., Zhao,L., Sun,Y., Wang,F.	
1469	KC297249	KC297249.1	KC297249	2010-XX-XX	Asia	China			Homo sapiens	2013-10-02		Cui et al		Cui,G., Zhu,R., Qian,Y., Deng,J., Zhao,L., Sun,Y., Wang,F.	
1470	KC297250	KC297250.1	KC297250	2010-XX-XX	Asia	China			Homo sapiens	2013-10-02		Cui et al		Cui,G., Zhu,R., Qian,Y., Deng,J., Zhao,L., Sun,Y., Wang,F.	
1471	KC297251	KC297251.1	KC297251	2010-XX-XX	Asia	China			Homo sapiens	2013-10-02		Cui et al		Cui,G., Zhu,R., Qian,Y., Deng,J., Zhao,L., Sun,Y., Wang,F.	
1472	KC297252	KC297252.1	KC297252	2010-XX-XX	Asia	China			Homo sapiens	2013-10-02		Cui et al		Cui,G., Zhu,R., Qian,Y., Deng,J., Zhao,L., Sun,Y., Wang,F.	
1473	KC297253	KC297253.1	KC297253	2010-XX-XX	Asia	China			Homo sapiens	2013-10-02		Cui et al		Cui,G., Zhu,R., Qian,Y., Deng,J., Zhao,L., Sun,Y., Wang,F.	
1474	KC297254	KC297254.1	KC297254	2010-XX-XX	Asia	China			Homo sapiens	2013-10-02		Cui et al		Cui,G., Zhu,R., Qian,Y., Deng,J., Zhao,L., Sun,Y., Wang,F.	
1475	KC297255	KC297255.1	KC297255	2010-XX-XX	Asia	China			Homo sapiens	2013-10-02		Cui et al		Cui,G., Zhu,R., Qian,Y., Deng,J., Zhao,L., Sun,Y., Wang,F.	
1476	KC297256	KC297256.1	KC297256	2010-XX-XX	Asia	China			Homo sapiens	2013-10-02		Cui et al		Cui,G., Zhu,R., Qian,Y., Deng,J., Zhao,L., Sun,Y., Wang,F.	
1477	KC297257	KC297257.1	KC297257	2010-XX-XX	Asia	China			Homo sapiens	2013-10-02		Cui et al		Cui,G., Zhu,R., Qian,Y., Deng,J., Zhao,L., Sun,Y., Wang,F.	
1478	KC297258	KC297258.1	KC297258	2010-XX-XX	Asia	China			Homo sapiens	2013-10-02		Cui et al		Cui,G., Zhu,R., Qian,Y., Deng,J., Zhao,L., Sun,Y., Wang,F.	
1479	KC297318	KC297318.1	KC297318	2010-XX-XX	Asia	China			Homo sapiens	2013-10-02		Cui et al		Cui,G., Zhu,R., Qian,Y., Deng,J., Zhao,L., Sun,Y., Wang,F.	
1480	KU955223	KU955223.1	KU955223	2010-XX-XX	Asia	China			Homo sapiens	2019-03-31		Jia et al		Jia,B., Xiao,Y., Wang,Y., Chen,L., Zhang,J., Ren,L., Wang,J.	
1481	KU955224	KU955224.1	KU955224	2010-XX-XX	Asia	China			Homo sapiens	2019-03-31		Jia et al		Jia,B., Xiao,Y., Wang,Y., Chen,L., Zhang,J., Ren,L., Wang,J.	
1482	KU955225	KU955225.1	KU955225	2010-XX-XX	Asia	China			Homo sapiens	2019-03-31		Jia et al		Jia,B., Xiao,Y., Wang,Y., Chen,L., Zhang,J., Ren,L., Wang,J.	
1483	KU955226	KU955226.1	KU955226	2010-XX-XX	Asia	China			Homo sapiens	2019-03-31		Jia et al		Jia,B., Xiao,Y., Wang,Y., Chen,L., Zhang,J., Ren,L., Wang,J.	
1484	KU955227	KU955227.1	KU955227	2010-XX-XX	Asia	China			Homo sapiens	2019-03-31		Jia et al		Jia,B., Xiao,Y., Wang,Y., Chen,L., Zhang,J., Ren,L., Wang,J.	
1485	KU955228	KU955228.1	KU955228	2010-XX-XX	Asia	China			Homo sapiens	2019-03-31		Jia et al		Jia,B., Xiao,Y., Wang,Y., Chen,L., Zhang,J., Ren,L., Wang,J.	
1486	KU955229	KU955229.1	KU955229	2010-XX-XX	Asia	China			Homo sapiens	2019-03-31		Jia et al		Jia,B., Xiao,Y., Wang,Y., Chen,L., Zhang,J., Ren,L., Wang,J.	
1487	KU955230	KU955230.1	KU955230	2010-XX-XX	Asia	China			Homo sapiens	2019-03-31		Jia et al		Jia,B., Xiao,Y., Wang,Y., Chen,L., Zhang,J., Ren,L., Wang,J.	
1488	KU955231	KU955231.1	KU955231	2010-XX-XX	Asia	China			Homo sapiens	2019-03-31		Jia et al		Jia,B., Xiao,Y., Wang,Y., Chen,L., Zhang,J., Ren,L., Wang,J.	
1489	KU955232	KU955232.1	KU955232	2010-XX-XX	Asia	China			Homo sapiens	2019-03-31		Jia et al		Jia,B., Xiao,Y., Wang,Y., Chen,L., Zhang,J., Ren,L., Wang,J.	
1490	KU955233	KU955233.1	KU955233	2010-XX-XX	Asia	China			Homo sapiens	2019-03-31		Jia et al		Jia,B., Xiao,Y., Wang,Y., Chen,L., Zhang,J., Ren,L., Wang,J.	
1491	KU955234	KU955234.1	KU955234	2010-XX-XX	Asia	China			Homo sapiens	2019-03-31		Jia et al		Jia,B., Xiao,Y., Wang,Y., Chen,L., Zhang,J., Ren,L., Wang,J.	
1492	KU955235	KU955235.1	KU955235	2010-XX-XX	Asia	China			Homo sapiens	2019-03-31		Jia et al		Jia,B., Xiao,Y., Wang,Y., Chen,L., Zhang,J., Ren,L., Wang,J.	
1493	KU955236	KU955236.1	KU955236	2010-XX-XX	Asia	China			Homo sapiens	2019-03-31		Jia et al		Jia,B., Xiao,Y., Wang,Y., Chen,L., Zhang,J., Ren,L., Wang,J.	
1494	KU955237	KU955237.1	KU955237	2010-XX-XX	Asia	China			Homo sapiens	2019-03-31		Jia et al		Jia,B., Xiao,Y., Wang,Y., Chen,L., Zhang,J., Ren,L., Wang,J.	
1495	KU955238	KU955238.1	KU955238	2010-XX-XX	Asia	China			Homo sapiens	2019-03-31		Jia et al		Jia,B., Xiao,Y., Wang,Y., Chen,L., Zhang,J., Ren,L., Wang,J.	
1496	KU955239	KU955239.1	KU955239	2010-XX-XX	Asia	China			Homo sapiens	2019-03-31		Jia et al		Jia,B., Xiao,Y., Wang,Y., Chen,L., Zhang,J., Ren,L., Wang,J.	
1497	KU955240	KU955240.1	KU955240	2010-XX-XX	Asia	China			Homo sapiens	2019-03-31		Jia et al		Jia,B., Xiao,Y., Wang,Y., Chen,L., Zhang,J., Ren,L., Wang,J.	
1498	KU955241	KU955241.1	KU955241	2010-XX-XX	Asia	China			Homo sapiens	2019-03-31		Jia et al		Jia,B., Xiao,Y., Wang,Y., Chen,L., Zhang,J., Ren,L., Wang,J.	
1499	KU955242	KU955242.1	KU955242	2010-XX-XX	Asia	China			Homo sapiens	2019-03-31		Jia et al		Jia,B., Xiao,Y., Wang,Y., Chen,L., Zhang,J., Ren,L., Wang,J.	
1500	KU955243	KU955243.1	KU955243	2010-XX-XX	Asia	China			Homo sapiens	2019-03-31		Jia et al		Jia,B., Xiao,Y., Wang,Y., Chen,L., Zhang,J., Ren,L., Wang,J.	
1501	KU955244	KU955244.1	KU955244	2010-XX-XX	Asia	China			Homo sapiens	2019-03-31		Jia et al		Jia,B., Xiao,Y., Wang,Y., Chen,L., Zhang,J., Ren,L., Wang,J.	
1502	KU955245	KU955245.1	KU955245	2010-XX-XX	Asia	China			Homo sapiens	2019-03-31		Jia et al		Jia,B., Xiao,Y., Wang,Y., Chen,L., Zhang,J., Ren,L., Wang,J.	
1503	KU955246	KU955246.1	KU955246	2010-XX-XX	Asia	China			Homo sapiens	2019-03-31		Jia et al		Jia,B., Xiao,Y., Wang,Y., Chen,L., Zhang,J., Ren,L., Wang,J.	
1504	KU955247	KU955247.1	KU955247	2010-XX-XX	Asia	China			Homo sapiens	2019-03-31		Jia et al		Jia,B., Xiao,Y., Wang,Y., Chen,L., Zhang,J., Ren,L., Wang,J.	
1505	KU955248	KU955248.1	KU955248	2010-XX-XX	Asia	China			Homo sapiens	2019-03-31		Jia et al		Jia,B., Xiao,Y., Wang,Y., Chen,L., Zhang,J., Ren,L., Wang,J.	
1506	KU955249	KU955249.1	KU955249	2010-XX-XX	Asia	China			Homo sapiens	2019-03-31		Jia et al		Jia,B., Xiao,Y., Wang,Y., Chen,L., Zhang,J., Ren,L., Wang,J.	
1507	KU955250	KU955250.1	KU955250	2010-XX-XX	Asia	China			Homo sapiens	2019-03-31		Jia et al		Jia,B., Xiao,Y., Wang,Y., Chen,L., Zhang,J., Ren,L., Wang,J.	
1508	KU955251	KU955251.1	KU955251	2010-XX-XX	Asia	China			Homo sapiens	2019-03-31		Jia et al		Jia,B., Xiao,Y., Wang,Y., Chen,L., Zhang,J., Ren,L., Wang,J.	
1509	KU955252	KU955252.1	KU955252	2010-XX-XX	Asia	China			Homo sapiens	2019-03-31		Jia et al		Jia,B., Xiao,Y., Wang,Y., Chen,L., Zhang,J., Ren,L., Wang,J.	
1510	KU955253	KU955253.1	KU955253	2010-XX-XX	Asia	China			Homo sapiens	2019-03-31		Jia et al		Jia,B., Xiao,Y., Wang,Y., Chen,L., Zhang,J., Ren,L., Wang,J.	
1511	KU955254	KU955254.1	KU955254	2010-XX-XX	Asia	China			Homo sapiens	2019-03-31		Jia et al		Jia,B., Xiao,Y., Wang,Y., Chen,L., Zhang,J., Ren,L., Wang,J.	
1512	KU955255	KU955255.1	KU955255	2010-XX-XX	Asia	China			Homo sapiens	2019-03-31		Jia et al		Jia,B., Xiao,Y., Wang,Y., Chen,L., Zhang,J., Ren,L., Wang,J.	
1513	KU955256	KU955256.1	KU955256	2010-XX-XX	Asia	China			Homo sapiens	2019-03-31		Jia et al		Jia,B., Xiao,Y., Wang,Y., Chen,L., Zhang,J., Ren,L., Wang,J.	
1514	KU955257	KU955257.1	KU955257	2010-XX-XX	Asia	China			Homo sapiens	2019-03-31		Jia et al		Jia,B., Xiao,Y., Wang,Y., Chen,L., Zhang,J., Ren,L., Wang,J.	
1515	KU955259	KU955259.1	KU955259	2010-XX-XX	Asia	China			Homo sapiens	2019-03-31		Jia et al		Jia,B., Xiao,Y., Wang,Y., Chen,L., Zhang,J., Ren,L., Wang,J.	
1516	KU955260	KU955260.1	KU955260	2010-XX-XX	Asia	China			Homo sapiens	2019-03-31		Jia et al		Jia,B., Xiao,Y., Wang,Y., Chen,L., Zhang,J., Ren,L., Wang,J.	
1517	KU955261	KU955261.1	KU955261	2010-XX-XX	Asia	China			Homo sapiens	2019-03-31		Jia et al		Jia,B., Xiao,Y., Wang,Y., Chen,L., Zhang,J., Ren,L., Wang,J.	
1518	KU962544	KU962544.1	KU962544	2010-XX-XX	Asia	China			Homo sapiens	2019-03-31		Jia et al		Jia,B., Xiao,Y., Wang,Y., Chen,L., Zhang,J., Ren,L., Wang,J.	
1519	KU962545	KU962545.1	KU962545	2010-XX-XX	Asia	China			Homo sapiens	2019-03-31		Jia et al		Jia,B., Xiao,Y., Wang,Y., Chen,L., Zhang,J., Ren,L., Wang,J.	
1520	KU962546	KU962546.1	KU962546	2010-XX-XX	Asia	China			Homo sapiens	2019-03-31		Jia et al		Jia,B., Xiao,Y., Wang,Y., Chen,L., Zhang,J., Ren,L., Wang,J.	
1521	KU962547	KU962547.1	KU962547	2010-XX-XX	Asia	China			Homo sapiens	2019-03-31		Jia et al		Jia,B., Xiao,Y., Wang,Y., Chen,L., Zhang,J., Ren,L., Wang,J.	
1522	KU962548	KU962548.1	KU962548	2010-XX-XX	Asia	China			Homo sapiens	2019-03-31		Jia et al		Jia,B., Xiao,Y., Wang,Y., Chen,L., Zhang,J., Ren,L., Wang,J.	
1523	KU962549	KU962549.1	KU962549	2010-XX-XX	Asia	China			Homo sapiens	2019-03-31		Jia et al		Jia,B., Xiao,Y., Wang,Y., Chen,L., Zhang,J., Ren,L., Wang,J.	
1524	KU962550	KU962550.1	KU962550	2010-XX-XX	Asia	China			Homo sapiens	2019-03-31		Jia et al		Jia,B., Xiao,Y., Wang,Y., Chen,L., Zhang,J., Ren,L., Wang,J.	
1525	KU962557	KU962557.1	KU962557	2010-XX-XX	Asia	China			Homo sapiens	2019-03-31		Jia et al		Jia,B., Xiao,Y., Wang,Y., Chen,L., Zhang,J., Ren,L., Wang,J.	
1526	KU962560	KU962560.1	KU962560	2010-XX-XX	Asia	China			Homo sapiens	2019-03-31		Jia et al		Jia,B., Xiao,Y., Wang,Y., Chen,L., Zhang,J., Ren,L., Wang,J.	
1527	KU962561	KU962561.1	KU962561	2010-XX-XX	Asia	China			Homo sapiens	2019-03-31		Jia et al		Jia,B., Xiao,Y., Wang,Y., Chen,L., Zhang,J., Ren,L., Wang,J.	
1528	KU962562	KU962562.1	KU962562	2010-XX-XX	Asia	China			Homo sapiens	2019-03-31		Jia et al		Jia,B., Xiao,Y., Wang,Y., Chen,L., Zhang,J., Ren,L., Wang,J.	
1529	KU962564	KU962564.1	KU962564	2010-XX-XX	Asia	China			Homo sapiens	2019-03-31		Jia et al		Jia,B., Xiao,Y., Wang,Y., Chen,L., Zhang,J., Ren,L., Wang,J.	
1530	KU962565	KU962565.1	KU962565	2010-XX-XX	Asia	China			Homo sapiens	2019-03-31		Jia et al		Jia,B., Xiao,Y., Wang,Y., Chen,L., Zhang,J., Ren,L., Wang,J.	
1531	KU962566	KU962566.1	KU962566	2010-XX-XX	Asia	China			Homo sapiens	2019-03-31		Jia et al		Jia,B., Xiao,Y., Wang,Y., Chen,L., Zhang,J., Ren,L., Wang,J.	
1532	KU962567	KU962567.1	KU962567	2010-XX-XX	Asia	China			Homo sapiens	2019-03-31		Jia et al		Jia,B., Xiao,Y., Wang,Y., Chen,L., Zhang,J., Ren,L., Wang,J.	
1533	KU962568	KU962568.1	KU962568	2010-XX-XX	Asia	China			Homo sapiens	2019-03-31		Jia et al		Jia,B., Xiao,Y., Wang,Y., Chen,L., Zhang,J., Ren,L., Wang,J.	
1534	KU962569	KU962569.1	KU962569	2010-XX-XX	Asia	China			Homo sapiens	2019-03-31		Jia et al		Jia,B., Xiao,Y., Wang,Y., Chen,L., Zhang,J., Ren,L., Wang,J.	
1535	KU962570	KU962570.1	KU962570	2010-XX-XX	Asia	China			Homo sapiens	2019-03-31		Jia et al		Jia,B., Xiao,Y., Wang,Y., Chen,L., Zhang,J., Ren,L., Wang,J.	
1536	KU962571	KU962571.1	KU962571	2010-XX-XX	Asia	China			Homo sapiens	2019-03-31		Jia et al		Jia,B., Xiao,Y., Wang,Y., Chen,L., Zhang,J., Ren,L., Wang,J.	
1537	KU962572	KU962572.1	KU962572	2010-XX-XX	Asia	China			Homo sapiens	2019-03-31		Jia et al		Jia,B., Xiao,Y., Wang,Y., Chen,L., Zhang,J., Ren,L., Wang,J.	
1538	KU962880	KU962880.1	KU962880	2010-XX-XX	Asia	China			Homo sapiens	2019-03-31		Jia et al		Jia,B., Xiao,Y., Wang,Y., Chen,L., Zhang,J., Ren,L., Wang,J.	
1539	KU962881	KU962881.1	KU962881	2010-XX-XX	Asia	China			Homo sapiens	2019-03-31		Jia et al		Jia,B., Xiao,Y., Wang,Y., Chen,L., Zhang,J., Ren,L., Wang,J.	
1540	KU962882	KU962882.1	KU962882	2010-XX-XX	Asia	China			Homo sapiens	2019-03-31		Jia et al		Jia,B., Xiao,Y., Wang,Y., Chen,L., Zhang,J., Ren,L., Wang,J.	
1541	KX533723	KX533723.1	KX533723	2010-XX-XX	Asia	China			Homo sapiens	2017-09-28		Song et al		Song,J., Zhang,Y., Wang,H., Shi,J., Sun,L., Zhang,X., Yang,Z., Guan,W., Zhang,H., Yu,P., Xie,Z., Cui,A., Ng,T.I., Xu,W.	
1542	KX533747	KX533747.1	KX533747	2010-XX-XX	Asia	China			Homo sapiens	2017-09-28		Song et al		Song,J., Zhang,Y., Wang,H., Shi,J., Sun,L., Zhang,X., Yang,Z., Guan,W., Zhang,H., Yu,P., Xie,Z., Cui,A., Ng,T.I., Xu,W.	
1543	KX533748	KX533748.1	KX533748	2010-XX-XX	Asia	China			Homo sapiens	2017-09-28		Song et al		Song,J., Zhang,Y., Wang,H., Shi,J., Sun,L., Zhang,X., Yang,Z., Guan,W., Zhang,H., Yu,P., Xie,Z., Cui,A., Ng,T.I., Xu,W.	
1544	KX533749	KX533749.1	KX533749	2010-XX-XX	Asia	China			Homo sapiens	2017-09-28		Song et al		Song,J., Zhang,Y., Wang,H., Shi,J., Sun,L., Zhang,X., Yang,Z., Guan,W., Zhang,H., Yu,P., Xie,Z., Cui,A., Ng,T.I., Xu,W.	
1545	KX533872	KX533872.1	KX533872	2010-XX-XX	Asia	China			Homo sapiens	2017-09-28		Song et al		Song,J., Zhang,Y., Wang,H., Shi,J., Sun,L., Zhang,X., Yang,Z., Guan,W., Zhang,H., Yu,P., Xie,Z., Cui,A., Ng,T.I., Xu,W.	
1546	MF496399	MF496399.1	R99-80	2010-XX-XX	Asia	Taiwan			Homo sapiens	2017-08-30		Chi et al		Chi,H., Hsiao,K.-L., Weng,L.-C., Chiu,N.-C., Huang,L.-M., Chiu,Y.-Y., Liu,C.-P., Liu,H.-F.	
1547	MF496400	MF496400.1	R99-57	2010-XX-XX	Asia	Taiwan			Homo sapiens	2017-08-30		Chi et al		Chi,H., Hsiao,K.-L., Weng,L.-C., Chiu,N.-C., Huang,L.-M., Chiu,Y.-Y., Liu,C.-P., Liu,H.-F.	
1548	MF496401	MF496401.1	R99-52	2010-XX-XX	Asia	Taiwan			Homo sapiens	2017-08-30		Chi et al		Chi,H., Hsiao,K.-L., Weng,L.-C., Chiu,N.-C., Huang,L.-M., Chiu,Y.-Y., Liu,C.-P., Liu,H.-F.	
1549	MF496402	MF496402.1	R99-51	2010-XX-XX	Asia	Taiwan			Homo sapiens	2017-08-30		Chi et al		Chi,H., Hsiao,K.-L., Weng,L.-C., Chiu,N.-C., Huang,L.-M., Chiu,Y.-Y., Liu,C.-P., Liu,H.-F.	
1550	MF496403	MF496403.1	R99-49	2010-XX-XX	Asia	Taiwan			Homo sapiens	2017-08-30		Chi et al		Chi,H., Hsiao,K.-L., Weng,L.-C., Chiu,N.-C., Huang,L.-M., Chiu,Y.-Y., Liu,C.-P., Liu,H.-F.	
1551	MF496404	MF496404.1	R99-47	2010-XX-XX	Asia	Taiwan			Homo sapiens	2017-08-30		Chi et al		Chi,H., Hsiao,K.-L., Weng,L.-C., Chiu,N.-C., Huang,L.-M., Chiu,Y.-Y., Liu,C.-P., Liu,H.-F.	
1552	MF496405	MF496405.1	R99-44	2010-XX-XX	Asia	Taiwan			Homo sapiens	2017-08-30		Chi et al		Chi,H., Hsiao,K.-L., Weng,L.-C., Chiu,N.-C., Huang,L.-M., Chiu,Y.-Y., Liu,C.-P., Liu,H.-F.	
1553	MF496406	MF496406.1	R99-37	2010-XX-XX	Asia	Taiwan			Homo sapiens	2017-08-30		Chi et al		Chi,H., Hsiao,K.-L., Weng,L.-C., Chiu,N.-C., Huang,L.-M., Chiu,Y.-Y., Liu,C.-P., Liu,H.-F.	
1554	MF496407	MF496407.1	R99-32	2010-XX-XX	Asia	Taiwan			Homo sapiens	2017-08-30		Chi et al		Chi,H., Hsiao,K.-L., Weng,L.-C., Chiu,N.-C., Huang,L.-M., Chiu,Y.-Y., Liu,C.-P., Liu,H.-F.	
1555	MF496408	MF496408.1	R99-30	2010-XX-XX	Asia	Taiwan			Homo sapiens	2017-08-30		Chi et al		Chi,H., Hsiao,K.-L., Weng,L.-C., Chiu,N.-C., Huang,L.-M., Chiu,Y.-Y., Liu,C.-P., Liu,H.-F.	
1556	MF496409	MF496409.1	R99-25	2010-XX-XX	Asia	Taiwan			Homo sapiens	2017-08-30		Chi et al		Chi,H., Hsiao,K.-L., Weng,L.-C., Chiu,N.-C., Huang,L.-M., Chiu,Y.-Y., Liu,C.-P., Liu,H.-F.	
1557	MF496410	MF496410.1	R99-24	2010-XX-XX	Asia	Taiwan			Homo sapiens	2017-08-30		Chi et al		Chi,H., Hsiao,K.-L., Weng,L.-C., Chiu,N.-C., Huang,L.-M., Chiu,Y.-Y., Liu,C.-P., Liu,H.-F.	
1558	MF496411	MF496411.1	R99-22	2010-XX-XX	Asia	Taiwan			Homo sapiens	2017-08-30		Chi et al		Chi,H., Hsiao,K.-L., Weng,L.-C., Chiu,N.-C., Huang,L.-M., Chiu,Y.-Y., Liu,C.-P., Liu,H.-F.	
1559	MF496412	MF496412.1	R99-21	2010-XX-XX	Asia	Taiwan			Homo sapiens	2017-08-30		Chi et al		Chi,H., Hsiao,K.-L., Weng,L.-C., Chiu,N.-C., Huang,L.-M., Chiu,Y.-Y., Liu,C.-P., Liu,H.-F.	
1560	MF496413	MF496413.1	R99-19	2010-XX-XX	Asia	Taiwan			Homo sapiens	2017-08-30		Chi et al		Chi,H., Hsiao,K.-L., Weng,L.-C., Chiu,N.-C., Huang,L.-M., Chiu,Y.-Y., Liu,C.-P., Liu,H.-F.	
1561	MF496414	MF496414.1	R99-16	2010-XX-XX	Asia	Taiwan			Homo sapiens	2017-08-30		Chi et al		Chi,H., Hsiao,K.-L., Weng,L.-C., Chiu,N.-C., Huang,L.-M., Chiu,Y.-Y., Liu,C.-P., Liu,H.-F.	
1562	MF496415	MF496415.1	R99-14	2010-XX-XX	Asia	Taiwan			Homo sapiens	2017-08-30		Chi et al		Chi,H., Hsiao,K.-L., Weng,L.-C., Chiu,N.-C., Huang,L.-M., Chiu,Y.-Y., Liu,C.-P., Liu,H.-F.	
1563	MF496416	MF496416.1	R99-09	2010-XX-XX	Asia	Taiwan			Homo sapiens	2017-08-30		Chi et al		Chi,H., Hsiao,K.-L., Weng,L.-C., Chiu,N.-C., Huang,L.-M., Chiu,Y.-Y., Liu,C.-P., Liu,H.-F.	
1564	MF496417	MF496417.1	R99-08	2010-XX-XX	Asia	Taiwan			Homo sapiens	2017-08-30		Chi et al		Chi,H., Hsiao,K.-L., Weng,L.-C., Chiu,N.-C., Huang,L.-M., Chiu,Y.-Y., Liu,C.-P., Liu,H.-F.	
1565	MG930125	MG930125.1	MG930125	2010-XX-XX	Europe	Germany	Wuerzburg		Homo sapiens	2018-03-19		Prifert et al		Prifert,C., Streng,A., Schultz,J., Liese,J.G., Weissbrich,B., Hofmann,D.	
1566	MG930126	MG930126.1	MG930126	2010-XX-XX	Europe	Germany	Wuerzburg		Homo sapiens	2018-03-19		Prifert et al		Prifert,C., Streng,A., Schultz,J., Liese,J.G., Weissbrich,B., Hofmann,D.	
1567	MG930127	MG930127.1	MG930127	2010-XX-XX	Europe	Germany	Wuerzburg		Homo sapiens	2018-03-19		Prifert et al		Prifert,C., Streng,A., Schultz,J., Liese,J.G., Weissbrich,B., Hofmann,D.	
1568	MG930128	MG930128.1	MG930128	2010-XX-XX	Europe	Germany	Wuerzburg		Homo sapiens	2018-03-19		Prifert et al		Prifert,C., Streng,A., Schultz,J., Liese,J.G., Weissbrich,B., Hofmann,D.	
1569	MG930129	MG930129.1	MG930129	2010-XX-XX	Europe	Germany	Wuerzburg		Homo sapiens	2018-03-19		Prifert et al		Prifert,C., Streng,A., Schultz,J., Liese,J.G., Weissbrich,B., Hofmann,D.	
1570	MG930130	MG930130.1	MG930130	2010-XX-XX	Europe	Germany	Wuerzburg		Homo sapiens	2018-03-19		Prifert et al		Prifert,C., Streng,A., Schultz,J., Liese,J.G., Weissbrich,B., Hofmann,D.	
1571	MG930131	MG930131.1	MG930131	2010-XX-XX	Europe	Germany	Wuerzburg		Homo sapiens	2018-03-19		Prifert et al		Prifert,C., Streng,A., Schultz,J., Liese,J.G., Weissbrich,B., Hofmann,D.	
1572	MG930132	MG930132.1	MG930132	2010-XX-XX	Europe	Germany	Wuerzburg		Homo sapiens	2018-03-19		Prifert et al		Prifert,C., Streng,A., Schultz,J., Liese,J.G., Weissbrich,B., Hofmann,D.	
1573	MG930143	MG930143.1	MG930143	2010-XX-XX	Europe	Germany	Wuerzburg		Homo sapiens	2018-03-19		Prifert et al		Prifert,C., Streng,A., Schultz,J., Liese,J.G., Weissbrich,B., Hofmann,D.	
1574	MG930144	MG930144.1	MG930144	2010-XX-XX	Europe	Germany	Wuerzburg		Homo sapiens	2018-03-19		Prifert et al		Prifert,C., Streng,A., Schultz,J., Liese,J.G., Weissbrich,B., Hofmann,D.	
1575	MG930145	MG930145.1	MG930145	2010-XX-XX	Europe	Germany	Wuerzburg		Homo sapiens	2018-03-19		Prifert et al		Prifert,C., Streng,A., Schultz,J., Liese,J.G., Weissbrich,B., Hofmann,D.	
1576	MG930149	MG930149.1	MG930149	2010-XX-XX	Europe	Germany	Wuerzburg		Homo sapiens	2018-03-19		Prifert et al		Prifert,C., Streng,A., Schultz,J., Liese,J.G., Weissbrich,B., Hofmann,D.	
1577	MK344691	MK344691.1	MK344691	2010-XX-XX	Asia	Taiwan			Homo sapiens	2020-01-11		Lee et al		Lee,C.-Y.	
1578	MK344692	MK344692.1	MK344692	2010-XX-XX	Asia	Taiwan			Homo sapiens	2020-01-11		Lee et al		Lee,C.-Y.	
1579	MK344693	MK344693.1	MK344693	2010-XX-XX	Asia	Taiwan			Homo sapiens	2020-01-11		Lee et al		Lee,C.-Y.	
1580	MK344694	MK344694.1	MK344694	2010-XX-XX	Asia	Taiwan			Homo sapiens	2020-01-11		Lee et al		Lee,C.-Y.	
1581	MK344695	MK344695.1	MK344695	2010-XX-XX	Asia	Taiwan			Homo sapiens	2020-01-11		Lee et al		Lee,C.-Y.	
1582	MK344696	MK344696.1	MK344696	2010-XX-XX	Asia	Taiwan			Homo sapiens	2020-01-11		Lee et al		Lee,C.-Y.	
1583	MK344697	MK344697.1	MK344697	2010-XX-XX	Asia	Taiwan			Homo sapiens	2020-01-11		Lee et al		Lee,C.-Y.	
1584	MW306455	MW306455.1	BGD/221420/RSV_A/2010	2010-XX-XX	Asia	Bangladesh			Homo sapiens	2021-11-01		Rahman et al		Rahman,M.Z., Hossain,M.E., Sumiya,M.K., Islam,M.M., Begum,M.N., Hoque,A.F., Uddin,K.M.M., Hassan,M.Z., Rahman,M., Goswami,D.R., Brooks,W.A.	
1585	MW306456	MW306456.1	BGD/236003/RSV_A/2010	2010-XX-XX	Asia	Bangladesh			Homo sapiens	2021-11-01		Rahman et al		Rahman,M.Z., Hossain,M.E., Sumiya,M.K., Islam,M.M., Begum,M.N., Hoque,A.F., Uddin,K.M.M., Hassan,M.Z., Rahman,M., Goswami,D.R., Brooks,W.A.	
1586	MW306457	MW306457.1	BGD/335327/RSV_A/2010	2010-XX-XX	Asia	Bangladesh			Homo sapiens	2021-11-01		Rahman et al		Rahman,M.Z., Hossain,M.E., Sumiya,M.K., Islam,M.M., Begum,M.N., Hoque,A.F., Uddin,K.M.M., Hassan,M.Z., Rahman,M., Goswami,D.R., Brooks,W.A.	
1587	MW306459	MW306459.1	BGD/359479/RSV_A/2010	2010-XX-XX	Asia	Bangladesh			Homo sapiens	2021-11-01		Rahman et al		Rahman,M.Z., Hossain,M.E., Sumiya,M.K., Islam,M.M., Begum,M.N., Hoque,A.F., Uddin,K.M.M., Hassan,M.Z., Rahman,M., Goswami,D.R., Brooks,W.A.	
1588	MW306460	MW306460.1	BGD/365974/RSV_A/2010	2010-XX-XX	Asia	Bangladesh			Homo sapiens	2021-11-01		Rahman et al		Rahman,M.Z., Hossain,M.E., Sumiya,M.K., Islam,M.M., Begum,M.N., Hoque,A.F., Uddin,K.M.M., Hassan,M.Z., Rahman,M., Goswami,D.R., Brooks,W.A.	
1589	MW306461	MW306461.1	BGD/341471/RSV_A/2010	2010-XX-XX	Asia	Bangladesh			Homo sapiens	2021-11-01		Rahman et al		Rahman,M.Z., Hossain,M.E., Sumiya,M.K., Islam,M.M., Begum,M.N., Hoque,A.F., Uddin,K.M.M., Hassan,M.Z., Rahman,M., Goswami,D.R., Brooks,W.A.	
1590	MW306462	MW306462.1	BGD/341504/RSV_A/2010	2010-XX-XX	Asia	Bangladesh			Homo sapiens	2021-11-01		Rahman et al		Rahman,M.Z., Hossain,M.E., Sumiya,M.K., Islam,M.M., Begum,M.N., Hoque,A.F., Uddin,K.M.M., Hassan,M.Z., Rahman,M., Goswami,D.R., Brooks,W.A.	
1591	MW306463	MW306463.1	BGD/346416/RSV_A/2010	2010-XX-XX	Asia	Bangladesh			Homo sapiens	2021-11-01		Rahman et al		Rahman,M.Z., Hossain,M.E., Sumiya,M.K., Islam,M.M., Begum,M.N., Hoque,A.F., Uddin,K.M.M., Hassan,M.Z., Rahman,M., Goswami,D.R., Brooks,W.A.	
1592	MW306464	MW306464.1	BGD/347260/RSV_A/2010	2010-XX-XX	Asia	Bangladesh			Homo sapiens	2021-11-01		Rahman et al		Rahman,M.Z., Hossain,M.E., Sumiya,M.K., Islam,M.M., Begum,M.N., Hoque,A.F., Uddin,K.M.M., Hassan,M.Z., Rahman,M., Goswami,D.R., Brooks,W.A.	
1593	MW306465	MW306465.1	BGD/350396/RSV_A/2010	2010-XX-XX	Asia	Bangladesh			Homo sapiens	2021-11-01		Rahman et al		Rahman,M.Z., Hossain,M.E., Sumiya,M.K., Islam,M.M., Begum,M.N., Hoque,A.F., Uddin,K.M.M., Hassan,M.Z., Rahman,M., Goswami,D.R., Brooks,W.A.	
1594	MW306466	MW306466.1	BGD/216099/RSV_A/2010	2010-XX-XX	Asia	Bangladesh			Homo sapiens	2021-11-01		Rahman et al		Rahman,M.Z., Hossain,M.E., Sumiya,M.K., Islam,M.M., Begum,M.N., Hoque,A.F., Uddin,K.M.M., Hassan,M.Z., Rahman,M., Goswami,D.R., Brooks,W.A.	
1595	MW306467	MW306467.1	BGD/350734/RSV_A/2010	2010-XX-XX	Asia	Bangladesh			Homo sapiens	2021-11-01		Rahman et al		Rahman,M.Z., Hossain,M.E., Sumiya,M.K., Islam,M.M., Begum,M.N., Hoque,A.F., Uddin,K.M.M., Hassan,M.Z., Rahman,M., Goswami,D.R., Brooks,W.A.	
1596	MW306468	MW306468.1	BGD/353808/RSV_A/2010	2010-XX-XX	Asia	Bangladesh			Homo sapiens	2021-11-01		Rahman et al		Rahman,M.Z., Hossain,M.E., Sumiya,M.K., Islam,M.M., Begum,M.N., Hoque,A.F., Uddin,K.M.M., Hassan,M.Z., Rahman,M., Goswami,D.R., Brooks,W.A.	
1597	MW306469	MW306469.1	BGD/354688/RSV_A/2010	2010-XX-XX	Asia	Bangladesh			Homo sapiens	2021-11-01		Rahman et al		Rahman,M.Z., Hossain,M.E., Sumiya,M.K., Islam,M.M., Begum,M.N., Hoque,A.F., Uddin,K.M.M., Hassan,M.Z., Rahman,M., Goswami,D.R., Brooks,W.A.	
1598	MW306471	MW306471.1	BDG/357189/RSV_A/2010	2010-XX-XX	Asia	Bangladesh			Homo sapiens	2021-11-01		Rahman et al		Rahman,M.Z., Hossain,M.E., Sumiya,M.K., Islam,M.M., Begum,M.N., Hoque,A.F., Uddin,K.M.M., Hassan,M.Z., Rahman,M., Goswami,D.R., Brooks,W.A.	
1599	MW306472	MW306472.1	BGD/350670/RSV_A/2010	2010-XX-XX	Asia	Bangladesh			Homo sapiens	2021-11-01		Rahman et al		Rahman,M.Z., Hossain,M.E., Sumiya,M.K., Islam,M.M., Begum,M.N., Hoque,A.F., Uddin,K.M.M., Hassan,M.Z., Rahman,M., Goswami,D.R., Brooks,W.A.	
1600	MW306473	MW306473.1	BGD/353848/RSV_A/2010	2010-XX-XX	Asia	Bangladesh			Homo sapiens	2021-11-01		Rahman et al		Rahman,M.Z., Hossain,M.E., Sumiya,M.K., Islam,M.M., Begum,M.N., Hoque,A.F., Uddin,K.M.M., Hassan,M.Z., Rahman,M., Goswami,D.R., Brooks,W.A.	
1601	OK649642	OK649642.1	OK649642	2010-XX-XX	South America	Brazil			Homo sapiens	2021-11-07		Wang et al		Wang,L., Ng,T.F.F., Castro,C.J., Marine,R.L., Magana,L.C., Esona,M., Peret,T.C.T., Thornburg,N.J.	
1602	OK649643	OK649643.1	OK649643	2010-XX-XX	South America	Brazil			Homo sapiens	2021-11-07		Wang et al		Wang,L., Ng,T.F.F., Castro,C.J., Marine,R.L., Magana,L.C., Esona,M., Peret,T.C.T., Thornburg,N.J.	
1603	OK649644	OK649644.1	OK649644	2010-XX-XX	South America	Brazil			Homo sapiens	2021-11-07		Wang et al		Wang,L., Ng,T.F.F., Castro,C.J., Marine,R.L., Magana,L.C., Esona,M., Peret,T.C.T., Thornburg,N.J.	
1604	OK649645	OK649645.1	OK649645	2010-XX-XX	South America	Brazil			Homo sapiens	2021-11-07		Wang et al		Wang,L., Ng,T.F.F., Castro,C.J., Marine,R.L., Magana,L.C., Esona,M., Peret,T.C.T., Thornburg,N.J.	
1605	OK649646	OK649646.1	OK649646	2010-XX-XX	South America	Brazil			Homo sapiens	2021-11-07		Wang et al		Wang,L., Ng,T.F.F., Castro,C.J., Marine,R.L., Magana,L.C., Esona,M., Peret,T.C.T., Thornburg,N.J.	
1606	OK649647	OK649647.1	OK649647	2010-XX-XX	South America	Brazil			Homo sapiens	2021-11-07		Wang et al		Wang,L., Ng,T.F.F., Castro,C.J., Marine,R.L., Magana,L.C., Esona,M., Peret,T.C.T., Thornburg,N.J.	
1607	OK649648	OK649648.1	OK649648	2010-XX-XX	South America	Brazil			Homo sapiens	2021-11-07		Wang et al		Wang,L., Ng,T.F.F., Castro,C.J., Marine,R.L., Magana,L.C., Esona,M., Peret,T.C.T., Thornburg,N.J.	
1608	OK649649	OK649649.1	OK649649	2010-XX-XX	South America	Brazil			Homo sapiens	2021-11-07		Wang et al		Wang,L., Ng,T.F.F., Castro,C.J., Marine,R.L., Magana,L.C., Esona,M., Peret,T.C.T., Thornburg,N.J.	
1609	OK649650	OK649650.1	OK649650	2010-XX-XX	South America	Brazil			Homo sapiens	2021-11-07		Wang et al		Wang,L., Ng,T.F.F., Castro,C.J., Marine,R.L., Magana,L.C., Esona,M., Peret,T.C.T., Thornburg,N.J.	
1610	OK649651	OK649651.1	OK649651	2010-XX-XX	South America	Brazil			Homo sapiens	2021-11-07		Wang et al		Wang,L., Ng,T.F.F., Castro,C.J., Marine,R.L., Magana,L.C., Esona,M., Peret,T.C.T., Thornburg,N.J.	
1611	OK649652	OK649652.1	OK649652	2010-XX-XX	South America	Brazil			Homo sapiens	2021-11-07		Wang et al		Wang,L., Ng,T.F.F., Castro,C.J., Marine,R.L., Magana,L.C., Esona,M., Peret,T.C.T., Thornburg,N.J.	
1612	OK649653	OK649653.1	OK649653	2010-XX-XX	South America	Brazil			Homo sapiens	2021-11-07		Wang et al		Wang,L., Ng,T.F.F., Castro,C.J., Marine,R.L., Magana,L.C., Esona,M., Peret,T.C.T., Thornburg,N.J.	
1613	OK649654	OK649654.1	OK649654	2010-XX-XX	South America	Brazil			Homo sapiens	2021-11-07		Wang et al		Wang,L., Ng,T.F.F., Castro,C.J., Marine,R.L., Magana,L.C., Esona,M., Peret,T.C.T., Thornburg,N.J.	
1614	OK649655	OK649655.1	OK649655	2010-XX-XX	South America	Brazil			Homo sapiens	2021-11-07		Wang et al		Wang,L., Ng,T.F.F., Castro,C.J., Marine,R.L., Magana,L.C., Esona,M., Peret,T.C.T., Thornburg,N.J.	
1615	OK649656	OK649656.1	OK649656	2010-XX-XX	South America	Brazil			Homo sapiens	2021-11-07		Wang et al		Wang,L., Ng,T.F.F., Castro,C.J., Marine,R.L., Magana,L.C., Esona,M., Peret,T.C.T., Thornburg,N.J.	
1616	OK649660	OK649660.1	OK649660	2010-XX-XX	Africa	Kenya			Homo sapiens	2021-11-07		Wang et al		Wang,L., Ng,T.F.F., Castro,C.J., Marine,R.L., Magana,L.C., Esona,M., Peret,T.C.T., Thornburg,N.J.	
1617	OM962800	OM962800.1	Pangasinan.PHL/2010/066	2010-XX-XX	Asia	Philippines			Homo sapiens	2022-06-29		Calaor-Morin et al		Calaor-Morin,J., Arguelles,V.L., Foronda,J.L., Tan,A., Lagamayo,E., Dapat,C., Lupisan,S., Morin,J.C., Foronda,J.L.M.	
1618	OM962807	OM962807.1	Cagayan.PHL/2010/009	2010-XX-XX	Asia	Philippines			Homo sapiens	2022-06-29		Calaor-Morin et al		Calaor-Morin,J., Arguelles,V.L., Foronda,J.L., Tan,A., Lagamayo,E., Dapat,C., Lupisan,S., Morin,J.C., Foronda,J.L.M.	
1619	OM962812	OM962812.1	Pangasinan.PHL/2010/047	2010-XX-XX	Asia	Philippines			Homo sapiens	2022-06-29		Calaor-Morin et al		Calaor-Morin,J., Arguelles,V.L., Foronda,J.L., Tan,A., Lagamayo,E., Dapat,C., Lupisan,S., Morin,J.C., Foronda,J.L.M.	
1620	OM962819	OM962819.1	Cagayan.PHL/2010/010	2010-XX-XX	Asia	Philippines			Homo sapiens	2022-06-29		Calaor-Morin et al		Calaor-Morin,J., Arguelles,V.L., Foronda,J.L., Tan,A., Lagamayo,E., Dapat,C., Lupisan,S., Morin,J.C., Foronda,J.L.M.	
1621	OM962828	OM962828.1	Pangasinan.PHL/2010/053	2010-XX-XX	Asia	Philippines			Homo sapiens	2022-06-29		Calaor-Morin et al		Calaor-Morin,J., Arguelles,V.L., Foronda,J.L., Tan,A., Lagamayo,E., Dapat,C., Lupisan,S., Morin,J.C., Foronda,J.L.M.	
1622	HQ699264	HQ699264.1	HQ699264	2010-01-XX	Asia	South Korea			Homo sapiens	2011-07-13		Baek et al		Baek,Y.H., Choi,E.H., Song,M.S., Pascua,P.N., Kwon,H.I., Park,S.J., Lee,J.H., Woo,S.I., Ahn,B.H., Han,H.S., Hahn,Y.S., Shin,K.S., Jang,H.L., Kim,S.Y., Choi,Y.K., Park,S.-J., Song,M.-S., Choi,Y.-K.	
1623	HQ699281	HQ699281.1	HQ699281	2010-01-XX	Asia	South Korea			Homo sapiens	2011-07-13		Baek et al		Baek,Y.H., Choi,E.H., Song,M.S., Pascua,P.N., Kwon,H.I., Park,S.J., Lee,J.H., Woo,S.I., Ahn,B.H., Han,H.S., Hahn,Y.S., Shin,K.S., Jang,H.L., Kim,S.Y., Choi,Y.K., Park,S.-J., Song,M.-S., Choi,Y.-K.	
1624	HQ699284	HQ699284.1	HQ699284	2010-01-XX	Asia	South Korea			Homo sapiens	2011-07-13		Baek et al		Baek,Y.H., Choi,E.H., Song,M.S., Pascua,P.N., Kwon,H.I., Park,S.J., Lee,J.H., Woo,S.I., Ahn,B.H., Han,H.S., Hahn,Y.S., Shin,K.S., Jang,H.L., Kim,S.Y., Choi,Y.K., Park,S.-J., Song,M.-S., Choi,Y.-K.	
1625	HQ699285	HQ699285.1	HQ699285	2010-01-XX	Asia	South Korea			Homo sapiens	2011-07-13		Baek et al		Baek,Y.H., Choi,E.H., Song,M.S., Pascua,P.N., Kwon,H.I., Park,S.J., Lee,J.H., Woo,S.I., Ahn,B.H., Han,H.S., Hahn,Y.S., Shin,K.S., Jang,H.L., Kim,S.Y., Choi,Y.K., Park,S.-J., Song,M.-S., Choi,Y.-K.	
1626	HQ699286	HQ699286.1	HQ699286	2010-01-XX	Asia	South Korea			Homo sapiens	2011-07-13		Baek et al		Baek,Y.H., Choi,E.H., Song,M.S., Pascua,P.N., Kwon,H.I., Park,S.J., Lee,J.H., Woo,S.I., Ahn,B.H., Han,H.S., Hahn,Y.S., Shin,K.S., Jang,H.L., Kim,S.Y., Choi,Y.K., Park,S.-J., Song,M.-S., Choi,Y.-K.	
1627	KP284703	KP284703.1	KP284703	2010-01-XX	Europe	Italy			Homo sapiens	2015-05-16		Esposito et al		Esposito,S., Piralla,A., Zampiero,A., Bianchini,S., Di Pietro,G., Scala,A., Pinzani,R., Fossali,E., Baldanti,F., Principi,N.	
1628	KP284704	KP284704.1	KP284704	2010-01-XX	Europe	Italy			Homo sapiens	2015-05-16		Esposito et al		Esposito,S., Piralla,A., Zampiero,A., Bianchini,S., Di Pietro,G., Scala,A., Pinzani,R., Fossali,E., Baldanti,F., Principi,N.	
1629	KP284706	KP284706.1	KP284706	2010-01-XX	Europe	Italy			Homo sapiens	2015-05-16		Esposito et al		Esposito,S., Piralla,A., Zampiero,A., Bianchini,S., Di Pietro,G., Scala,A., Pinzani,R., Fossali,E., Baldanti,F., Principi,N.	
1630	KP284707	KP284707.1	KP284707	2010-01-XX	Europe	Italy			Homo sapiens	2015-05-16		Esposito et al		Esposito,S., Piralla,A., Zampiero,A., Bianchini,S., Di Pietro,G., Scala,A., Pinzani,R., Fossali,E., Baldanti,F., Principi,N.	
1631	KP284708	KP284708.1	KP284708	2010-01-XX	Europe	Italy			Homo sapiens	2015-05-16		Esposito et al		Esposito,S., Piralla,A., Zampiero,A., Bianchini,S., Di Pietro,G., Scala,A., Pinzani,R., Fossali,E., Baldanti,F., Principi,N.	
1632	KP284709	KP284709.1	KP284709	2010-01-XX	Europe	Italy			Homo sapiens	2015-05-16		Esposito et al		Esposito,S., Piralla,A., Zampiero,A., Bianchini,S., Di Pietro,G., Scala,A., Pinzani,R., Fossali,E., Baldanti,F., Principi,N.	
1633	KP284710	KP284710.1	KP284710	2010-01-XX	Europe	Italy			Homo sapiens	2015-05-16		Esposito et al		Esposito,S., Piralla,A., Zampiero,A., Bianchini,S., Di Pietro,G., Scala,A., Pinzani,R., Fossali,E., Baldanti,F., Principi,N.	
1634	KP284711	KP284711.1	KP284711	2010-01-XX	Europe	Italy			Homo sapiens	2015-05-16		Esposito et al		Esposito,S., Piralla,A., Zampiero,A., Bianchini,S., Di Pietro,G., Scala,A., Pinzani,R., Fossali,E., Baldanti,F., Principi,N.	
1635	KP284712	KP284712.1	KP284712	2010-01-XX	Europe	Italy			Homo sapiens	2015-05-16		Esposito et al		Esposito,S., Piralla,A., Zampiero,A., Bianchini,S., Di Pietro,G., Scala,A., Pinzani,R., Fossali,E., Baldanti,F., Principi,N.	
1636	KX946342	KX946342.1	NhaTrang/ARI-2193/2010	2010-01-XX	Asia	Vietnam			Homo sapiens	2016-10-24		Yoshihara et al		Yoshihara,K., Le,M.N., Nagasawa,K., Tsukagoshi,H., Nguyen,H.A., Toizumi,M., Moriuchi,H., Hashizume,M., Ariyoshi,K., Dang,D.A., Kimura,H., Yoshida,L.M., Nhat Le,M., Yoshida,L.-M.	
1637	KF156501	KF156501.1	KF156501	2010-01-02	Africa	Kenya			Homo sapiens	2013-11-30		Agoti et al		Agoti,C.N., Mayieka,L.M., Otieno,J.R., Ahmed,J.A., Fields,B.S., Waiboci,L.W., Nyoka,R., Eidex,R.B., Marano,N., Burton,W., Montgomery,J.M., Breiman,R.F., Nokes,D.J., Mayieka,L., Fields,B., Waiboci,L.B., Eidex,R., Morano,N., Montgomery,J., Breiman,R.	
1638	KF156502	KF156502.1	KF156502	2010-01-02	Africa	Kenya			Homo sapiens	2013-11-30		Agoti et al		Agoti,C.N., Mayieka,L.M., Otieno,J.R., Ahmed,J.A., Fields,B.S., Waiboci,L.W., Nyoka,R., Eidex,R.B., Marano,N., Burton,W., Montgomery,J.M., Breiman,R.F., Nokes,D.J., Mayieka,L., Fields,B., Waiboci,L.B., Eidex,R., Morano,N., Montgomery,J., Breiman,R.	
1639	KF156504	KF156504.1	KF156504	2010-01-04	Africa	Kenya			Homo sapiens	2013-11-30		Agoti et al		Agoti,C.N., Mayieka,L.M., Otieno,J.R., Ahmed,J.A., Fields,B.S., Waiboci,L.W., Nyoka,R., Eidex,R.B., Marano,N., Burton,W., Montgomery,J.M., Breiman,R.F., Nokes,D.J., Mayieka,L., Fields,B., Waiboci,L.B., Eidex,R., Morano,N., Montgomery,J., Breiman,R.	
1640	KF156505	KF156505.1	KF156505	2010-01-05	Africa	Kenya			Homo sapiens	2013-11-30		Agoti et al		Agoti,C.N., Mayieka,L.M., Otieno,J.R., Ahmed,J.A., Fields,B.S., Waiboci,L.W., Nyoka,R., Eidex,R.B., Marano,N., Burton,W., Montgomery,J.M., Breiman,R.F., Nokes,D.J., Mayieka,L., Fields,B., Waiboci,L.B., Eidex,R., Morano,N., Montgomery,J., Breiman,R.	
1641	KF156370	KF156370.1	KF156370	2010-01-06	Africa	Kenya			Homo sapiens	2013-11-30		Agoti et al		Agoti,C.N., Mayieka,L.M., Otieno,J.R., Ahmed,J.A., Fields,B.S., Waiboci,L.W., Nyoka,R., Eidex,R.B., Marano,N., Burton,W., Montgomery,J.M., Breiman,R.F., Nokes,D.J., Mayieka,L., Fields,B., Waiboci,L.B., Eidex,R., Morano,N., Montgomery,J., Breiman,R.	
1642	KT765262	KT765262.1	KEN/Kilifi/786_06/01/2010	2010-01-06	Africa	Kenya			Homo sapiens	2016-02-27		Otieno et al		Otieno,J.R., Agoti,C.N., Gitahi,C.W., Bett,A., Ngama,M., Medley,G.F., Cane,P.A., Nokes,D.J., Nokes,J.D.	
1643	KT765515	KT765515.1	KEN/Kilifi/787_08/01/2010	2010-01-08	Africa	Kenya			Homo sapiens	2016-02-27		Otieno et al		Otieno,J.R., Agoti,C.N., Gitahi,C.W., Bett,A., Ngama,M., Medley,G.F., Cane,P.A., Nokes,D.J., Nokes,J.D.	
1644	OK458652	OK458652.1	OK458652	2010-01-08	Africa	Kenya			Homo sapiens	2021-12-13		Wangui et al		Wangui,J.M., Nokes,J.D., Opot,B.H., Opanda,S.M., Agoti,C.N., Otieno,J.R., Bulimo,W.D.	
1645	OK458654	OK458654.1	OK458654	2010-01-08	Africa	Kenya			Homo sapiens	2021-12-13		Wangui et al		Wangui,J.M., Nokes,J.D., Opot,B.H., Opanda,S.M., Agoti,C.N., Otieno,J.R., Bulimo,W.D.	
1646	OK458612	OK458612.1	OK458612	2010-01-14	Africa	Kenya			Homo sapiens	2021-12-13		Wangui et al		Wangui,J.M., Nokes,J.D., Opot,B.H., Opanda,S.M., Agoti,C.N., Otieno,J.R., Bulimo,W.D.	
1647	KF156371	KF156371.1	KF156371	2010-01-15	Africa	Kenya			Homo sapiens	2013-11-30		Agoti et al		Agoti,C.N., Mayieka,L.M., Otieno,J.R., Ahmed,J.A., Fields,B.S., Waiboci,L.W., Nyoka,R., Eidex,R.B., Marano,N., Burton,W., Montgomery,J.M., Breiman,R.F., Nokes,D.J., Mayieka,L., Fields,B., Waiboci,L.B., Eidex,R., Morano,N., Montgomery,J., Breiman,R.	
1648	KF156506	KF156506.1	KF156506	2010-01-15	Africa	Kenya			Homo sapiens	2013-11-30		Agoti et al		Agoti,C.N., Mayieka,L.M., Otieno,J.R., Ahmed,J.A., Fields,B.S., Waiboci,L.W., Nyoka,R., Eidex,R.B., Marano,N., Burton,W., Montgomery,J.M., Breiman,R.F., Nokes,D.J., Mayieka,L., Fields,B., Waiboci,L.B., Eidex,R., Morano,N., Montgomery,J., Breiman,R.	
1649	KF156507	KF156507.1	KF156507	2010-01-15	Africa	Kenya			Homo sapiens	2013-11-30		Agoti et al		Agoti,C.N., Mayieka,L.M., Otieno,J.R., Ahmed,J.A., Fields,B.S., Waiboci,L.W., Nyoka,R., Eidex,R.B., Marano,N., Burton,W., Montgomery,J.M., Breiman,R.F., Nokes,D.J., Mayieka,L., Fields,B., Waiboci,L.B., Eidex,R., Morano,N., Montgomery,J., Breiman,R.	
1650	KT765216	KT765216.1	KEN/Kilifi/788_15/01/2010	2010-01-15	Africa	Kenya			Homo sapiens	2016-02-27		Otieno et al		Otieno,J.R., Agoti,C.N., Gitahi,C.W., Bett,A., Ngama,M., Medley,G.F., Cane,P.A., Nokes,D.J., Nokes,J.D.	
1651	KT765414	KT765414.1	KEN/Kilifi/789_15/01/2010	2010-01-15	Africa	Kenya			Homo sapiens	2016-02-27		Otieno et al		Otieno,J.R., Agoti,C.N., Gitahi,C.W., Bett,A., Ngama,M., Medley,G.F., Cane,P.A., Nokes,D.J., Nokes,J.D.	
1652	KF156508	KF156508.1	KF156508	2010-01-16	Africa	Kenya			Homo sapiens	2013-11-30		Agoti et al		Agoti,C.N., Mayieka,L.M., Otieno,J.R., Ahmed,J.A., Fields,B.S., Waiboci,L.W., Nyoka,R., Eidex,R.B., Marano,N., Burton,W., Montgomery,J.M., Breiman,R.F., Nokes,D.J., Mayieka,L., Fields,B., Waiboci,L.B., Eidex,R., Morano,N., Montgomery,J., Breiman,R.	
1653	KF156503	KF156503.1	KF156503	2010-01-18	Africa	Kenya			Homo sapiens	2013-11-30		Agoti et al		Agoti,C.N., Mayieka,L.M., Otieno,J.R., Ahmed,J.A., Fields,B.S., Waiboci,L.W., Nyoka,R., Eidex,R.B., Marano,N., Burton,W., Montgomery,J.M., Breiman,R.F., Nokes,D.J., Mayieka,L., Fields,B., Waiboci,L.B., Eidex,R., Morano,N., Montgomery,J., Breiman,R.	
1654	KF156509	KF156509.1	KF156509	2010-01-18	Africa	Kenya			Homo sapiens	2013-11-30		Agoti et al		Agoti,C.N., Mayieka,L.M., Otieno,J.R., Ahmed,J.A., Fields,B.S., Waiboci,L.W., Nyoka,R., Eidex,R.B., Marano,N., Burton,W., Montgomery,J.M., Breiman,R.F., Nokes,D.J., Mayieka,L., Fields,B., Waiboci,L.B., Eidex,R., Morano,N., Montgomery,J., Breiman,R.	
1655	KF156510	KF156510.1	KF156510	2010-01-18	Africa	Kenya			Homo sapiens	2013-11-30		Agoti et al		Agoti,C.N., Mayieka,L.M., Otieno,J.R., Ahmed,J.A., Fields,B.S., Waiboci,L.W., Nyoka,R., Eidex,R.B., Marano,N., Burton,W., Montgomery,J.M., Breiman,R.F., Nokes,D.J., Mayieka,L., Fields,B., Waiboci,L.B., Eidex,R., Morano,N., Montgomery,J., Breiman,R.	
1656	KT765235	KT765235.1	KEN/Kilifi/790_18/01/2010	2010-01-18	Africa	Kenya			Homo sapiens	2016-02-27		Otieno et al		Otieno,J.R., Agoti,C.N., Gitahi,C.W., Bett,A., Ngama,M., Medley,G.F., Cane,P.A., Nokes,D.J., Nokes,J.D.	
1657	KT765268	KT765268.1	KEN/Kilifi/791_18/01/2010	2010-01-18	Africa	Kenya			Homo sapiens	2016-02-27		Otieno et al		Otieno,J.R., Agoti,C.N., Gitahi,C.W., Bett,A., Ngama,M., Medley,G.F., Cane,P.A., Nokes,D.J., Nokes,J.D.	
1658	KT765455	KT765455.1	KEN/Kilifi/792_19/01/2010	2010-01-19	Africa	Kenya			Homo sapiens	2016-02-27		Otieno et al		Otieno,J.R., Agoti,C.N., Gitahi,C.W., Bett,A., Ngama,M., Medley,G.F., Cane,P.A., Nokes,D.J., Nokes,J.D.	
1659	KT765486	KT765486.1	KEN/Kilifi/793_19/01/2010	2010-01-19	Africa	Kenya			Homo sapiens	2016-02-27		Otieno et al		Otieno,J.R., Agoti,C.N., Gitahi,C.W., Bett,A., Ngama,M., Medley,G.F., Cane,P.A., Nokes,D.J., Nokes,J.D.	
1660	OK458666	OK458666.1	OK458666	2010-01-19	Africa	Kenya			Homo sapiens	2021-12-13		Wangui et al		Wangui,J.M., Nokes,J.D., Opot,B.H., Opanda,S.M., Agoti,C.N., Otieno,J.R., Bulimo,W.D.	
1661	KF156372	KF156372.1	KF156372	2010-01-20	Africa	Kenya			Homo sapiens	2013-11-30		Agoti et al		Agoti,C.N., Mayieka,L.M., Otieno,J.R., Ahmed,J.A., Fields,B.S., Waiboci,L.W., Nyoka,R., Eidex,R.B., Marano,N., Burton,W., Montgomery,J.M., Breiman,R.F., Nokes,D.J., Mayieka,L., Fields,B., Waiboci,L.B., Eidex,R., Morano,N., Montgomery,J., Breiman,R.	
1662	KT765217	KT765217.1	KEN/Kilifi/794_20/01/2010	2010-01-20	Africa	Kenya			Homo sapiens	2016-02-27		Otieno et al		Otieno,J.R., Agoti,C.N., Gitahi,C.W., Bett,A., Ngama,M., Medley,G.F., Cane,P.A., Nokes,D.J., Nokes,J.D.	
1663	KT765230	KT765230.1	KEN/Kilifi/795_21/01/2010	2010-01-21	Africa	Kenya			Homo sapiens	2016-02-27		Otieno et al		Otieno,J.R., Agoti,C.N., Gitahi,C.W., Bett,A., Ngama,M., Medley,G.F., Cane,P.A., Nokes,D.J., Nokes,J.D.	
1664	KT765278	KT765278.1	KEN/Kilifi/797_24/01/2010	2010-01-24	Africa	Kenya			Homo sapiens	2016-02-27		Otieno et al		Otieno,J.R., Agoti,C.N., Gitahi,C.W., Bett,A., Ngama,M., Medley,G.F., Cane,P.A., Nokes,D.J., Nokes,J.D.	
1665	KT765411	KT765411.1	KEN/Kilifi/796_24/01/2010	2010-01-24	Africa	Kenya			Homo sapiens	2016-02-27		Otieno et al		Otieno,J.R., Agoti,C.N., Gitahi,C.W., Bett,A., Ngama,M., Medley,G.F., Cane,P.A., Nokes,D.J., Nokes,J.D.	
1666	KT765259	KT765259.1	KEN/Kilifi/799_25/01/2010	2010-01-25	Africa	Kenya			Homo sapiens	2016-02-27		Otieno et al		Otieno,J.R., Agoti,C.N., Gitahi,C.W., Bett,A., Ngama,M., Medley,G.F., Cane,P.A., Nokes,D.J., Nokes,J.D.	
1667	KT765485	KT765485.1	KEN/Kilifi/798_25/01/2010	2010-01-25	Africa	Kenya			Homo sapiens	2016-02-27		Otieno et al		Otieno,J.R., Agoti,C.N., Gitahi,C.W., Bett,A., Ngama,M., Medley,G.F., Cane,P.A., Nokes,D.J., Nokes,J.D.	
1668	OK458646	OK458646.1	OK458646	2010-01-25	Africa	Kenya			Homo sapiens	2021-12-13		Wangui et al		Wangui,J.M., Nokes,J.D., Opot,B.H., Opanda,S.M., Agoti,C.N., Otieno,J.R., Bulimo,W.D.	
1669	OK458647	OK458647.1	OK458647	2010-01-25	Africa	Kenya			Homo sapiens	2021-12-13		Wangui et al		Wangui,J.M., Nokes,J.D., Opot,B.H., Opanda,S.M., Agoti,C.N., Otieno,J.R., Bulimo,W.D.	
1670	OK458657	OK458657.1	OK458657	2010-01-25	Africa	Kenya			Homo sapiens	2021-12-13		Wangui et al		Wangui,J.M., Nokes,J.D., Opot,B.H., Opanda,S.M., Agoti,C.N., Otieno,J.R., Bulimo,W.D.	
1671	KT765248	KT765248.1	KEN/Kilifi/800_26/01/2010	2010-01-26	Africa	Kenya			Homo sapiens	2016-02-27		Otieno et al		Otieno,J.R., Agoti,C.N., Gitahi,C.W., Bett,A., Ngama,M., Medley,G.F., Cane,P.A., Nokes,D.J., Nokes,J.D.	
1672	KF156511	KF156511.1	KF156511	2010-01-27	Africa	Kenya			Homo sapiens	2013-11-30		Agoti et al		Agoti,C.N., Mayieka,L.M., Otieno,J.R., Ahmed,J.A., Fields,B.S., Waiboci,L.W., Nyoka,R., Eidex,R.B., Marano,N., Burton,W., Montgomery,J.M., Breiman,R.F., Nokes,D.J., Mayieka,L., Fields,B., Waiboci,L.B., Eidex,R., Morano,N., Montgomery,J., Breiman,R.	
1673	KJ658813	KJ658813.1	SH10012806NA1	2010-01-28	Asia	China			Homo sapiens	2014-12-20		Liu et al		Liu,J., Mu,Y., Dong,W., Yao,F., Wang,L., Yan,H., Lan,K., Zhang,C.	
1674	KT765571	KT765571.1	KEN/Kilifi/801_29/01/2010	2010-01-29	Africa	Kenya			Homo sapiens	2016-02-27		Otieno et al		Otieno,J.R., Agoti,C.N., Gitahi,C.W., Bett,A., Ngama,M., Medley,G.F., Cane,P.A., Nokes,D.J., Nokes,J.D.	
1675	KT765271	KT765271.1	KEN/Kilifi/802_31/01/2010	2010-01-31	Africa	Kenya			Homo sapiens	2016-02-27		Otieno et al		Otieno,J.R., Agoti,C.N., Gitahi,C.W., Bett,A., Ngama,M., Medley,G.F., Cane,P.A., Nokes,D.J., Nokes,J.D.	
1676	HQ699275	HQ699275.1	HQ699275	2010-02-XX	Asia	South Korea			Homo sapiens	2011-07-13		Baek et al		Baek,Y.H., Choi,E.H., Song,M.S., Pascua,P.N., Kwon,H.I., Park,S.J., Lee,J.H., Woo,S.I., Ahn,B.H., Han,H.S., Hahn,Y.S., Shin,K.S., Jang,H.L., Kim,S.Y., Choi,Y.K., Park,S.-J., Song,M.-S., Choi,Y.-K.	
1677	HQ699276	HQ699276.1	HQ699276	2010-02-XX	Asia	South Korea			Homo sapiens	2011-07-13		Baek et al		Baek,Y.H., Choi,E.H., Song,M.S., Pascua,P.N., Kwon,H.I., Park,S.J., Lee,J.H., Woo,S.I., Ahn,B.H., Han,H.S., Hahn,Y.S., Shin,K.S., Jang,H.L., Kim,S.Y., Choi,Y.K., Park,S.-J., Song,M.-S., Choi,Y.-K.	
1678	KP284652	KP284652.1	KP284652	2010-02-XX	Europe	Italy			Homo sapiens	2015-05-16		Esposito et al		Esposito,S., Piralla,A., Zampiero,A., Bianchini,S., Di Pietro,G., Scala,A., Pinzani,R., Fossali,E., Baldanti,F., Principi,N.	
1679	KP284653	KP284653.1	KP284653	2010-02-XX	Europe	Italy			Homo sapiens	2015-05-16		Esposito et al		Esposito,S., Piralla,A., Zampiero,A., Bianchini,S., Di Pietro,G., Scala,A., Pinzani,R., Fossali,E., Baldanti,F., Principi,N.	
1680	KP284654	KP284654.1	KP284654	2010-02-XX	Europe	Italy			Homo sapiens	2015-05-16		Esposito et al		Esposito,S., Piralla,A., Zampiero,A., Bianchini,S., Di Pietro,G., Scala,A., Pinzani,R., Fossali,E., Baldanti,F., Principi,N.	
1681	KP284655	KP284655.1	KP284655	2010-02-XX	Europe	Italy			Homo sapiens	2015-05-16		Esposito et al		Esposito,S., Piralla,A., Zampiero,A., Bianchini,S., Di Pietro,G., Scala,A., Pinzani,R., Fossali,E., Baldanti,F., Principi,N.	
1682	KP284656	KP284656.1	KP284656	2010-02-XX	Europe	Italy			Homo sapiens	2015-05-16		Esposito et al		Esposito,S., Piralla,A., Zampiero,A., Bianchini,S., Di Pietro,G., Scala,A., Pinzani,R., Fossali,E., Baldanti,F., Principi,N.	
1683	KP284657	KP284657.1	KP284657	2010-02-XX	Europe	Italy			Homo sapiens	2015-05-16		Esposito et al		Esposito,S., Piralla,A., Zampiero,A., Bianchini,S., Di Pietro,G., Scala,A., Pinzani,R., Fossali,E., Baldanti,F., Principi,N.	
1684	KP284666	KP284666.1	KP284666	2010-02-XX	Europe	Italy			Homo sapiens	2015-05-16		Esposito et al		Esposito,S., Piralla,A., Zampiero,A., Bianchini,S., Di Pietro,G., Scala,A., Pinzani,R., Fossali,E., Baldanti,F., Principi,N.	
1685	KT765214	KT765214.1	KEN/Kilifi/804_01/02/2010	2010-02-01	Africa	Kenya			Homo sapiens	2016-02-27		Otieno et al		Otieno,J.R., Agoti,C.N., Gitahi,C.W., Bett,A., Ngama,M., Medley,G.F., Cane,P.A., Nokes,D.J., Nokes,J.D.	
1686	KT765281	KT765281.1	KEN/Kilifi/803_01/02/2010	2010-02-01	Africa	Kenya			Homo sapiens	2016-02-27		Otieno et al		Otieno,J.R., Agoti,C.N., Gitahi,C.W., Bett,A., Ngama,M., Medley,G.F., Cane,P.A., Nokes,D.J., Nokes,J.D.	
1687	KT765247	KT765247.1	KEN/Kilifi/805_04/02/2010	2010-02-04	Africa	Kenya			Homo sapiens	2016-02-27		Otieno et al		Otieno,J.R., Agoti,C.N., Gitahi,C.W., Bett,A., Ngama,M., Medley,G.F., Cane,P.A., Nokes,D.J., Nokes,J.D.	
1688	KT765252	KT765252.1	KEN/Kilifi/806_05/02/2010	2010-02-05	Africa	Kenya			Homo sapiens	2016-02-27		Otieno et al		Otieno,J.R., Agoti,C.N., Gitahi,C.W., Bett,A., Ngama,M., Medley,G.F., Cane,P.A., Nokes,D.J., Nokes,J.D.	
1689	KT765288	KT765288.1	KEN/Kilifi/807_07/02/2010	2010-02-07	Africa	Kenya			Homo sapiens	2016-02-27		Otieno et al		Otieno,J.R., Agoti,C.N., Gitahi,C.W., Bett,A., Ngama,M., Medley,G.F., Cane,P.A., Nokes,D.J., Nokes,J.D.	
1690	KT765266	KT765266.1	KEN/Kilifi/820_09/02/2010	2010-02-09	Africa	Kenya			Homo sapiens	2016-02-27		Otieno et al		Otieno,J.R., Agoti,C.N., Gitahi,C.W., Bett,A., Ngama,M., Medley,G.F., Cane,P.A., Nokes,D.J., Nokes,J.D.	
1691	KT765574	KT765574.1	KEN/Kilifi/808_09/02/2010	2010-02-09	Africa	Kenya			Homo sapiens	2016-02-27		Otieno et al		Otieno,J.R., Agoti,C.N., Gitahi,C.W., Bett,A., Ngama,M., Medley,G.F., Cane,P.A., Nokes,D.J., Nokes,J.D.	
1692	OK458649	OK458649.1	OK458649	2010-02-11	Africa	Kenya			Homo sapiens	2021-12-13		Wangui et al		Wangui,J.M., Nokes,J.D., Opot,B.H., Opanda,S.M., Agoti,C.N., Otieno,J.R., Bulimo,W.D.	
1693	OK458653	OK458653.1	OK458653	2010-02-11	Africa	Kenya			Homo sapiens	2021-12-13		Wangui et al		Wangui,J.M., Nokes,J.D., Opot,B.H., Opanda,S.M., Agoti,C.N., Otieno,J.R., Bulimo,W.D.	
1694	OK458669	OK458669.1	OK458669	2010-02-11	Africa	Kenya			Homo sapiens	2021-12-13		Wangui et al		Wangui,J.M., Nokes,J.D., Opot,B.H., Opanda,S.M., Agoti,C.N., Otieno,J.R., Bulimo,W.D.	
1695	MN262225	MN262225.1	MN262225	2010-02-12	Africa	Morocco	Rabat		Homo sapiens	2019-08-26		Tan et al		Tan,G., Fedorova,N., Amedeo,P., Christensen,J., Miller,J., Durbin,A., Williams,T., Cadiz,C., Khoo,K., LeSouef,P., Annamalay,A., Bassat,Q.	
1696	KT765250	KT765250.1	KEN/Kilifi/809_16/02/2010	2010-02-16	Africa	Kenya			Homo sapiens	2016-02-27		Otieno et al		Otieno,J.R., Agoti,C.N., Gitahi,C.W., Bett,A., Ngama,M., Medley,G.F., Cane,P.A., Nokes,D.J., Nokes,J.D.	
1697	KT765229	KT765229.1	KEN/Kilifi/811_17/02/2010	2010-02-17	Africa	Kenya			Homo sapiens	2016-02-27		Otieno et al		Otieno,J.R., Agoti,C.N., Gitahi,C.W., Bett,A., Ngama,M., Medley,G.F., Cane,P.A., Nokes,D.J., Nokes,J.D.	
1698	KT765269	KT765269.1	KEN/Kilifi/810_17/02/2010	2010-02-17	Africa	Kenya			Homo sapiens	2016-02-27		Otieno et al		Otieno,J.R., Agoti,C.N., Gitahi,C.W., Bett,A., Ngama,M., Medley,G.F., Cane,P.A., Nokes,D.J., Nokes,J.D.	
1699	OK458655	OK458655.1	OK458655	2010-02-18	Africa	Kenya			Homo sapiens	2021-12-13		Wangui et al		Wangui,J.M., Nokes,J.D., Opot,B.H., Opanda,S.M., Agoti,C.N., Otieno,J.R., Bulimo,W.D.	
1700	OK458660	OK458660.1	OK458660	2010-02-18	Africa	Kenya			Homo sapiens	2021-12-13		Wangui et al		Wangui,J.M., Nokes,J.D., Opot,B.H., Opanda,S.M., Agoti,C.N., Otieno,J.R., Bulimo,W.D.	
1701	KT765402	KT765402.1	KEN/Kilifi/812_21/02/2010	2010-02-21	Africa	Kenya			Homo sapiens	2016-02-27		Otieno et al		Otieno,J.R., Agoti,C.N., Gitahi,C.W., Bett,A., Ngama,M., Medley,G.F., Cane,P.A., Nokes,D.J., Nokes,J.D.	
1702	KT765575	KT765575.1	KEN/Kilifi/813_22/02/2010	2010-02-22	Africa	Kenya			Homo sapiens	2016-02-27		Otieno et al		Otieno,J.R., Agoti,C.N., Gitahi,C.W., Bett,A., Ngama,M., Medley,G.F., Cane,P.A., Nokes,D.J., Nokes,J.D.	
1703	OK458668	OK458668.1	OK458668	2010-02-24	Africa	Kenya			Homo sapiens	2021-12-13		Wangui et al		Wangui,J.M., Nokes,J.D., Opot,B.H., Opanda,S.M., Agoti,C.N., Otieno,J.R., Bulimo,W.D.	
1704	KT765406	KT765406.1	KEN/Kilifi/814_25/02/2010	2010-02-25	Africa	Kenya			Homo sapiens	2016-02-27		Otieno et al		Otieno,J.R., Agoti,C.N., Gitahi,C.W., Bett,A., Ngama,M., Medley,G.F., Cane,P.A., Nokes,D.J., Nokes,J.D.	
1705	KT765263	KT765263.1	KEN/Kilifi/815_26/02/2010	2010-02-26	Africa	Kenya			Homo sapiens	2016-02-27		Otieno et al		Otieno,J.R., Agoti,C.N., Gitahi,C.W., Bett,A., Ngama,M., Medley,G.F., Cane,P.A., Nokes,D.J., Nokes,J.D.	
1706	KT765467	KT765467.1	KEN/Kilifi/816_26/02/2010	2010-02-26	Africa	Kenya			Homo sapiens	2016-02-27		Otieno et al		Otieno,J.R., Agoti,C.N., Gitahi,C.W., Bett,A., Ngama,M., Medley,G.F., Cane,P.A., Nokes,D.J., Nokes,J.D.	
1707	HQ699277	HQ699277.1	HQ699277	2010-03-XX	Asia	South Korea			Homo sapiens	2011-07-13		Baek et al		Baek,Y.H., Choi,E.H., Song,M.S., Pascua,P.N., Kwon,H.I., Park,S.J., Lee,J.H., Woo,S.I., Ahn,B.H., Han,H.S., Hahn,Y.S., Shin,K.S., Jang,H.L., Kim,S.Y., Choi,Y.K., Park,S.-J., Song,M.-S., Choi,Y.-K.	
1708	KT765228	KT765228.1	KEN/Kilifi/818_01/03/2010	2010-03-01	Africa	Kenya			Homo sapiens	2016-02-27		Otieno et al		Otieno,J.R., Agoti,C.N., Gitahi,C.W., Bett,A., Ngama,M., Medley,G.F., Cane,P.A., Nokes,D.J., Nokes,J.D.	
1709	KT765413	KT765413.1	KEN/Kilifi/817_01/03/2010	2010-03-01	Africa	Kenya			Homo sapiens	2016-02-27		Otieno et al		Otieno,J.R., Agoti,C.N., Gitahi,C.W., Bett,A., Ngama,M., Medley,G.F., Cane,P.A., Nokes,D.J., Nokes,J.D.	
1710	KT765452	KT765452.1	KEN/Kilifi/819_01/03/2010	2010-03-01	Africa	Kenya			Homo sapiens	2016-02-27		Otieno et al		Otieno,J.R., Agoti,C.N., Gitahi,C.W., Bett,A., Ngama,M., Medley,G.F., Cane,P.A., Nokes,D.J., Nokes,J.D.	
1711	KT765403	KT765403.1	KEN/Kilifi/821_04/03/2010	2010-03-04	Africa	Kenya			Homo sapiens	2016-02-27		Otieno et al		Otieno,J.R., Agoti,C.N., Gitahi,C.W., Bett,A., Ngama,M., Medley,G.F., Cane,P.A., Nokes,D.J., Nokes,J.D.	
1712	KF156512	KF156512.1	KF156512	2010-03-05	Africa	Kenya			Homo sapiens	2013-11-30		Agoti et al		Agoti,C.N., Mayieka,L.M., Otieno,J.R., Ahmed,J.A., Fields,B.S., Waiboci,L.W., Nyoka,R., Eidex,R.B., Marano,N., Burton,W., Montgomery,J.M., Breiman,R.F., Nokes,D.J., Mayieka,L., Fields,B., Waiboci,L.B., Eidex,R., Morano,N., Montgomery,J., Breiman,R.	
1713	KT765270	KT765270.1	KEN/Kilifi/822_05/03/2010	2010-03-05	Africa	Kenya			Homo sapiens	2016-02-27		Otieno et al		Otieno,J.R., Agoti,C.N., Gitahi,C.W., Bett,A., Ngama,M., Medley,G.F., Cane,P.A., Nokes,D.J., Nokes,J.D.	
1714	KT765220	KT765220.1	KEN/Kilifi/823_06/03/2010	2010-03-06	Africa	Kenya			Homo sapiens	2016-02-27		Otieno et al		Otieno,J.R., Agoti,C.N., Gitahi,C.W., Bett,A., Ngama,M., Medley,G.F., Cane,P.A., Nokes,D.J., Nokes,J.D.	
1715	KT765412	KT765412.1	KEN/Kilifi/824_07/03/2010	2010-03-07	Africa	Kenya			Homo sapiens	2016-02-27		Otieno et al		Otieno,J.R., Agoti,C.N., Gitahi,C.W., Bett,A., Ngama,M., Medley,G.F., Cane,P.A., Nokes,D.J., Nokes,J.D.	
1716	KT765272	KT765272.1	KEN/Kilifi/825_10/03/2010	2010-03-10	Africa	Kenya			Homo sapiens	2016-02-27		Otieno et al		Otieno,J.R., Agoti,C.N., Gitahi,C.W., Bett,A., Ngama,M., Medley,G.F., Cane,P.A., Nokes,D.J., Nokes,J.D.	
1717	KT765215	KT765215.1	KEN/Kilifi/829_11/03/2010	2010-03-11	Africa	Kenya			Homo sapiens	2016-02-27		Otieno et al		Otieno,J.R., Agoti,C.N., Gitahi,C.W., Bett,A., Ngama,M., Medley,G.F., Cane,P.A., Nokes,D.J., Nokes,J.D.	
1718	KT765222	KT765222.1	KEN/Kilifi/827_11/03/2010	2010-03-11	Africa	Kenya			Homo sapiens	2016-02-27		Otieno et al		Otieno,J.R., Agoti,C.N., Gitahi,C.W., Bett,A., Ngama,M., Medley,G.F., Cane,P.A., Nokes,D.J., Nokes,J.D.	
1719	KT765289	KT765289.1	KEN/Kilifi/826_11/03/2010	2010-03-11	Africa	Kenya			Homo sapiens	2016-02-27		Otieno et al		Otieno,J.R., Agoti,C.N., Gitahi,C.W., Bett,A., Ngama,M., Medley,G.F., Cane,P.A., Nokes,D.J., Nokes,J.D.	
1720	KT765545	KT765545.1	KEN/Kilifi/828_11/03/2010	2010-03-11	Africa	Kenya			Homo sapiens	2016-02-27		Otieno et al		Otieno,J.R., Agoti,C.N., Gitahi,C.W., Bett,A., Ngama,M., Medley,G.F., Cane,P.A., Nokes,D.J., Nokes,J.D.	
1721	KT765283	KT765283.1	KEN/Kilifi/830_12/03/2010	2010-03-12	Africa	Kenya			Homo sapiens	2016-02-27		Otieno et al		Otieno,J.R., Agoti,C.N., Gitahi,C.W., Bett,A., Ngama,M., Medley,G.F., Cane,P.A., Nokes,D.J., Nokes,J.D.	
1722	KT765221	KT765221.1	KEN/Kilifi/833_13/03/2010	2010-03-13	Africa	Kenya			Homo sapiens	2016-02-27		Otieno et al		Otieno,J.R., Agoti,C.N., Gitahi,C.W., Bett,A., Ngama,M., Medley,G.F., Cane,P.A., Nokes,D.J., Nokes,J.D.	
1723	KT765236	KT765236.1	KEN/Kilifi/831_13/03/2010	2010-03-13	Africa	Kenya			Homo sapiens	2016-02-27		Otieno et al		Otieno,J.R., Agoti,C.N., Gitahi,C.W., Bett,A., Ngama,M., Medley,G.F., Cane,P.A., Nokes,D.J., Nokes,J.D.	
1724	KT765245	KT765245.1	KEN/Kilifi/832_13/03/2010	2010-03-13	Africa	Kenya			Homo sapiens	2016-02-27		Otieno et al		Otieno,J.R., Agoti,C.N., Gitahi,C.W., Bett,A., Ngama,M., Medley,G.F., Cane,P.A., Nokes,D.J., Nokes,J.D.	
1725	KT765227	KT765227.1	KEN/Kilifi/834_15/03/2010	2010-03-15	Africa	Kenya			Homo sapiens	2016-02-27		Otieno et al		Otieno,J.R., Agoti,C.N., Gitahi,C.W., Bett,A., Ngama,M., Medley,G.F., Cane,P.A., Nokes,D.J., Nokes,J.D.	
1726	KF156373	KF156373.1	KF156373	2010-03-16	Africa	Kenya			Homo sapiens	2013-11-30		Agoti et al		Agoti,C.N., Mayieka,L.M., Otieno,J.R., Ahmed,J.A., Fields,B.S., Waiboci,L.W., Nyoka,R., Eidex,R.B., Marano,N., Burton,W., Montgomery,J.M., Breiman,R.F., Nokes,D.J., Mayieka,L., Fields,B., Waiboci,L.B., Eidex,R., Morano,N., Montgomery,J., Breiman,R.	
1727	KT765572	KT765572.1	KEN/Kilifi/835_16/03/2010	2010-03-16	Africa	Kenya			Homo sapiens	2016-02-27		Otieno et al		Otieno,J.R., Agoti,C.N., Gitahi,C.W., Bett,A., Ngama,M., Medley,G.F., Cane,P.A., Nokes,D.J., Nokes,J.D.	
1728	KT765417	KT765417.1	KEN/Kilifi/837_23/03/2010	2010-03-23	Africa	Kenya			Homo sapiens	2016-02-27		Otieno et al		Otieno,J.R., Agoti,C.N., Gitahi,C.W., Bett,A., Ngama,M., Medley,G.F., Cane,P.A., Nokes,D.J., Nokes,J.D.	
1729	KT765410	KT765410.1	KEN/Kilifi/836_25/03/2010	2010-03-25	Africa	Kenya			Homo sapiens	2016-02-27		Otieno et al		Otieno,J.R., Agoti,C.N., Gitahi,C.W., Bett,A., Ngama,M., Medley,G.F., Cane,P.A., Nokes,D.J., Nokes,J.D.	
1730	KT765254	KT765254.1	KEN/Kilifi/838_26/03/2010	2010-03-26	Africa	Kenya			Homo sapiens	2016-02-27		Otieno et al		Otieno,J.R., Agoti,C.N., Gitahi,C.W., Bett,A., Ngama,M., Medley,G.F., Cane,P.A., Nokes,D.J., Nokes,J.D.	
1731	KT765546	KT765546.1	KEN/Kilifi/840_27/03/2010	2010-03-27	Africa	Kenya			Homo sapiens	2016-02-27		Otieno et al		Otieno,J.R., Agoti,C.N., Gitahi,C.W., Bett,A., Ngama,M., Medley,G.F., Cane,P.A., Nokes,D.J., Nokes,J.D.	
1732	KT765573	KT765573.1	KEN/Kilifi/839_27/03/2010	2010-03-27	Africa	Kenya			Homo sapiens	2016-02-27		Otieno et al		Otieno,J.R., Agoti,C.N., Gitahi,C.W., Bett,A., Ngama,M., Medley,G.F., Cane,P.A., Nokes,D.J., Nokes,J.D.	
1733	KT765465	KT765465.1	KEN/Kilifi/841_29/03/2010	2010-03-29	Africa	Kenya			Homo sapiens	2016-02-27		Otieno et al		Otieno,J.R., Agoti,C.N., Gitahi,C.W., Bett,A., Ngama,M., Medley,G.F., Cane,P.A., Nokes,D.J., Nokes,J.D.	
1734	KT765404	KT765404.1	KEN/Kilifi/842_31/03/2010	2010-03-31	Africa	Kenya			Homo sapiens	2016-02-27		Otieno et al		Otieno,J.R., Agoti,C.N., Gitahi,C.W., Bett,A., Ngama,M., Medley,G.F., Cane,P.A., Nokes,D.J., Nokes,J.D.	
1735	KC461282	KC461282.1	CQ518-0410	2010-04-XX	Asia	China			Homo sapiens	2013-04-15		Ren et al		Ren,L., Liu,E.	
1736	KX946343	KX946343.1	NhaTrang/ARI-2292/2010	2010-04-XX	Asia	Vietnam			Homo sapiens	2016-10-24		Yoshihara et al		Yoshihara,K., Le,M.N., Nagasawa,K., Tsukagoshi,H., Nguyen,H.A., Toizumi,M., Moriuchi,H., Hashizume,M., Ariyoshi,K., Dang,D.A., Kimura,H., Yoshida,L.M., Nhat Le,M., Yoshida,L.-M.	
1737	KX946344	KX946344.1	NhaTrang/ARI-2303/2010	2010-04-XX	Asia	Vietnam			Homo sapiens	2016-10-24		Yoshihara et al		Yoshihara,K., Le,M.N., Nagasawa,K., Tsukagoshi,H., Nguyen,H.A., Toizumi,M., Moriuchi,H., Hashizume,M., Ariyoshi,K., Dang,D.A., Kimura,H., Yoshida,L.M., Nhat Le,M., Yoshida,L.-M.	
1738	KX946345	KX946345.1	NhaTrang/ARI-2306/2010	2010-04-XX	Asia	Vietnam			Homo sapiens	2016-10-24		Yoshihara et al		Yoshihara,K., Le,M.N., Nagasawa,K., Tsukagoshi,H., Nguyen,H.A., Toizumi,M., Moriuchi,H., Hashizume,M., Ariyoshi,K., Dang,D.A., Kimura,H., Yoshida,L.M., Nhat Le,M., Yoshida,L.-M.	
1739	KX946346	KX946346.1	NhaTrang/ARI-2308/2010	2010-04-XX	Asia	Vietnam			Homo sapiens	2016-10-24		Yoshihara et al		Yoshihara,K., Le,M.N., Nagasawa,K., Tsukagoshi,H., Nguyen,H.A., Toizumi,M., Moriuchi,H., Hashizume,M., Ariyoshi,K., Dang,D.A., Kimura,H., Yoshida,L.M., Nhat Le,M., Yoshida,L.-M.	
1740	KX946347	KX946347.1	NhaTrang/ARI-2330/2010	2010-04-XX	Asia	Vietnam			Homo sapiens	2016-10-24		Yoshihara et al		Yoshihara,K., Le,M.N., Nagasawa,K., Tsukagoshi,H., Nguyen,H.A., Toizumi,M., Moriuchi,H., Hashizume,M., Ariyoshi,K., Dang,D.A., Kimura,H., Yoshida,L.M., Nhat Le,M., Yoshida,L.-M.	
1741	KT765218	KT765218.1	KEN/Kilifi/843_01/04/2010	2010-04-01	Africa	Kenya			Homo sapiens	2016-02-27		Otieno et al		Otieno,J.R., Agoti,C.N., Gitahi,C.W., Bett,A., Ngama,M., Medley,G.F., Cane,P.A., Nokes,D.J., Nokes,J.D.	
1742	KT765223	KT765223.1	KEN/Kilifi/844_01/04/2010	2010-04-01	Africa	Kenya			Homo sapiens	2016-02-27		Otieno et al		Otieno,J.R., Agoti,C.N., Gitahi,C.W., Bett,A., Ngama,M., Medley,G.F., Cane,P.A., Nokes,D.J., Nokes,J.D.	
1743	KT765454	KT765454.1	KEN/Kilifi/845_03/04/2010	2010-04-03	Africa	Kenya			Homo sapiens	2016-02-27		Otieno et al		Otieno,J.R., Agoti,C.N., Gitahi,C.W., Bett,A., Ngama,M., Medley,G.F., Cane,P.A., Nokes,D.J., Nokes,J.D.	
1744	KT765276	KT765276.1	KEN/Kilifi/846_06/04/2010	2010-04-06	Africa	Kenya			Homo sapiens	2016-02-27		Otieno et al		Otieno,J.R., Agoti,C.N., Gitahi,C.W., Bett,A., Ngama,M., Medley,G.F., Cane,P.A., Nokes,D.J., Nokes,J.D.	
1745	KT765219	KT765219.1	KEN/Kilifi/847_08/04/2010	2010-04-08	Africa	Kenya			Homo sapiens	2016-02-27		Otieno et al		Otieno,J.R., Agoti,C.N., Gitahi,C.W., Bett,A., Ngama,M., Medley,G.F., Cane,P.A., Nokes,D.J., Nokes,J.D.	
1746	KF156374	KF156374.1	KF156374	2010-04-12	Africa	Kenya			Homo sapiens	2013-11-30		Agoti et al		Agoti,C.N., Mayieka,L.M., Otieno,J.R., Ahmed,J.A., Fields,B.S., Waiboci,L.W., Nyoka,R., Eidex,R.B., Marano,N., Burton,W., Montgomery,J.M., Breiman,R.F., Nokes,D.J., Mayieka,L., Fields,B., Waiboci,L.B., Eidex,R., Morano,N., Montgomery,J., Breiman,R.	
1747	KT765279	KT765279.1	KEN/Kilifi/848_12/04/2010	2010-04-12	Africa	Kenya			Homo sapiens	2016-02-27		Otieno et al		Otieno,J.R., Agoti,C.N., Gitahi,C.W., Bett,A., Ngama,M., Medley,G.F., Cane,P.A., Nokes,D.J., Nokes,J.D.	
1748	KT765284	KT765284.1	KEN/Kilifi/849_15/04/2010	2010-04-15	Africa	Kenya			Homo sapiens	2016-02-27		Otieno et al		Otieno,J.R., Agoti,C.N., Gitahi,C.W., Bett,A., Ngama,M., Medley,G.F., Cane,P.A., Nokes,D.J., Nokes,J.D.	
1749	KT765521	KT765521.1	KEN/Kilifi/850_15/04/2010	2010-04-15	Africa	Kenya			Homo sapiens	2016-02-27		Otieno et al		Otieno,J.R., Agoti,C.N., Gitahi,C.W., Bett,A., Ngama,M., Medley,G.F., Cane,P.A., Nokes,D.J., Nokes,J.D.	
1750	KT765418	KT765418.1	KEN/Kilifi/851_17/04/2010	2010-04-17	Africa	Kenya			Homo sapiens	2016-02-27		Otieno et al		Otieno,J.R., Agoti,C.N., Gitahi,C.W., Bett,A., Ngama,M., Medley,G.F., Cane,P.A., Nokes,D.J., Nokes,J.D.	
1751	KT765249	KT765249.1	KEN/Kilifi/853_19/04/2010	2010-04-19	Africa	Kenya			Homo sapiens	2016-02-27		Otieno et al		Otieno,J.R., Agoti,C.N., Gitahi,C.W., Bett,A., Ngama,M., Medley,G.F., Cane,P.A., Nokes,D.J., Nokes,J.D.	
1752	KT765255	KT765255.1	KEN/Kilifi/852_19/04/2010	2010-04-19	Africa	Kenya			Homo sapiens	2016-02-27		Otieno et al		Otieno,J.R., Agoti,C.N., Gitahi,C.W., Bett,A., Ngama,M., Medley,G.F., Cane,P.A., Nokes,D.J., Nokes,J.D.	
1753	KT765257	KT765257.1	KEN/Kilifi/854_19/04/2010	2010-04-19	Africa	Kenya			Homo sapiens	2016-02-27		Otieno et al		Otieno,J.R., Agoti,C.N., Gitahi,C.W., Bett,A., Ngama,M., Medley,G.F., Cane,P.A., Nokes,D.J., Nokes,J.D.	
1754	KT765251	KT765251.1	KEN/Kilifi/855_23/04/2010	2010-04-23	Africa	Kenya			Homo sapiens	2016-02-27		Otieno et al		Otieno,J.R., Agoti,C.N., Gitahi,C.W., Bett,A., Ngama,M., Medley,G.F., Cane,P.A., Nokes,D.J., Nokes,J.D.	
1755	KT765256	KT765256.1	KEN/Kilifi/856_25/04/2010	2010-04-25	Africa	Kenya			Homo sapiens	2016-02-27		Otieno et al		Otieno,J.R., Agoti,C.N., Gitahi,C.W., Bett,A., Ngama,M., Medley,G.F., Cane,P.A., Nokes,D.J., Nokes,J.D.	
1756	KT765224	KT765224.1	KEN/Kilifi/857_29/04/2010	2010-04-29	Africa	Kenya			Homo sapiens	2016-02-27		Otieno et al		Otieno,J.R., Agoti,C.N., Gitahi,C.W., Bett,A., Ngama,M., Medley,G.F., Cane,P.A., Nokes,D.J., Nokes,J.D.	
1757	KT765267	KT765267.1	KEN/Kilifi/858_30/04/2010	2010-04-30	Africa	Kenya			Homo sapiens	2016-02-27		Otieno et al		Otieno,J.R., Agoti,C.N., Gitahi,C.W., Bett,A., Ngama,M., Medley,G.F., Cane,P.A., Nokes,D.J., Nokes,J.D.	
1758	KX946348	KX946348.1	NhaTrang/ARI-2337/2010	2010-05-XX	Asia	Vietnam			Homo sapiens	2016-10-24		Yoshihara et al		Yoshihara,K., Le,M.N., Nagasawa,K., Tsukagoshi,H., Nguyen,H.A., Toizumi,M., Moriuchi,H., Hashizume,M., Ariyoshi,K., Dang,D.A., Kimura,H., Yoshida,L.M., Nhat Le,M., Yoshida,L.-M.	
1759	KX946349	KX946349.1	NhaTrang/ARI-2346/2010	2010-05-XX	Asia	Vietnam			Homo sapiens	2016-10-24		Yoshihara et al		Yoshihara,K., Le,M.N., Nagasawa,K., Tsukagoshi,H., Nguyen,H.A., Toizumi,M., Moriuchi,H., Hashizume,M., Ariyoshi,K., Dang,D.A., Kimura,H., Yoshida,L.M., Nhat Le,M., Yoshida,L.-M.	
1760	KX946350	KX946350.1	NhaTrang/ARI-2357/2010	2010-05-XX	Asia	Vietnam			Homo sapiens	2016-10-24		Yoshihara et al		Yoshihara,K., Le,M.N., Nagasawa,K., Tsukagoshi,H., Nguyen,H.A., Toizumi,M., Moriuchi,H., Hashizume,M., Ariyoshi,K., Dang,D.A., Kimura,H., Yoshida,L.M., Nhat Le,M., Yoshida,L.-M.	
1761	KX946351	KX946351.1	NhaTrang/ARI-2358/2010	2010-05-XX	Asia	Vietnam			Homo sapiens	2016-10-24		Yoshihara et al		Yoshihara,K., Le,M.N., Nagasawa,K., Tsukagoshi,H., Nguyen,H.A., Toizumi,M., Moriuchi,H., Hashizume,M., Ariyoshi,K., Dang,D.A., Kimura,H., Yoshida,L.M., Nhat Le,M., Yoshida,L.-M.	
1762	KX946352	KX946352.1	NhaTrang/ARI-2366/2010	2010-05-XX	Asia	Vietnam			Homo sapiens	2016-10-24		Yoshihara et al		Yoshihara,K., Le,M.N., Nagasawa,K., Tsukagoshi,H., Nguyen,H.A., Toizumi,M., Moriuchi,H., Hashizume,M., Ariyoshi,K., Dang,D.A., Kimura,H., Yoshida,L.M., Nhat Le,M., Yoshida,L.-M.	
1763	KX946353	KX946353.1	NhaTrang/ARI-2367/2010	2010-05-XX	Asia	Vietnam			Homo sapiens	2016-10-24		Yoshihara et al		Yoshihara,K., Le,M.N., Nagasawa,K., Tsukagoshi,H., Nguyen,H.A., Toizumi,M., Moriuchi,H., Hashizume,M., Ariyoshi,K., Dang,D.A., Kimura,H., Yoshida,L.M., Nhat Le,M., Yoshida,L.-M.	
1764	KX946354	KX946354.1	NhaTrang/ARI-2378/2010	2010-05-XX	Asia	Vietnam			Homo sapiens	2016-10-24		Yoshihara et al		Yoshihara,K., Le,M.N., Nagasawa,K., Tsukagoshi,H., Nguyen,H.A., Toizumi,M., Moriuchi,H., Hashizume,M., Ariyoshi,K., Dang,D.A., Kimura,H., Yoshida,L.M., Nhat Le,M., Yoshida,L.-M.	
1765	KF156513	KF156513.1	KF156513	2010-05-01	Africa	Kenya			Homo sapiens	2013-11-30		Agoti et al		Agoti,C.N., Mayieka,L.M., Otieno,J.R., Ahmed,J.A., Fields,B.S., Waiboci,L.W., Nyoka,R., Eidex,R.B., Marano,N., Burton,W., Montgomery,J.M., Breiman,R.F., Nokes,D.J., Mayieka,L., Fields,B., Waiboci,L.B., Eidex,R., Morano,N., Montgomery,J., Breiman,R.	
1766	KF156514	KF156514.1	KF156514	2010-05-04	Africa	Kenya			Homo sapiens	2013-11-30		Agoti et al		Agoti,C.N., Mayieka,L.M., Otieno,J.R., Ahmed,J.A., Fields,B.S., Waiboci,L.W., Nyoka,R., Eidex,R.B., Marano,N., Burton,W., Montgomery,J.M., Breiman,R.F., Nokes,D.J., Mayieka,L., Fields,B., Waiboci,L.B., Eidex,R., Morano,N., Montgomery,J., Breiman,R.	
1767	KT765225	KT765225.1	KEN/Kilifi/859_07/05/2010	2010-05-07	Africa	Kenya			Homo sapiens	2016-02-27		Otieno et al		Otieno,J.R., Agoti,C.N., Gitahi,C.W., Bett,A., Ngama,M., Medley,G.F., Cane,P.A., Nokes,D.J., Nokes,J.D.	
1768	KT765246	KT765246.1	KEN/Kilifi/860_18/05/2010	2010-05-18	Africa	Kenya			Homo sapiens	2016-02-27		Otieno et al		Otieno,J.R., Agoti,C.N., Gitahi,C.W., Bett,A., Ngama,M., Medley,G.F., Cane,P.A., Nokes,D.J., Nokes,J.D.	
1769	KT765553	KT765553.1	KEN/Kilifi/861_18/05/2010	2010-05-18	Africa	Kenya			Homo sapiens	2016-02-27		Otieno et al		Otieno,J.R., Agoti,C.N., Gitahi,C.W., Bett,A., Ngama,M., Medley,G.F., Cane,P.A., Nokes,D.J., Nokes,J.D.	
1770	KT765277	KT765277.1	KEN/Kilifi/862_20/05/2010	2010-05-20	Africa	Kenya			Homo sapiens	2016-02-27		Otieno et al		Otieno,J.R., Agoti,C.N., Gitahi,C.W., Bett,A., Ngama,M., Medley,G.F., Cane,P.A., Nokes,D.J., Nokes,J.D.	
1771	AB899792	AB899792.1	AB899792	2010-06-XX	Asia	Japan	Okinawa		Homo sapiens	2014-01-08		Nidaira et al		Nidaira,M., Taira,K., Kyan,H., Okano,S., Takara,T., Kudaka,J.	
1772	AB899793	AB899793.1	AB899793	2010-06-XX	Asia	Japan	Okinawa		Homo sapiens	2014-01-08		Nidaira et al		Nidaira,M., Taira,K., Kyan,H., Okano,S., Takara,T., Kudaka,J.	
1773	AB899794	AB899794.1	AB899794	2010-06-XX	Asia	Japan	Okinawa		Homo sapiens	2014-01-08		Nidaira et al		Nidaira,M., Taira,K., Kyan,H., Okano,S., Takara,T., Kudaka,J.	
1774	KX946355	KX946355.1	NhaTrang/ARI-2390/2010	2010-06-XX	Asia	Vietnam			Homo sapiens	2016-10-24		Yoshihara et al		Yoshihara,K., Le,M.N., Nagasawa,K., Tsukagoshi,H., Nguyen,H.A., Toizumi,M., Moriuchi,H., Hashizume,M., Ariyoshi,K., Dang,D.A., Kimura,H., Yoshida,L.M., Nhat Le,M., Yoshida,L.-M.	
1775	KX946356	KX946356.1	NhaTrang/ARI-2395/2010	2010-06-XX	Asia	Vietnam			Homo sapiens	2016-10-24		Yoshihara et al		Yoshihara,K., Le,M.N., Nagasawa,K., Tsukagoshi,H., Nguyen,H.A., Toizumi,M., Moriuchi,H., Hashizume,M., Ariyoshi,K., Dang,D.A., Kimura,H., Yoshida,L.M., Nhat Le,M., Yoshida,L.-M.	
1776	KX946357	KX946357.1	NhaTrang/ARI-2407/2010	2010-06-XX	Asia	Vietnam			Homo sapiens	2016-10-24		Yoshihara et al		Yoshihara,K., Le,M.N., Nagasawa,K., Tsukagoshi,H., Nguyen,H.A., Toizumi,M., Moriuchi,H., Hashizume,M., Ariyoshi,K., Dang,D.A., Kimura,H., Yoshida,L.M., Nhat Le,M., Yoshida,L.-M.	
1777	KX946358	KX946358.1	NhaTrang/ARI-2413/2010	2010-06-XX	Asia	Vietnam			Homo sapiens	2016-10-24		Yoshihara et al		Yoshihara,K., Le,M.N., Nagasawa,K., Tsukagoshi,H., Nguyen,H.A., Toizumi,M., Moriuchi,H., Hashizume,M., Ariyoshi,K., Dang,D.A., Kimura,H., Yoshida,L.M., Nhat Le,M., Yoshida,L.-M.	
1778	KX946359	KX946359.1	NhaTrang/ARI-2414/2010	2010-06-XX	Asia	Vietnam			Homo sapiens	2016-10-24		Yoshihara et al		Yoshihara,K., Le,M.N., Nagasawa,K., Tsukagoshi,H., Nguyen,H.A., Toizumi,M., Moriuchi,H., Hashizume,M., Ariyoshi,K., Dang,D.A., Kimura,H., Yoshida,L.M., Nhat Le,M., Yoshida,L.-M.	
1779	KX946360	KX946360.1	NhaTrang/ARI-2415/2010	2010-06-XX	Asia	Vietnam			Homo sapiens	2016-10-24		Yoshihara et al		Yoshihara,K., Le,M.N., Nagasawa,K., Tsukagoshi,H., Nguyen,H.A., Toizumi,M., Moriuchi,H., Hashizume,M., Ariyoshi,K., Dang,D.A., Kimura,H., Yoshida,L.M., Nhat Le,M., Yoshida,L.-M.	
1780	KX946361	KX946361.1	NhaTrang/ARI-2422/2010	2010-06-XX	Asia	Vietnam			Homo sapiens	2016-10-24		Yoshihara et al		Yoshihara,K., Le,M.N., Nagasawa,K., Tsukagoshi,H., Nguyen,H.A., Toizumi,M., Moriuchi,H., Hashizume,M., Ariyoshi,K., Dang,D.A., Kimura,H., Yoshida,L.M., Nhat Le,M., Yoshida,L.-M.	
1781	KX946362	KX946362.1	NhaTrang/ARI-2423/2010	2010-06-XX	Asia	Vietnam			Homo sapiens	2016-10-24		Yoshihara et al		Yoshihara,K., Le,M.N., Nagasawa,K., Tsukagoshi,H., Nguyen,H.A., Toizumi,M., Moriuchi,H., Hashizume,M., Ariyoshi,K., Dang,D.A., Kimura,H., Yoshida,L.M., Nhat Le,M., Yoshida,L.-M.	
1782	KX946363	KX946363.1	NhaTrang/ARI-2425/2010	2010-06-XX	Asia	Vietnam			Homo sapiens	2016-10-24		Yoshihara et al		Yoshihara,K., Le,M.N., Nagasawa,K., Tsukagoshi,H., Nguyen,H.A., Toizumi,M., Moriuchi,H., Hashizume,M., Ariyoshi,K., Dang,D.A., Kimura,H., Yoshida,L.M., Nhat Le,M., Yoshida,L.-M.	
1783	KX946364	KX946364.1	NhaTrang/ARI-2426/2010	2010-06-XX	Asia	Vietnam			Homo sapiens	2016-10-24		Yoshihara et al		Yoshihara,K., Le,M.N., Nagasawa,K., Tsukagoshi,H., Nguyen,H.A., Toizumi,M., Moriuchi,H., Hashizume,M., Ariyoshi,K., Dang,D.A., Kimura,H., Yoshida,L.M., Nhat Le,M., Yoshida,L.-M.	
1784	KX946365	KX946365.1	NhaTrang/ARI-2427/2010	2010-06-XX	Asia	Vietnam			Homo sapiens	2016-10-24		Yoshihara et al		Yoshihara,K., Le,M.N., Nagasawa,K., Tsukagoshi,H., Nguyen,H.A., Toizumi,M., Moriuchi,H., Hashizume,M., Ariyoshi,K., Dang,D.A., Kimura,H., Yoshida,L.M., Nhat Le,M., Yoshida,L.-M.	
1785	KX946366	KX946366.1	NhaTrang/ARI-2430/2010	2010-06-XX	Asia	Vietnam			Homo sapiens	2016-10-24		Yoshihara et al		Yoshihara,K., Le,M.N., Nagasawa,K., Tsukagoshi,H., Nguyen,H.A., Toizumi,M., Moriuchi,H., Hashizume,M., Ariyoshi,K., Dang,D.A., Kimura,H., Yoshida,L.M., Nhat Le,M., Yoshida,L.-M.	
1786	KX946367	KX946367.1	NhaTrang/ARI-2431/2010	2010-06-XX	Asia	Vietnam			Homo sapiens	2016-10-24		Yoshihara et al		Yoshihara,K., Le,M.N., Nagasawa,K., Tsukagoshi,H., Nguyen,H.A., Toizumi,M., Moriuchi,H., Hashizume,M., Ariyoshi,K., Dang,D.A., Kimura,H., Yoshida,L.M., Nhat Le,M., Yoshida,L.-M.	
1787	KX946368	KX946368.1	NhaTrang/ARI-2432/2010	2010-06-XX	Asia	Vietnam			Homo sapiens	2016-10-24		Yoshihara et al		Yoshihara,K., Le,M.N., Nagasawa,K., Tsukagoshi,H., Nguyen,H.A., Toizumi,M., Moriuchi,H., Hashizume,M., Ariyoshi,K., Dang,D.A., Kimura,H., Yoshida,L.M., Nhat Le,M., Yoshida,L.-M.	
1788	KX946369	KX946369.1	NhaTrang/ARI-2437/2010	2010-06-XX	Asia	Vietnam			Homo sapiens	2016-10-24		Yoshihara et al		Yoshihara,K., Le,M.N., Nagasawa,K., Tsukagoshi,H., Nguyen,H.A., Toizumi,M., Moriuchi,H., Hashizume,M., Ariyoshi,K., Dang,D.A., Kimura,H., Yoshida,L.M., Nhat Le,M., Yoshida,L.-M.	
1789	KX946370	KX946370.1	NhaTrang/ARI-2443/2010	2010-06-XX	Asia	Vietnam			Homo sapiens	2016-10-24		Yoshihara et al		Yoshihara,K., Le,M.N., Nagasawa,K., Tsukagoshi,H., Nguyen,H.A., Toizumi,M., Moriuchi,H., Hashizume,M., Ariyoshi,K., Dang,D.A., Kimura,H., Yoshida,L.M., Nhat Le,M., Yoshida,L.-M.	
1790	KF156515	KF156515.1	KF156515	2010-06-11	Africa	Kenya			Homo sapiens	2013-11-30		Agoti et al		Agoti,C.N., Mayieka,L.M., Otieno,J.R., Ahmed,J.A., Fields,B.S., Waiboci,L.W., Nyoka,R., Eidex,R.B., Marano,N., Burton,W., Montgomery,J.M., Breiman,R.F., Nokes,D.J., Mayieka,L., Fields,B., Waiboci,L.B., Eidex,R., Morano,N., Montgomery,J., Breiman,R.	
1791	KT765273	KT765273.1	KEN/Kilifi/863_19/06/2010	2010-06-19	Africa	Kenya			Homo sapiens	2016-02-27		Otieno et al		Otieno,J.R., Agoti,C.N., Gitahi,C.W., Bett,A., Ngama,M., Medley,G.F., Cane,P.A., Nokes,D.J., Nokes,J.D.	
1792	AB899795	AB899795.1	AB899795	2010-07-XX	Asia	Japan	Okinawa		Homo sapiens	2014-01-08		Nidaira et al		Nidaira,M., Taira,K., Kyan,H., Okano,S., Takara,T., Kudaka,J.	
1793	AB899796	AB899796.1	AB899796	2010-07-XX	Asia	Japan	Okinawa		Homo sapiens	2014-01-08		Nidaira et al		Nidaira,M., Taira,K., Kyan,H., Okano,S., Takara,T., Kudaka,J.	
1794	KX946371	KX946371.1	NhaTrang/ARI-2446/2010	2010-07-XX	Asia	Vietnam			Homo sapiens	2016-10-24		Yoshihara et al		Yoshihara,K., Le,M.N., Nagasawa,K., Tsukagoshi,H., Nguyen,H.A., Toizumi,M., Moriuchi,H., Hashizume,M., Ariyoshi,K., Dang,D.A., Kimura,H., Yoshida,L.M., Nhat Le,M., Yoshida,L.-M.	
1795	KX946372	KX946372.1	NhaTrang/ARI-2454/2010	2010-07-XX	Asia	Vietnam			Homo sapiens	2016-10-24		Yoshihara et al		Yoshihara,K., Le,M.N., Nagasawa,K., Tsukagoshi,H., Nguyen,H.A., Toizumi,M., Moriuchi,H., Hashizume,M., Ariyoshi,K., Dang,D.A., Kimura,H., Yoshida,L.M., Nhat Le,M., Yoshida,L.-M.	
1796	KX946373	KX946373.1	NhaTrang/ARI-2456/2010	2010-07-XX	Asia	Vietnam			Homo sapiens	2016-10-24		Yoshihara et al		Yoshihara,K., Le,M.N., Nagasawa,K., Tsukagoshi,H., Nguyen,H.A., Toizumi,M., Moriuchi,H., Hashizume,M., Ariyoshi,K., Dang,D.A., Kimura,H., Yoshida,L.M., Nhat Le,M., Yoshida,L.-M.	
1797	KX946374	KX946374.1	NhaTrang/ARI-2457/2010	2010-07-XX	Asia	Vietnam			Homo sapiens	2016-10-24		Yoshihara et al		Yoshihara,K., Le,M.N., Nagasawa,K., Tsukagoshi,H., Nguyen,H.A., Toizumi,M., Moriuchi,H., Hashizume,M., Ariyoshi,K., Dang,D.A., Kimura,H., Yoshida,L.M., Nhat Le,M., Yoshida,L.-M.	
1798	KX946375	KX946375.1	NhaTrang/ARI-2458/2010	2010-07-XX	Asia	Vietnam			Homo sapiens	2016-10-24		Yoshihara et al		Yoshihara,K., Le,M.N., Nagasawa,K., Tsukagoshi,H., Nguyen,H.A., Toizumi,M., Moriuchi,H., Hashizume,M., Ariyoshi,K., Dang,D.A., Kimura,H., Yoshida,L.M., Nhat Le,M., Yoshida,L.-M.	
1799	KX946376	KX946376.1	NhaTrang/ARI-2459/2010	2010-07-XX	Asia	Vietnam			Homo sapiens	2016-10-24		Yoshihara et al		Yoshihara,K., Le,M.N., Nagasawa,K., Tsukagoshi,H., Nguyen,H.A., Toizumi,M., Moriuchi,H., Hashizume,M., Ariyoshi,K., Dang,D.A., Kimura,H., Yoshida,L.M., Nhat Le,M., Yoshida,L.-M.	
